comment url,comment forum,comment keywords,comment message,comment date,comment username,comment name,paper doi,paper title,paper authors,paper date
https://www.biorxiv.org/content/10.1101/2022.12.28.522153v1#comment-6147258622,biorxivstage,0,"I've found a typo. Bottom of page 2, where it says ""hypergeomteric"", it shoud say ""hypergeometric""",2023-03-27T10:13:20,feministo,feministo,10.1101/2022.12.28.522153,Accuracy of functional gene community detection in Saccharomyces cerevisiae by maximizing Generalized Modularity Density,"Pramesh Singh, Jiahao Guo, Jing Li, Urminder Singh, Eve Syrkin Wurtele, Kevin E. Bassler",2022-12-30
https://www.biorxiv.org/content/10.1101/2022.05.12.491630v3#comment-6147207230,biorxivstage,0,This paper was published on 21 March 2023 in Frontiers in Cellular Neuroscience DOI 10.3389/fncel.2023.1131151,2023-03-27T07:31:04,,Sidney I. Wiener,10.1101/2022.05.12.491630,Locus cœruleus noradrenergic neurons phase-lock to prefrontal and hippocampal infra-slow rhythms that synchronize to behavioral events,"Liyang Xiang, Antoine Harel, Ralitsa Todorova, HongYing Gao, Susan J. Sara, Sidney I. Wiener",2023-02-14
https://www.biorxiv.org/content/10.1101/2023.03.20.533471v1#comment-6146568881,biorxivstage,0,Congratulations for this interesting and useful approach. I will follow this work as well as the next step with the SBD. May I suggest this article for the comparison of the raft binding properties of HIV and SARS-CoV-2 ? Convergent Evolution Dynamics of SARS-CoV-2 and HIV Surface Envelope Glycoproteins Driven by Host Cell Surface Receptors and Lipid Rafts: Lessons for the Future. International Journal of Molecular Sciences. 2023; 24(3):1923. https://doi.org/10.3390/ijm... Jacques Fantini.,2023-03-26T08:50:59,,Jacques Fantini,10.1101/2023.03.20.533471,"ProRafts: A machine-learning predictor for raftophilicity, the protein affinity for biomembrane rafts","Deniz Yurtsever, Can Keşmir, Maria Maddalena Sperotto",2023-03-23
https://www.biorxiv.org/content/10.1101/2023.03.17.533163v1#comment-6145880199,biorxivstage,0,"« to be exhaustive in their state of the art of long-term DNA storage procedures, after the statement: ""These synthetic shells extend the half-life of DNA to    hundreds of years25,27 "" the authors, could have added : Encapsulation under an anoxic and anhydrous atmosphere could further extend this half-life of DNA  to thousands of years. (coudy et al  PLoSOne 16 (11) 2021 Long term conservation of DNA at ambient temperature. Implications for DNA data storage. DOI: 10.1371/journal.pone.0259868. eCollection 2021",2023-03-25T07:53:01,bonnetjacques,Bonnet Jacques,10.1101/2023.03.17.533163,DNA storage in thermoresponsive microcapsules for repeated random multiplexed data access,"Bas W.A. Bögels, Bichlien H. Nguyen, David Ward, Levena Gascoigne, David P. Schrijver, Anna-Maria Makri Pistikou, Alex Joesaar, Shuo Yang, Ilja K. Voets, Willem J.M. Mulder, Andrew Phillips, Stephen Mann, Georg Seelig, Karin Strauss, Yuan-Jyue Chen, Tom F. A. de Greef",2023-03-18
https://www.biorxiv.org/content/10.1101/2023.03.17.532022v1#comment-6145808913,biorxivstage,0,A very impressive study by Lepletier and co-workers. It is especially interesting to see the time-lag difference between mRNA expression and proteomic data. Something to bear in mind when doing these expression studies in bacteria.,2023-03-25T03:39:42,yaramahzalucki,Yaramah Zalucki,10.1101/2023.03.17.532022,Integrative proteomics and transcriptomics of human T-cells reveals temporal metabolic reprogramming following TCR-induced activation,"Harshi Weerakoon, Ahmed Mohamed, Yide Wong, Bhagya Senadheera, Oscar Haigh, Thomas S. Watkins, Stephen Kazakoff, Pamela Mukhopadhyay, Jason Mulvenna, John J. Miles, Michelle M. Hill, Ailin Lepletier",2023-03-20
https://www.biorxiv.org/content/10.1101/2022.03.17.484053v1#comment-6145691855,biorxivstage,0,"Hi! Thank you so much for your submission of your paper. The language was very clear and extremely easy to understand for individuals that are not familiar with the field.  I particularly liked your diagram representation in Figure 8. It was excellent at conveying the concepts and made it easy for the reader to visualize. I do have a few suggestions: Personally, I felt Figure 1 had too much data and was a bit overwhelming. I would suggest breaking the figure down into smaller figures. I found it difficult to read Figure 4G. I would suggest increasing the size and resolution of the image. Overall, this was a great paper. Thank you for your work.",2023-03-24T23:40:31,akshayajayakarunakaran,Akshaya Jayakarunakaran,10.1101/2022.03.17.484053,Maintaining hypoxia environment of subchondral bone alleviates osteoarthritis progression,"Hao Zhang, Lipeng Wang, Jin Cui, Sicheng Wang, Yafei Han, Hongda Shao, Cheng Wang, Yan Hu, Xiaoqun Li, Qirong Zhou, Jiawei Guo, Xinchen Zhuang, Shihao Sheng, Tao Zhang, Dongyang Zhou, Jiao Chen, Fuxiao Wang, Qianmin Gao, Yingying Jing, Xiao Chen, Jiacan Su",2022-03-18
https://www.biorxiv.org/content/10.1101/2022.10.31.514585v1#comment-6145688616,biorxivstage,0,"Thank you so much for your paper. Therapeutics in relation to viruses is a personal favorite of mine and I found your paper to be extremely intriguing. I personally thought your mice work was great, and was a great model to be used. Additionally, the language employed by the paper was very easy to read and interpret. I do have a few suggestions: Personally, I found it a bit hard to read figure 5. So, I would encourage you to increase the size of the images. I would have also liked if separate data was included for mice of both sexes, so we could compare the effect that sex has. Figure 10 was also not great. I would have preferred a line graph to a bar graph or two bar graphs for each condition as opposed to stacked together. Overall, this was a great paper. Thank you for your work.",2023-03-24T23:34:31,akshayajayakarunakaran,Akshaya Jayakarunakaran,10.1101/2022.10.31.514585,A novel anti-cancer therapy with nuclear export inhibitor Selinexor in combination with oncolytic myxoma virus,"Masmudur M. Rahman, Fleur van Oosterom, Junior Ayuk Enow, Maksuda Hossain, Ami D. Gutierrez-Jensen, Mackenzie Cashen, Anne Everts, Kenneth Lowe, Jacquelyn Kilbourne, Juliane Daggett-Vondras, Timothy L. Karr, Grant McFadden",2022-11-01
https://www.biorxiv.org/content/10.1101/2023.01.01.522422v1#comment-6145684654,biorxivstage,0,"Hi! Thank you so much for your paper. We found your discussion of fibrosis in mouse models to be great. It was very interesting and well written. I do have a few suggestions: You had utilized pig and mouse models. It would have been nice to include why you thought it was important to include both animal models. Also, I thought it was important to include animals of both sexes and the effect in different sexes. I also felt it was a bit difficult to read and interpret figure 3B due to its small size. I would recommend increasing the size and resolution of the image. Thank you again for your paper!",2023-03-24T23:27:08,akshayajayakarunakaran,Akshaya Jayakarunakaran,10.1101/2023.01.01.522422,Circuit to target approach defines an autocrine myofibroblast loop that drives cardiac fibrosis,"Shoval Miyara, Miri Adler, Elad Bassat, Yalin Divinsky, Kfir B. Umansky, Jacob Elkahal, Alexander Genzelinakh, David Kain, Daria Lendengolts, Tali Shalit, Michael Gershovits, Avraham Shakked, Lingling Zhang, Jingkui Wang, Danielle M. Kimchi, Andrea Baehr, Rachel Sarig, Christian Kupatt, Elly M. Tanaka, Ruslan Medzhitov, Avi Mayo, Uri Alon, Eldad Tzahor",2023-01-03
https://www.biorxiv.org/content/10.1101/2023.01.17.524254v1#comment-6145680984,biorxivstage,0,"Thank you for your paper. Our class discussed this paper and we really enjoyed the discussion of it. One of my classmates felt very connected to this paper as her grandfather passed away due to COVID- 19. Additionally, my grandfather suffered from Alzheimer’s disease and eventually passed away from the disease. So, we thank you for your work that is quite impactful and translational. I thought Figure 2 was excellent. It was succinct and clearly conveyed the data to the reader.  I do have a few suggestions: I found Figure 3 quite tough to read. Personally, I think there is too much data conveyed in one figure. I think it would be best to break it down into several figures. I also felt this paper had a bit too many figures. I think it's great to have done so much work but it is quite overwhelming for the reader to have to go through so many figures. It would have been best to limit it to a few most important figures.",2023-03-24T23:20:28,akshayajayakarunakaran,Akshaya Jayakarunakaran,10.1101/2023.01.17.524254,Higher Angiotensin I Converting Enzyme 2 (ACE2) levels in the brain of individuals with Alzheimer’s disease,"Reveret Louise, Leclerc Manon, Emond Vincent, Loiselle Andréanne, Bourassa Philippe, Tremblay Cyntia, David A Bennett, Hébert Sébastien, Calon Frédéric",2023-01-18
https://www.biorxiv.org/content/10.1101/2023.01.10.523434v1#comment-6145675644,biorxivstage,0,"Hi! Thank you so much for your submission of your paper. The language was very clear and extremely easy to understand for individuals that are not familiar with the field. The employment of xenografts was great. Personally, I was not familiar with the technique and learnt a lot about it through reading your paper. Furthermore, I thought your employment of controls was great and very appropriate. It served well to verify the reliability of experiments. It also serves well to help analyze the experimental data in relation to the control. The some of the things that could be improved are: Personally, I felt Figure 3 and 4 could be combined because they seem to be conveying the same thing. The plot in Figure 2 is a bit unclear and I would prefer a box and whisker plot to convey the data better. Again, this was a great paper and we really enjoyed reading it.  Thank you for your scientific contribution.",2023-03-24T23:10:53,akshayajayakarunakaran,Akshaya Jayakarunakaran,10.1101/2023.01.10.523434,Spatial distribution and functional relevance of FGFR1 and FGFR2 expression for glioblastoma tumor invasion,"Nawal Alshahrany, Ana Jimenez-Pascual, Florian A Siebzehnrubl",2023-01-10
https://www.biorxiv.org/content/10.1101/2021.10.01.462746v1#comment-6145495534,biorxivstage,0,"Hello, kind readers! The final, peer-reviewed version of this article is now live on Current Biology, at https://doi.org/10.1016/j.c.... Cheers, Joe Bedont",2023-03-24T18:52:53,,Joseph Bedont,10.1101/2021.10.01.462746,Polyamine elevation and nitrogen stress are toxic hallmarks of chronic sleep loss in Drosophila melanogaster,"Joseph Bedont, Anna Kolesnik, Dania Malik, Aalim Weljie, Amita Sehgal",2021-10-02
https://www.biorxiv.org/content/10.1101/2021.09.13.460097v3#comment-6145475731,biorxivstage,0,It has been published https://doi.org/10.1016/j.m...,2023-03-24T18:27:52,yuxipang,Yuxi Pang,10.1101/2021.09.13.460097,Orientation dependent proton transverse relaxation in the human brain white matter: The magic angle effect on a cylindrical helix,Yuxi Pang,2022-04-19
https://www.biorxiv.org/content/10.1101/2022.09.16.508261v1#comment-6145473897,biorxivstage,0,THis manuscipt has been publised in NMR in Biomedicine ( https://doi.org/10.1002/nbm... under a different title.,2023-03-24T18:25:41,yuxipang,Yuxi Pang,10.1101/2022.09.16.508261,On the origin of R2 orientation dependence angle offsets in white matter,Yuxi Pang,2022-09-17
https://www.biorxiv.org/content/10.1101/2023.03.18.533265v1#comment-6144811156,biorxivstage,0,"This is a very interesting story, thank you for sharing on BioRxiv. We reported supporting results within mice cerebellum ( https://pubmed.ncbi.nlm.nih..., where we found that the functional organization between granule cells and Purkinje cells accounts for mice behavior at an individual, task-dependent level. I was wondering whether CF described in your study could somehow be related to implementation of internal models (in your case for non-motor related tasks) ?",2023-03-23T21:38:01,ludovicspaeth,Ludovic Spaeth,10.1101/2023.03.18.533265,Predicting an Individual’s Cerebellar Activity from Functional Connectivity Fingerprints,"Vaibhav Tripathi, David C Somers",2023-03-18
https://www.biorxiv.org/content/10.1101/2021.12.22.473897v1#comment-6144445647,biorxivstage,2,"Good analysis. All points agreed. A valuable contribution to the field. Except the  attribute given to the causal factors such as feeding, I could not grasp: (a) how and where the authors quantified bioturbation or uprooting effects of foraging cyprinids?; (b) where and how the authors quantified repeated feed application in littoral zone/ bed made them unsuitable for recurrent aquatic macrophyte growth?; (c) what is the redfield ratio of feed input and how it dilutes or upconcentrates the same ratio in littoral bed making them unsuitable?. The authors show nicely temporal trends of littoral machrophyte zone shrinking (OKAY), but do not show direct causal relationship with attributes for which they are blaming the reason (e.g., feeding or no feeding). One can say, the same inference could be drawn for climate change too (perhaps stronger after evaluating a multi-decadal water stress in the territory). If fishpond management is to blame, why chasing feed application alone, when there are bigger causes such as farmers preferring not to keep them as they interfere with netting/ harvesting operations. Why not discuss these? Lastly, an intuitive point to consider, higher the littoral macrophyte vegetation (especially the emergent ones), more intense is the evapotranspiration by the pond body; because there is more surface area which actively evapo-transpires. This is further compounded by water stress (climate change), see the IPCC report published recently. Is not the relationship between shrinkage of littoral vegetation cover and a good littoral vegetative cover, universally juxtaposed forever? As a matter of fact, if recent IPCC report is true, one could question if keeping dense macrophyte beds (littoral) is even reasonable to combat water stress, and not making green belts around the pond instead. Which is efficient and not counter-productive? To conclude, the publication has a strong logic, but it could easily discuss its results on a broader context; instead of localizing its focal point with things that are more socio-politically charged and less of science. I recommend the study to be published; but also request the learned authors (with good legacies of work behind their names) to consider this request. The writing is good.",2023-03-23T13:49:31,,wonderfulponderfulponds,10.1101/2021.12.22.473897,Habitat deterioration despite protection: long-term declines of littoral area of fishponds in Czech nature reserves,"Vojtech Kolar, Kateřina Francová, Jaroslav Vrba, Stanislav Grill, David S. Boukal",2021-12-23
https://www.biorxiv.org/content/10.1101/2023.02.11.528110v2#comment-6144439579,biorxivstage,1,"This is really an exciting study. It’s one of the most extensive layer-fMRI studies that exist. Very convincing and beautiful data quality and images. While reading through it, I could think of a few comments. Line 750, GRAPPA 0: I think the convention in the field would be to refer to it as GRAPPA 1, or just say not GRAPPA acceleration. Line 789 Excluding columns that are dominated from pial vessels: It is not really clear to me how this affects the results. Maybe it would give the reader a better insight if there is a statement about how many voxels were excluded? 1267 reference should be Huber (not Renzo). In Fig. 1a and  2d, the color bars seem to be wrong. There is no light blue and no yellow in the maps. I believe the maps are using a binary colorbar with just positive and negative responses? Fig. 6d looks manually edited (included screenshots overlaid on vector graphic). It might be that this is some rendering from BioRxiv, but the line artifacts look strange. I found it hard to interpret the unit of % signal change with the used baseline definitions. I am looking forward to seeing this published in a prestigious journal. Renzo",2023-03-23T13:41:12,,renzohuber@gmail.com,10.1101/2023.02.11.528110,Hierarchical and fine-scale mechanisms of binocular rivalry for conscious perception,"Chencan Qian, Zhiqiang Chen, Gilles de Hollander, Tomas Knapen, Zihao Zhang, Sheng He, Peng Zhang",2023-03-02
https://www.biorxiv.org/content/10.1101/2023.02.02.526749v1#comment-6144346052,biorxivstage,3,"Comment on the BioRxiv article by Wasniewski et al., 2023 (doi: 10.1101/2023.02.02.526749) We congratulate the authors on this very extensive work on SARS-CoV-2 genome sequences from mink sampled in France. However, we regret that all previous studies we have published on the same topic (Fournier et al., 2021; Devaux et al., 2021; Colson et al., 2021; Colson et al., 2023) have been ignored here. Practically, France did not implement systematic SARS-CoV-2 surveillance in mink farms during the summer of 2020, despite information circulating at the WHO after information from Holland and Denmark showing that there were SARS-CoV-2 epidemics among farm mink that were transmissible to humans, and then, in a human-to-human manner (Larsen et al., 2021; Oude Munnink et al., 2021). In France, after the first incidence wave, a new rise of incidence was observed during summer 2020 that started in June from Mayenne (in the left upper corner of France), a department where SARS-CoV-2 cases were reported in two slaughterhouses including one in Laval in June 2020 and that is close to the Eure-et-Loir department, where there was the French farm with minks diagnosed SARS-CoV-2-positive mid-November 2020. Interestingly, the re-increase of Covid-19 cases in France was associated with the emergence of a new variant, which we identified in our geographical area and we called ""Marseille 4"" and which was classified in the B.1.160 Pangolin lineage (Fournier et al., 2021). We tried to get access to the SARS-CoV-2 sequences or samples of the mink of the Eure-et-Loir farm, but we could not get them, and the first sequence was published 4 months after the systematic culling of the whole mink reservoir. Our epidemiological hypothesis was that the ""Marseille 4"" epidemic, which predominated and was the most severe between August 2020 and February 2021 in France, had its origin in mink farming, and indeed, the first sequence released showed a perfect similarity with the very many sequences of this variant that we were able to obtain from humans, as we already reported in 3 publications of studies analyzing these sequences (Fournier et al., 2021; Colson et al., 2021). Moreover, a Marseille-4 genome was found in a mink sampled in October 2020 in Italy (Moreno et al., 2022). Our hypothesis is that mink generated a new variant transmissible to humans as in the Netherlands and in Denmark. It is a pity that, in a publication of this nature, all these elements, which have already been published and are on-line, were not integrated into a discussion of the epidemics of SARS-CoV-2 in French mink farms. Didier Raoult, Philippe Colson References Colson P, Fournier PE, Chaudet H, Delerce J, Giraud-Gatineau A, Houhamdi L, Andrieu C, Brechard L, Bedotto M, Prudent E, Gazin C, Beye M, Burel E, Dudouet P, Tissot-Dupont H, Gautret P, Lagier JC, Million M, Brouqui P, Parola P, Fenollar F, Drancourt M, La Scola B, Levasseur A, Raoult D. Analysis of SARS- CoV-2 Variants From 24,181 Patients Exemplifies the Role of Globalization and Zoonosis in Pandemics. Front Microbiol. 2022 Feb 7;12:786233. doi: 10.3389/fmicb.2021.786233. PMID: 35197938; PMCID: PMC8859183. Colson P, Gautret P, Delerce J, Chaudet H, Pontarotti P, Forterre P, Tola R, Bedotto M, Delorme L, Bader W, Levasseur A, Lagier JC, Million M, Yahi N, Fantini J, La Scola B, Fournier PE, Raoult D. The emergence, spread and vanishing of a French SARS-CoV-2 variant exemplifies the fate of RNA virus epidemics and obeys the Mistigri rule. J Med Virol. 2023 Jan;95(1):e28102. doi: 10.1002/jmv.28102. Epub 2022 Sep 10. PMID: 36031728; PMCID: PMC9539255. Devaux CA, Pinault L, Delerce J, Raoult D, Levasseur A, Frutos R. Spread of Mink SARS-CoV-2 Variants in Humans: A Model of Sarbecovirus Interspecies Evolution. Front Microbiol. 2021 Sep 20;12:675528. doi: 10.3389/fmicb.2021.675528. PMID: 34616371; PMCID: PMC8488371. Fournier PE, Colson P, Levasseur A, Devaux CA, Gautret P, Bedotto M, Delerce J, Brechard L, Pinault L, Lagier JC, Fenollar F, Raoult D. Emergence and outcomes of the SARS-CoV-2 'Marseille-4' variant. Int J Infect Dis. 2021 May;106:228-236. doi: 10.1016/j.ijid.2021.03.068. Epub 2021 Mar 27. PMID: 33785459; PMCID: PMC7997945. Larsen HD, Fonager J, Lomholt FK, Dalby T, Benedetti G, Kristensen B, Urth TR, Rasmussen M, Lassaunière R, Rasmussen TB, Strandbygaard B, Lohse L, Chaine M, Møller KL, Berthelsen AN, Nørgaard SK, Sönksen UW, Boklund AE, Hammer AS, Belsham GJ, Krause TG, Mortensen S, Bøtner A, Fomsgaard A, Mølbak K. Preliminary report of an outbreak of SARS-CoV-2 in mink and mink farmers associated with community spread, Denmark, June to November 2020. Euro Surveill. 2021 Feb;26(5):2100009. doi: 10.2807/1560-7917.ES.2021.26.5.210009. PMID: 33541485; PMCID: PMC7863232. Moreno A, Lelli D, Trogu T, Lavazza A, Barbieri I, Boniotti M, Pezzoni G, Salogni C, Giovannini S, Alborali G, Bellini S, Boldini M, Farioli M, Ruocco L, Bessi O, Maroni Ponti A, Di Bartolo I, De Sabato L, Vaccari G, Belli G, Margutti A, Giorgi M. SARS-CoV-2 in a Mink Farm in Italy: Case Description, Molecular and Serological Diagnosis by Comparing Different Tests. Viruses. 2022 Aug 8;14(8):1738. doi: 10.3390/v14081738. PMID: 36016360; PMCID: PMC9415545. Oude Munnink BB, Sikkema RS, Nieuwenhuijse DF, Molenaar RJ, Munger E, Molenkamp R, van der Spek A, Tolsma P, Rietveld A, Brouwer M, Bouwmeester- Vincken N, Harders F, Hakze-van der Honing R, Wegdam-Blans MCA, Bouwstra RJ, GeurtsvanKessel C, van der Eijk AA, Velkers FC, Smit LAM, Stegeman A, van der Poel WHM, Koopmans MPG. Transmission of SARS-CoV-2 on mink farms between humans and mink and back to humans. Science. 2021 Jan 8;371(6525):172-177. doi: 10.1126/science.abe5901. Epub 2020 Nov 10. PMID: 33172935; PMCID: PMC7857398. Wasniewski M, Boué F, Richomme C, Simon-Lorière E, Van der Werf S, Donati F, Enouf V, Blanchard Y, Beven V, Leperchois E, Leterrier B, Corbet S, Le Gouil M, Monchatre-Leroy E, Picard-Meyer E. Investigations on SARS-CoV-2 and other coronaviruses in mink farms in France at the end of the first year of COVID-19 pandemic. bioRxiv [Preprint]. 2023 Feb 2:2023.02.02.526749. doi: 10.1101/2023.02.02.526749. PMID: 36778275; PMCID: PMC9915642.",2023-03-23T10:54:22,didier_raoult,Didier Raoult,10.1101/2023.02.02.526749,Investigations on SARS-CoV-2 and other coronaviruses in mink farms in France at the end of the first year of COVID-19 pandemic,"Marine Wasniewski, Franck Boué, Céline Richomme, Etienne Simon-Lorière, Sylvie Van der Werf, Flora Donati, Vincent Enouf, Yannick Blanchard, Véronique Beven, Estelle Leperchois, Bryce Leterrier, Sandrine Corbet, Meriadeg Le Gouil, Elodie Monchatre-Leroy, Evelyne Picard-Meyer",2023-02-02
https://www.biorxiv.org/content/10.1101/2022.03.30.486335v1#comment-6144327050,biorxivstage,0,A revised version is now out on eLife: https://elifesciences.org/a...,2023-03-23T10:03:53,disqus_Yo5FffmVVd,Asaph Zylbertal (@azylbertal@n,10.1101/2022.03.30.486335,A recurrent network architecture explains tectal activity dynamics and experience-dependent behaviour,"Asaph Zylbertal, Isaac H. Bianco",2022-04-01
https://www.biorxiv.org/content/10.1101/2023.03.22.533649v1#comment-6144282361,biorxivstage,0,"1. p 3 l 4: First categorizing of TAs into 8 groups was 2020 by the Wood group ( doi.org/10.3389/fmicb.2020...., not ref 2. 2. p 3 L 6 is incorrect (type VIII has a non-protein toxin). 3. p 3 L 29: Should cite the first TAs reported to inhibit phage, Hok/Sok 1996 (doi: 10.1128/jb.178.7.2044-2050.1996), since this created the whole TAs as phage inhibition paradigm. 4. p 3 L 29: no evidence of ABI via TAs. 5. p 3 L 35 and p 4 l 3: should cite first protein engineering to show malleability of TAs, that toxins and antitoxins were interconvertible via protein engineering (DOI: 10.1038/srep04807), before the same method was used for Panacea.",2023-03-23T07:54:02,Junco7777,Prof. T. K. Wood,10.1101/2023.03.22.533649,The structural basis of hyperpromiscuity in a core combinatorial network of Type II toxin-antitoxin and related phage defence systems,"Karin Ernits, Chayan Kumar Saha, Tetiana Brodiazhenko, Bhanu Chouhan, Aditi Shenoy, Julián J. Duque-Pedraza, Veda Bojar, Jose A. Nakamoto, Tatsuaki Kurata, Artyom Egorov, Lena Shyrokova, Marcus J. O. Johansson, Toomas Mets, Aytan Rustamova, Jelisaveta Džigurski, Tanel Tenson, Abel Garcia-Pino, Arne Elofsson, Vasili Hauryliuk, Gemma C. Atkinson",2023-03-22
