comment url,comment forum,comment keywords,comment message,comment date,comment username,comment name,paper doi,paper title,paper authors,paper date
https://www.biorxiv.org/content/10.1101/2022.10.10.511625v1#comment-6018071163,biorxivstage,1,"I would like to thank Dr Crits-Christoph for his detailed critique Regarding point (3) Dr Crits-Christoph states that many of the intermediate genomes derived from a ""dataset with poor coverage, that included the vast majority of samples which had no coverage at the relevant sites."" If he has evidence of zero coverage at relevant sites in the 'vast majority of samples' then we encourage him to share it. Likewise, it would be of great utility if he could provide evidence of miscalls at positions 8782/28144 in the Sichuan/Wuhan C/C intermediate genomes. Bafflingly, Pekar et al. include over 50 genomes from the Lin et al (2021) dataset in their analysis but chose to exclude 12 C/C intermediate genomes from the same dataset (we identified 12 additional C/C intermediates that they did not consider that we note in our bioRxiv preprint). This is inconsistent with Dr Crits-Christoph's claim. that the 'vast majority...had no coverage at the relevant sites'. On what basis did they choose to retain these >50 genomes, but discard the C/C intermediates? This appears to be a clear case of selection bias. The genomes generated by Lin et al (2021) are of variable coverage - however, from their Table S2 the average % coverage with > 1 read is 95.5% (for Sichuan genomes). The likelihood is therefore that most genomes will have coverage at position 8782 (and given that all positions 28144 are called as C, it can be assumed that these all have coverage there, as Wuhan-Hu-1 has T at this position). A case in point regarding the quality of the Lin et al dataset: C/C intermediate EPI_ISL_451389 has 99.8% coverage with  > 10X read depth. This is a good quality genome therefore. Problems with the inferences made regarding claimed A and B specific SNVs in some of the C/C intermediates were discussed in: https://zenodo.org/record/7... Here is an updated summary: ' Seven intermediate genomes were excluded for possessing what were described as A, B or a combination of A and B specific SNVs.The rationale given was that these were A or B lineage genomes that acquired convergent mutations at positions 8782 and 28144 to produce C/C or T/T genotypes. However, if a B lineage genome acquired the mutation T28144C, converting it into a C/C intermediate, this would be a reversion mutation rather than a convergent mutation. In addition, no data was provided to demonstrate that a particular SNV was A or B specific. Four of the genomes had only one A or B specific (however defined) SNV (EPI_ISL_1069206 had one A specific SNV, while EPI_ISL_451390 and two unidentified genomes had one B specific SNV each). These could just as easily represent homoplasies that arose via convergence. No caveat to this effect was included in Pekar et al. Whether the remaining 3 genomes that had more than one SNV (claimed as A or B specific) are located intermediate between lineage A and lineage B genomes on a phylogenetic tree, or were phylogenetically aberrant, was not tested by the authors.' Dr Crits-Christoph claims some of the C/C intermediates are 'phylogenetically aberrant'. One way he could substantiate this is by showing this on a phylogenetic tree (remembering that homoplasies result in 'phylogenetic aberrance', indeed this is one of the manners in which they are detected). 21844 will be changed to 28144 in the next version of the preprint, thankyou for noting",2022-10-20T23:49:36,disqus_plWzQuLdvi,Steven Massey,10.1101/2022.10.10.511625,Statistical challenges for inferring multiple SARS-CoV-2 spillovers with early outbreak phylodynamics,"Alex Washburne, Adrian Jones, Daoyu Zhang, Yuri Deigin, Steven Quay, Steven E Massey",2022-10-13
https://www.biorxiv.org/content/10.1101/2022.08.30.505955v1#comment-6017983239,biorxivstage,0,In the third and fourth panel of Figure 2F it looks like the low FRET states might be a result of photobleaching. In those traces did you see recovery to the higher FRET state or was the transition to a low FRET state permanent?,2022-10-20T21:34:50,FishGordon,Moshe Tsvi Gordon,10.1101/2022.08.30.505955,Negative allosteric modulation of the glucagon receptor by RAMP2,"Kaavya Krishna Kumar, Evan S. O’Brien, Chris H. Habrian, Naomi R. Latorraca, Haoqing Wang, Inga Tuneew, Elizabeth Montabana, Susan Marqusee, Daniel Hilger, Ehud Y. Isacoff, Jesper Mosolff Mathiesen, Brian K. Kobilka",2022-08-31
https://www.biorxiv.org/content/10.1101/2022.10.13.512134v1#comment-6017882797,biorxivstage,2,"It's usually beyond the scope of research publications to describe such protocols, as that's not the point of research publications. That said, it takes like 2 seconds to look up ""BSL-3 BU"" and you can see that these protocols are in the public domain: https://www.bu.edu/research... Please do your due diligence before commenting in order to avoid wasting other people's time. Thank you in advance.",2022-10-20T19:34:35,496e66696e6974650d0a,49 6e 66 69 6e 69 74 65 0d 0a,10.1101/2022.10.13.512134,Role of spike in the pathogenic and antigenic behavior of SARS-CoV-2 BA.1 Omicron,"Da-Yuan Chen, Devin Kenney, Chue Vin Chin, Alexander H. Tavares, Nazimuddin Khan, Hasahn L. Conway, GuanQun Liu, Manish C. Choudhary, Hans P. Gertje, Aoife K. O’Connell, Darrell N. Kotton, Alexandra Herrmann, Armin Ensser, John H. Connor, Markus Bosmann, Jonathan Z. Li, Michaela U. Gack, Susan C. Baker, Robert N. Kirchdoerfer, Yachana Kataria, Nicholas A. Crossland, Florian Douam, Mohsan Saeed",2022-10-14
https://www.biorxiv.org/content/10.1101/2022.09.26.509600v2#comment-6017775130,biorxivstage,0,"I really liked reading this article! It provided new insight on antibiotic resistance and provided a new approach that could have potential to be developed into drugs for future use. It is easy to see the big picture when reading through the summary, however there was no clear hypothesis to the study but only a sentence about the big picture of what the methods contained. Including a hypothesis may be better to communicate what the goal is of this study. Readers do know what steps were involved but it may be unclear at first why are we testing this and what results or conclusions are we trying to get to. the results and figures did support each other and each method had correlated figures that showed the results from that method and made it easy for me to understand the results. However, because the result and methods are grouped  into one big portion, it was a bit hard to follow the flow of how the experiment was done. I had to go back and forth between each subheading to be able to have a big picture of what the methods were. The results were also scattered in each section and I had to go through the whole results section to be able to have a summary of results. If I were trying to duplicate results, this may take me more time to go through as there is no separate methods section. I would have to read through everything for each step of the research. I liked how there were analysis of in vivo and in vitro as well as biochemistry of ARM-1. Yet there was not a lot of replication done. With replications of study, it could help strengthen the findings, although sone findings here are consistent with previous findings, which does strengthen the argument. I liked how there were a lot of references, however a lot were from 10 years or older, which may be outdated. It would be better to include more recent findings or studies to strengthen the arguments. Overall, this paper did provide insight to AMR and did contribute to the community.",2022-10-20T17:33:27,disqus_FXzVSBtIr7,Amy Chen,10.1101/2022.09.26.509600,A small molecule that inhibits the evolution of antibiotic resistance,"Anna E. Johnson, Harrison Bracey, Angel Joel Hernandez Viera, Juan Carvajal-Garcia, Esra N. Simsek, Kwangho Kim, Houra Merrikh",2022-10-03
https://www.biorxiv.org/content/10.1101/2022.07.13.499964v1#comment-6017652338,biorxivstage,1,Discussion on this manuscript can be found on Pubpeer. https://pubpeer.com/publica...,2022-10-20T15:13:32,,pp crawler,10.1101/2022.07.13.499964,A minimal role for synonymous variation in human disease,"Ryan S. Dhindsa, Quanli Wang, Dimitrios Vitsios, Oliver S. Burren, Fengyuan Hu, James E. DiCarlo, Leonid Kruglyak, Daniel G. MacArthur, Matthew E. Hurles, Slavé Petrovski",2022-07-15
https://www.biorxiv.org/content/10.1101/2021.05.17.444511v1#comment-6017636994,biorxivstage,2,A comment can be found on Pubpeer. https://pubpeer.com/publica...,2022-10-20T14:55:33,,pp crawler,10.1101/2021.05.17.444511,HLA Gene Expression Mediates Tumor Immunogenicity and Escape,"Xutong Gong, Rachel Karchin",2021-05-18
https://www.biorxiv.org/content/10.1101/2022.09.26.509442v1#comment-6017618576,biorxivstage,1,Discussion on this manuscript can be found on Pubpeer. https://pubpeer.com/publica...,2022-10-20T14:35:12,,pp crawler,10.1101/2022.09.26.509442,Age-associated sleep-wake patterns are altered with Prdm13 signaling in the dorsomedial hypothalamus and dietary restriction in mice,"Shogo Tsuji, Cynthia S Brace, Ruiqing Yao, Yoshitaka Tanie, Hirobumi Tada, Nicholas Rensing, Seiya Mizuno, Julio Almunia, Yingyi Kong, Kazuhiro Nakamura, Noboru Ogiso, Shinya Toyokuni, Satoru Takahashi, Michael Wong, Shin-ichiro Imai, Akiko Satoh",2022-09-28
https://www.biorxiv.org/content/10.1101/2022.10.12.511963v1#comment-6017226237,biorxivstage,0,Excited to try this!,2022-10-20T01:31:05,owenhovey,Owen Hovey,10.1101/2022.10.12.511963,MSFragger-Labile: A Flexible Method to Improve Labile PTM Analysis in Proteomics,"Daniel A. Polasky, Daniel J. Geiszler, Fengchao Yu, Kai Li, Guo Ci Teo, Alexey I. Nesvizhskii",2022-10-17
https://www.biorxiv.org/content/10.1101/2021.10.01.462790v1#comment-6017075852,biorxivstage,0,This article has been accepted in Nature Communications.  Here it is the temporary link: https://rdcu.be/cXtfP An official link to the journal will be forthcoming.,2022-10-19T21:25:49,barbara_calabrese,Barbara Calabrese,10.1101/2021.10.01.462790,INF2-mediated actin filament reorganization confers intrinsic resilience to neuronal ischemic injury,"Barbara Calabrese, Steven Jones, Yoko Yamaguchi-Shiraishi, Michael Lingelbach, Uri Manor, Tatyana M Svitkina, Henry N Higgs, Andy Y Shih, Shelley Halpain",2021-10-01
https://www.biorxiv.org/content/10.1101/2022.10.10.511625v1#comment-6016843829,biorxivstage,0,"This is another irrelevant digression about selective scrutiny of intermediate genomes. Pekar et al authors can speak to that if they like. Briefly, it's rational to spend finite time scrutinizing the most important data, and there was a demand to do exactly this for possible intermediate sequences prior to this work. Others are free to extend detective work applied to 20 sequences to the other 787 sequences and report the results. I am not claiming anything was miscalled -- I am pointing out that in some cases you have listed genomes in which half of the genome was called neither incorrectly nor correctly because it was not called at all. This does not match the inclusion criteria of fewer than 1% Ns, but to see this, it requires additional scrutiny beyond the GISAID record that is not possible for many genomes in the data set.",2022-10-19T17:11:07,zach_hensel,Zach Hensel,10.1101/2022.10.10.511625,Statistical challenges for inferring multiple SARS-CoV-2 spillovers with early outbreak phylodynamics,"Alex Washburne, Adrian Jones, Daoyu Zhang, Yuri Deigin, Steven Quay, Steven E Massey",2022-10-13
https://www.biorxiv.org/content/10.1101/2022.10.10.511625v1#comment-6016708469,biorxivstage,1,"Dr Hensel asks us to believe that he is able to determine that position 8782 was miscalled as C in all 24 C/C intermediate genomes from the Lin et al (2021) dataset, without providing any direct evidence. Regarding the quality of the sequences in Lin et al., he neglects to mention that Pekar et al used > 50 other genomes from Lin et al in their analysis. So clearly the authors felt that the dataset was of good quality. Incidentally, this represents an apparent example of selection bias. Regarding EPI_ISL_452363 and EPI_ISL_453783, once again, on the information provided it is impossible to know if this is the same sequence with duplicate entries, or the same sample resequenced. EPI_ISL_453783 was not explicitly addressed by Pekar et al, and Dr Hensel prefers the reader to assume that it was considered and discarded by Pekar et al, who then didn't feel the need to report that they did this. How many other potential intermediate genomes did they do this to ? Again, without explicit confirmation by Pekar et al it is impossible to know. We are planning to add a note regarding the similarities between the two sequences to the preprint and we thank him for his input.",2022-10-19T14:44:41,disqus_plWzQuLdvi,Steven Massey,10.1101/2022.10.10.511625,Statistical challenges for inferring multiple SARS-CoV-2 spillovers with early outbreak phylodynamics,"Alex Washburne, Adrian Jones, Daoyu Zhang, Yuri Deigin, Steven Quay, Steven E Massey",2022-10-13
https://www.biorxiv.org/content/10.1101/2020.05.14.096032v3#comment-6016450648,biorxivstage,1,"How is the project going ? Why the manuscript is withdrawn ? It seems the data presented here is somewhat contradictroy with their previous publication ( http://dx.doi.org/10.1016/j... showing that co-injection of Pa + Mm (Fig.2) didn't reduce neutrophils recruitment VS injection of Pa alone, suggesting not a inhibitory role of Mm but neutrophils are invisible to Mm.",2022-10-19T06:48:27,zbfz,zbfz,10.1101/2020.05.14.096032,Mycobacteria inhibit neutrophil recruitment to avoid neutrophil-assisted killing by macrophages,"Sergio Candel, Lalita Ramakrishnan",2020-07-29
https://www.biorxiv.org/content/10.1101/2022.10.10.511625v1#comment-6016264632,biorxivstage,1,"The methods in Lin et al clearly state that these are not complete genomic sequences. The data in the paper and supplementary data clearly show that coverage is too low to infer anything other than variations reported from Wuhan-Hu-1. It is not a coincidence that a large majority of C/C sequences sampled on or before 14/Feb/2020 are unrelated patients spanning several hospitals and two provinces from the same study. Simply put, Washburne et al are claiming that absence of evidence is evidence of absence. This is problematic in any case and especially so if claiming to have identified evidence of a vanishingly rare intermediate lineage. In addition to having the same age, sample date, sample ID, patient status, sample type, sequencing method, sequencing coverage, and sequence to show that EPI_ISL_453783 and EPI_ISL_452363 are obviously the same sample, the sample ID is ""DT-WH04"" with WH meaning Wuhan. While the data for EPI_ISL_452363 comes from Beijing, the sample metadata includes additional location information: Wuhan. The relevant exclusion criteria for this is described in Pekar et al: ""if the virus was sequenced multiple times..."" It's plainly the same sample, and Dr. Massey was informed of this as well as low coverage of Sichuan genomes on 20/Sept/2022. I did not mention reasons for excluding those two Beijing sequences and this has no relevance to my comment.",2022-10-19T00:14:18,zach_hensel,Zach Hensel,10.1101/2022.10.10.511625,Statistical challenges for inferring multiple SARS-CoV-2 spillovers with early outbreak phylodynamics,"Alex Washburne, Adrian Jones, Daoyu Zhang, Yuri Deigin, Steven Quay, Steven E Massey",2022-10-13
https://www.biorxiv.org/content/10.1101/2021.01.13.426423v2#comment-6015853723,biorxivstage,0,Published in Molecular Vision December of 2021 PMID: 35136346,2022-10-18T16:05:17,,Kacie Meyer,10.1101/2021.01.13.426423,Recombinant adenovirus causes prolonged mobilization of macrophages in the anterior chamber of mice,"Kacie J. Meyer, Danielle Pellack, Adam Hedberg-Buenz, Nicholas Pomernackas, Dana Soukup, Kai Wang, John H. Fingert, Michael G. Anderson",2021-09-23
https://www.biorxiv.org/content/10.1101/2022.09.21.508539v1#comment-6015803645,biorxivstage,0,"This is an interesting paper that applies neural networks to model ATAC-seq and TF binding data in Plasmodium for the first time. However, it would be useful to provide a more detailed description of the methods, particularly to clarify the following points: Q1: The training labels are applied to 200bp bins, but the input sequences are expanded to 1Kbp centered on each bin. I'm confused about how the labels propagate when the windows are expanded. Let's say you have a negative bin that neighbors a positive bin. When you expand the 1Kbp window around the negative bin, the input sequence will encompass the positive bin. Is this 1Kbp input then labeled as positive or negative? Q2: When you split the data into training/validation/test, do you randomly choose bins or restrict them to particular chromosomes? If you randomly choose 200bp bins for your test data, won't the sequences from the test bins also be present in the training set (because of the way that windows are expanded to 1Kbp)? Q3: How were the Enformer and Basenji2 models trained? Are they trained on all data at once (i.e., multi-headed output model) or on each dataset separately? Q4: According to Supp. Table 1, most models include the following hyperparameter settings: convKnernal1st=320, convKnernal2ed=480. These hyperparameters are labeled as follows in the table:  ""convKnernal1st: The filter size of first convolution layer; convKnernal2ed: The second size of first convolution layer"". I'm confused by this description. Do these hyperparameters represent the filter width or the number of filters in each layer? I'm presuming the latter, but then what width filters were used? Q5: The Github doesn't seem to contain code for training the models; is this code available?",2022-10-18T15:12:35,disqus_8Wp7l2BGp4,Shaun Mahony,10.1101/2022.09.21.508539,MalariaSED: a deep learning framework to decipher the regulatory contributions of noncoding variants in malaria parasites,"Chengqi Wang, Yibo Dong, Jenna Oberstaller, Chang Li, Min Zhang, Justin Gibbons, Camilla Valente Pires, Lei Zhu, Rays H.Y. Jiang, Kami Kim, Jun Miao, Thomas D. Otto, Liwang Cui, John H. Adams, Xiaoming Liu",2022-09-22
https://www.biorxiv.org/content/10.1101/2022.10.13.512134v1#comment-6015370756,biorxivstage,0,So please describe all of the protocols that are in place to prevent this prototype variant from escaping the Laboratory.,2022-10-18T00:52:00,disqus_pCPLs6fyC5,Hypo,10.1101/2022.10.13.512134,Role of spike in the pathogenic and antigenic behavior of SARS-CoV-2 BA.1 Omicron,"Da-Yuan Chen, Devin Kenney, Chue Vin Chin, Alexander H. Tavares, Nazimuddin Khan, Hasahn L. Conway, GuanQun Liu, Manish C. Choudhary, Hans P. Gertje, Aoife K. O’Connell, Darrell N. Kotton, Alexandra Herrmann, Armin Ensser, John H. Connor, Markus Bosmann, Jonathan Z. Li, Michaela U. Gack, Susan C. Baker, Robert N. Kirchdoerfer, Yachana Kataria, Nicholas A. Crossland, Florian Douam, Mohsan Saeed",2022-10-14
https://www.biorxiv.org/content/10.1101/2022.10.10.511625v1#comment-6015243717,biorxivstage,0,"The papers you've cited that find basal polytomies for ""introductions"" don't actually show that they are associated with ""introductions"". In fact, they are more likely the consequence of superspreading events that occurred after introduction, such as Mardi Gras. Introductions don't cause polytomies, superspreading does. Second, you've actually made our point for us: the problem with FAVITES is precisely that it models within-host evolution while also spreading superspreading events over timescales during which within-host evolution can occur. Whereas real-world superspreading can take place in hours, FAVITES superspreading will take place over the entire infectious period. With a stationary propensity of within-host mutations, FAVITES will have a much higher probability of turning a 3-hour choir-practice superspreading event into a 9-day event (with many being extremely long, due to the exponential distribution of infectious periods in the model). This isn't a good model of superspreading-evolution of SARS-CoV-2. The genomic data for the early SARS-CoV-2 pandemic is not peculiar - it's exactly like the other early-outbreak polytomies you cited, and those weren't caused by spillover, they were caused by superspreading. Some of the efforts to see peculiarities in early outbreak genomes/trees are also prone to observer bias. I can look at a license plate in front of me - NGK 190 - and say ""what are the odds of *exactly* that? I can run a null model of license plates and say ""basically no chance of that"". Then, I can make a license plate that's restricted in my favor. It'll have a much higher odds of NGK 190. That doesn't mean my new model is right. It means my initial probabilistic assessment of an unusual feature I picked up is prone to observer bias. Pekar et al. noticed two basal polytomies, tested that with a model that made it seem very unlikely, and then created an alternative model that made it seem more likely.",2022-10-17T21:33:23,alexwashburne,Alex Washburne,10.1101/2022.10.10.511625,Statistical challenges for inferring multiple SARS-CoV-2 spillovers with early outbreak phylodynamics,"Alex Washburne, Adrian Jones, Daoyu Zhang, Yuri Deigin, Steven Quay, Steven E Massey",2022-10-13
https://www.biorxiv.org/content/10.1101/2022.10.10.511625v1#comment-6015130692,biorxivstage,1,"The intermediate genome sequences generated by Lin et al (2021) must all have had coverage at position 28144 in order for it to be called as a 'C' . Dr Hensel provides no evidence that position 8782 was miscalled as a C in all 24 C/C intermediate genomes sequenced and published by Lin et al. If he does have such evidence, he should make it available. Dr Hensel neglects to mention that the two sample entries EPI_ISL_452363 and EPI_ISL_453783 are not exact duplicates as one is listed as being obtained from Beijing/Wuhan (EPI_ISL_452363), the other from Wuhan (EPI_ISL_453783), consequently it is unclear if the two sequences were generated from the same sequencing run. We are correct in saying that EPI_ISL_453783 was not considered by Pekar et al, and no explanation for its exclusion was given. In addition, a reading of the preprint shows we challenge the basis for the exclusion of EPI_ISL_452363, on page 7: 'two C/C intermediates from Beijing, EPI_ISL_452361 and EPI_ISL_452363, were excluded for the reason that their additional mutations (they both have 2 SNVs compared to Wuhan-Hu-1) 'were not observed in early Lineage A or B genomes and underlying data was not available'. The first criterion is puzzling as it is not explained why the absence of the 2 SNVs observed in the two Beijing genomes, in other early Lineage A or B genomes, is significant. The second exclusion criterion - unavailability of underlying data - is not relevant for phylogenetic inference and was apparently not applied to the rest of the 787 genomes that were utilized in Pekar et al's analysis.'",2022-10-17T19:21:08,disqus_plWzQuLdvi,Steven Massey,10.1101/2022.10.10.511625,Statistical challenges for inferring multiple SARS-CoV-2 spillovers with early outbreak phylodynamics,"Alex Washburne, Adrian Jones, Daoyu Zhang, Yuri Deigin, Steven Quay, Steven E Massey",2022-10-13
https://www.biorxiv.org/content/10.1101/2022.09.14.507978v1#comment-6015076780,biorxivstage,0,"Citation: Candia J et al, Scientific Reports 12:17147 (2022).",2022-10-17T18:21:49,disqus_MpyEq3E4IG,Julian C,10.1101/2022.09.14.507978,Assessment of Variability in the Plasma 7k SomaScan Proteomics Assay,"Julián Candia, Gulzar N. Daya, Toshiko Tanaka, Luigi Ferrucci, Keenan A. Walker",2022-09-15
https://www.biorxiv.org/content/10.1101/2022.06.05.494861v1#comment-6014848709,biorxivstage,0,"The first part of the title, ""Root twisting drives halotropism"", does not seem to be indicated by presented data. Am I missing something?",2022-10-17T14:06:24,yutaotsuka,Yuta Otsuka,10.1101/2022.06.05.494861,Root twisting drives halotropism via stress-induced microtubule reorientation,"Bo Yu, Wenna Zheng, Lu Xing, Jian-Kang Zhu, Staffan Persson, Yang Zhao",2022-06-05
