comment url,comment forum,comment keywords,comment message,comment date,comment username,comment name,paper doi,paper title,paper authors,paper date
https://www.biorxiv.org/content/10.1101/2023.02.16.528884v1#comment-6143853770,biorxivstage,1,"The following comments are from a postdoc in my lab: 1.	Abstract- ….”OGT-KO mice exacerbated DEN-induced HCC developments with increased inflammation, fibrosis, and YAP signaling”  YAP1 is active and localized to nucleus for proliferative activities only in O-GlcNAcylated state, without OGT YAP undergoes phosphorylation and translocation to cytosol for subsequent ubiquitination. 2.	Methods-… “For chronic OGT deletion, two-month-old male OGT-floxed mice were injected intraperitoneally (i.p.) with AAV8-TBG-GFP or AAV8-TBG-CRE, and tissues were collected 35 days after AAV8 administration” Here administering AAvs via IP seems out of place, has any reports of its success been documented??? 3.	Results- ….There was no difference in OGT protein levels in healthy, steatosis, and NASH samples, but OGT was completely absent in cirrhosis and HCC samples” the ogt levels seem increased in steatosis and NASH, but glycation is otherwise no conclusive data. •	Western blot analysis was utilized to confirm successful OGT-KO (Fig. 2B).  I can not see significant OGT deletion or global o-glycation. IP ADMINISTRATION OF AAV FAILURE?? •	“Depletion of O-GlcNAcylation promotes diethylnitrosamine-induced HCC”  2 months post OGT deletion is too short duration. •	…..Lastly, we found decrease in phosphorylated LATS and phosphorylated Yap but an increase in total Yap in OGT-KO mice compared to control mice (Fig. 6O). qPCR on YAP target genes (Ctgf and Ankrd1) corroborated the YAP activity data (Fig. 6P). These data indicated that proliferation is governed by YAP signaling…” this statement is contradictory to YAP dynamics it switches between glycated and phosphorylated forms, while phosphorylated form is destined for turning over the glycated one is active and stable. Increase in phosphorylation should relate to opposite of what authors are claiming. 4.	Discussion- •	“The HCC model we implied was only a 7 month after DEN-injections with only 2 month of OGA deletion. This is relatively short to allow HCC to develop.” But the same duration was conclusive enough for authors for after effects of OGT deletion. •	“Two O-GlcNAcylation sites have currently been mapped to YAP, Ser127 and Thr241. Interestingly, one site is thought to inhibit HCC progress (Ser127), while the other enhances disease progression (Thr241). Both modifications act by increasing the translocation and activity of YAP; however, each seems to have a different role. Ser127 leads to increased cell proliferation and survival, whereas Thr241 modification allows YAP to upregulate the transferrin receptor (TFRC), promoting cell death through ferroptosis.” The bold text regarding glycation at Thr241 are contradictory. •	The competition  of YAP/HNF4α for heterodimerization with TEAD4 is also contradictory. While lack of O-GlcNAcylation leads to downregulation of HNF4α, IT DOES SO WITH YAP too. Need satisfactory explanation 5.	Our Conclusion- The study needs thorough revision and validation with satisfactory explanation of the outcomes.",2023-03-22T19:03:10,disqus_7tyB47z6Be,Wasim Khan,10.1101/2023.02.16.528884,The Essential Role of O-GlcNAcylation in Hepatic Differentiation,"Dakota R. Robarts, Manasi Kotulkar, Diego Paine-Cabrera, Kaitlyn K. Venneman, John A. Hanover, Natasha E. Zachara, Chad Slawson, Udayan Apte",2023-02-17
https://www.biorxiv.org/content/10.1101/2023.03.16.532322v1#comment-6143474250,biorxivstage,0,In the 50:50 BaTP:UTP competitive transcription experiment you can't tell from figure 2B whether U or B are being incorporated preferentially as stated in the text. You could potentially however tell this from the HPLC data in 2c iii). To do this you need to calculate the relative molar extinction coefficients on the HPLC using a concentration gradient of standard samples and measuring their relative absorbance. Then normalise your HPLC integrals from 2c iii) against those coefficients,2023-03-22T10:19:38,disqus_loC5YoSTlW,Sam Roberts,10.1101/2023.03.16.532322,A prebiotic genetic alphabet as an early Darwinian ancestor for pre-RNA evolution,"Anupam A. Sawant, Sneha Tripathi, Sanjeev Galande, Sudha Rajamani",2023-03-16
https://www.biorxiv.org/content/10.1101/2023.03.15.532610v1#comment-6143471086,biorxivstage,0,"Congratulations on the success with OCT1 and 2 - really exciting! It would certainly strengthen your paper even more to compare your insights with the recently published OCT3 structure, as they are quite homologous: https://doi.org/10.1038/s41...",2023-03-22T10:14:43,,A scientist,10.1101/2023.03.15.532610,Molecular basis of polyspecific drug binding and transport by OCT1 and OCT2,"Yang Suo, Nicholas J. Wright, Hugo Guterres, Justin G. Fedor, Kevin John Butay, Mario J. Borgnia, Wonpil Im, Seok-Yong Lee",2023-03-16
https://www.biorxiv.org/content/10.1101/2023.01.17.524254v1#comment-6143232237,biorxivstage,1,"Overall, I really enjoyed this paper and appreciated the implications about the correlation between AD and COVID, since I personally had a loved one who suffered from AD who passed away after a short battle with COVID-19. Overall, I believed this is a very strong paper, but have a few comments that you may take into consideration: In the cohort chart, I would ensure that your statistical analyses are correct. I see that in Cohort #1, you employed largely Mann-Whitney tests implying that your data was nonparametric, however in Cohort #2, you employed parametric tests (Pearson & unpaired t-test) to statistically analyze the data. Was the data set in Cohort #2 parametric? Put a reference and/or graph displaying what criteria/qualifications that are involved in ABC scoring. This would be helpful to your readers who aren’t experts in diagnosing neurological diseases and have an example of how patients are diagnosed. Figure 3 is very overwhelming, as there is so much information compact into one image. Breaking it up into 3a: Antemortem evaluation, 3b: Neurological markers, 3c: BBB markers could help readers easily visualize and digest the information and analyze trends and correlations within the heat map.",2023-03-22T00:12:42,,Jasmine Caballero,10.1101/2023.01.17.524254,Higher Angiotensin I Converting Enzyme 2 (ACE2) levels in the brain of individuals with Alzheimer’s disease,"Reveret Louise, Leclerc Manon, Emond Vincent, Loiselle Andréanne, Bourassa Philippe, Tremblay Cyntia, David A Bennett, Hébert Sébastien, Calon Frédéric",2023-01-18
https://www.biorxiv.org/content/10.1101/2022.12.01.518643v1#comment-6143099898,biorxivstage,1,"Review of the paper on Immunopeptidome profiling of human coronavirus OC43-infected cells identifies CD4 T cell epitopes specific to seasonal coronaviruses or cross-reactive with SARS-CoV-2 Summary. Human coronavirus OC43 is a single-stranded positive-sense RNA virus belonging to the genus beta-coronavirus within the family Coronaviridae. Research interest in the immunopathology of beta-coronaviruses has increased following the emergence of SARS-Cov-2, the causative agent of the disease COVID-19. OC43 infection generally causes mild respiratory symptoms and is grouped into the broad category of seasonal “common-cold” coronaviruses. However, like SARS-CoV-2, it can also cause more severe symptoms in those that are of older age or immunocompromised. Recent studies have found that T cells directed against seasonal human coronaviruses such as OC43 cross-react with SARS-CoV-2 indicating a potential protective role. Currently, there is still a knowledge gap about the specific immune response elicited by “common-cold” coronaviruses and their potential in offering protective immunity against more pathogenic coronaviruses such as SARS. In this study, authors aimed to identify and characterize specific seasonal coronavirus CD4+ T cell epitopes and explore their ability to cross-react with T cell epitopes of SARS-CoV-2. Utilizing a human embryonic kidney cell line transduced with CIITA, the immunopeptidome presented by MHC classes was identified following OC43 infection. Moreover, the authors identified a total of 83 peptides derived from some of the major structural proteins and enzymes comprising OC43. Expanded T-cell populations in vitro found that CD4+ T cells recognized OC43 viral peptides. Seasonal human coronavirus specific epitopes were also identified along with two SARS-CoV-2 cross reactive CD4 epitopes. Overall, this study provides interesting insight into the immune response to seasonal human coronaviruses and highlights the possible protective role of identified T cell epitopes as a whole. Positive feedback. The use of the ELIspot assay over an ELISA assay served as good experimental advancement since the ELIspot assay can detect protein levels of cytokines with greater sensitivity and provides a quantitative assessment of cell number. The use of MassSpec provided a way of identifying new epitopes since it was an untargeted method. The amount of samples analyzed through this manuscript was quite impressive. The color scheme used for different MHC classes was consistent and helped with clarity of figures. The spacing and flow of panels within each figure was laid out well. Major Concerns The study did address that the human embryonic kidney cell line(HEK-293) is not the natural target of OC43 and therefore not the most physiologically relevant. MRC-5, a lung fibroblast cell line, would be a good candidate as it is a natural target and has been shown to propagate OC43 well. It was mentioned that among the 6 biological replicates, 11-68% of the HEK293 CIITA cells showed expression of OC43 nucleoprotein. This is a rather large variability. More explanation or analysis of what this might mean would be helpful. In Figure 3 E-F, donor consistency varies between peptides. P1 and P6 have the same donor, but P2 only has one of the same donors. P4 has two completely different donors as compared to the rest.  The lowest peptide dose eliciting a positive response will vary across donors. Since donors serum was not available to test for confirmed exposure to OC43 or other seasonal human coronaviruses, a western blot could be performed on PBMCs with an antibody against OC43 Spike protein to confirm exposure. HEK-293 were transduced with CIITA, which was acknowledged to potentially block effects of viral infection. It would have been good to keep a non-transduced line of HEK-293 as a control to better assess the possibility of CIITA counteracting effects. The healthy individuals that the PBMCs were isolated from were not clearly described. This information is said to be in the supplemental figures (not provided though on biorxiv), but it would be helpful to have the age and current health status of the patients described in the text. It would be useful to know the prevalence of the HLAs for identified peptides in the population to determine how relevant these findings are. In figure 3 G, it would be helpful to normalize to cell numbers so that cell death can be accounted for. In figure 3 G, a known stimulus for IFN-y such as PMA would be useful to have as a positive control. Minor concerns It would have been of interest to explain the use of the TCID50 assay over a plaque assay which is the usual gold standard for quantifying infectious virus particles. The layout of the figures was slightly disorganized and not always laid out sequentially. Arranging them horizontally instead of vertically would help with ease of reading. For example, in Figure 1 B-F. Supplemental figure legends were provided, but not the supplementary figures. It was also not clear on where to access them. It would be good to make these more accessible. It would be helpful to briefly describe the significance of CD107a as it will not be familiar to someone who is not an expert. In Figure 3 G, the panel is difficult to read. In Figure 3 E-F, the overall take home message from this data is not well described. In Figure 1, datasets could be evaluated for possible post-translational modifications which may affect binding to MHC I and II. This would be interesting, as some post-translational modifications promote MHC binding (Engelhard VH, Altrich-Vanlith M, Ostankovitch M, Zarling AL. Post-translational modifications of naturally processed MHC-binding epitopes. Curr Opin Immunol. 2006 Feb;18(1):92-7. doi: 10.1016/j.coi.2005.11.015.; Sandalova T, Sala BM, Achour A. Structural aspects of chemical modifications in the MHC-restricted immunopeptidome; Implications for immune recognition. Front Chem. 2022 Aug 9;10:861609. doi: 10.3389/fchem.2022.861609.) Specific APC used is not specified in Figure 3 B-C. Antibodies used to detect the proteins produced by MHC-II were specific (HLA-DR, HLA-DQ, and HLA-DP), but the antibodies used to detect MHC-1 proteins, HLA-ABC, were not. More explanation as to why this was the case might be helpful. It might be beneficial to explore other types of immune cells other than T cells, such as B cells, as this might greatly expand the scope of the study. This could be addressed in the discussion just to clarify why T cells were chosen specifically. It might be beneficial to refer to the viral peptides presented by MHC-II as something other than natural as it was acknowledged that the expression of MHC-II proteins was enhanced using CIITA.",2023-03-21T20:47:35,,MICR 603 Journal Club,10.1101/2022.12.01.518643,Immunopeptidome profiling of human coronavirus OC43-infected cells identifies CD4 T cell epitopes specific to seasonal coronaviruses or cross-reactive with SARS-CoV-2,"Aniuska Becerra-Artiles, Padma P. Nanaware, Khaja Muneeruddin, Grant C. Weaver, Scott A. Shaffer, J. Mauricio Calvo-Calle, Lawrence J. Stern",2022-12-01
https://www.biorxiv.org/content/10.1101/2023.03.16.532704v1#comment-6142934677,biorxivstage,1,"Congratulations to the authors on a great study. I think this is a fantastic and powerful approach. I wanted to make one suggestion - I think you should cite this study: https://www.ncbi.nlm.nih.go... Here the authors (who I have no affiliation with) use a similar combination of combinatorial assembly, short and long read sequencing and barcode sequencing to perform parallel assessment of functional libraries. Another demonstration of the power of this approach! It seems quite relevant to me, of course I could be mistaken, but wanted to comment in the interest of open discussion. Again, great work and congrats to the authors.",2023-03-21T17:20:17,disqus_Vx3rcvvBlm,Charlie Gilbert,10.1101/2023.03.16.532704,Ultra-high throughput mapping of genetic design space,"Ronan W. O’Connell, Kshitij Rai, Trenton C. Piepergerdes, Kian D. Samra, Jack A. Wilson, Shujian Lin, Thomas H. Zhang, Eduardo M. Ramos, Andrew Sun, Bryce Kille, Kristen D. Curry, Jason W. Rocks, Todd J. Treangen, Pankaj Mehta, Caleb J. Bashor",2023-03-17
https://www.biorxiv.org/content/10.1101/2021.12.23.474039v1#comment-6142877790,biorxivstage,0,"The peer-reviewed version of this paper was published on March 21, 2023: https://www.nature.com/arti...",2023-03-21T16:09:59,axel_nimmerjahn,Axel Nimmerjahn,10.1101/2021.12.23.474039,"Multiplex, translaminar imaging in the spinal cord of behaving mice","Pavel Shekhtmeyster, Erin M. Carey, Daniela Duarte, Alexander Ngo, Grace Gao, Nicholas A. Nelson, Charles L. Clark, Axel Nimmerjahn",2021-12-24
https://www.biorxiv.org/content/10.1101/2020.02.27.967539v1#comment-6142696990,biorxivstage,1,"I kindly request that you update the journal link to the following: CandiHap: a haplotype analysis toolkit for natural variation study. Molecular Breeding, 2023, 43:21. DOI: 10.1007/s11032-023-01366-4. https://link.springer.com/a...",2023-03-21T11:48:26,xukaili,Xukai Li,10.1101/2020.02.27.967539,CandiHap: a toolkit for haplotype analysis for sequence of samples and fast identification of candidate causal gene(s) in genome-wide association study,"Xukai Li, Zhiyong Shi, Qianru Qie, Jianhua Gao, Xingchun Wang, Yuanhuai Han",2020-02-27
https://www.biorxiv.org/content/10.1101/2021.12.23.474042v1#comment-6142376637,biorxivstage,0,"The peer-reviewed version of this paper was published on March 6, 2023: https://www.nature.com/arti...",2023-03-20T22:38:16,axel_nimmerjahn,Axel Nimmerjahn,10.1101/2021.12.23.474042,Trans-segmental imaging in the spinal cord of behaving mice,"Pavel Shekhtmeyster, Daniela Duarte, Erin M. Carey, Alexander Ngo, Grace Gao, Jack A. Olmstead, Nicholas A. Nelson, Axel Nimmerjahn",2021-12-24
https://www.biorxiv.org/content/10.1101/2023.03.13.532430v1#comment-6141911732,biorxivstage,0,"Readers interested in this paper should first read Trelstad Dev Biol 1982; 92:133-4 and then begin a long reading thread with Bouligand Y. et al. 1985 Biol Cell 54, 143-180 and Bouligand Y. et al. 1985 in Biology of invertebrate and lower vertebrate collagens pp 115-134. Then they should continue on with the rest of Marie Giraud-Guille's work on liquid crystal collagen and its relevance to animal structure.",2023-03-20T12:17:23,,Jeffrey Ruberti,10.1101/2023.03.13.532430,Modelling collagen fibril self-assembly from extracellular medium in embryonic tendon,"Christopher K. Revell, Jeremy A. Herrera, Craig Lawless, Yinhui Lu, Karl E. Kadler, Joan Chang, Oliver E. Jensen",2023-03-15
https://www.biorxiv.org/content/10.1101/2023.03.03.531064v1#comment-6141839551,biorxivstage,0,"Nice paper- it nicely complements a paper we published in Journal of Neuroscience last year ( https://pubmed.ncbi.nlm.nih..., in which we found that neurons in the DMH deepened and prolonged torpor in calorie-restricted mice but were not sufficient to induce it in fed mice. I feel it should be referenced.",2023-03-20T09:31:07,disqus_GiFgEIpnD7,Mike Ambler,10.1101/2023.03.03.531064,Brain-wide mapping of neuronal architecture controlling torpor,"Hiroshi Yamaguchi, Keith R Murphy, Noriaki Fukatsu, Kazuhide Sato, Akihiro Yamanaka, Luis de Lecea",2023-03-04
https://www.biorxiv.org/content/10.1101/2023.03.03.530942v1#comment-6141806976,biorxivstage,0,https://github.com/krijgsve...,2023-03-20T07:51:36,tomanbortecen,Toman Bortecen,10.1101/2023.03.03.530942,An integrated workflow for quantitative analysis of the newly synthesized proteome,"Toman Borteçen, Torsten Müller, Jeroen Krijgsveld",2023-03-03
https://www.biorxiv.org/content/10.1101/2022.10.18.512756v1#comment-6141644501,biorxivstage,0,"As suggested elsewhere in this thread, “please use a DNA analysis tool, such as free SnapGene Viewer. Just using text can be faulty as restriction sites may be cut into 2 lines of text, and their reverse complement sequences may not be found”, resulting in and explaining the faulty search results you refer to as facts.",2023-03-20T00:07:07,matthewelvey,matthewelvey,10.1101/2022.10.18.512756,Endonuclease fingerprint indicates a synthetic origin of SARS-CoV-2,"Valentin Bruttel, Alex Washburne, Antonius VanDongen",2022-10-20
https://www.biorxiv.org/content/10.1101/2023.03.15.532815v1#comment-6141451331,biorxivstage,1,"If I say ""storculation"" a few hundred times in a peer-reviewed article, it doesn't mean ""storculation"" is a real phenomenon. But if Amissah et al. say ""cannabis poisoning"" a few hundred times, you, dear reader, may start to think ""cannabis poisoning"" is real. Because these are scientific/intellectual labourers, because they work in the knowledge industry, and because bioRxiv appears a reputable publication. But ""storculation"" and ""cannabis poisoning"" aren't real. And no amount of repeating these words will make them real.",2023-03-19T19:08:49,claymccann,Clay McCann,10.1101/2023.03.15.532815,Neural and Behavioral Correlates of Edible Cannabis-Induced Poisoning: Characterizing a Novel Preclinical Model,"Richard Quansah Amissah, Hakan Kayir, Malik Asfandyaar Talhat, Ahmad Hassan, Yu Gu, Ron Johnson, Karolina Urban, Jibran Y. Khokhar",2023-03-15
https://www.biorxiv.org/content/10.1101/2023.03.15.532815v1#comment-6141446557,biorxivstage,0,"Not quite clear here on what constitutes ""poisoning"" when the LD-50 for cannabis remains unknown, when cannabis is one of the least toxic substances known to humanity, and especially when humans have no CB receptors in the brain stem (making it literally impossible to overdose on cannabis). This ""study"" represents more than half of all cannabis research, instrumentalized as drug scare propaganda.",2023-03-19T19:02:36,claymccann,Clay McCann,10.1101/2023.03.15.532815,Neural and Behavioral Correlates of Edible Cannabis-Induced Poisoning: Characterizing a Novel Preclinical Model,"Richard Quansah Amissah, Hakan Kayir, Malik Asfandyaar Talhat, Ahmad Hassan, Yu Gu, Ron Johnson, Karolina Urban, Jibran Y. Khokhar",2023-03-15
https://www.biorxiv.org/content/10.1101/2022.02.16.480797v2#comment-6141158492,biorxivstage,0,"The statement ""Successful expression of the functional α-carboxysome in tobacco chloroplasts led to an increase in biomass production"" is incorrect. This could never happen unless there were also bicarbonate transport systems in the chloroplast membrane. We make this clear in the cited paper (Long et al., 2018) and others on the subject.",2023-03-19T11:28:06,disqus_9iFgTJTtCL,Ben Long,10.1101/2022.02.16.480797,Enhanced photosynthetic efficiency for increased carbon assimilation and woody biomass production in hybrid poplar INRA 717-1B4,"Living Carbon Team, Yumin Tao, Li-Wei Chiu, Jacob W. Hoyle, Jessica Du, Karli Rasmussen, Patrick Mellor, Christian Richey, Julie Kuiper, Madeline Fried, Rebecca A. Dewhirst, Dominick Tucker, Alex Crites, Gary A. Orr, Matthew J. Heckert, Damaris G. Vidal, Martha L. Orosco-Cardenas, Madeline E. Hall",2022-03-09
https://www.biorxiv.org/content/10.1101/2023.01.31.526401v1#comment-6141039502,biorxivstage,1,"https://pubpeer.com/publica... I believe the author's data preprocessing methods are problematic. In the paper, the author stated that ""all the TPM was standardized with log2(TMP + 0.001)"", but upon reviewing the author's processed data provided in the database, I found that the author did not process the data according to the actual situation of each dataset. For example, in the Braun et al. KIRC cohort (PMID:32472114), the supplementary material of the paper provided TPM data that was transformed by upper quartile normalization and then log2 transformed . However, in the data frame provided by the authors, the already standardized data was once again transformed with log2(TMP + 0.001), which is incorrect. Furthermore, since the supplementary material provides data that has been standardized by quartiles, it cannot be reversed to the unnormalized TPM data. Therefore, the correct approach would be to apply for the raw data stored in EGA and re-quantify the data. In addition, different datasets used different reference genomes(hg19 or hg38), and the author should have indicated this or re-quantified all datasets. Additionally, the author's labeling of the treatment types for Braun's data is also incorrect, as Checkmate025 is a mixed cohort where patients receive either immune checkpoint inhibitor therapy or mTOR-targeted therapy. The author simply labeled this cohort as an ICI cohort in the table. In summary, the author should carefully review the data provided.",2023-03-19T04:39:50,,Melolontha hippocastani,10.1101/2023.01.31.526401,IMPACT: a web server for exploring immunotherapeutic predictive and cancer prognostic biomarkers,"Yutao Liu, Yundi Zhang, Wenchuan Xie, Jing Zhao, Yiting Dong, Chunwei Xu, Yanan Wang, Man Li, Guoqiang Wang, Xin Zhu, Wenxian Wang, Kequan Lin, Huafei Lu, Yusheng Han, Leo Li, Jianchun Duan, Shangli Cai, Jie Wang, Zhijie Wang",2023-02-03
https://www.biorxiv.org/content/10.1101/2023.03.15.530726v1#comment-6140636040,biorxivstage,0,"Great work! But, directly quoting from the paper ""...an experimental model of human thalamocortical connectivity has not yet been developed in vitro"" is a false claim. In fact, the paper author cited just before this sentence (ref. 23) did model thalamocortical connectivity fusing thalamic and cortical organoids 4 years ago!",2023-03-18T16:54:59,mbgfrk,frkmbg,10.1101/2023.03.15.530726,Human assembloids reveal the consequences of CACNA1G gene variants in the thalamocortical pathway,"Ji-il Kim, Yuki Miura, Min-Yin Li, Omer Revah, Sridhar Selvaraj, Fikri Birey, Xiangling Meng, Mayuri Vijay Thete, Sergey D. Pavlov, Jimena Andersen, Anca M. Paşca, Matthew H. Porteus, John R. Huguenard, Sergiu P. Paşca",2023-03-17
