comment url,comment forum,comment keywords,comment message,comment date,comment username,comment name,paper doi,paper title,paper authors,paper date
https://www.biorxiv.org/content/10.1101/2021.12.12.472313v1#comment-5777208223,biorxivstage,0,"This manuscript describes a computational pipeline to predict how antibody (and other “therapeutic entities”) binding varies to different SARS-CoV-2 Spike protein variants. The goal of this pipeline is to be able to generate structural models of novel SARS-CoV-2 variants in complex with existing therapeutics (nanobodies, antibodies, etc) and (re)design antibodies to maintain or improve antibody binding interactions. The authors initially develop a set of computed structural models (CSMs - an acronym/term that we find unnecessary and confusing, wouldn’t “model” suffice?) of Omicron Spike protein bound to ACE2 and therapeutic entities using experimentally-determined structures optimized by Rosetta FastRelax or predicted structures from AlphaFold2. The major confusion we have with this paper is the utility of generating predicted structures from AlphaFold2 when there are numerous experimentally-determined structures available on the PDB as starting models for mutagenesis and Rosetta optimization. The justification for using AF2 is not outlined clearly in the manuscript, and the data do not suggest that AF2 provides any obvious benefits over using Rosetta alone. The majority of the paper uses a consensus approach to score predictions based on different procedures. However, we could see a compelling argument for using AF2 in future VOC (or new viruses) that are even more diverged than Omicron. If this is the type of future application the authors imagine, presenting consensus scores as the sum of scores instead of the individual scores for each procedure undermines the potential comparative utility of having both experimental and predicted models in this analysis (a potential strength of the manuscript). The major limitation of this study is that it is purely computational and while the anecdotal evidence that certain clinically relevant antibodies retain (or lose) effectiveness against Omicron is a good validation, the rescue mutant studies will likely have little resonance with the community until validated experimentally. Perhaps there is a greater argument to be made based on some of the deep mutational scanning data that is emerging. The presentation of energetic changes as either “stabilizing” or “destabilizing” without accompanying quantitative values or calibration to experiment obscures the magnitude of de/stabilization caused by each amino acid substitution. Overall, this manuscript is an interesting exploration of how researchers can utilize computational structural biology to (re)design therapeutics in real-time to address the ongoing SARS-CoV-2 pandemic. The manuscript would benefit from providing stronger justification of why predicted structures can be essential for understanding how host-pathogen protein:protein interfaces evolve in an evolving pandemic - and from learning how to make those predictions stronger. Major Points 1. The justification for generating CSMs with and without position coordinate restraints should be explained. 2. Consensus Scoring currently obscures the Rosetta Energy Unit value for each CSM and does not help the reader better understand why 4 CSMs are needed to accomplish the outlined goal of the paper. 3. Is it conceivable that the degree of (de)stabilization is related to the magnitude of the REU value, i.e. 1.4 REU vs 3 REU? 4. L309-311: Citation 26 proposes that Omicron may have developed into immunosuppressed chronically infected COVID-19 patients, but this is a hypothesis and not currently supported by data. I would remove this statement or cite primary literature supporting this claim such as Kemp, S.A., Collier, D.A., Datir, R.P. et al. SARS-CoV-2 evolution during treatment of chronic infection. Nature 592, 277–282 (2021). https://doi.org/10.1038/s41.... 5. Figure 2A: why is the cryoEM structure overlaid with the predicted structure? The structures look nearly identical, so unclear what this representation adds. If positional differences between experimental and predicted structure is important, color residues in AF2 structure by RMSD. 6. Figure 2B-C: if you’re trying to highlight changes in the extensive interaction network between WT and Omicron, show as an overlay. 7. Figure 3: this figure does not make sense. 8. Figure 2, 4-10: Represent WT and Omicron comparisons as an overlay in one panel instead of two structures in side by side panels. This will be easier for reader to visualize the differences. Minor Points 1. Refer to Wuhan-Hu-1 as WT, by NCBI number, or other identifier that does not use the city name, so as to reduce stigma. 2. L121: The definition of “cocktail” as “two or more bound proteins in a single multi-protein complex.” The term “multi-protein” implies two or more proteins, either protomers of the same protein or monomers of different proteins. Suggested edits would be “two or more proteins bound to an oligomeric protein complex (ACE2 trimer).” 3. L132: Define pLDDT earlier than line 136. 4. L152-154: Why were N- and C-termini included in both experimental and predicted models if they are not necessary and will skew the overall Calpha RMSD? 5. L251-252: Recommend adding a figure/table showing sequence consensus between Omicron and other variants only for AA sites mutated in Omicron 6. Figure 2A: In the inset, it is unclear why Res 387-389 are annotated if the authors want to focus on Res 364-376. I would show the full residue range 364-376 as sidechains and label each residue. It seems that there are additional residues 477-478 shown as sidechains in the full image to represent mutations found in omRBD. This is unclear from the text and figure legend. I recommend removing the inset. 7. If using a yellow-to-green spectrum coloring scheme, include a scale bar on the image. Also, yellow to green is a difficult color spectrum to visually interpret, and this is made more difficult given that the backbone is colored green. We review non-anonymously, James Fraser and Roberto Efraín Díaz (UCSF)",2022-03-04T02:13:39,Rediaz111,Roberto Efraín Díaz,10.1101/2021.12.12.472313,Structural models of SARS-CoV-2 Omicron variant in complex with ACE2 receptor or antibodies suggest altered binding interfaces,"Joseph H. Lubin, Christopher Markosian, D. Balamurugan, Renata Pasqualini, Wadih Arap, Stephen K. Burley, Sagar D. Khare",2021-12-13
https://www.biorxiv.org/content/10.1101/2022.03.02.482633v1#comment-5776933006,biorxivstage,1,"Thanks for all the inputs and the encouraging words!  I will look in detail all of this. For now, a few comments: + In Fig. 1, the two peaks that merge into one come very clearly from two independent nucleation events. Eventually, the two clusters merge. + In the case of GSY at the lowest concentration (Fig. 2), there certainly is diffusion of the condensate from left to right of the box, even if part of the effect in the figure may be due the COM-centering in the density calculation.  At the lowest concentrations there is barely enough ""protein"" for spanning the box from side to side and hence the condensate is more droplet-like. I think it makes sense that the condensate diffuses more easily than when the slab is thicker and comfortably spans the simulation box. + With respect to the single or multiple nucleation spots (e.g. GSY 2 M), I haven't yet looked at critical number of particles, but from my many simulations, I can say different things will happen in different runs. Finally, I haven't really explored force field dependence in sufficient length to confidently say whether there are mechanistic differences. Thanks for all the typos too! All the best, David",2022-03-03T21:05:06,daviddesancho,daviddesancho,10.1101/2022.03.02.482633,Liquid-liquid phase separation in amino acid mixtures is governed by composition,David De Sancho,2022-03-02
https://www.biorxiv.org/content/10.1101/2022.03.02.482639v1#comment-5776797665,biorxivstage,0,"Misleading conclusion:""We showed that mRNA vaccine (Pfizer) changes mitochondria by downregulation of  cytochrome c resulting in lower effectiveness of respiration (oxidative phosphorylation) and lower ATP production."" - Respiratory function nor ATP production were not actually accessed. Given the highly dynamic nature of the mitochondria, is is not always clear that a reduction in Cyt c is pathologic. Given the fact that intensity hardly changed (and also not statistically significant) in normal astrocytes when incubated with mRNA, the concern for alternations is weak. As seen in Fig 4., this was seen once again seen in Fig 5A. *This point above should be highly emphasized in the abstract since this paper is already being circulated online in order to discredit the vaccine and intensify hesitancy.* The entire justification for the mRNA being in direct contact with brain cells/tissue is unclear and not based on scientific data: ""COVID-19 mRNA has been recovered from the cerebrospinal fluid [11], suggesting it can cross the blood–brain barrier (BBB)"" - Citation 11 links to a 2004 paper on SARS-CoV replication in the respiratory tract of mice. - Dr. Abraham Alahmad, who studies the BBB, discussed this idea back in 2021 (links below); the biodistribution to the brain was incredibly low in mice and unlikely to have any meaningful effect in humans. The mechanistic justification for directly exposing brain cells to, what is estimated to be, an entire dose of the vaccine is flawed. https://twitter.com/scienti... https://scientistabe.wordpr... The manuscript highly contradicts the methodology of the paper : ""Also, mRNAs are short-lived molecules. The vaccine’s messenger does not stay inside the cell indefinitely, but is degraded after a few hours, without leaving a trace."" - Why was mRNA incubated for 96 hours, or even 24 hours? The justification here for how in vitro incubation of the mRNA for 96 hours translates to human physiology is lacking. Highly misleading abstract sentence :""mRNA vaccine produce statistically significant changes in cell nucleus due to histone alterations."" - It should be emphasized that this was only seen in cancer cell lines, NOT normal brain cells. Additionally, changes in astrocytoma intensity were only seen under supraphysiological incubation of 96 hours.",2022-03-03T19:11:05,brettchrest,Brett Chrest,10.1101/2022.03.02.482639,Decoding COVID-19 mRNA Vaccine Immunometabolism in Central Nervous System: human brain normal glial and glioma cells by Raman imaging,"H. Abramczyk, B. Brozek-Pluska, Karolina Beton",2022-03-02
https://www.biorxiv.org/content/10.1101/2022.03.02.482633v1#comment-5776301268,biorxivstage,0,"Hi David, Fantastic work! Neat and straight to the point. Quick question, when we see in figure 1 the formation of two smaller clusters before emerging a larger and single one, can we say these are initial LLPS formation steps or two well-formed smaller condensates that fuse into a bigger one? It's interesting to see in figure 2 that lower concentration GSY condensates diffuse from left to right in the box, while higher concentration condensates remain fixed (don't diffuse) once formed. Is this an MD artefact, or does it represent larger bodies' diffusion hindrance? Also, in figure 2 B), for 2M concentrations, we see forming two initial condensation spots (dark blue). In contrast, this is not so visible for other concentrations, and the system seems to transit straight to a single cluster. Is there a concentration lower and upper limit to form these initial smaller clusters? Have you found this behaviour to depend much on the initial seed number? It does depend on the force-field, as seen in FigS1. Minor typos. fig 4: y-axis legend of panel C - missing ( figS1 - have the starting colours be a bit darker. The first line is too light. figS2 - we would suggest having the Ncontacts on the same scale for all the panels to facilitate comparison Cheers, Susana Barrera-Vilarmau and João MC Teixeira",2022-03-03T11:36:46,viviendocientifics,Susana and Joao,10.1101/2022.03.02.482633,Liquid-liquid phase separation in amino acid mixtures is governed by composition,David De Sancho,2022-03-02
https://www.biorxiv.org/content/10.1101/2021.12.21.473623v2#comment-5776300879,biorxivstage,0,Exciting story! Can it be that the bacteria are simply trapped in the vicinity of the antibiotics and cannot move away?,2022-03-03T11:36:10,,Victoria,10.1101/2021.12.21.473623,Suicidal chemotaxis in bacteria,"Nuno M. Oliveira, James H. R. Wheeler, Cyril Deroy, Sean C. Booth, Edmond J. Walsh, William M. Durham, Kevin R. Foster",2021-12-28
https://www.biorxiv.org/content/10.1101/2022.02.24.481860v1#comment-5776289518,biorxivstage,0,"Interesting manuscript. I especially like the fact that inactivation of FtsH overcomes a PSII assembly defect. This is in line with earlier work in cyanobacteria that showed that inactivation of the thylakoid FtsH2 protease led to enhanced accumulation of PSII assembly intermediates and variant PSII complexes. For example, Komenda et al (2008) JBC 283: 22390 and Boehm et al (2011) JBC 286: 14812",2022-03-03T11:18:55,disqus_3h8tF4xpaA,Peter Nixon,10.1101/2022.02.24.481860,FtsH Protease Inactivation Allows Accumulation of Aberrant Photosystem II in a Chlamydomonas Rubredoxin Mutant,"Robert H. Calderon, Catherine de Vitry, Francis-André Wollman, Krishna K. Niyogi",2022-02-26
https://www.biorxiv.org/content/10.1101/2022.01.24.477547v1#comment-5775477644,biorxivstage,0,Could you please upload your supplemental tables?,2022-03-02T17:46:25,disqus_cxqLjWhehm,Clare,10.1101/2022.01.24.477547,A human DNA methylation atlas reveals principles of cell type-specific methylation and identifies thousands of cell type-specific regulatory elements,"Netanel Loyfer, Judith Magenheim, Ayelet Peretz, Gordon Cann, Joerg Bredno, Agnes Klochendler, Ilana Fox-Fisher, Sapir Shabi-Porat, Merav Hecht, Tsuria Pelet, Joshua Moss, Zeina Drawshy, Hamed Amini, Patriss Moradi, Sudharani Nagaraju, Dvora Bauman, David Shveiky, Shay Porat, Gurion Rivkin, Omer Or, Nir Hirshoren, Einat Carmon, Alon Pikarsky, Abed Khalaileh, Gideon Zamir, Ronit Grinboim, Machmud Abu Gazala, Ido Mizrahi, Noam Shussman, Amit Korach, Ori Wald, Uzi Izhar, Eldad Erez, Vladimir Yutkin, Yaacov Samet, Devorah Rotnemer Golinkin, Kirsty L. Spalding, Henrik Druid, Peter Arner, A.M. James Shapiro, Markus Grompe, Alex Aravanis, Oliver Venn, Arash Jamshidi, Ruth Shemer, Yuval Dor, Benjamin Glaser, Tommy Kaplan",2022-01-25
https://www.biorxiv.org/content/10.1101/2022.02.21.481252v1#comment-5775088869,biorxivstage,0,"The link in the abstract points to https://github.com/chaoning..., not https://github.com/chaoning....",2022-03-02T11:38:18,,Marcel Schilling,10.1101/2022.02.21.481252,An Improved Linear Mixed Model for Multivariate Genome-Wide Association Studies,"Dan Wang, Jun Teng, Changheng Zhao, Xinhao Zhang, Hui Tang, Xinzhong Fan, Shizhong Xu, Qin Zhang, Chao Ning",2022-02-22
https://www.biorxiv.org/content/10.1101/2022.01.13.476268v1#comment-5774837536,biorxivstage,0,"Dear Prof. Naveen Kumar, Sure! in the next time, we will add your work to our one. Our work are under review now. Sincerely sorry for our problem. Best regards, Quang-Huy Nguyen.",2022-03-02T03:51:47,,Quang-Huy Nguyen,10.1101/2022.01.13.476268,A biphasic Deep Semi-supervised framework for Suptype Classification and biomarker discovery,"Hoang Le, Van-Minh Nguyen, Quang-Huy Nguyen, Duc-Hau Le",2022-01-17
https://www.biorxiv.org/content/10.1101/432328v6#comment-5774611402,biorxivstage,0,This article published now. https://doi.org/10.1080/165...,2022-03-01T23:32:21,emanalirashad,eman ali rashad,10.1101/432328,Pink Cedar (Acrocarpus fraxinifolius): its prophylactic role against APAP–induced organs toxicity in rats and its antiviral activity against Herpes simplex virus type 1,"Eman A. Abdelghffar, Alaa Barakat, Zenab A. Torky, Ihab K. Mohamed, Kamela Ali",2021-11-03
https://www.biorxiv.org/content/10.1101/2022.02.06.479300v1#comment-5774121159,biorxivstage,0,Great work. I appreciate the use of real data to support thermodynamics based theories of aging. I would suggest adding a legend to Figure 3 and Figure 5 that that clarify the meaning of the differently colored lines prior to journal submission.,2022-03-01T16:30:25,waylonjhastings,Waylon J Hastings,10.1101/2022.02.06.479300,"Aging clocks, entropy, and the limits of age-reversal","Andrei E. Tarkhov, Kirill A. Denisov, Peter O. Fedichev",2022-02-09
https://www.biorxiv.org/content/10.1101/2021.05.10.443368v3#comment-5773912731,biorxivstage,1,This preprint has been published. A link will be forthcoming,2022-03-01T13:25:37,jheckenhauer,JHeckenhauer,10.1101/2021.05.10.443368,Genome size evolution in the diverse insect order Trichoptera,"Jacqueline Heckenhauer, Paul B. Frandsen, John S. Sproul, Zheng Li, Juraj Paule, Amanda M. Larracuente, Peter J. Maughan, Michael S. Barker, Julio V. Schneider, Russell J. Stewart, Steffen U. Pauls",2021-11-25
https://www.biorxiv.org/content/10.1101/2020.03.30.015305v1#comment-5773710872,biorxivstage,1,"The preprint has been published in Genomics, Proteomics & Bioinformatics. https://www.sciencedirect.c... Please cite the update-to-date published version if possible. Thank you!",2022-03-01T08:12:01,foonjianhuanchen,Jian-Huan Chen,10.1101/2020.03.30.015305,Characterization of dynamic age-dependent changes and driver microbes in primate gut microbiota during host’s development and healthy aging via captive crab-eating macaque model,"Zhi-Yuan Wei, Jun-Hua Rao, Ming-Tian Tang, Guo-An Zhao, Qi-Chun Li, Li-Ming Wu, Shao-Qiang Liu, Bi-Hai Li, Bai-Quan Xiao, Xing-Yin Liu, Jian-Huan Chen",2020-03-31
https://www.biorxiv.org/content/10.1101/2021.09.02.458738v1#comment-5773680639,biorxivstage,0,"Interesting work, but where is the supplementary information? I can't seem to find it.",2022-03-01T07:08:40,disqus_S4BoWBGxWE,Mark Fisher,10.1101/2021.09.02.458738,The nuclear effector ArPEC25 from the necrotrophic fungus Ascochyta rabiei targets the chickpea transcription factor CaβLIM1a and negatively modulates lignin biosynthesis for host susceptibility,"Shreenivas Kumar Singh, Sandhya Verma, Kunal Singh, Ankita Shree, Ritu Singh, Vikas Srivastava, Kamal Kumar, Ashutosh Pandey, Praveen Kumar Verma",2021-09-05
https://www.biorxiv.org/content/10.1101/796052v3#comment-5773586595,biorxivstage,0,"Now published: Molecular Immunology Volume 144, April 2022, Pages 138-151. https://authors.elsevier.co...",2022-03-01T04:05:17,disqus_AiRsIIsYT0,Joe Murray,10.1101/796052,CDR3 binding chemistry controls TCR V-domain rotational probability and germline CDR2 scanning of polymorphic MHC,Joseph S. Murray,2021-06-25
https://www.biorxiv.org/content/10.1101/2022.01.11.475911v2#comment-5773217664,biorxivstage,1,"The following is a review compiled by graduate students participating in the Infectious Disease Journal Club, Department of Biomedical Sciences, University at Albany, SUNY: This paper addresses the significance of cis-regulatory elements in the expression of the Type Six Secretion System (T6SS) of Vibrio cholerae. Previous work has shown that the transcription factors QstR and TfoY are key regulators of the V. cholerae T6SS in a pandemic strain, but the authors demonstrate constitutive expression and activity of the T6SS in other V. cholerae strains that have a single SNP in the intergenic region upstream of the T6SS genes. This work has important implications for how T6SS expression has evolved in different V. cholerae lineages, and the conditions under which the T6SS is active in different strains. More broadly, the paper demonstrates that a single SNP in an intergenic region can dramatically affect gene expression. The data are of high quality throughout the paper, and the use of complementary assays of T6SS activity and expression provides independent assessment of T6SS regulation. The major conclusion of the paper is that a T at position -68 is associated with strong expression/activity of the T6SS, whereas a G at -68 has much lower T6SS expression/activity unless qstR is overexpressed. This conclusion is well supported by the data. However, the authors also argue that having a T at position -68 makes T6SS expression independent of QstR, but they do not test this. It may simply be that a T at -68 leads to overall higher expression of T6SS genes that could be further boosted by overexpression of qstR. Whether or not T6SS expression is affected by QstR in strains with -68T has important implications for the mechanism by which position -68 influences T6SS expression. Major Comments: 1. The authors claim in several places that the base identity at position -68 determines whether or not T6SS expression is activated by QstR. However, the authors do not test whether overexpression of qstR (i.e., the qstR * strain) impacts expression of T6SS genes in strains with a T at -68. For some strains, expression may already be so high that any effect of qstR overexpression will be difficult to see, but that is likely not the case for strains VC22, 2479-86, and 2512-86. The authors should test the effect of overexpression of qstR on T6SS expression or activity in one or more of these strains. 2. The paper implies that QstR expression is induced by chitin. This connection should be more clearly explained. If QstR expression is indeed induced by chitin, an important additional experiment would be to show that chitin promotes T6SS expression/activity in C6706, and that this effect is reduced in a Δ qstR strain. Minor Comments: 1. We recommend quantifying the data shown in Figure 1G and moving this to the supplement. Alternatively, Figure 1G could be removed from the paper since it is largely redundant with Figure 1C. 2. It would be helpful to modify Figure 3A to include the phylogenetic tree from Figure S3. 3. Position -68 is sometimes referred to as -388, presumably reflecting the position relative to the start codon of the first gene in the operon. We recommend using “-68” throughout. 4. One of the data points in Figure 2B/C is labeled as “IGRV52”. While this is correctly labeled, we suggest changing the label to “G-68T”, as this makes the figure easier to interpret and easier to compare to Figure 2D/E. 5. There are published ChIP-seq data for QstR. It would be informative to briefly discuss where QstR binds relative to position -68. This could be indicated in Figure 2A. 6. The discussion is very brief. We encourage the authors to elaborate on (i) possible mechanisms by which the SNP at position -68 alters T6SS expression, and (ii) possible selective pressures associated with the SNP at -68 for the different V. cholerae strains. 7. A figure at the end of the paper showing a model for the two types of regulation would be helpful for readers. This schematic could include what we already know about the roles of TfoX, TfoY, and QstR in T6SS regulation.",2022-02-28T21:28:13,disqus_y9FR6hyg5J,Joseph Wade,10.1101/2022.01.11.475911,Evolution of a cis-acting SNP that controls Type VI Secretion in Vibrio cholerae,"Siu Lung Ng, Sophia Kammann, Gabi Steinbach, Tobias Hoffmann, Peter J Yunker, Brian K. Hammer",2022-02-14
https://www.biorxiv.org/content/10.1101/2022.02.21.481304v1#comment-5772524472,biorxivstage,2,"Congratulations on these very interesting results. Together with the functional data, the new structures described in this preprint greatly contribute to a better understanding of neuromedin U receptors (NMURs) and potentially related peptide-binding GPCRs. Here, I add a short, constructive comment regarding one of the NMURs’ related peptide-binding GPCRs, i.e., the neurotensin receptor 1 (NTSR1). In wild-type NTSR1, residue 3.33 is Asp, not Glu. Therefore, the labeling of residue 3.33 in the panel “JMV449-NTSR1” in Supplementary Fig. 5d should be corrected. In addition, the sentence in lines 119–121 of the main text PDF beginning with “Noteworthily, a conserved salt bridge between...” should be slightly changed; e.g., “E3.33” should be changed to “E/D3.33” or to “acidic residue at position 3.33”. The shorter D3.33 side chain in NTSR1 compared to E3.33 in the related NTSR2, NMURs, ghrelin receptor, and motilin receptor probably affects the strength and possibly the role of the ionic interaction between the acidic residue at position 3.33 and R6.55 in NTSR1 compared to the above-mentioned related receptors. In the ghrelin receptor, the salt bridge between E3.33 and R6.55 has been proposed to play a role in the receptor’s constitutive activity [ https://doi.org/10.1038/s41... ], and the same could also apply to NTSR2. In contrast, NTSR1, which bears D3.33, has almost no constitutive activity. The shorter D3.33 side chain probably plays a role in agonist-induced activation of NTSR1 [DOI: 10.1126/sciadv.abe5504 (ref. 47 in this preprint)] and is related to the “R6.55-mediated activation mechanism” that the authors of this preprint point out in the Discussion section. All the best, Mattia Deluigi",2022-02-28T11:25:34,mattiadeluigi,Mattia Deluigi,10.1101/2022.02.21.481304,Structural insights into the peptide selectivity and activation of human neuromedin U receptors,"Chongzhao You, Yumu Zhang, Peiyu Xu, Sijie Huang, Wanchao Yin, H. Eric Xu, Yi Jiang",2022-02-21
https://www.biorxiv.org/content/10.1101/2022.02.10.479744v1#comment-5771849520,biorxivstage,1,Please see the latest response to the Akirtava et al. preprint from the Barna lab: https://drive.google.com/fi...,2022-02-27T23:32:57,mariabarna,Maria Barna,10.1101/2022.02.10.479744,False-Positive IRESes from Hoxa9 and other genes resulting from errors in mammalian 5’ UTR annotations,"Christina Akirtava, Gemma E. May, C. Joel McManus",2022-02-10
