comment url,comment forum,comment keywords,comment message,comment date,comment username,comment name,paper doi,paper title,paper authors,paper date
https://www.biorxiv.org/content/10.1101/2022.02.25.481906v1#comment-5800103437,biorxivstage,3,"Hello authors, Thank you for submitting this interesting preprint over the effects of the microbiome in response to parasitic infection in Daphnia species to a public domain. I have a few questions on your methods and results. The detailed sampling and processing section was great, but I was interested in why only one sampling site used and collected on a singular day. Do you think using more sampling sites and/or over a longer period would give greater insights? Was there a particular reason this site was chosen? For dissection and sample preparation, there was no mention of how the samples were stored following collection. Were the samples immediately processed after collection or were they stored? If so, how were they stored? For pre-processing of the reads, how was coverage measured for the samples? Did you include steps to minimize PCR errors or chimeras? Did you correct for variance in 16S copy number and variance in genome size? The samples were rarefied to an even depth of 170,000 reads. Were any other methods used to quantify total bacterial numbers such as qPCR or culture methods? For results, what is the purpose of the horizontal spread of the dot points in figure 2? In figure 3, could the data points be clustered on the PCOA plots? Overall, this article was very insightful to the host-parasite-bacterial community interaction with potential for more broad applications in the significance of the host-associated microbiota. I really hope these comments/questions help.",2022-03-21T23:05:13,,Megan,10.1101/2022.02.25.481906,Infection by a eukaryotic gut parasite in wild Daphnia sp. associates with a distinct bacterial community,"Amruta Rajarajan, Justyna Wolinska, Jean-Claude Walser, Minea Mäder, Piet Spaak",2022-02-26
https://www.biorxiv.org/content/10.1101/621458v5#comment-5798769228,biorxivstage,0,Here is the permanent link: https://doi.org/10.1016/j.v...,2022-03-21T15:13:11,strasburger,Strasburger,10.1101/621458,"On the cortical mapping function – visual space, cortical space, and crowding",Hans Strasburger,2021-06-28
https://www.biorxiv.org/content/10.1101/2022.02.25.481914v1#comment-5798679578,biorxivstage,0,fascinating study.  you should adjust your counts of your known strains by their 16S copy numbers to reflect true abundance.,2022-03-21T13:45:45,toddprimm,todd primm,10.1101/2022.02.25.481914,Horizontal gene transfer increases microbiome stability,"K. Z. Coyte, C. Stevenson, C. G. Knight, E. Harrison, J. P. J. Hall, M. A. Brockhurst",2022-02-25
https://www.biorxiv.org/content/10.1101/621458v5#comment-5798603906,biorxivstage,0,"Dear reader, the final published version is available under https://authors.elsevier.co...",2022-03-21T12:11:35,strasburger,Strasburger,10.1101/621458,"On the cortical mapping function – visual space, cortical space, and crowding",Hans Strasburger,2021-06-28
https://www.biorxiv.org/content/10.1101/2022.03.01.482580v1#comment-5798393519,biorxivstage,2,"First, well done on achieving such high resolution, and largely noninvasively. Now we can start to see evidence of what is really going on in the cochlea. Your work raises a whole lot of issues, but I’ll just mention a few key findings. I hope you find these comments helpful. 1. In the abstract a fairly provocative statement is that the data is not explained by current theories. In my view, I don’t think this is quite right, as the motions you reveal appear to be the result of simple resonance between the rows, an idea first raised in my PhD thesis and then in several associated publications. Perhaps the most germane are Bell & Fletcher (2004), The cochlear amplifier as a standing wave, JASA 116, 1016; https://doi.org/10.1121/1.1766053 and Bell (2012), A resonance approach to cochlear mechanics, PLOS One, https://doi.org/10.1371/journal.pone.0047918. Both papers set out a scheme whereby the three rows of OHCs work together to establish a resonant element which gives rise to a standing wave between the rows. Tuning thus depends largely on the row spacing, not the stiffness of the BM. The OHCs are stimulated virtually instantaneously by the fast pressure wave (OHCs are pressure sensors, for which I’ve made a case elsewhere), not the conventional travelling wave. In this way, I think most of your findings can be accommodated, as set out below. 2. In your Introduction you say that a special sort of phasing is required in order to amplify the travelling wave. This is not necessary if you look at it in terms of resonance. As Bell (2012) broadly explains, the travelling wave is simply the observed result of what happens in response to a graded bank of highly tuned resonators that are almost simultaneously excited by a fast pressure wave. The delay observed is then simply Q/pi cycles, where Q is the tuning sharpness. In other words, I suggest you may be looking at things back-to-front causally: it is the resonance that gives rise to an apparent TW, not that the TW is a causal entity that, through very careful phasing, is able to amplify BM motion and give rise to a large peak! That is, the OHCs don’t amplify motion at all; instead they are pressure transducers which, via electromotility, vibrate in response to the sound pressure surrounding them (the OHCs contain pressure-sensitive ion channels). I’ve published a number of papers on this, and I’m happy to discuss the idea with you in more detail if you wish. In brief, I am suggesting that, if we look at cochlear mechanics differently, the TW is an epiphenomenon of a tuned bank of active elements. The elements are local oscillators – there doesn’t need to be global coupling in order to propagate a TW. 3. I am suggesting that each triplet of OHC1, OHC2, and OHC3 act together like a guitar string arranged radially. However, unlike a string, there is a fluid connection between the rows (a squirting wave) so that the wave travels at a particularly low velocity. Applied to your observations, at a BF of 46 kHz the wave traverses OHC1 to OHC3 (a distance of about 30 um) in 1/46000 of a second – that is, a speed of about 1 m/s. As an explanation, so-called squirting waves have such low phase velocities, and anatomically are well suited to act in the space between the TM and reticular lamina, as Bell & Fletcher (2004) describe. Electromotility of the OHCs causes squeezing in that space, generating squirting waves. 4. At their tuned frequency (BF), the amplitude of vibration is largest, and that is consistent with a resonating element that is tuned to that frequency. Thanks to your high resolution, we can see the activity of each of the three OHCs. In Figure 5c there seems to be a larger amplitude of vibration for RL3 than RL1; another radial profile at a different level (Figure 7c) shows that the amplitudes are about equal. Given the intricate geometry, I think that the findings are generally consistent with a radial standing wave with the OHCs at the antinodes. 5. Now, about the phases. The 3 OHCs seem to have about the same phase, and this is consistent with a standing wave between them. A standing wave is a wave that oscillates in time but whose profile of peak amplitude does not move in space. My papers suggest that OHC2 acts in antiphase to OHC1 and OHC3, an arrangement which is closer to a xylophone bar than a guitar string. In other words, each OHC sits at an antinode, and the result is a full-wavelength standing wave. Your OCT device sees all the OHCs vibrating at the same amplitude, but doesn’t see the wave moving backwards and forwards between them. Other phase arrangements may be possible, but the full wavelength case is probably the simplest. For a guitar string, there is only 1 antinode and 2 nodes, so if this applied in the cochlea, all the work would be done be OHC2 (we wouldn’t need 3 rows of OHCs). 6. Taking together all the above, I hope you may appreciate that if we had a ringing xylophone bar between OHC1 and OHC3 then an OCT device would see all the OHCs vibrating at the same amplitude and the same phase. It would require special techniques to detect the standing wave, and I wonder if your device has that capability. This would provide convincing evidence in favour of a resonance model. 7. Note that in my papers I regard the phase lag at resonance to reflect the group delay of the resonators. For a linear resonator, the group delay amounts to Q/pi cycles. It is interesting to look at the group delays you recorded in Figure 8f-h and Figure 10e,f. At BF (resonance) they show a phase lag of 2–3 cycles. So if one considers these delays to derive from a linear resonator (not strictly true, but perhaps not too far off), then the associated Q values would be pi times 2 or 3, which is about 6–9. Such Q values are roughly the same as those measured otoacoustically for the gerbil. In summary, I suggest it is possible to interpret your findings using a different causal chain, the inverse of what you have done. That is, the causal chain may involve the direct electromotility of OHCs in response to sound pressure, and not that OHCs have to very carefully amplify atomic-scale BM motions to create a traveling wave – and this approach simplifies cochlear mechanics enormously. The alternative view is that the BM may just be a supporting membrane for an array of tuned elements, which are independently excited by the fast pressure wave. Indeed, it is interesting that the ITER team (Khanna and colleagues) adopted this view more than 30 years ago. They said that “The present observations suggest that the outer hair cells vibrate mechanically along their axes in response to acoustical stimulation.” (p.188) https://doi.org/10.3109/00016488909138336. It is perfectly possible to look at your data in a different, but internally consistent, way. I hope this helps us move towards the truth of the matter. Best wishes for your publication. Andrew Bell.",2022-03-21T04:02:34,disqus_kGaMYxKa2j,Andrew Bell,10.1101/2022.03.01.482580,Motion of the Cochlear Reticular Lamina Varies Radially Across Outer-Hair-Cell Rows,"Nam Hyun Cho, Sunil Puria",2022-03-04
https://www.biorxiv.org/content/10.1101/2021.12.21.473695v1#comment-5798249482,biorxivstage,0,"Nice analysis! Would have been great to see what the authors make of the biochemical interactions and structures reported over the last couple of years for some of the very ancient metazoan Bcl-2 proteins (from sponge, hydra and trichoplax), and how that fits with their conclusions.",2022-03-21T00:08:22,,Marc K,10.1101/2021.12.21.473695,Intrinsic apoptosis is evolutionary divergent among metazoans,"Gabriel Krasovec, Éric Quéinnec, Jean-Philippe Chambon",2021-12-23
https://www.biorxiv.org/content/10.1101/2021.10.23.464385v1#comment-5796510250,biorxivstage,0,A great job! But it seems that the supplementary materials have not been uploaded.,2022-03-19T08:47:28,disqus_0C7aroRmQk,Chao Li,10.1101/2021.10.23.464385,A suspension technique for efficient large-scale cancer organoid culturing and perturbation screens,"Stacey Price, Shriram Bhosle, Emanuel Gonçalves, Xiaodun Li, Dylan P McClurg, Syd Barthorpe, Alex Beck, Caitlin Hall, Howard Lightfoot, Luke Farrow, Rizwan Ansari, David A Jackson, Laura Allen, Kirsty Roberts, Charlotte Beaver, Hayley E Francies, Mathew J Garnett",2021-10-24
https://www.biorxiv.org/content/10.1101/2021.05.09.443337v1#comment-5795515749,biorxivstage,0,This is fantastic work. I can't wait to see this published.,2022-03-18T18:20:42,bartholomewroland,Bartholomew Roland,10.1101/2021.05.09.443337,Structural basis for ligand recognition and G protein-coupling promiscuity of the cholecystokinin A receptor,"Qiufeng Liu, Dehua Yang, Youwen Zhuang, Tristan I. Croll, Xiaoqing Cai, Antao Dai, Xinheng He, Jia Duan, Wanchao Yin, Chenyu Ye, Fulai Zhou, Beili Wu, Qiang Zhao, H. Eric Xu, Ming-Wei Wang, Yi Jiang",2021-05-10
https://www.biorxiv.org/content/10.1101/2022.02.03.478491v1#comment-5795495047,biorxivstage,0,"Will you release any Y-DNA information? Y-DNA haplogroup distribution tables per cluster? For deeper analyses, anonymized lists of samples with their locations and subclades?",2022-03-18T18:01:26,sylvainloyen,Sylvain Loyen,10.1101/2022.02.03.478491,Genetic population structure across Brittany and the downstream Loire basin provides new insights on the demographic history of Western Europe,"Isabel Alves, Joanna Giemza, Michael Blum, Carolina Bernhardsson, Stéphanie Chatel, Matilde Karakachoff, Aude Saint Pierre, Anthony F. Herzig, Robert Olaso, Martial Monteil, Véronique Gallien, Elodie Cabot, Emma Svensson, Delphine Bacq-Daian, Estelle Baron, Charlotte Berthellier, Céline Besse, Hélène Blanché, Ozvan Bocher, Anne Boland, Stéphanie Bonnaud, Eric Charpentier, Claire Dandine-Roulland, Claude Férec, Christine Fruchet, Simon Lecointe, Edith Le Floch, Thomas Ludwig, Gaëlle Marenne, Vincent Meyer, Elisabeth Quellery, Fernando Racimo, Karen Rouault, Florian Sandron, Jean-Jacques Schott, Lourdes Velo Suarez, Jade Violleau, Eske Willerslev, Yves Coativy, Mael Jézéquel, Daniel Le-Bris, Clément Nicolas, Yvan Pailler, Marcel Goldberg, Marie Zins, Hervé Le-Marec, Mattias Jakobsson, Pierre Darlu, Emmanuelle Génin, Jean-François Deleuze, Richard Redon, Christian Dina",2022-02-04
https://www.biorxiv.org/content/10.1101/2022.02.08.479599v3#comment-5795029493,biorxivstage,0,"An interesting study.   A small thought on tree comparison: whilst the normalized RF distance is no doubt picking up the general trend in Fig. 2, I wonder whether the more subtle distinction between IB and IC in Fig. 8 might be worth exploring with a less crude tree distance metric (e.g. Quartet distance or information-theoretic RF distance, see Smith 2020, Bioinformatics, https://doi.org/10.1093/bio... for a review) – perhaps a less problematic metric might show more clearly whether there is a pattern in the distance to neighbouring trees?",2022-03-18T09:04:32,PalaeoSmith,Martin R. Smith,10.1101/2022.02.08.479599,Recombination-aware Phylogeographic Inference Using the Structured Coalescent with Ancestral Recombination,"Fangfang Guo, Ignazio Carbone, David A. Rasmussen",2022-03-16
https://www.biorxiv.org/content/10.1101/2022.03.01.482540v1#comment-5793019570,biorxivstage,0,"The authors may wish to compare their results to our recent study of WT and I40V LECT2 (DOI: 10.1016/j.jbc.2021.100446). The differences are subtle to be sure, but significant for the zinc-free protein.",2022-03-17T19:32:20,stewartloh,Stewart Loh,10.1101/2022.03.01.482540,An amyloidosis-associated polymorphism does not alter LECT2 stability in vitro,"Liudmila Belonogov, Paris E. Taylor, Sherry Wong, Gareth J. Morgan",2022-03-01
https://www.biorxiv.org/content/10.1101/2021.01.08.425887v2#comment-5792855222,biorxivstage,0,This work is now published in Frontiers in Digital Health : https://doi.org/10.3389/fdg...,2022-03-17T17:00:47,disqus_6QZRSMAq3a,Joram,10.1101/2021.01.08.425887,Auto-CORPus: A Natural Language Processing Tool for Standardising and Reusing Biomedical Literature,"Tim Beck, Tom Shorter, Yan Hu, Zhuoyu Li, Shujian Sun, Casiana M. Popovici, Nicholas A. R. McQuibban, Filip Makraduli, Cheng S. Yeung, Thomas Rowlands, Joram M. Posma",2021-11-21
https://www.biorxiv.org/content/10.1101/2021.12.14.472726v1#comment-5792611219,biorxivstage,0,"A revised version of our BIORXIV/2021/472726 manuscript has been published in the journal Acta Crystallographica Section D under the following title : ""The X-ray crystallography phase problem solved thanks to AlphaFold and RoseTTAFold models : a case study report."". Here is the link : https://doi.org/10.1107/S20... Unfortunately, it is not in open access (too expensive) so if you are interested, ask the contact author.",2022-03-17T13:00:06,tandemteammarcgraillelab,Tandem team (Marc Graille Lab),10.1101/2021.12.14.472726,Artificial intelligence to solve the X-ray crystallography phase problem: a case study report,"Irène Barbarin-Bocahu, Marc Graille",2021-12-15
https://www.biorxiv.org/content/10.1101/720912v6#comment-5791325590,biorxivstage,0,This paper has been accepted to The Plant Cell and can be viewed  at https://doi.org/10.1093/plc...,2022-03-16T09:06:46,yaelgrunwald,yael grunwald,10.1101/720912,Out of the blue: Phototropins of the leaf vascular bundle sheath mediate the regulation of leaf hydraulic conductance by blue light,"Yael Grunwald, Sanbon Chaka Gosa, Tanmayee Torne Srivastava, Nava Moran, Menachem Moshelion",2022-02-15
https://www.biorxiv.org/content/10.1101/2022.03.10.483737v1#comment-5791271416,biorxivstage,0,"Thanks for the pointer on the tree space analyses, and for pointing me toward Smith 2022-- I'll definitely check it out and check to make sure that our 2D PCoAs aren't distorting actual clustering relationships. I did do some exploratory analyses (using TreeDist) to make sure that clustering analyses separated the trees in a similar manner to the visual patterns, but will do a more thorough exploration after seeing those recent findings. Thanks!",2022-03-16T06:57:17,,Jessica Rick,10.1101/2022.03.10.483737,Reference genome choice and filtering thresholds jointly influence phylogenomic analyses,"Jessica A. Rick, Chad D. Brock, Alexander L. Lewanski, Jimena Golcher-Benavides, Catherine E. Wagner",2022-03-12
https://www.biorxiv.org/content/10.1101/2021.05.14.444071v2#comment-5790613671,biorxivstage,0,"This article has been peer reviewed and published on Cell Reports with a modified title ""RORγt phosphorylation protects against T cell-mediated inflammation"". See article on: https://www.cell.com/cell-reports/fulltext/S2211-1247(22)00256-X",2022-03-15T17:19:15,wendyjmhuangslabatucsandiego,Wendy JM Huang's Lab at UC San,10.1101/2021.05.14.444071,RORγt serine 182 tightly regulates T cell heterogeneity to maintain mucosal homeostasis and restrict tissue inflammation,"Shengyun Ma, Shefali Patel, Nicholas Chen, Parth R. Patel, Benjamin S. Cho, Nazia Abbasi, John T. Chang, Wendy Jia Men Huang",2021-06-08
https://www.biorxiv.org/content/10.1101/2021.12.12.472313v1#comment-5790233703,biorxivstage,2,"Thank you, Roberto and James for taking the time to engage with our work and for these helpful comments! We are revising the manuscript in the light of these comments (among others). We will post a detailed response to your comments in time. Re. why we used AF2 when exptl structures are available: we generated these models in early December and posted this preprint on Dec 13 before any experimental data were available. When the first structures came out in early Jan, we performed a comparison with our models and submitted to journal in mid-January. (what can I say, that's the pace of scientific publishing :))",2022-03-15T10:42:31,sagar_khare,sagar khare,10.1101/2021.12.12.472313,Structural models of SARS-CoV-2 Omicron variant in complex with ACE2 receptor or antibodies suggest altered binding interfaces,"Joseph H. Lubin, Christopher Markosian, D. Balamurugan, Renata Pasqualini, Wadih Arap, Stephen K. Burley, Sagar D. Khare",2021-12-13
https://www.biorxiv.org/content/10.1101/2021.12.02.470899v1#comment-5790049851,biorxivstage,0,This manuscript has now been published in eLife ( https://elifesciences.org/a....,2022-03-15T03:40:03,jilongliu,Ji-Long Liu,10.1101/2021.12.02.470899,Structural basis of dynamic P5CS filaments,"Jiale Zhong, Chen-Jun Guo, Xian Zhou, Chia-Chun Chang, Boqi Yin, Tianyi Zhang, Huan-Huan Hu, Guang-Ming Lu, Ji-Long Liu",2021-12-02
https://www.biorxiv.org/content/10.1101/2022.02.21.481304v1#comment-5789978860,biorxivstage,1,"Thanks, Mattia. We agree and have made corresponding corrections. Thanks for your constructive comments. All the best, Yi Jiang",2022-03-15T01:49:28,disqus_LPqj2zkxl2,yi jiang,10.1101/2022.02.21.481304,Structural insights into the peptide selectivity and activation of human neuromedin U receptors,"Chongzhao You, Yumu Zhang, Peiyu Xu, Sijie Huang, Wanchao Yin, H. Eric Xu, Yi Jiang",2022-02-21
