comment url,comment forum,comment keywords,comment message,comment date,comment username,comment name,paper doi,paper title,paper authors,paper date
https://www.biorxiv.org/content/10.1101/2024.03.13.584607v1#comment-6463646780,biorxivstage,0,"Interesting paper. However, I'm afraid you are mixing up a lot of concepts that should be kept separate. Ethnonyms like Goths, Langobards and Frisians are political terms. They are not biological categories. Terms like ""Wielbark Goths"" (847) are entirely nonsensical. We simply don't know how the people of the Wielbark culture identified or were identified by others. Most likely they had never heard the name Goths and were not called so by outsiders. The name Goths appears only later in an entirely different region. We also don't know of the earlier ""Gutans"" had anything to do with the Wielbark-people or the later historical Goths. If you investigate the remains of a person buried in a cemetary that may have belonged to the Langobards, you still don't know how the individual identified whose DNA you extracted. Historians have been very careful to workout the problems that arise from mixing up ethnic/political terminology with archaeology. This paper revives the old mistakes by mixing up ethnic/political terms with archaeological material culture and biology.",2024-05-21T11:13:03,dirkfaltin,dirkfaltin,10.1101/2024.03.13.584607,Steppe Ancestry in western Eurasia and the spread of the Germanic Languages,"Hugh McColl, Guus Kroonen, J. Víctor Moreno-Mayar, Frederik Valeur Seersholm, Gabriele Scorrano, Thomaz Pinotti, Tharsika Vimala, Søren M. Sindbæk, Per Ethelberg, Ralph Fyfe, Marie-José Gaillard, Hanne M. Ellegård Larsen, Morten Fischer Mortensen, Fabrice Demeter, Marie Louise S. Jørkov, Sophie Bergerbrant, Peter de Barros Damgaard, Morten E. Allentoft, Lasse Vinner, Charleen Gaunitz, Abigail Ramsøe, Isin Altinkaya, Rasmus Amund Henriksen, Evan K. Irving-Pease, Serena Sabatini, Anders Fischer, William Barrie, Andrés Ingason, Anders Rosengren, Andrew Vaughn, Jialu Cao, Jacqueline Staring, Jesper Stenderup, Fulya Eylem Yediay, Torbjörn Ahlström, Sofie Laurine Albris, Biyaslan Atabiev, Pernille Bangsgaard, Maria Giovanna Belcastro, Nick Card, Philippe Charlier, Elizaveta Chernykh, Torben Trier Christiansen, Alfredo Coppa, Maura De Coster, Sean Dexter Denham, Sophie Desenne, Jane Downes, Karin Margarita Frei, Olivér Gábor, Johan Zakarias Gårdsvoll, Zanette Tsigaridas Glørstad, Jesper Hansen, Stijn Heeren, Merete Henriksen, Volker Heyd, Mette Høj, Mads Kähler Holst, Rimantas Jankauskas, Henrik Janson, Mads Dengsø Jessen, Jens Winther Johannsen, Torkel Johansen, Ole Thirup Kastholm, Anton Kern, Ruslan Khaskhanov, Katrine Kjær, Vladimir Kolosov, Lisette M. Kootker, Anne Christine Larsen, Thierry Lejars, Mette Løvschal, Niels Lynnerup, Yvonne Magnusson, Kristiina Mannermaa, Vyacheslav Masyakin, Anne Lene Melheim, Inga Merkyte, Vyacheslav Moiseyev, Stig Bergmann Møller, Erika Molnár, Nadja Mortensen, Eileen Murphy, Bjarne Henning Nielsen, Doris Pany-Kucera, Bettina Schulz Paulsson, Marcia S Ponce de León, Håkon Reiersen, Walter Reinhard, Antti Sajantila, Birgitte Skar, Vladimir Slavchev, Václav Smrčka, Lasse Sørensen, Georg Tiefengraber, Otto Christian Uldum, Jorge Vega, Daniele Vitali, Alexey Voloshinov, Sidsel Wåhlin, Holger Wendling, Anna Wessman, Helene Wilhelmson, Karin Wiltschke, João Zilhao, Christoph PE Zollikofer, Thorfinn Sand Korneliussen, Bruno Chaume, Jean-Paul Demoule, Thomas Werge, Line Olsen, Rasmus Nielsen, Lotte Hedeager, Kristian Kristiansen, Martin Sikora, Eske Willerslev",2024-03-14
https://www.biorxiv.org/content/10.1101/2024.03.18.585639v1#comment-6462725756,biorxivstage,3,"I was asked to review a version of the manuscript for a journal. Below are my comments to the authors. In this manuscript Shub and colleagues present MIC, a new tool for the analysis of three-dimensional macromolecular structures obtained using x-ray diffraction or cryogenic electron microscopy (cryoEM). Given an atomic model featuring water molecules and/or ions, and the corresponding 3D map data, MIC automatically labels each putative water and/or ion location with a guess water or ion identity. Thanks to improvements in cryoEM instrumentation and data analysis, 3D maps can now frequently be obtained at resolutions better than 2.7Å, so that the problem of correctly labeling small map features as either water or ion presents itself more frequently to practictioners, myself included. In that context the availability of a well-characterized, open-source and highly performant classifier of ion/water density features is timely and most welcome. I found the manuscript to be well written, the description of the method and how it was tested clear (though as a non-expert I had trouble following the description of the network architecture and of the feature attribution methodology), and the results convincing. Most questions that arose as I was reading early parts of the manuscript (e.g. regarding the influence of slight errors in modeling of protein atoms on the labeling of ions/water) were answered in later parts. I only have minor feedback & suggestions for the authors and otherwise am supportive of publication. Here's the feedback I have: - lines 47-48: Perhaps... but I wonder if the authors are aware of Ravera et al (Nature, 2022)... and there may be a few other reports I'm unaware of myself... I wonder whether a radial average profile could be used as part of the fingerprint in future versions of MIC to improve the quality of the labeling by the network. Perhaps the authors could comment (in the discussion?) about whether incorporating experimental map features could be possible in future work? - lines 189-190: ""this simple metric showed statistically significant separation between test set predictions that agreed and disagreed with the deposited PBD label"": I found this sentence confusing at first, and still do to an extent. To me the syntax did not convey the meaning of the figure unambiguously. To spell it out: -- My understanding on first reading was: when a site lands near a boundary (i.e. the model is uncertain), the model's prediction tends to disagree with the deposited PDB label. Doesn't that mean that if the user gets a result that is assigned low confidence, they should actually assume that the identity assigned by MIC is wrong? That would seem to be problematic... wouldn't it? -- Having reviewed Fig 2e, I now think the text was a bit confusing. My interpretation of the figure: at low confidence scores, say around 0.5, it's only slighlty more likely than not that there's a disagreement with the PDB; this is more in line with the behavior I would have hoped for... i.e. when there's uncertainty, it's a close call - not necessarily was the wrong label given... - line 213: ""The revised overall test set accuracy following manual annotation is 83.3%"". This is impressive. How will this translate to lower-resolution structures, where there will be more error in atom positions... I am thinking back to the fact that they authors found that fingerprinting worked best when using very fine shells... Perhaps this should be discussed somewhere [I think this is touched on in the paragraph ending line 269] - line 269: Right. That touches on my earlier question. When you get to the ~3Å range, unless you happen to have your coordinating side chains modeled really well, MIC is going to be quite prone to error. [I still think this topic of accuracy as a function of resolution should be returned to in the discussion] - line 432: ""MIC achieves incredible accuracy"". Hah! I think the authors should aim for the readers to actually believe the claimed accuracy, and it is unhelpful to characterize the accuracy as ""incredible"". I found the manuscript credible overall ;) - line 495-498: ""limiting all calculated (...) to be identity agnostic"" - I don't understand this. Might be worth spelling things out for non-specialists like myself - line 512: ""non/prune-fifp"" I think should be ""non-prune/fifp"" - line 513: ""prune-eifp"" I think should be ""prune/eifp"" Alexis Rohou May 2024",2024-05-20T00:22:12,alexisrohou,Alexis Rohou,10.1101/2024.03.18.585639,Metric Ion Classification (MIC): A deep learning tool for assigning ions and waters in cryo-EM and x-ray crystallography structures,"Laura Shub, Wenjin Liu, Georgios Skiniotis, Michael J. Keiser, Michael J. Robertson",2024-03-19
https://www.biorxiv.org/content/10.1101/2024.02.23.581812v1#comment-6461899302,biorxivstage,1,This preprint has now been revised and published in CELL: https://www.cell.com/cell/f...,2024-05-18T21:03:14,disqus_uyIFUIC5j1,Camilla Forsberg,10.1101/2024.02.23.581812,An age-specific platelet differentiation path from hematopoietic stem cells contributes to exacerbated thrombosis,"DM Poscablo, AK Worthington, S Smith-Berdan, BA Manso, R Adili, T Cool, RE Reggiardo, S Dahmen, AE Beaudin, SW Boyer, M Holinstat, EC Forsberg",2024-02-24
https://www.biorxiv.org/content/10.1101/2023.12.21.572870v2#comment-6461733695,biorxivstage,0,Data and code available on GitHub and Zenodo as listed in DOI: 10.1126/science.ado043,2024-05-18T16:15:50,,Carol Greider,10.1101/2023.12.21.572870,Human telomere length is chromosome specific and conserved across individuals,"Kayarash Karimian, Aljona Groot, Vienna Huso, Ramin Kahidi, Kar-Tong Tan, Samantha Sholes, Rebecca Keener, John F. McDyer, Jonathan K. Alder, Heng Li, Andreas Rechtsteiner, Carol W. Greider",2024-01-13
https://www.biorxiv.org/content/10.1101/2023.12.21.572870v2#comment-6461732614,biorxivstage,0,This paper is now published in Science DOI: 10.1126/science.ado0431,2024-05-18T16:14:04,,Carol Greider,10.1101/2023.12.21.572870,Human telomere length is chromosome specific and conserved across individuals,"Kayarash Karimian, Aljona Groot, Vienna Huso, Ramin Kahidi, Kar-Tong Tan, Samantha Sholes, Rebecca Keener, John F. McDyer, Jonathan K. Alder, Heng Li, Andreas Rechtsteiner, Carol W. Greider",2024-01-13
https://www.biorxiv.org/content/10.1101/2022.01.23.477429v1#comment-6460780346,biorxivstage,0,Now published in Science Advances doi: 10.1126/sciadv.abp8747,2024-05-17T06:43:31,baydendrussell,Bayden D. Russell,10.1101/2022.01.23.477429,Global success in oyster reef restoration despite ongoing recovery debt,"Deevesh A. Hemraj, Melanie J. Bishop, Boze Hancock, Jay J. Minuti, Ruth H. Thurstan, Philine S.E. Zu Ermgassen, Bayden D. Russell",2022-01-24
https://www.biorxiv.org/content/10.1101/2024.01.10.575094v2#comment-6460753405,biorxivstage,0,Updated citation: PLoS ONE 19(5): e0302696. https://doi.org/10.1371/jou...,2024-05-17T05:05:22,disqus_MpyEq3E4IG,Julian C,10.1101/2024.01.10.575094,Assessment of Gene Set Enrichment Analysis using curated RNA-seq-based benchmarks,"Julián Candia, Luigi Ferrucci",2024-04-10
https://www.biorxiv.org/content/10.1101/2024.05.08.592785v1#comment-6460259196,biorxivstage,0,"Nice article, we are hoping that we could use the genome sequence for our current work. I would recommend that the authors do not replicate the standard adage of how we have to study this beetle because it is a pest that is difficult to control. There are piles of literature on this topic, including two comprehensive compendia by the Forest Service, dedicated to the biology and management of this species. Foresters know very well how to manage forests to avoid outbreaks of the Southern pine beetle. There is a multi-state program for monitoring the population of the species, and predicting its local outbreaks. Case in point - the beetle was pretty much eradicated from the state of Texas, which is presumably why the authors had to use material from Mississippi. Studying genetics in order to ""kill the pest"" seems mistargeted. We know nearly all bark beetle outbreaks are a symptom of excessive stand density, warming climate, or introductions of invasive species, i.e., human-caused. So justifying this great research by the need to control the insects is not very convincing. The many incredible biological features of this insect would make a much more interesting justification.",2024-05-16T13:44:41,jirihulcr,Jiri Hulcr,10.1101/2024.05.08.592785,Genome assembly of the southern pine beetle (Dendroctonus frontalis Zimmerman) reveals the origins of gene content reduction in Dendroctonus,"Megan Copeland, Shelby Landa, Adekola Owoyemi, Michelle M. Jonika, Jamie Alfieri, Terrence Sylvester, Zachary Hoover, Carl E. Hjelmen, J. Spencer Johnston, Bethany R. Kyre, Lynne K. Rieske, Heath Blackmon, Claudio Casola",2024-05-10
https://www.biorxiv.org/content/10.1101/2023.12.14.571746v1#comment-6459255419,biorxivstage,1,This preprint has been published in Virus Evolution (10.1093/ve/veae031). The title has been slightly modified: “Highly pathogenic avian influenza H5N1 virus infections in pinnipeds and seabirds in Uruguay: implications for bird-mammal transmission in South America”.,2024-05-15T13:15:57,disqus_MpI98bdQm3,Ruben Perez,10.1101/2023.12.14.571746,Highly pathogenic avian influenza H5N1 virus infections in pinnipeds and seabirds in Uruguay: a paradigm shift to virus transmission in South America,"Gonzalo Tomás, Ana Marandino, Yanina Panzera, Sirley Rodríguez, Gabriel Luz Wallau, Filipe Zimmer Dezordi, Ramiro Pérez, Lucía Bassetti, Raúl Negro, Joaquín Williman, Valeria Uriarte, Fabiana Grazioli, Carmen Leizagoyen, Sabrina Riverón, Jaime Coronel, Soledad Bello, Enrique Páez, Martín Lima, Virginia Méndez, Ruben Pérez",2023-12-15
https://www.biorxiv.org/content/10.1101/2024.05.09.593319v1#comment-6458390307,biorxivstage,0,"Dear Stefano Vianello, Thank you for the clarification! It is important to have these details correct so we will adapt our text. Very interesting that the morphologies correspond with ""our"" condition 3, in our hands this was the only one perceptive to a later chiron pulse - perhaps that also leads to a stronger meso/endoderm induction. Thank you for reaching out! Best wishes, Marloes",2024-05-14T07:26:46,disqus_HrYV5IK9nP,Marloes Blotenburg,10.1101/2024.05.09.593319,Stem cell culture conditions affect in vitro differentiation potential and efficiency of mouse gastruloid development,"Marloes Blotenburg, Lianne Suurenbroek, Vivek Bhardwaj, Peter Zeller",2024-05-09
https://www.biorxiv.org/content/10.1101/2024.03.12.584663v1#comment-6458347583,biorxivstage,0,"1. Limited Sample Size: In Figure 1A-E, I noticed that only 18 out of the 54 subjects were included in the comparison of biological age versus chronological age in EL subjects. Due to the already limited nature of having a large sample size of centenarians for research studies, it may be more effective to include more participants because having a smaller sample size may limit the generalizability of findings and necessitate caution in applying results to broader populations or conclusions about aging. 2. Including more controls: In Figure 3 where the forward programming of EL-specific iPSCs into cortical neurons was analyzed, I noticed that there was no control of an established cortical neuron cell line. Including this control, would be helpful in comparing the differences and similarities between the differentiated iPSCs and the cortical neurons, and would further help to confirm the pluripotency of the iPSCs created in this experiment. 3. Inclusion of Demographic Information: Including the demographic information of centenarians or the countries from which they come from would be helpful in contextualizing the study and understanding the possible influences on biological age. Considering that factors such as, geographical location, lifestyle habits and access to healthcare can all influence the aging process, including the demographic information of participants may illustrate environmental or genetic factors that may lead to exceptional longevity. Furthermore, having iPSCs from diverse populations may lead to more robust findings in that they would better represent the genetic variation across the globe. 4. Supplemental figures: While the inclusion of the supplemental figures was interesting in seeing the different population of immune cells in centenarians, there was not sufficient information for readers to see how these immune cell populations compared to offspring or their spouses. Having a control of an offsprings’ spouse would help your audience understand how the population of immune cells in centenarians may have lead them to living a longer life, and provide a clearer picture of the role of immune cells in longevity.",2024-05-14T04:54:31,,Erick Nedd,10.1101/2024.03.12.584663,A longevity-specific bank of induced pluripotent stem cells from centenarians and their offspring,"Todd W. Dowrey, Samuel F. Cranston, Nicholas Skvir, Yvonne Lok, Brian Gould, Bradley Petrowitz, Daniel Villar, Jidong Shan, Marianne James, Mark Dodge, Anna C. Belkina, Richard M. Giadone, Paola Sebastiani, Thomas T. Perls, Stacy L. Andersen, George J. Murphy",2024-03-14
https://www.biorxiv.org/content/10.1101/2023.02.17.529037v1#comment-6457761976,biorxivstage,0,"This is a great experiment for looking at changes in serum metabolites over migratory stages. This is valuable information. However, it is a shame that the gut microbiome part of the study is only rudimentary - the study would be much stronger if it could link changes to metabolites with gut microbiota variation, which requires measuring the gut microbiota across all stages and using metagenomics or universal primers. As such, I think the 'gut microbiome adaptions' in the title is misleading.",2024-05-13T11:39:30,,Alice Risely,10.1101/2023.02.17.529037,Seasonal plasticity and energy efficiency in migratory buntings is an assemblage of alterations in metabolic and gut microbe adaptations,"Neelu Jain Gupta, Samya Das, Mrinal Das, Rakesh Arya, Anit Kumar, Ranjan Kumar Nanda",2023-02-18
https://www.biorxiv.org/content/10.1101/2023.04.21.537778v1#comment-6457483130,biorxivstage,0,Please see a summary of problems with this study: https://gfi.org/wp-content/...,2024-05-12T22:14:39,elliotswartz,Elliot Swartz,10.1101/2023.04.21.537778,Environmental impacts of cultured meat: A cradle-to-gate life cycle assessment,"Derrick Risner, Yoonbin Kim, Cuong Nguyen, Justin B. Siegel, Edward S. Spang",2023-04-21
https://www.biorxiv.org/content/10.1101/685404v2#comment-6456294604,biorxivstage,0,"A revised version of this manuscript has been published in October 2023: https://doi.org/10.1038/s41... Genome sequences of 36,000- to 37,000-year-old modern humans at Buran-Kaya III in Crimea E. Andrew Bennett, Oğuzhan Parasayan, Sandrine Prat, Stéphane Péan, Laurent Crépin, Alexandr Yanevich, Thierry Grange & Eva-Maria Geigl Nature Ecology & Evolution volume 7, pages 2160–2172 (2023)",2024-05-11T17:42:26,thierrygrange,Thierry Grange,10.1101/685404,"The origin of the Gravettians: genomic evidence from a 36,000-year-old Eastern European","E. Andrew Bennett, Sandrine Prat, Stéphane Péan, Laurent Crépin, Alexandr Yanevich, Simon Puaud, Thierry Grange, Eva-Maria Geigl",2019-07-02
https://www.biorxiv.org/content/10.1101/2024.05.06.592684v1#comment-6455789797,biorxivstage,0,"In discussion, para 2, 19th line, the author mentioned that the expression of ""the induction of Fe uptake related genes such as FRO2, IRT1 was also not compromised in the pye mutant unlike hy5 mutant"" and refered to the ""Figure S2"". But, in ""Figure S2"", it appears that FRO2 and IRT1 levels are lower in pye than in hy5 mutant as compared to the WT.",2024-05-10T21:05:06,disqus_gM8nbME1Vj,disqus_gM8nbME1Vj,10.1101/2024.05.06.592684,ELONGATED HYPOCOTYL 5 (HY5) and POPEYE (PYE) Regulate Intercellular Iron Transport in Plants,"Samriti Mankotia, Abhishek Dubey, Pooja Jakhar, Santosh B. Satbhai",2024-05-07
https://www.biorxiv.org/content/10.1101/2024.05.09.593319v1#comment-6455339055,biorxivstage,0,"Dear Dr. Blotenburg, I'm Stefano, the author of REF 20 re endoderm-rich gastruloids. In the Discussion section of your manuscript you write that [REF20] maintained mESCs in 2i-medium and reported faithful emergence of endoderm cells . Given the importance of mESC culture conditions in your analyses and possible future interpretations (at least, re endoderm), I wanted to point out that — following the practice of the lab I was working in at the time — mESCs were not grown in the classic 2i medium (2i in N2B27), but in fact in a 2i in ES+LIF medium (exact recipe in REF20's Materials & Methods > Cell culture). Based on gastruloid end-phenotype alone (of those shown in FigS1), I would guess this atypical mESCs culture medium is most closely matched by your culture condition 3 (and possibly condition 4), and that those conditions (though they were not selected for scRNAseq) are giving rise to endoderm-rich gastruloids. Sincerely, Stefano Vianello",2024-05-10T08:11:47,disqus_194gFD9nRp,Stefano Vianello,10.1101/2024.05.09.593319,Stem cell culture conditions affect in vitro differentiation potential and efficiency of mouse gastruloid development,"Marloes Blotenburg, Lianne Suurenbroek, Vivek Bhardwaj, Peter Zeller",2024-05-09
https://www.biorxiv.org/content/10.1101/2023.03.02.530833v1#comment-6455011272,biorxivstage,0,This paper has been published: https://doi.org/10.1161/CIR... Circulation Research. 2024;134:e112–e132,2024-05-09T19:30:15,disqus_GbcWcmoLjZ,Sophie Astrof,10.1101/2023.03.02.530833,Identification of novel buffering mechanisms in aortic arch artery development and congenital heart disease,"AnnJosette Ramirez, Karl Degenhardt, Sophie Astrof",2023-03-02
https://www.biorxiv.org/content/10.1101/2023.05.27.542556v2#comment-6454846948,biorxivstage,0,"This paper had been accepted by Nature Communications volume 15, Article number: 3746 (2024) https://doi.org/10.1038/s41...",2024-05-09T15:38:48,disqus_ZGAOTLoSD2,Yi-HsuanPan,10.1101/2023.05.27.542556,A non-image-forming visual circuit mediates the innate fear of heights,"Wei Shang, Shuangyi Xie, Wenbo Feng, Zhuangzhuang Li, Jingyan Jia, Xiaoxiao Cao, Yanting Shen, Jing Li, Haibo Shi, Yiran Gu, Shi-Jun Weng, Longnian Lin, Yi-Hsuan Pan, Xiao-Bing Yuan",2024-02-07
https://www.biorxiv.org/content/10.1101/2024.05.08.593200v1#comment-6454745892,biorxivstage,1,Fascinating work but it doesn’t complicate the central dogma in any way regardless of what inaccurate textbooks say. https://www.researchgate.ne... Crick was quite specific: the central dogma simply says that translation is irreversible.,2024-05-09T13:09:41,disqus_wtPyWa2JzO,Peter Ellis,10.1101/2024.05.08.593200,De novo gene synthesis by an antiviral reverse transcriptase,"Stephen Tang, Valentin Conte, Dennis J. Zhang, Rimantė Žedaveinytė, George D. Lampe, Tanner Wiegand, Lauren C. Tang, Megan Wang, Matt W.G. Walker, Jerrin Thomas George, Luke E. Berchowitz, Marko Jovanovic, Samuel H. Sternberg",2024-05-08
https://www.biorxiv.org/content/10.1101/2022.09.19.508526v1#comment-6454633846,biorxivstage,0,"Apologies for the late reply. The variant in the LOXHD1 gene (as all other enriched variants listed in Tables 1-5) can be found in ClinVar by searching for AlleleID = 176561, rather than by variation ID. https://www.ncbi.nlm.nih.go...",2024-05-09T08:52:36,,Mihail Halachev,10.1101/2022.09.19.508526,Regionally enriched rare deleterious exonic variants in the UK and Ireland,"Mihail Halachev, Elvina Gountouna, Alison Meynert, Regeneron Genetics Center, Gannie Tzoneva, Alan R. Shuldiner, Colin A. Semple, James F. Wilson",2022-09-21
https://www.biorxiv.org/content/10.1101/2024.04.30.591852v1#comment-6454156033,biorxivstage,0,"Many people have used ellipsoids (Mahalanobis distance) for niche modelling in the past. I think you need to consult, at least: Farber, O. and Kadmon, R., 2003. Assessment of alternative approaches for bioclimatic modeling with special emphasis on the Mahalanobis distance. Ecological modelling, 160(1-2), pp.115-130. Jiménez, L., Soberón, J., Christen, J.A. and Soto, D., 2019. On the problem of modeling a fundamental niche from occurrence data. Ecological Modelling, 397, pp.74-83. Drake, J.M., 2015. Range bagging: a new method for ecological niche modelling from presence-only data. Journal of the Royal Society Interface, 12(107), p.20150086. Hirzel, A.H., Hausser, J., Chessel, D. and Perrin, N., 2002. Ecological‐niche factor analysis: how to compute habitat‐suitability maps without absence data?. Ecology, 83(7), pp.2027-2036.",2024-05-08T16:54:50,jorge_soberon,Jorge Soberon,10.1101/2024.04.30.591852,Beyond a diagnostic tool: Validating standardized Mahalanobis distance as a species distribution model for invasive alien species in North America,"JR Stinziano, A Charron, M Damus",2024-05-03
https://www.biorxiv.org/content/10.1101/2024.05.02.592218v1#comment-6453779862,biorxivstage,0,"""The artifacts of the dataset were removed by the authors while publishing the dataset"" statement is false. The data you downloaded are raw EEG data (as stated in the dataset description. All analyses are therefore performed on data containing a lot of eye movement and muscle artifacts making your classification algorithm useless.",2024-05-08T12:59:32,,Yuri Pavlov,10.1101/2024.05.02.592218,Bayesian Functional Connectivity and Graph Convolutional Network for Working Memory Load Classification,"Harshini Gangapuram, Vidya Manian",2024-05-05
