comment url,comment forum,comment keywords,comment message,comment date,comment username,comment name,paper doi,paper title,paper authors,paper date
https://www.biorxiv.org/content/10.1101/2023.09.01.555894v1#comment-6315191360,biorxivstage,1,"We - the authors of this manuscript - appreciate a Community Review of this manuscript posted here: https://zenodo.org/records/.... We agree with the overall assessment of the reviewers. 1) For the method description, we have cited previous publications and mentioned ‘as described previously’. Based on the reviewers' suggestion we will further describe the methods in detail to clarify the reviewers' concerns. In addition, we will include the age and sexes of mice in the legends of each figure. We will upload a revised version of this manuscript in a few months. eLife journal will publish the manuscript. 2) We agree with the reviewers that additional experiments are necessary for in-depth analyses of how elevated glycosuria increases compensatory glucose production. The goal of this project was to provide a foundation for future studies that will be informed by the list of secreted proteins identified using plasma proteomics, some of them may be correlative and others causal. At this time, it is not feasible to test each of the identified protein for its causal role in enhancing a compensatory glucose production. 3) eLife will publish a revised version of this manuscript in a few weeks.",2023-11-03T15:51:53,,Corresponding Author,10.1101/2023.09.01.555894,A kidney-hypothalamus axis promotes compensatory glucose production in response to glycosuria,"Tumininu S. Faniyan, Xinyi Zhang, Donald A. Morgan, Jorge Robles, Siresha Bathina, Paul S. Brookes, Kamal Rahmouni, Rachel J. Perry, Kavaljit H. Chhabra",2023-09-05
https://www.biorxiv.org/content/10.1101/2023.07.26.550726v1#comment-6315135548,biorxivstage,0,"It is not clear about the background of the used mutants. Some lines have WS background (for example, ahk3-1 and ahk3-2 - Wisconsin University lines WS-2) [Nishimura et al., 2004], while others - Col-0. Authors, however, always used only Col-0 as a control. Please, provide the proper background description for every used line.",2023-11-03T14:34:03,,Alex,10.1101/2023.07.26.550726,Cytokinins control secondary cell wall formation in the inflorescence stem of Arabidopsis,"Vojtech Didi, Dominique Arnaud, Anna Pacinková, Radek Jupa, Radim Cegan, Alesia Melnikava, Jana Vasickova, Mariana Benitez, Faride Unda, Tereza Dobisova, Willi Riber, Zuzana Dostalova, Shawn D. Mansfield, Ondrej Novak, Miroslav Strnad, Roman Hobza, Vít Gloser, Eva Budinska, Jan Hejatko",2023-07-28
https://www.biorxiv.org/content/10.1101/2022.10.02.510516v1#comment-6314987718,biorxivstage,0,This article is now published at https://doi.org/10.1093/mol...,2023-11-03T10:00:12,disqus_nweTGY294Y,Laura Dean,10.1101/2022.10.02.510516,On the origins of phenotypic parallelism in benthic and limnetic stickleback,"Laura L. Dean, Isabel Santos Magalhaes, Daniele D’Agostino, Paul Hohenlohe, Andrew D. C. MacColl",2022-10-04
https://www.biorxiv.org/content/10.1101/2023.10.27.564342v1#comment-6314687029,biorxivstage,0,"Here are a couple of points for readers to consider: 1. Soula et al., agree that by increasing the group size severalfold, the statistical results often change. It is worth emphasizing, that the group sizes in our study were either on par with or notably larger than those reported in the study by Iaccarino et al. 2. In the spirit of full disclosure, it's important to note that the authors of this manuscript have a vested interest as they own a company that manufactures and sells 40-Hz stimulation devices ( https://optoceutics.com)",2023-11-02T21:38:56,,Marisol ,10.1101/2023.10.27.564342,Unexpected contribution to the prevailing trend of positive results for 40 Hz light flicker,"M. Carstensen, J. T. Pedersen, J. Carstensen",2023-11-01
https://www.biorxiv.org/content/10.1101/2020.11.14.382416v1#comment-6314516991,biorxivstage,0,"Published version of this article titled "" Non-canonical function of histone methyltransferase G9a in the translational regulation of chronic inflammation"" is now available: https://www.sciencedirect.c...",2023-11-02T17:48:33,adil_muneer,Adil Muneer,10.1101/2020.11.14.382416,"Novel gene-specific translation mechanism of dysregulated, chronic inflammation reveals promising, multifaceted COVID-19 therapeutics","Li Wang, Adil Muneer, Ling Xie, Feng Zhang, Bing Wu, Liu Mei, Erik M Lenarcic, Emerald Hillary Feng, Juan Song, Yan Xiong, Xufen Yu, Charles Wang, Ciprian Gheorghe, Karina Torralba, Jeanette Gowen Cook, Yisong Y. Wan, Nathaniel John Moorman, Hongjun Song, Jian Jin, Xian Chen",2020-11-16
https://www.biorxiv.org/content/10.1101/2022.06.08.495248v1#comment-6314214700,biorxivstage,0,This article have been now published at https://doi.org/10.1186/s12...,2023-11-02T10:03:14,katarinagresova,Katarina Gresova,10.1101/2022.06.08.495248,Genomic Benchmarks: A Collection of Datasets for Genomic Sequence Classification,"Katarina Gresova, Vlastimil Martinek, David Cechak, Petr Simecek, Panagiotis Alexiou",2022-06-10
https://www.biorxiv.org/content/10.1101/2023.02.13.528296v3#comment-6313682448,biorxivstage,0,"Published in Research Article, J Mar Biol Oceanogr Vol: 12 Issue: 4 ( https://www.scitechnol.com/...",2023-11-01T16:33:32,disqus_Ppa0zMTe73,Jae Choi,10.1101/2023.02.13.528296,"A multi-stage, delay differential model of snow crab population dynamics in the Scotian Shelf of Atlantic Canada",Jae S. Choi,2023-06-18
https://www.biorxiv.org/content/10.1101/2023.10.19.563117v1#comment-6313549693,biorxivstage,0,It's an ananlysis we'd like to do but at this level seem to be underpowered.,2023-11-01T13:30:08,michaelvanelzakker,Michael VanElzakker,10.1101/2023.10.19.563117,Neuroinflammation in post-acute sequelae of COVID-19 (PASC) as assessed by [11C]PBR28 PET correlates with vascular disease measures,"Michael B. VanElzakker, Hannah F. Bues, Ludovica Brusaferri, Minhae Kim, Deena Saadi, Eva-Maria Ratai, Darin D. Dougherty, Marco L. Loggia",2023-10-20
https://www.biorxiv.org/content/10.1101/2023.10.19.563117v1#comment-6313549175,biorxivstage,0,"Yes! Thank you for catching the typo. You are right, we caught that and made the change before submitting to the primary journal.",2023-11-01T13:29:19,michaelvanelzakker,Michael VanElzakker,10.1101/2023.10.19.563117,Neuroinflammation in post-acute sequelae of COVID-19 (PASC) as assessed by [11C]PBR28 PET correlates with vascular disease measures,"Michael B. VanElzakker, Hannah F. Bues, Ludovica Brusaferri, Minhae Kim, Deena Saadi, Eva-Maria Ratai, Darin D. Dougherty, Marco L. Loggia",2023-10-20
https://www.biorxiv.org/content/10.1101/2023.05.16.540990v1#comment-6312915774,biorxivstage,0,Hello! I would like to inform that my manuscript has now been peer-reviewed and published. You can find the published version here: https://www.sciencedirect.c...,2023-10-31T15:58:49,diogomloureno,Diogo M. Lourenço,10.1101/2023.05.16.540990,Unravelling a novel role for Cannabidivarin in the modulation of subventricular zone postnatal neurogenesis,"Diogo M. Lourenço, Rita Soares, Sónia Sá Santos, Joana M. Mateus, Rui S. Rodrigues, João B. Moreira, Sandra H. Vaz, Ana M. Sebastião, Susana Solá, Sara Xapelli",2023-05-17
https://www.biorxiv.org/content/10.1101/2023.10.25.563937v1#comment-6312873948,biorxivstage,0,"For table 1, it looks like citation 17 used an Illumina HiSeq platform. ""Libraries Preparation and Sequencing Libraries were prepared using the Nextera DNA Library Preparation kit (Illumina) and sequenced on an Illumina HiSeq platform (leading to 40,552,111 ±9,650,536 reads/sample)."" Also, Qiagen is a company, not an extraction kit. Qiagen manufactures many of the kits listed in table 1, so it is confusing to have ""Qiagen"" listed as a DNA-Exk.",2023-10-31T15:03:11,scottcthomas,Scott C Thomas,10.1101/2023.10.25.563937,Evaluation of normalization methods for predicting quantitative phenotypes in metagenomic data analysis,"Beibei Wang, Yihui Luan",2023-10-29
https://www.biorxiv.org/content/10.1101/2023.10.26.564040v1#comment-6312865298,biorxivstage,0,Very interesting tool. We will test for biological applications,2023-10-31T14:51:47,,Therese,10.1101/2023.10.26.564040,Back to sequences: find the origin of k-mers,"Anthony Baire, Pierre Peterlongo",2023-10-29
https://www.biorxiv.org/content/10.1101/2022.05.26.493548v1#comment-6312740854,biorxivstage,0,Published version available here: https://www.nature.com/arti...,2023-10-31T11:39:45,,Graham,10.1101/2022.05.26.493548,Spectral flow cytometry reveals metabolic heterogeneity in tissue macrophages,"Graham A Heieis, Thiago A Patente, Tamar Tak, Luís Almeida, Bart Everts",2022-05-28
https://www.biorxiv.org/content/10.1101/2023.08.06.552168v1#comment-6312429262,biorxivstage,1,"Hey folks, I really appreciate your thoughtful feedback. Thanks for taking the time. I'm going to incorporate your suggestions and address your critiques, as well as make some changes based on additional feedback from another reviewer, and then I am excited to resubmit and get another (hopefully final!) look at it from all parties. I'll post the updated version to bioRxiv as a second version of the manuscript when I have it. I may be a little slow because of an impending grant deadline, so I just wanted to say thanks while it may still be fresh in your brain. All the best, Ben",2023-10-30T22:19:46,disqus_7uoIQJfF7R,Benjamin Brown,10.1101/2023.08.06.552168,Approximating conformational Boltzmann distributions with AlphaFold2 predictions,"Benjamin P. Brown, Richard A. Stein, Jens Meiler, Hassane Mchaourab",2023-08-07
https://www.biorxiv.org/content/10.1101/2022.09.19.508597v1#comment-6312389136,biorxivstage,0,Published: Biotechnology and Bioengineering. DOI: 10.1002/bit.28532,2023-10-30T21:19:17,,Kyle Sander,10.1101/2022.09.19.508597,"Eliminating Genes for a Two Component System Increases PHB Productivity in Cupriavidus basilensis 4G11 Under PHB Suppressing, Non-Stress Conditions","Kyle Sander, Anthony J. Abel, Skyler Friedline, William Sharpless, Jeffrey Skerker, Adam Deutschbauer, Douglas S. Clark, Adam P. Arkin",2022-09-20
https://www.biorxiv.org/content/10.1101/2023.10.23.563605v1#comment-6312371825,biorxivstage,1,This manuscript has been accepted for publication in Langmuir.,2023-10-30T20:54:28,vernitagordon,Vernita Gordon,10.1101/2023.10.23.563605,Physiological concentrations of calcium interact with alginate and extracellular DNA in the matrices of Pseudomonas aeruginosa biofilms to impede phagocytosis by neutrophils,"Marilyn J. Wells, Hailey Currie, Vernita D. Gordon",2023-10-23
https://www.biorxiv.org/content/10.1101/2023.10.16.562533v1#comment-6311912240,biorxivstage,0,"Dear authors, I've learned a lot from reading your pre-print! I'm intrigued to see what language models will mean for deeper understanding of complex biomedical data in the near future. I have noticed that a few UMAPs (see for example figures 3 and 4) have slightly different shapes in the differently colour-coded versions (a vs b, c vs d). As a non-expert, I can imagine that this can easily be missed while updating figures. I thought it would be beneficial to everyone to give a heads-up.",2023-10-30T08:40:11,estelcolladocamps,Estel Collado Camps,10.1101/2023.10.16.562533,GENEPT: A SIMPLE BUT HARD-TO-BEAT FOUNDATION MODEL FOR GENES AND CELLS BUILT FROM CHATGPT,"Yiqun T. Chen, James Zou",2023-10-19
https://www.biorxiv.org/content/10.1101/2023.03.08.531702v2#comment-6311905821,biorxivstage,1,A revised version of this preprint has been published and can be found here: https://doi.org/10.1016/j.n...,2023-10-30T08:19:18,smathot,Sebastiaan Mathôt,10.1101/2023.03.08.531702,Causal Effects of Pupil Size on Visual Processing,"Sebastiaan Mathôt, Hermine Berberyan, Philipp Büchel, Veera Ruuskanen, Ana Vilotijević, Wouter Kruijne",2023-06-21
https://www.biorxiv.org/content/10.1101/2022.06.21.496830v1#comment-6311224695,biorxivstage,1,"Fascinating study as expected from the Yanai lab. I work on DTPs as well. I read the whole preprint and watched the Match Onco seminar by Prof. Yanai about this work. Maybe I missed some point in the paper but I wonder why the identified IC50 for drug-naive Kuramochi cell line is ~2 uM? In my own measurements, using both CellTiter-Glo and SRB assays in a 12-concentration range, 72-hr format, I always calculate an IC50 in the range of 150 to 200 uM in Kuramochi cell line for olaparib. These values are also supported by measurements in the GDSC (both versions 1 and 2) project. Did the authors check this? This might be an issue in the context of drug adaptability since the cell line, in bulk, is already poised to adapt by tolerating low uM olaparib concentrations used in the study (<160 uM).",2023-10-29T09:08:48,borrisaldonza,BBB  Prair,10.1101/2022.06.21.496830,Drug-induced adaptation along a resistance continuum in cancer cells,"Gustavo S. França, Maayan Baron, Maayan Pour, Benjamin R. King, Anjali Rao, Selim Misirlioglu, Dalia Barkley, Igor Dolgalev, Kwan Ho-Tang, Gal Avital, Felicia Kuperwaser, Ayushi Patel, Douglas A. Levine, Timothee Lionnet, Itai Yanai",2022-06-25
https://www.biorxiv.org/content/10.1101/2023.09.12.557347v1#comment-6310353649,biorxivstage,1,"Hello! I had a great time reading your paper as it is very important to the field of public health and very informative! I was wondering, however, if there was enough data that was collected to show the immune response differences in those who had the vaccines separately. I assume that the closer you get the vaccines together, the better your IgG responses will be in the future, but I'd be interested to see if there is a weird window of time that the second vaccine becomes a catalyst for a more powerful IgG response (something random like 9 days after the second vaccine perhaps?) . Again thank you so much for your effort that you put into this research as it is very important and helpful to so many!",2023-10-27T23:34:09,cdsljhsph,CDSL JHSPH,10.1101/2023.09.12.557347,Concurrent administration of COVID-19 and influenza vaccines enhances Spike-specific antibody responses,"Susanna E. Barouch, Taras M. Chicz, Ross Blanc, Domenic R. Barbati, Lily J. Parker, Xin Tong, Ryan P. McNamara",2023-09-12
https://www.biorxiv.org/content/10.1101/2022.11.24.517847v4#comment-6310227278,biorxivstage,0,Now published on GigaScience: https://doi.org/10.1093/gig...,2023-10-27T19:48:12,cristaniguti,Cris Taniguti,10.1101/2022.11.24.517847,Developing best practices for genotyping-by-sequencing analysis in the construction of linkage maps,"Cristiane Hayumi Taniguti, Lucas Mitsuo Taniguti, Rodrigo Rampazo Amadeu, Jeekin Lau, Gabriel de Siqueira Gesteira, Thiago de Paula Oliveira, Getulio Caixeta Ferreira, Guilherme da Silva Pereira, David Byrne, Marcelo Mollinari, Oscar Riera-Lizarazu, Antonio Augusto Franco Garcia",2023-10-06
https://www.biorxiv.org/content/10.1101/2023.10.26.564206v1#comment-6310216829,biorxivstage,0,"The claim that you have generated brown adipocytes is overstated. There is no clear proof morphologically or by significant changes in gene expression (UCP1) that would support brown adipocyte character. I would revisit that experiment. Showing tissue that has formed (and analyze it histomorphological) would make the in vivo work much more convincing. In line with that, survival for up to 28 weeks seems overstated as IVIS data thresholding doesn't seem to be corrected for background noise.",2023-10-27T19:33:35,,Federico,10.1101/2023.10.26.564206,Designer Fat Cells: Adipogenic Differentiation of CRISPR-Cas9 Genome-Engineered Induced Pluripotent Stem Cells,"E. V. Ely, A. T. Kapinski, S. G. Paradi, R. Tang, F. Guilak, K. H. Collins",2023-10-26
https://www.biorxiv.org/content/10.1101/2023.08.06.552168v1#comment-6310058037,biorxivstage,1,"In this manuscript the authors have tested the hypothesis that the MSA constructed by AlphaFold2 (AF2) contains information about the distribution of different conformational states of a protein. Whereas the current way of thinking about AF2’s MSA-predicted Cβ–Cβ distance maps focuses on their power to provide binary classifications of inter-residue contacts, the authors propose that Cβ–Cβ distances should instead be thought of as a set of collective variables that approximate a Boltzmann distribution. This is a novel hypothesis that lends AF2 the ability to decipher the conformational Boltzmann distributions of proteins. The authors test this in the contexts of protein dynamics, mutation impacts, and protein-protein interactions. They start with analyzing the correlation between AF2 contact distance and spin label distance distributions obtained from EPR spectroscopy using T4 lysozyme as a model, finding a general agreement despite broader AF2 distributions. Following this, they explore if AF2 can approximate free energy changes in systems that contain multiple biologically important minima, using EGFR KD studies for this purpose. AF2 accurately identifies altered contact distance distributions corresponding to active or inactive conformations in several mutations, indicating a sensitivity to alterations that stabilize particular conformational states. Next, they assess sensitivity to thermodynamically destabilizing mutations. AF2 was able to predict different contact distance probabilities for disruptive mutations like L198R in UBA1, but was less sensitive for milder mutations like L198A. Lastly, AF2’s sensitivity to protein-protein interactions was explored using the μ-opioid receptor (μOR). Although the helix displacement distances observed in the predicted structure of isolated and complexed μOR do not exactly match with expected values, AF2 did successfully predict differences in select contact distance distributions of active/inactive-state μOR. Demonstrating that Cβ–Cβ distance probabilities from the same AF2-learned distribution reflect distances observed in differentially behaving domains of a protein lends strong support to the hypothesis that AF2 contact distance distributions can approximate conformational distributions. The manuscript explores the correlations and sensitivities of AF2 predicted Cβ–Cβ distances across a variety of protein contexts, giving a broad view of its capabilities and limitations. Transitions between the various sections flowed well, and overall the writing was well worded and easily comprehensible. In addition, the presentation was balanced. It doesn’t just focus on the success of AF2, but also highlights where its sensitivities might vary or fall short, providing a balanced view of its capabilities. Given limited computational resources, the conformational space explored by MD and MCMC simulations is limited by their initial states. AI methods are instead limited by how informative their system definitions (MSAs and pre-set theoretical or experimental contact distance distributions) are, allowing AI methods, such as the AF2 method outlined by the authors, to more effectively sample conformational space. This is a very fascinating implication of their work which the authors have briefly mentioned in the discussion. This (and the connection to Figure 7 in the paper) warrants a deeper discussion, but the main conclusions the authors come to are within the scope of the manuscript, and are backed up by the evidence presented. There are a few points we would like to bring to the attention of the authors to strengthen the manuscript further. Major points: 1.There are some difficulties interpreting Figure 2. (a) It is important to mark the distances between the two chosen pairs of atoms in the active and inactive state. Without this information, the purpose of Figure 2D is unclear and Figure 2D, F and G are difficult to understand. (b) What is the threshold distance to classify a state as active or inactive? (c) Figure 2E seems confusing with different axis and ranges. 2. In case of DDR1, does the MD simulations reflect the peak distances (between 7.5 and 10.0 Å for DFG-in and between 16.0 and 18.0 Å for DFG-out) observed for AF2 distance distributions? Also, the probability distribution shift towards shorter distances for Y755A does not seem particularly strong at first glance. Is this why the double alanine mutant was included? Are there also MD simulations of the double mutant that show a reduced preference for the DFG-out conformation? 3. The overall results on EGFR mutants are striking. Many of these mutants (most notably L858R have structures deposited in the PDB (ID:2ITT and many others) that are potentially part of the overall training of AF2/OpenFold. Can you comment on how this might affect the results? Minor Points: 1. There is some ambiguity in the statement, “The central hypothesis of this manuscript is that the collective contact distance distributions predicted by AF2 contain relevant information that can approximate Boltzmann distributions provided the relevant conformational states can be adequately described by these contact distances.” We suggest adding to this such that a stronger connection is formed between the theory section and the remainder of the paper. For example, the authors could explain that the contact distances specified in each section are the set of CVs you describe earlier, “we identify a set of CVs, ξ = (ξ1, ξ2, …, ξm)...”. It would also be helpful to clarify that the distributions predicted by AF2 represent the ensemble averaged observable, as described by equation 4. Lastly, the authors mention that these distributions can approximate Boltzmann distributions, but this is somewhat vague. This could be reworded to say that AF2 distributions can approximate experimentally derived Boltzmann distributions of the same distance. 2. The authors are comparing  Cβ–Cβ distances determined by AF2 to spin label distances from EPR. This is explained in the methods section, but the procedure for adjusting the spin label distances to facilitate a meaningful comparison between them and the AF2 distances is somewhat unclear. To make a stronger justification for why these are comparable, the authors could clarify the procedure. For example, some context from the authors’ previous paper, De Novo High-Resolution Protein Structure Determination from Sparse Spin labeling EPR Data: “[distance from spin label] dSL is a starting point for the upper estimate of dCβ, and subtracting the effective distance of 6Å twice from dSL gives a starting point for the lower estimate of dCβ” could be beneficial. Including a rank correlation coefficient, as hinted above, could also help emphasize that the results demonstrate “similar relative probabilities among the contact distances for AF2 and EPR” 3. In the comparison of distance distributions between AF2 predictions and EPR measures, the major peaks of the two distributions are similar but in certain cases (127CB - 154CB, 120CB - 131CB), some additional peaks are found beyond 10A. A statistical comparison of the distributions, perhaps using a KS test, will help in evaluating the significance of the similarities. 4. Typo in Hamiltonian Equation 1 (should be momentum squared) 5. In the T4 Lysozyme example, how were the six contacts between the 12 unique residues found? 6. In Figure 5, the fourth row could have more discussion/explanation. What does the colorbar represent? There is no label. 7. As mentioned earlier, the connection between the Discussion and Figure 7 is not well established. The authors could expand on their writing and/or make the figure more simplified to match the discussion better. -  Jessica Flowers, Angelica Lam, Ashraya Ravikumar, James Fraser",2023-10-27T15:59:31,ashrayaravikumar,Ashraya Ravikumar,10.1101/2023.08.06.552168,Approximating conformational Boltzmann distributions with AlphaFold2 predictions,"Benjamin P. Brown, Richard A. Stein, Jens Meiler, Hassane Mchaourab",2023-08-07
https://www.biorxiv.org/content/10.1101/2023.06.29.547063v1#comment-6310024871,biorxivstage,0,Is it possible to show where the ecRNH and ttRNH would fall relative to the clusters in Fig. 9? Their identity to the AncA/B/C sequences? And key residues that vary between ecRNH and the most homologous Anc sequence?,2023-10-27T15:13:53,,JO,10.1101/2023.06.29.547063,The importance of input sequence set to consensus-derived proteins and their relationship to reconstructed ancestral proteins,"Charlotte Nixon, Shion A. Lim, Matt Sternke, Doug Barrick, Mike Harms, Susan Marqusee",2023-07-01
