comment url,comment forum,comment keywords,comment message,comment date,comment username,comment name,paper doi,paper title,paper authors,paper date
https://www.biorxiv.org/content/10.1101/2023.03.13.532391v1#comment-6363188950,biorxivstage,0,"The peer-reviewed version is available at Journal of Evolutionary Biology 36, 1525-1538, https://doi.org/10.1111/jeb.14224",2024-01-10T09:51:21,toddvision,Todd Vision,10.1101/2023.03.13.532391,Evolutionary rescue under demographic and environmental stochasticity,"Kuangyi Xu, Todd J. Vision, Maria R. Servedio",2023-03-14
https://www.biorxiv.org/content/10.1101/2023.02.19.528613v1#comment-6363188445,biorxivstage,0,"The peer-reviewed version is available at Methods in Ecology and Evolution 14, 2531-2540. https://doi.org/10.1111/204...",2024-01-10T09:49:46,toddvision,Todd Vision,10.1101/2023.02.19.528613,rphenoscate: An R package for semantic-aware evolutionary analyses of anatomical traits,"Diego S. Porto, Sergei Tarasov, Caleb Charpentier, Hilmar Lapp, James P. Balhoff, Todd J. Vision, Wasila M. Dahdul, Paula M. Mabee, Josef Uyeda",2023-02-21
https://www.biorxiv.org/content/10.1101/2023.11.03.565501v1#comment-6363123677,biorxivstage,0,"Dear Mel, Thanks a lot for your interest in our work. Regarding the E.coli LTR-LTR recombination, we usually control for this by restriction enzyme digestion and we do not see much recombination happening at that stage. While a small proportion of the plasmid may still recombine , this seems to be negligible as our viral prep is highly infectious. Recombination-wise our major issue was loss of the cassette in the viral particles after passaging.This is why we codon optimised the Nef sequence. I hope this answers your question. Best, Caterina Prelli Bozzo",2024-01-10T06:15:53,caterinaprellibozzo,caterinaprellibozzo,10.1101/2023.11.03.565501,Traitor-virus-guided discovery of novel antiviral factors,"Caterina Prelli Bozzo, Alexandre Laliberté, Aurora De Luna, Chiara Pastorio, Kerstin Regensburger, Stefan Krebs, Alexander Graf, Helmut Blum, Meta Volcic, Konstantin M.J. Sparrer, Frank Kirchhoff",2023-11-04
https://www.biorxiv.org/content/10.1101/2023.08.31.555711v1#comment-6362549412,biorxivstage,0,Prevotella copri has been renamed Segatella copri,2024-01-09T15:07:07,tomhitch,Tom Hitch,10.1101/2023.08.31.555711,Human gut metagenomic mining reveals an untapped source of peptide antibiotics,"Marcelo D. T. Torres, Erin Brooks, Angela Cesaro, Hila Sberro, Cosmos Nicolaou, Ami S. Bhatt, Cesar de la Fuente-Nunez",2023-09-03
https://www.biorxiv.org/content/10.1101/2023.07.19.549730v1#comment-6362459844,biorxivstage,1,"A revised version of this article has been accepted for publication in Matrix Biology and is available online from their website.  The title has been revised: ""Peroxidasin is required for full viability in development and for maintenance of tissue mechanics in adults"". Matrix Biol. 2023 Nov 22:S0945-053X(23)00117-8.  doi: 10.1016/j.matbio.2023.11.005. Online ahead of print. K Elkie Peebles, Kimberly S LaFever, Patrick S Page-McCaw, Selene Colon, Dan Wang, Aubrie M Stricker, Nicholas Ferrell, Gautam Bhave, Andrea Page-McCaw PMID: 38000777  DOI: 10.1016/j.matbio.2023.11.005",2024-01-09T12:47:09,andreapagemccaw,Andrea Page-McCaw,10.1101/2023.07.19.549730,Analysis of Drosophila and mouse mutants reveals that Peroxidasin is required for tissue mechanics and full viability,"K. Elkie Peebles, Kimberly S. LaFever, Patrick S. Page-McCaw, Selene Colon, Dan Wang, Aubrie M. Stricker, Nicholas Ferrell, Gautam Bhave, Andrea Page-McCaw",2023-07-19
https://www.biorxiv.org/content/10.1101/2023.12.22.569885v1#comment-6361979917,biorxivstage,1,"Thank you very much for your interest in our study. We appreciate your helpful and valid comment! Thank you and best, Nadine",2024-01-08T19:54:29,nadine_praeg,Nadine Praeg,10.1101/2023.12.22.569885,Biodiversity in mountain soils above the treeline,"Nadine Praeg, Michael Steinwandter, Davnah Urbach, Mark A. Snethlage, Rodrigo P. Alves, Martha E. Apple, Andrea J. Britton, Estelle P. Bruni, Ting-Wen Chen, Kenneth Dumack, Fernando Fernandez-Mendoza, Michele Freppaz, Beat Frey, Nathalie Fromin, Stefan Geisen, Martin Grube, Elia Guariento, Antoine Guisan, Qiao-Qiao Ji, Juan J. Jiménez, Stefanie Maier, Lucie A. Malard, Maria A. Minor, Cowan C. Mc Lean, Edward A. D. Mitchell, Thomas Peham, Roberto Pizzolotto, Andy F. S. Taylor, Philippe Vernon, Johan J. van Tol, Yunga Wu, Donghui Wu, Zhijing Xie, Bettina Weber, Paul Illmer, Julia Seeber",2023-12-23
https://www.biorxiv.org/content/10.1101/2023.12.29.573643v1#comment-6361876703,biorxivstage,0,The role of Creb3l2 and XBP1 in professional secretory cell has already been established in 2019 by Khetchoumian et al. Any reason why this paper wasn't mentioned in reference?,2024-01-08T17:48:05,,Jonathan,10.1101/2023.12.29.573643,Gene module reconstruction elucidates cellular differentiation processes and the regulatory logic of specialized secretion,"Yiqun Wang, Jialin Liu, Lucia Y. Du, Jannik L. Wyss, Jeffrey A. Farrell, Alexander F. Schier",2023-12-29
https://www.biorxiv.org/content/10.1101/2020.10.12.336487v2#comment-6361799467,biorxivstage,1,Please note that the Supplemental Table 1 is missing from the preprint but can be found in the published version.,2024-01-08T16:30:19,artinavare,artinavare,10.1101/2020.10.12.336487,Viral protein engagement of GBF1 induces host cell vulnerability through synthetic lethality,"Arti T Navare, Fred D Mast, Jean Paul Olivier, Thierry Bertomeu, Maxwell Neal, Lindsay N Carpp, Alexis Kaushansky, Jasmin Coulombe-Huntington, Mike Tyers, John D Aitchison",2020-11-06
https://www.biorxiv.org/content/10.1101/2022.06.05.494587v1#comment-6360800506,biorxivstage,1,Link to the published version of the preprint: https://journals.asm.org/do...,2024-01-07T08:11:23,,Saroj Khadka,10.1101/2022.06.05.494587,Regulation of Klebsiella pneumoniae mucoidy by the bacterial tyrosine kinase Wzc,"Saroj Khadka, Brooke Ring, Lindsey R. Krzeminski, Matthew Hathaway, Ryan S. Walker, Harry L.T. Mobley, Laura A. Mike",2022-06-05
https://www.biorxiv.org/content/10.1101/2023.04.13.536719v2#comment-6359472837,biorxivstage,0,"The peer reviewed article been published in ASM journal mSystems in October 2023, but link to online  version never updated. The mSystems version also doesnt show up in google scholar so Im not sure what is going on. https://journals.asm.org/do...",2024-01-05T14:30:56,chrisschadt,Chris Schadt,10.1101/2023.04.13.536719,"Elevated temperature alters microbial communities, but not decomposition rates, during three years of in-situ peat decomposition","Spencer Roth, Natalie A. Griffiths, Randall K. Kolka, Keith C. Oleheiser, Alyssa A. Carrell, Dawn M. Klingeman, Angela Seibert, Jeffrey P. Chanton, Paul J. Hanson, Christopher W. Schadt",2023-04-27
https://www.biorxiv.org/content/10.1101/797654v1#comment-6358766399,biorxivstage,0,"This manuscript has not yet been published in a peer-reviewed journal yet because we noticed that our engineered epithelial cell line, expressing ZEB1 under the control of doxycyclin, was contaminated with mycoplasma. We currently don't have the human ressources to make a new cell line, and repeat the key experiments in order to validate (at least) the main conclusions.",2024-01-04T16:19:04,,Manuel Théry,10.1101/797654,Biophysical properties of intermediate states of EMT outperform both epithelial and mesenchymal states,"Yoran Margaron, Tomoaki Nagai, Laurent Guyon, Laetitia Kurzawa, Anne-Pierre Morel, Alice Pinheiro, Laurent Blanchoin, Fabien Reyal, Alain Puisieux, Manuel Théry",2019-10-08
https://www.biorxiv.org/content/10.1101/2023.12.14.571608v2#comment-6358670301,biorxivstage,0,"Congratulations on the paper. It's very important that we start adding pieces to this immunity evolutionary puzzle. I just need to highlight that the work developed at the Baker Lab on the evolution of Argonautes, bringing archaeal sequences into debate and positioning them in the evolutionary context, must be cited here. ( https://www.biorxiv.org/con... It's very important that both papers are linked so we can have a more comprehensive understanding of such a complex topic. Your paper basically",2024-01-04T14:03:40,,Caroline,10.1101/2023.12.14.571608,RNA-guided RNA silencing by an Asgard archaeal Argonaute,"Carolien Bastiaanssen, Pilar Bobadilla Ugarte, Kijun Kim, Yanlei Feng, Giada Finocchio, Todd A. Anzelon, Stephan Köstlbacher, Daniel Tamarit, Thijs J. G. Ettema, Martin Jinek, Ian J. MacRae, Chirlmin Joo, Daan C. Swarts, Fabai Wu",2023-12-15
https://www.biorxiv.org/content/10.1101/2023.12.22.569885v1#comment-6358633070,biorxivstage,0,It would be useful if the authors add a list of the reviewed articles classified by the categories of Tables S4 to S6.,2024-01-04T12:57:26,,BB,10.1101/2023.12.22.569885,Biodiversity in mountain soils above the treeline,"Nadine Praeg, Michael Steinwandter, Davnah Urbach, Mark A. Snethlage, Rodrigo P. Alves, Martha E. Apple, Andrea J. Britton, Estelle P. Bruni, Ting-Wen Chen, Kenneth Dumack, Fernando Fernandez-Mendoza, Michele Freppaz, Beat Frey, Nathalie Fromin, Stefan Geisen, Martin Grube, Elia Guariento, Antoine Guisan, Qiao-Qiao Ji, Juan J. Jiménez, Stefanie Maier, Lucie A. Malard, Maria A. Minor, Cowan C. Mc Lean, Edward A. D. Mitchell, Thomas Peham, Roberto Pizzolotto, Andy F. S. Taylor, Philippe Vernon, Johan J. van Tol, Yunga Wu, Donghui Wu, Zhijing Xie, Bettina Weber, Paul Illmer, Julia Seeber",2023-12-23
https://www.biorxiv.org/content/10.1101/2020.08.11.245837v3#comment-6358192781,biorxivstage,1,"This preprint has now been published - please see Rowe ZW, Robins JH & Rands SA (2023). Red deer Cervus elaphus blink more in larger groups. Ecology and Evolution 13: e9908 https://doi.org/10.1002/ece...",2024-01-03T20:44:59,,Sean Rands,10.1101/2020.08.11.245837,Red deer Cervus elaphus blink more in larger groups,"Zeke W. Rowe, Joseph H. Robins, Sean A. Rands",2021-06-29
https://www.biorxiv.org/content/10.1101/2023.01.26.525751v16#comment-6358179963,biorxivstage,0,I think the links in the figure legends are broken - not working from the browser pdf.,2024-01-03T20:27:28,peytonlab,Peyton Lab,10.1101/2023.01.26.525751,Analysis of NIH K99/R00 Awards and the Career Progression of Awardees,"Nicole C Woitowich, Sarah R Hengel, Christopher Solis, Tauras P Vilgalys, Joel Babdor, Daniel J Tyrrell",2023-12-29
https://www.biorxiv.org/content/10.1101/2022.09.23.509242v1#comment-6358108205,biorxivstage,0,Published in Cell Stem Cell: https://www.sciencedirect.c...,2024-01-03T18:50:02,disqus_IJij91XW1k,Sergiy,10.1101/2022.09.23.509242,Enhancing Sox/Oct cooperativity induces higher-grade developmental reset,"Caitlin M. MacCarthy, Vikas Malik, Guangming Wu, Taras Velychko, Gal Keshet, Ralf Jauch, Vlad Cojocaru, Hans R. Schöler, Sergiy Velychko",2022-09-25
https://www.biorxiv.org/content/10.1101/2023.12.08.570889v1#comment-6358092669,biorxivstage,0,"Section D.3 of version 1 of the manuscript states that SPR binding affinity measurements on individual DNA variants are repeated four times: two duplicate measurements per experimental run, multiplied by two technical replicates of each run. In section F.3, version 1, figures 19-26 show SPR binding affinity measurements for several dozen DNA variants per antibody.  The values plotted for -log10(KD)(M) appear to represent the sample mean of each set of four SPR measurements.  These figures could be improved by also including error bars representing the sample standard deviation of each set of four measurements. Including error bars is important because the precision and accuracy of SPR experiments varies depending upon experimental context.  Although some authors report standard deviations of +/-10% or better (see, for example, Table 1 in Brown, M.E. et al., (2020) ""Assessing the binding properties of the anti-PD-1 antibody landscape using label-free biosensors"" PLoS ONE 15(3) doi: 10.1371/journal.pone.0229206), the repeatability of SPR experiments can be impaired by many experimental artefacts: baseline drift, bulk shift discontinuities, mass transport effects, non-specific binding, manufacturing batch variation of sensor chips or other consumables, fitting to an incorrect kinetic model, etc. If the measurement uncertainties are large enough, then the observations of stronger binding affinities than the reference antibodies may not be statistically significant.  Affinity values supposedly above the references could be explained away as random statistical noise around a true binding affinity which is actually left unchanged relative to the reference (presumably because the sequence mutations for those DNA variants ultimately had a neutral impact on the final shape of the folded antibody). This is a critical point, because if IgDesign does not actually produce mutant sequences with binding affinities signficantly above the reference, then it would weaken a key conclusion of the paper: in such a scenario, IgDesign would not be useful for affinity maturation.",2024-01-03T18:29:59,,anonymous,10.1101/2023.12.08.570889,In vitro validated antibody design against multiple therapeutic antigens using generative inverse folding,"Amir Shanehsazzadeh, Julian Alverio, George Kasun, Simon Levine, Jibran A. Khan, Chelsea Chung, Nicolas Diaz, Breanna K. Luton, Ysis Tarter, Cailen McCloskey, Katherine B. Bateman, Hayley Carter, Dalton Chapman, Rebecca Consbruck, Alec Jaeger, Christa Kohnert, Gaelin Kopec-Belliveau, John M. Sutton, Zheyuan Guo, Gustavo Canales, Kai Ejan, Emily Marsh, Alyssa Ruelos, Rylee Ripley, Brooke Stoddard, Rodante Caguiat, Kyra Chapman, Matthew Saunders, Jared Sharp, Douglas Ganini da Silva, Audree Feltner, Jake Ripley, Megan E. Bryant, Danni Castillo, Joshua Meier, Christian M. Stegmann, Katherine Moran, Christine Lemke, Shaheed Abdulhaqq, Lillian R. Klug, Sharrol Bachas, Absci Corporation",2023-12-09
https://www.biorxiv.org/content/10.1101/2023.05.10.540135v1#comment-6358063175,biorxivstage,0,This work is now published in Microbiology Spectrum. DOI: https://doi.org/10.1128/spe...,2024-01-03T17:52:50,,Sébastien Rigali,10.1101/2023.05.10.540135,Common scab disease: structural basis of elicitor recognition in pathogenic Streptomyces species,"Frédéric Kerff, Samuel Jourdan, Isolde M. Francis, Benoit Deflandre, Silvia Ribeiro Monteiro, Nudzejma Stulanovic, Rosemary Loria, Sébastien Rigali",2023-05-10
https://www.biorxiv.org/content/10.1101/2022.09.23.509258v1#comment-6358037426,biorxivstage,0,Now published in The CRISPR Journal: https://www.liebertpub.com/...,2024-01-03T17:20:48,disqus_sG4o2FXyvs,Francesco Iorio,10.1101/2022.09.23.509258,Benchmark data and software for assessing genome-wide CRISPR-Cas9 screening pipelines,"Raffaele Iannuzzi, Ichcha Manipur, Clare Pacini, Fiona M. Behan, Mario R. Guarracino, Mathew J. Garnett, Aurora Savino, Francesco Iorio",2022-09-25
https://www.biorxiv.org/content/10.1101/2023.12.13.571314v1#comment-6357930055,biorxivstage,1,Please see reply to the other commenter.,2024-01-03T14:57:24,hunterschone,Hunter Schone,10.1101/2023.12.13.571314,Stable Cortical Body Maps Before and After Arm Amputation,"Hunter R. Schone, Roni O. Maimon Mor, Mathew Kollamkulam, Craig Gerrand, Alexander Woollard, Norbert V. Kang, Chris I. Baker, Tamar R. Makin",2023-12-14
