comment url,comment forum,comment keywords,comment message,comment date,comment username,comment name,paper doi,paper title,paper authors,paper date
https://www.biorxiv.org/content/10.1101/2023.06.07.544100v1#comment-6448652706,biorxivstage,0,now in PubMed DOI: 10.1038/s44319-024-00140-7,2024-05-01T13:37:55,davidetrotti,Davide Trotti,10.1101/2023.06.07.544100,Glucose Hypometabolism Prompts RAN Translation and Exacerbates C9orf72-related ALS/FTD Phenotypes,"A.T. Nelson, M.E. Cicardi, S.S. Markandaiah, J. Han, N. Philp, E. Welebob, A.R. Haeusler, P. Pasinelli, G. Manfredi, H. Kawamata, D. Trotti",2023-06-07
https://www.biorxiv.org/content/10.1101/2024.03.22.586348v1#comment-6448200953,biorxivstage,0,"Fascinating paper both on the topics of cutting edge field of microbiomes and still-ongoing issues of human-caused environmental crises, specifically oil spillages. Here are a few ideas and questions I have that I think could possibly improve this paper: 1. Since this study focuses on N and P levels and hydrocarbon degradation, then the levels of N and P in the collected seawater need to be quantified. 2. I understand that it must not be under lab-ready circumstances to extract AND analyze the samples of the artic waters at the same exact location for a more accurate sampling of the microbiome 3. The levels in the three growth conditions of high, low, and ambient. It would be helpful to list all ingredients and their final concentrations for the three conditions as well. 4. Perhaps in the future, the use of transposons could also be used to track the genes that correlate with biodegradation of crude oil, and which strains/taxa of bacteria they originate. Making a isolated, pairwise and community could also help narrow it down. 5. PCR conditions for the V4 amplification should be described. 6. In the “differential abundance analysis,” were there adjustments made for different 16S copy numbers in different taxa?  Different genome sizes?  If not, this must be mentioned as a limitation.",2024-04-30T20:15:37,austinmcilhany,Austin McIlhany,10.1101/2024.03.22.586348,Novel oil-associated bacteria in Arctic seawater exposed to different nutrient biostimulation regimes,"Francisco D. Davila Aleman, María A. Bautista, Janine McCalder, Kaiden Jobin, Sean M. C. Murphy, Brent Else, Casey R.J. Hubert",2024-03-23
https://www.biorxiv.org/content/10.1101/2023.07.27.550195v4#comment-6447953950,biorxivstage,0,"Published on 26 April 2024 as: Elofsson A., Han L., Bianchi E., Wright G. J. & Jovine L. Deep learning insights into the architecture of the mammalian egg-sperm fusion synapse eLife 13:RP93131 (2024) DOI: https://doi.org/10.7554/eLi... PubMed: https://pubmed.ncbi.nlm.nih...",2024-04-30T14:51:04,lucajovine,Luca Jovine,10.1101/2023.07.27.550195,Deep learning insights into the architecture of the mammalian egg-sperm fusion synapse,"Arne Elofsson, Ling Han, Enrica Bianchi, Gavin J. Wright, Luca Jovine",2024-02-23
https://www.biorxiv.org/content/10.1101/2023.12.23.573049v1#comment-6447784711,biorxivstage,0,This article has been peer reviewed and published on https://onlinelibrary.wiley...,2024-04-30T09:45:18,,Federico Colombo,10.1101/2023.12.23.573049,2-photon laser printing to mechanically stimulate multicellular systems in 3D,"Federico Colombo, Mohammadreza Taale, Fereydoon Taheri, Maria Villiou, Teresa Debatin, Gent Dulatahu, Philipp Kollenz, Målin Schmidt, Christina Schlagheck, Joachim Wittbrodt, Christine Selhuber-Unkel",2023-12-24
https://www.biorxiv.org/content/10.1101/2022.03.26.485904v1#comment-6447498376,biorxivstage,0,Final version of this article is published at MPMI. Here is the link: https://doi.org/10.1094/MPM...,2024-04-29T21:54:07,,Yeshveer Singh,10.1101/2022.03.26.485904,Transcriptome analysis reveals robust transcriptional reprogramming during early stages of Cicer-Ascochyta interaction,"Ritu Singh, Aditi Dwivedi, Yeshveer Singh, Kamal Kumar, Aashish Ranjan, Praveen Kumar Verma",2022-03-27
https://www.biorxiv.org/content/10.1101/752576v1#comment-6447244970,biorxivstage,1,"Additional comments Hello! I am a Sam Houston State University graduate student enrolled in a microbiome course, BIOL5394. My overall impression of the manuscript is that it is excellent, and the information presented is helpful for forensic science. Abstract and Introduction The introduction is very clear and to the point. Does this study consider where the individual's death occurred, indoors or outdoors? I believe the environment in which a death occurred could alter the microbial community succession and potentially influence your given results. What ethical guidelines were followed when handling the cadavers? Methods Quality control •	Need specific PCR protocol, like # cycles, temps, polymerase, etc. https://journals.asm.org/do... •	There is no mention of the correction of the 16S copy number and variances in genome size for taxa identified ASVs. https://journals.plos.org/p... •	Was coverage of communities measured and representatively sampled equally? o	Include coverage measures such as Good’s coverage or Chao1. •	Line 115 explicitly states the protocol for USA samples. What about the samples from Finland and Italy? •	Lines 113-114 mention sections of the dissected internal organs but fail to mention the specific section. Is there a measured area region that was dissected? This could help with consistency in sampling. DNA Extraction and Sequencing •	Lines 130-131 state the Greengenes database used to assign taxonomy was last updated in May 2013. More accurate identification results would come from a more recently updated 16S gene database. Statistical analyses •	Good practice to include the complete list of packages and codes used for the analysis. Results Figure 3 •	PCoA assumes normal distribution of data. Need to show normality test or use NMDS. Figure 4 •	The taxa in this figure show excessive “unknowns.” I believe updating the database could improve this. Figure 5 •	Lines 256-259 mention the findings of ASV family are in class Bacteroidia, however after reviewing I believe the correct class is Betaproteobacteria. o	Bacteroidia, Betaproteobacteria, and Clostidia are color-coded with very similar colors. Consider making the jump to the next class a bit more distinctive. Additional comments •	The article mentions the sample size was 265, but when I add up the four category sample sizes, I get a sum of 262. Is this intentional, or a typo? •	Of the 20 Finnish cadavers, why was the liver the only organ supplied? •	Overall, it was a very interesting study!",2024-04-29T15:59:37,disqus_UL51SLzfwv,Amber Gonzalez,10.1101/752576,Manner of death and demographic effects on microbial community composition in organs of the human cadaver,"Holly Lutz, Alexandria Vangelatos, Neil Gottel, Emily Speed, Antonio Osculati, Silvia Visona, Sheree J. Finley, Sari Tuomisto, Pekka Karhunen, Jack A. Gilbert, Gulnaz T. Javan",2019-08-31
https://www.biorxiv.org/content/10.1101/2023.08.31.555744v1#comment-6447142956,biorxivstage,1,"Abstract & Introduction The abstract is good overall and structured well. It gives a clear insight into the concern at hand and summarizes the key findings to show its significance. However, the research question is not clearly stated. This is something that can be elaborated on in the introductions, but it should also be stated briefly in the abstract. I understand that there is not a lot of research done on the effects of pregnancy to the female microbiota, but it is unclear as to what the research question is. This introduction gives a good background on the issue of pregnancy altering the microbiome. Below are my comments on what could be added or further explained. 1.	Are you trying to determine which organisms are lost/recovered? 2.	Is this study for a general understanding of the effects of pregnancy on women (pre/post birth)? 3.	Are you looking at a specific family of bacteria, fungi or archea that has a meaningful change during both phases (pre- and post-maturation) to see their effects? 4.	Are the women from diverse backgrounds (race)? 5.	Was this study conducted in the same location? 6.	Include more previous studies, if any, stating what others have claimed to be the reasons behind “side effects” of pregnancy 7.	Include your own claims on what you would expect and not expect to see. Figures and Tables The table heading and description are good and easy to read. However, make sure to explain all abbreviations. Table 1. 1.	What is the difference between an t-test and a Fishers exact t-test? 2.	What does SS-days mean? 3.	Also explain why each test was used for the p-value result. Figure 3. 1.	I am not sure what these diagrams represent. 2.	3B- What is a vaginal community state type? How were they classified? It is stated that software clusters them, but what are the criteria? 3.	3A- What do the colors represent? Explain the unknown portion? General comments for figures Figures captions need to be clear, like in 1C ii) the title is “Rchress.” Is that observed ASVs?  Include clear titles for your figures as well as axis labels. References to the figures from the results section show that the figures support the findings. You can include the reasoning behind choosing these graphical analyses. Methods, Materials & Analysis 1.	In your sample and collection section, it is mentioned that the participants collected their own samples. Is there a reason for this? Why did a professional, specifically a doctor, not collect the samples? Was there a way to determine that the samples were collected and stored properly? 2.	Does the study look at women across different races? Consider this please! 3.	How was Lctobacillus classified to species level using only the V4 region? That is not possible, the full 16S sequence is required. https://www.nature.com/arti... 4.	How did your account for chimeras and PCR errors before going onto further filtering steps? 5.	Further explain your controls. It was mentioned that positive and negative controls were removed, but there is no mention of their identity. 6.	What analysis was used to determine dominant and rare taxa? This was mentioned in the paper but was not included in the methods section. 7.	This study used 16S rRNA analysis to determine species present as different body sites, when the sequencing step is conducted to determine the species what the sequencing coverage is. Is it complete? In addition, how many reads per sample? a.	This was not stated at all in the paper, and it would be good to include it in the analysis portion. Results, Discussion, Conclusion In the limitations section, it is mentioned that the samples were not collected from the same women before and after pregnancy. Wouldn’t this affect the results you have presented? It is hard to say whether your results and conclusion support the claims which were made due to this aspect of sample collection. Although your results and conclusions are significant to the study, the validity is questionable.",2024-04-29T13:34:46,oyinoluwa,Oyinoluwa,10.1101/2023.08.31.555744,The Dynamics of the Female Microbiome: Unveiling Abrupt Changes of Microbial Domains across Body Sites from Preconception to Perinatal Phase,"Charlotte J Neumann, Manuela-Raluca Pausan, Victoria Haid, Eva-Christine Weiss, Vassiliki Kolovetsiou-Kreiner, Bettina Amtmann, Petra Winkler, Alexander Mahnert, Evelyn Jantscher-Krenn, Christine Moissl-Eichinger",2023-09-01
https://www.biorxiv.org/content/10.1101/2023.04.03.535317v1#comment-6445394510,biorxivstage,0,The article is published on Frontiers of Computational Neuroscience ( https://www.frontiersin.org...,2024-04-26T21:29:38,,Kwangjun Lee,10.1101/2023.04.03.535317,Predictive coding with spiking neurons and feedforward gist signalling,"Kwangjun Lee, Shirin Dora, Jorge F. Mejias, Sander M. Bohte, Cyriel M.A. Pennartz",2023-04-03
https://www.biorxiv.org/content/10.1101/2023.10.24.563814v2#comment-6445334710,biorxivstage,0,"Now published with the title ""Cell-type-resolved mosaicism reveals clonal dynamics of the human forebrain"" ( https://www.nature.com/articles/s41586-024-07292-5) in Nature",2024-04-26T19:51:10,xiaoxuyang,Xiaoxu Yang,10.1101/2023.10.24.563814,Cell-type-resolved somatic mosaicism reveals clonal dynamics of the human forebrain,"Changuk Chung, Xiaoxu Yang, Robert F. Hevner, Katie Kennedy, Keng Ioi Vong, Yang Liu, Arzoo Patel, Rahul Nedunuri, Scott T. Barton, Chelsea Barrows, Valentina Stanley, Swapnil Mittal, Martin W. Breuss, Johannes C. M. Schlachetzki, Joseph G. Gleeson",2023-10-26
https://www.biorxiv.org/content/10.1101/2024.01.15.575807v1#comment-6445060165,biorxivstage,0,"Hi, thanks for the kind words. I'll share with you the supplementary data promptly !",2024-04-26T13:25:08,robbyconchaeloko,Robby Concha-Eloko,10.1101/2024.01.15.575807,DepoScope: accurate phage depolymerase annotation and domain delineation using large language models,"Robby Concha-Eloko, Michiel Stock, Bernard De Baets, Yves Briers, Rafael Sanjuan, Pilar Domingo-Calap, Dimitri Boeckaerts",2024-01-17
https://www.biorxiv.org/content/10.1101/2021.03.08.434344v1#comment-6444870446,biorxivstage,0,"Yes, 0.2mg/mL GO. A leading zero was not used.",2024-04-26T05:30:23,,Avinash Patel,10.1101/2021.03.08.434344,Efficient graphene oxide coating improves cryo-EM sample preparation and data collection from tilted grids,"Avinash Patel, Daniel Toso, Audrey Litvak, Eva Nogales",2021-03-08
https://www.biorxiv.org/content/10.1101/2024.03.16.585360v1#comment-6444702703,biorxivstage,1,This is an important study rapidly presenting key findings of sampling for HPAI in the Antarctic region. We have some concerns around the interpretation of the results - we beleive the diagnostic used is excellent at detecting a broad diversity of H5 viruses and is not specific to HPAI H5 and therefore it is unclear whether the authors detected HPAI H5N1 or LPAI H5Nx. A summary of our concerns has been presented here: https://www.preprints.org/m...,2024-04-25T23:14:15,michellewille,Michelle Wille,10.1101/2024.03.16.585360,Highly Pathogenic Avian Influenza A (H5N1) Suspected in penguins and shags on the Antarctic Peninsula and West Antarctic Coast,"Fabiola León, Céline Le Bohec, Eduardo J. Pizarro, Loïcka Baille, Robin Cristofari, Aymeric Houstin, Daniel P. Zitterbart, Gonzalo Barriga, Elie Poulin, Juliana A. Vianna",2024-03-18
https://www.biorxiv.org/content/10.1101/2024.04.24.590951v1#comment-6444340481,biorxivstage,0,"New address for Dr. Patrice Quintana: Université Clermont Auvergne, INSERM, U1107, NEURO-DOL, Clermont-Ferrand, France.",2024-04-25T14:29:24,Etche_homo,Heather Etchevers,10.1101/2024.04.24.590951,Braf-mutant Schwann cells divert to a repair phenotype to induce congenital demyelinating neuropathy,"Elise Marechal, Patrice Quintana, Daniel Aldea, Grégoire Mondielli, Nathalie Bernard-Marissal, Mathias Moreno, Valérie Delague, Lauren A. Weiss, Anne Barlier, Heather C. Etchevers",2024-04-25
https://www.biorxiv.org/content/10.1101/2024.04.15.589484v1#comment-6444170513,biorxivstage,0,That's interesting! Thank you for answering my question.,2024-04-25T09:17:37,shigita,shigita,10.1101/2024.04.15.589484,Chromosome-level assembly of Cucumis sativus cv. ‘Tokiwa’ as a reference genome of Japanese cucumber,"Takashi Seiko, Chiaki Muto, Koichiro Shimomura, Ryoichi Yano, Yoichi Kawazu, Mitsuhiro Sugiyama, Kenji Kato, Norihiko Tomooka, Ken Naito",2024-04-17
https://www.biorxiv.org/content/10.1101/2024.01.15.575807v1#comment-6444125661,biorxivstage,1,"Hi, it’s very interesting work! I was wondering if you could make your supplementary material available? I don’t see it posted with the preprint. Thank you",2024-04-25T07:12:08,rafalmostowy,Rafal Mostowy,10.1101/2024.01.15.575807,DepoScope: accurate phage depolymerase annotation and domain delineation using large language models,"Robby Concha-Eloko, Michiel Stock, Bernard De Baets, Yves Briers, Rafael Sanjuan, Pilar Domingo-Calap, Dimitri Boeckaerts",2024-01-17
https://www.biorxiv.org/content/10.1101/2023.10.04.560979v1#comment-6443623899,biorxivstage,1,Please link this preprint to the published paper https://rdcu.be/dFAvb Thank you!,2024-04-24T16:37:09,disqus_MBIGUYeUyy,Q Li,10.1101/2023.10.04.560979,Multimodal joint deconvolution and integrative signature selection in proteomics,"Yue Pan, Xusheng Wang, Chunyu Liu, Junmin Peng, Qian Li",2023-10-06
https://www.biorxiv.org/content/10.1101/2022.12.07.519298v2#comment-6443533993,biorxivstage,0,This manuscript has been peer reviewed and published: https://journals.plos.org/p...,2024-04-24T14:37:31,bonniethiel,Bonnie Thiel,10.1101/2022.12.07.519298,Hypo-responsiveness of human alveolar macrophages to IFN-γ is not due to attenuated STAT1 signaling,"Bonnie A Thiel, Kathleen C Lundberg, Daniela Schlatzer, Jessica Jarvela, Qing Li, Rachel Shaw, Sara E Beckloff, Mark R Chance, W Henry Boom, Richard F Silver, Gurkan Bebek",2023-01-04
https://www.biorxiv.org/content/10.1101/2021.04.28.441765v3#comment-6443333438,biorxivstage,0,This article was published in PLoS Biology: https://doi.org/10.1371/jou...,2024-04-24T07:40:24,julienydutheil,Julien Y. Dutheil,10.1101/2021.04.28.441765,Testing the adaptive walk model of gene evolution,"Ana Filipa Moutinho, Adam Eyre-Walker, Julien Y. Dutheil",2022-07-07
https://www.biorxiv.org/content/10.1101/2023.05.31.539801v1#comment-6443095333,biorxivstage,0,The peer reviewed version of this article has been published on Nature Medicine in March 2024 at the following DOI: https://doi.org/10.1038/s41...,2024-04-23T21:44:35,MattiaFMGerli,Mattia FM Gerli,10.1101/2023.05.31.539801,Single cell-guided prenatal derivation of primary epithelial organoids from the human amniotic and tracheal fluids,"Mattia Francesco Maria Gerli, Giuseppe Calà, Max Arran Beesley, Beatrice Sina, Lucinda Tullie, Francesco Panariello, Federica Michielin, Kylin Sun Yunyan, Joseph R Davidson, Francesca Maria Russo, Brendan C Jones, Dani Lee, Savvas Savvidis, Theodoros Xenakis, Ian Simcock, Anna A Straatman-Iwanowska, Robert A Hirst, Anna L David, Christopher O’Callaghan, Alessandro Olivo, Simon Eaton, Stavros P Loukogeorgakis, Davide Cacchiarelli, Jan Deprest, Vivian SW Li, Giovanni Giuseppe Giobbe, Paolo De Coppi",2023-06-01
https://www.biorxiv.org/content/10.1101/2024.04.16.589811v1#comment-6443010726,biorxivstage,0,"Thank you for responding and I look forward to your revised pre-print. The point of contention regards the use of the Mann-Whitney U test for pairwise comparisons. While true this test would be idea for this data, this test assumes independent measurements. Hubs within a single nucleus, or multiple nuclei in a biological sample,  would not be considered independent. Different embryos (with each hub data pooled) would be best to assess the biological rigor of the interactions.",2024-04-23T19:37:06,,CommunityScientist ,10.1101/2024.04.16.589811,A fine kinetic balance of interactions directs transcription factor hubs to genes,"Apratim Mukherjee, Samantha Fallacaro, Puttachai Ratchasanmuang, Joseph Zinski, Alan Boka, Kareena Shankta, Mustafa Mir",2024-04-16
https://www.biorxiv.org/content/10.1101/2024.03.04.583182v2#comment-6442898041,biorxivstage,1,"Hello, the Yadav lab has shown data on a protein structurally similar to SLK in humans called TAOK1, I have linked their paper here https://www.science.org/doi.... Do you have any comment on the similarity between these two proteins especially since this other kinase seems to have an I-bar domain as well.",2024-04-23T17:09:36,,Moira C,10.1101/2024.03.04.583182,STRIPAK controls cell-cell communication by promoting cytoneme biogenesis through the membrane-sculpting function of Slik,"Basile Rambaud, Mathieu Joseph, Feng-Ching Tsai, Camille De Jamblinne, Emmanuelle Del Guidice, Renata Sabelli, Patricia Bassereau, David R Hipfner, Sébastien Carréno",2024-04-08
https://www.biorxiv.org/content/10.1101/2024.02.23.581830v1#comment-6442700247,biorxivstage,0,"This paper highlights some valuable genetic elements and offers precise quantifications of subtle effects on fruit shape, which are attributed to a single STM autoregulatory element. While it is commendable that such effects have been observed and quantified with apparent robustness, this aspect alone does not compensate for the overall weaknesses of the study. The significance of this autoactivation in fruit metamorphosis, as discussed, is exaggerated. Techniques such as imaging quantification and single-cell analysis are utilized, yet they seem to function more as ornamental enhancements rather than providing substantial contributions to the core narrative. For instance, the imaging quantification primarily shows proliferation within the stomatal lineages but fails to delve deeper into the overall growth mechanisms influencing fruit shape. Additionally, the single-cell analysis appears to be inadequately executed in several aspects. A thorough reporting and discussion on the robustness of observations involving transgenic lines, such as GUS reporters, inducible lines, and mutants, is sorely missing. This is crucial, especially considering the minimal phenotypical effects of the cis-regulatory element under investigation. A detailed analysis is needed to ascertain whether the observed effects are indeed significant or simply artifacts stemming from genetic background noise. Lastly, the selection analysis presented in Supplementary Figure 26 is conceptually flawed and should be reconsidered. The approach of segregating sequences with and without the binding site (BS) before analysis is fundamentally problematic. Selecting species that carry the BS and then asserting high conservation within this group compared to others is tautological and compromises the scientific integrity of the findings.",2024-04-23T12:36:47,alessandropopoli,Alessandro Popoli,10.1101/2024.02.23.581830,SHOOTMERISTEMLESS autoactivation: A prerequisite for fruit metamorphosis,"Yang Dong, Zhi-Cheng Hu, Mateusz Majda, Hao-Ran Sun, Yao Zhang, Yi-Ning Ding, Quan Yuan, Tong-Bing Su, Tian-Feng Lü, Feng Gao, Gui-Xia Xu, Richard S. Smith, Lars Østergaard",2024-02-27
https://www.biorxiv.org/content/10.1101/2024.04.17.589597v1#comment-6442669563,biorxivstage,0,"On further look, the highest levels of steppe ancestry are in northwest Anatolia (Barcin_C & Ilipinar) . Even individuals from southwest Anatolia (Ispart) seem to have higher levels of stepep than those in the East. Analysis using Cernavoda is complex, and migth benefit from splitting them into different clusters. Cernavoda_high steppe might be fruitful",2024-04-23T11:40:15,disqus_qfLs8Uh7wF,Robert George,10.1101/2024.04.17.589597,The Genetic Origin of the Indo-Europeans,"Iosif Lazaridis, Nick Patterson, David Anthony, Leonid Vyazov, Romain Fournier, Harald Ringbauer, Iñigo Olalde, Alexander A. Khokhlov, Egor P. Kitov, Natalia I. Shishlina, Sorin C. Ailincăi, Danila S. Agapov, Sergey A. Agapov, Elena Batieva, Baitanayev Bauyrzhan, Zsolt Bereczki, Alexandra Buzhilova, Piya Changmai, Andrey A. Chizhevsky, Ion Ciobanu, Mihai Constantinescu, Marietta Csányi, János Dani, Peter K. Dashkovskiy, Sándor Évinger, Anatoly Faifert, Pavel N. Flegontov, Alin Frînculeasa, Mădălina N. Frînculeasa, Tamás Hajdu, Tom Higham, Paweł Jarosz, Pavol Jelínek, Valeri I. Khartanovich, Eduard N. Kirginekov, Viktória Kiss, Alexandera Kitova, Alexeiy V. Kiyashko, Jovan Koledin, Arkady Korolev, Pavel Kosintsev, Gabriella Kulcsár, Pavel Kuznetsov, Rabadan Magomedov, Mamedov Aslan Malikovich, Eszter Melis, Vyacheslav Moiseyev, Erika Molnár, Janet Monge, Octav Negrea, Nadezhda A. Nikolaeva, Mario Novak, Maria Ochir-Goryaeva, György Pálfi, Sergiu Popovici, Marina P. Rykun, Tatyana M. Savenkova, Vladimir P. Semibratov, Nikolai N. Seregin, Alena Šefčáková, Mussayeva Raikhan Serikovna, Irina Shingiray, Vladimir N. Shirokov, Angela Simalcsik, Kendra Sirak, Konstantin N. Solodovnikov, Judit Tárnoki, Alexey A. Tishkin, Viktov Trifonov, Sergey Vasilyev, Ali Akbari, Esther S. Brielle, Kim Callan, Francesca Candilio, Olivia Cheronet, Elizabeth Curtis, Olga Flegontova, Lora Iliev, Aisling Kearns, Denise Keating, Ann Marie Lawson, Matthew Mah, Adam Micco, Megan Michel, Jonas Oppenheimer, Lijun Qiu, J. Noah Workman, Fatma Zalzala, Anna Szécsényi-Nagy, Pier Francesco Palamara, Swapan Mallick, Nadin Rohland, Ron Pinhasi, David Reich",2024-04-18
https://www.biorxiv.org/content/10.1101/2023.07.19.549755v1#comment-6442628957,biorxivstage,0,"The final version of this manuscript has been published in Molecular Ecology journal: Diz, A.P., &  Skibinski, D.O.F. (2024).  Patterns of admixture and introgression in a mosaic Mytilus galloprovincialis and Mytilus edulis hybrid zone in SW England. Molecular Ecology,  33, e17233. https://doi.org/10.1111/mec...",2024-04-23T10:07:33,AngelPerezDiz,AngelPerezDiz,10.1101/2023.07.19.549755,Spatial and long-term temporal evolution of a marine mussel hybrid zone (Mytilus spp.) in SW England,"Angel P. Diz, David O. F. Skibinski",2023-07-19
