comment url,comment forum,comment keywords,comment message,comment date,comment username,comment name,paper doi,paper title,paper authors,paper date
https://www.biorxiv.org/content/10.1101/2024.05.23.595289v1#comment-6470187274,biorxivstage,0,"Hi, Interesting work for rapid separation and detection of bacteria from blood. However, the 2nd step of ''Selective cell lysis'' is used from the work which is already published and has a patent approval in progress. This original work has not been cited in this pre-print. This has to be added in the original paper before publishing. It is highly important to properly cite the original paper if their method is utilized in another work. The original paper citation details is below: Narayana Iyengar S, Dietvorst J, Ferrer-Vilanova A, Guirado G, Muñoz-Berbel X, Russom A. Toward Rapid Detection of Viable Bacteria in Whole Blood for Early Sepsis Diagnostics and Susceptibility Testing. ACS Sens. 2021 Sep 24;6(9):3357-3366. doi: 10.1021/acssensors.1c01219. Epub 2021 Aug 19. PMID: 34410700; PMCID: PMC8477386.",2024-05-30T19:17:48,sharathtippurnarayanaiyenga,Sharath Tippur Narayana Iyenga,10.1101/2024.05.23.595289,Culture-free Rapid Isolation and Detection of Bacteria from Whole Blood at Clinically Relevant Concentrations,"M. Henar Marino Miguélez, Mohammad Osaid, Jimmy Larsson, Vinodh Kandavalli, Johan Elf, Wouter van der Wijngaart",2024-05-26
https://www.biorxiv.org/content/10.1101/2024.04.26.591300v1#comment-6470107959,biorxivstage,0,Where is the supplementary material of this paper?,2024-05-30T17:30:49,disqus_hdYd67swtK,Pawan,10.1101/2024.04.26.591300,The molecular framework underlying the growth and defense tradeoff in Arabidopsis roots in response to danger signals,"Souvik Dhar, Soo Youn Kim, Heeji Shin, Jongsung Park, Ji-Young Lee",2024-04-29
https://www.biorxiv.org/content/10.1101/2024.04.26.591349v1#comment-6470083009,biorxivstage,0,"Dear Authors,  this quite interesting and great effort to bring published HiChip work in one single platform. We, Riggi lab has published couple of articles in sarcoma models which includes HiChIP profiling from relevant cell lines,  mesenchymal stem cells and specific oncogene knock-down condition. It would be nice to have those datasets also included in the Loop Catalogue. 1. Nature Communications volume 13, Article number: 2267 (2022). https://www.nature.com/arti... 2. SCIENCE ADVANCES, 31 Mar 2023, Vol 9, Issue 13, DOI: 10.1126/sciadv.abo3789 Thanks",2024-05-30T16:57:13,,sanalkumar rajendran,10.1101/2024.04.26.591349,Loop Catalog: a comprehensive HiChIP database of human and mouse samples,"Joaquin Reyna, Kyra Fetter, Romeo Ignacio, Cemil Can Ali Marandi, Nikhil Rao, Zichen Jiang, Daniela Salgado Figueroa, Sourya Bhattacharyya, Ferhat Ay",2024-04-29
https://www.biorxiv.org/content/10.1101/2024.03.08.583134v1#comment-6470078711,biorxivstage,1,"Dear authors of the article, entitled: “Molecular Mimicry as a Mechanism of Viral Immune Evasion and Autoimmunity” ( https://doi.org/10.1101/202.... Thank you for sharing this very interesting article. In this article, you stated that “Molecular mimicry explains portions of the multiple sclerosis auto-antibodyome”. I suggest that you should take the findings of Martins, et al. (2023) [1] into consideration. These authors pointed out that although the amount of antigenic sharing between hosts and both pathogenic and non-pathogenic parasites and bacteria is massive, molecular mimicry by itself is not a sufficient factor to disrupt intact self-tolerance mechanisms. In this context, in my recent paper ( https://www.aimspress.com/a... [2], I provided the missing link between molecular mimicry and the activation of autoimmune responses. I figured out that activation of the purinergic P2X7R expressed on regulatory T cells is potentially required for molecular mimicry to activate autoimmune responses. This occurs only after repeated or high-dose microbe infection and not after a single low-dose infection. I also presented a novel model of immune responses in mammals to foreign antigens, self-antigens and antigens with molecular mimicry. I hope that these comments will help to improve the quality of your paper. Kind regards, Djo Hasan References 1. Martins YC, Jurberg AD, Daniel-Ribeiro CT. Visiting Molecular Mimicry Once More: Pathogenicity, Virulence, and Autoimmunity. Microorganisms. 2023;11(6). doi: 10.3390/microorganisms11061472. 2. Hasan D. Purinergic P2X7R expressed on regulatory T cells potentially links molecular mimicry to autoimmune responses. AIMS Allergy and Immunology. 2024;8(2):80-123. doi: 10.3934/Allergy.2024006.",2024-05-30T16:51:25,djohasan,Djo Hasan,10.1101/2024.03.08.583134,Molecular Mimicry as a Mechanism of Viral Immune Evasion and Autoimmunity,"Cole Maguire, Chumeng Wang, Akshara Ramasamy, Cara Fonken, Brinkley Morse, Nathan Lopez, Dennis Wylie, Esther Melamed",2024-03-09
https://www.biorxiv.org/content/10.1101/2024.05.24.595788v1#comment-6469918597,biorxivstage,1,"Alex, we supplied literally millions of counts already, and our suppl files exceed what most journals can take, but we'd be happy to provide KrakenUniq's k-mer counts and other data on request to those who want even more data. This has been submitted to a journal, and we had to come up with a workaround because we had too much data for them to handle.",2024-05-30T13:01:03,stevensalzberg,Steven Salzberg,10.1101/2024.05.24.595788,Comprehensive analysis of microbial content in whole-genome sequencing samples from The Cancer Genome Atlas project,"Yuchen Ge, Jennifer Lu, Mahler Revsine, Daniela Puiu, Steven L. Salzberg",2024-05-29
https://www.biorxiv.org/content/10.1101/2024.05.23.595608v2#comment-6469841296,biorxivstage,0,"Again, growth on methane was achieved by reversing methanogenesis in 2016 by obtaining active Mcr for the first time in a pure culture (ref 20), so the Introduction remains misleading (line 48, 'in their natural state') and line 323 is misleading: ""...ANME-1 MCR may allow Methanosarcina to perform AOM (20 )."" We used multiple lines of evidence to demonstrate growth in 2016 and subsequent papers converted methane to lactate and even created a microbial fuel cell using methane, hence both uncited works again confirm active Mcr so it is not appropriate to write ""may allow"" growth. Should the field refer to all of your results as ""may be' valid? Moreover, in effect, the recombinant strain we produced was the way Nature created ANME, according to your work  here (by altering Mcr) so our work is relevant to your report here as validation of this study, and the Introduction in this second version is still misleading.",2024-05-30T10:18:07,Junco7777,Prof. T. K. Wood,10.1101/2024.05.23.595608,Convergence and horizontal gene transfer drive the evolution of anaerobic methanotrophy in archaea,"Philip H. Woods, Daan R. Speth, Rafael Laso-Pérez, Daniel R. Utter, S. Emil Ruff, Victoria J. Orphan",2024-05-28
https://www.biorxiv.org/content/10.1101/2024.05.09.583166v1#comment-6469820087,biorxivstage,0,Is there list of the peptides identified with the subtiligase biotin-assay availlable somewhere?,2024-05-30T09:18:41,samcalis,Sam Calis,10.1101/2024.05.09.583166,Naa10 regulates hippocampal neurite outgrowth via Btbd3 N-α-acetylation-mediated actin dynamics,"Chien-Te Chou, Ming-Lun Kang, Chen-Cheng Lee, Pang-Hung Hsu, Li-Jung Juan",2024-05-10
https://www.biorxiv.org/content/10.1101/2024.04.29.591623v1#comment-6469755343,biorxivstage,0,"We are trying to install  Nanomotif in our server. We tried all of the install methods, and the major install looks good. However, when we tried nanomotif MTase-linker install, the following error was shown. It seems that module  'snakemake'  had some issues. We then checked the 'snakemake'  install and  found we had snakemake==8.12.0. Is there any method to solve the problem for MTase-linker install? Thank you very much! ------------------- $ nanomotif MTase-linker install /home/miniconda3/envs/nanomotif/lib/python3.12/site-packages/nanomotif/mtase_linker/setup.smk Traceback (most recent call last): File ""/home/miniconda3/envs/nanomotif/bin/nanomotif"", line 10, in sys.exit(main()) ^^^^^^ File ""/home/miniconda3/envs/nanomotif/lib/python3.12/site-packages/nanomotif/ main.py"", line 513, in main mtase_linker(args) File ""/home/miniconda3/envs/nanomotif/lib/python3.12/site-packages/nanomotif/ main.py"", line 475, in mtase_linker snakemake_create_environments(args) File ""/home/miniconda3/envs/nanomotif/lib/python3.12/site-packages/nanomotif/mtase_linker/ dependencies.py"", line 24, in snakemake_create_environments status = snakemake.snakemake(snakefile, ^^^^^^^^^^^^^^^^^^^ AttributeError: module 'snakemake' has no attribute 'snakemake' -------------------",2024-05-30T05:42:05,,cong,10.1101/2024.04.29.591623,Nanomotif: Identification and Exploitation of DNA Methylation Motifs in Metagenomes using Oxford Nanopore Sequencing,"Søren Heidelbach, Sebastian Mølvang Dall, Jeppe Støtt Bøjer, Jacob Nissen, Lucas N.L. van der Maas, Mantas Sereika, Rasmus H. Kirkegaard, Sheila I. Jensen, Sabrina Just Kousgaard, Ole Thorlacius-Ussing, Katja Hose, Thomas Dyhre Nielsen, Mads Albertsen",2024-05-02
https://www.biorxiv.org/content/10.1101/2024.05.23.592075v1#comment-6469749002,biorxivstage,0,"Thanks for looking into the downstream effects of HDAC inhibitors in various cells and on several levels. It would be interesting to compare the results to recently published data on proteomics and phosphoproteomics response to a broad panel of HDAC inhibitors, such as: - Decrypting lysine deacetylase inhibitor action and protein modifications by dose-resolved proteomics, Cell Rep. 2024 - Decrypting the molecular basis of cellular drug phenotypes by dose-resolved expression proteomics, Nat Biotech. 2024 Further, the Abexinostat selectivity data in the main text lacks a reference. The statement also does not fully agree with the recently updated target selectivity landscape of HDAC inhibitors, where Abexinostat is shown to bind HDAC10 and the off-target MBLAC2 with substantially higher affinity than HDAC1: - Target deconvolution of HDAC pharmacopoeia reveals MBLAC2 as common off-target, 2022. Nat Chem Bio",2024-05-30T05:18:38,severinlechner,Severin Lechner,10.1101/2024.05.23.592075,Lineage-specific proteome remodeling of diverse lung cancer cells by targeted epigenetic inhibitors,"Chuwei Lin, Catherine Sniezek, Ross M Giglio, Rashmi Karki, Christopher McGann, Benjamin A. Garcia, Jose L McFaline-Figeroa, Devin K. Schweppe",2024-05-28
https://www.biorxiv.org/content/10.1101/2024.05.23.595430v1#comment-6469572854,biorxivstage,0,Just curious whether your analyses adjusted for variability in blood cell type composition? Thanks!,2024-05-29T22:16:44,,kdkorthauer,10.1101/2024.05.23.595430,Identification of 17 novel epigenetic biomarkers associated with anxiety disorders using differential methylation analysis followed by machine learning-based validation,"Yoonsung Kwon, Asta Blazyte, Yeonsu Jeon, Yeo Jin Kim, Kyungwhan An, Sungwon Jeon, Hyojung Ryu, Dong-Hyun Shin, Jihye Ahn, Hyojin Um, Younghui Kang, Hyebin Bak, Byoung-Chul Kim, Semin Lee, Hyung-Tae Jung, Eun-Seok Shin, Jong Bhak",2024-05-27
https://www.biorxiv.org/content/10.1101/2024.05.24.595788v1#comment-6469195902,biorxivstage,0,"KrakenUniq reports the coverage (""breadth of coverage"", the percentage of the reference genome that is covered by sequencing reads) of each reference genome that may be present in the sample. Breadth information is a key way of determining true positive from false positive hits in metagenomics: almost all false positives are characterized by low breadth of coverage, as in these cases, reads only mapped to a fraction of the reference. The authors should report coverage from KrakenUniq for their analyses; only counts are provided in the supplementary, but coverage values would be more informative for determining whether a microbial genome is present in a sample. For a brief discussion of this see: https://instrain.readthedoc... Further, the authors could then consider employing a minimum breadth cutoff to further separate true from false positives. Finally the authors could also consider comparing to approaches that incorporate breadth automatically, such as: https://github.com/bluenote... https://sourmash.readthedoc... https://instrain.readthedoc...",2024-05-29T13:09:14,acc_account,Alex Crits-Christoph,10.1101/2024.05.24.595788,Comprehensive analysis of microbial content in whole-genome sequencing samples from The Cancer Genome Atlas project,"Yuchen Ge, Jennifer Lu, Mahler Revsine, Daniela Puiu, Steven L. Salzberg",2024-05-29
https://www.biorxiv.org/content/10.1101/2024.03.22.586327v1#comment-6469193116,biorxivstage,0,very elegant demonstration,2024-05-29T13:04:29,,Fares SAYEGH,10.1101/2024.03.22.586327,Distinct roles of medial prefrontal cortex subregions in the consolidation and recall of remote spatial memories,"Eleonora Centofante, Mattia Santoboni, Elena L.J. Mombelli, Arianna Rinaldi, Andrea Mele",2024-03-27
https://www.biorxiv.org/content/10.1101/2023.11.14.567145v1#comment-6469076103,biorxivstage,0,"Manuscript has been published Chernov AS, Rodionov MV, Kazakov VA, Ivanova KA, Meshcheryakov FA, Kudriaeva AA, Gabibov AG, Telegin GB, Belogurov AA Jr. CCR5/CXCR3 antagonist TAK-779 prevents diffuse alveolar damage of the lung in the murine model of the acute respiratory distress syndrome. Front Pharmacol. 2024 Feb 21;15:1351655. doi: 10.3389/fphar.2024.1351655. PMID: 38449806; PMCID: PMC10915062.",2024-05-29T08:20:26,,Alexey Belogurov Jr.,10.1101/2023.11.14.567145,CCR5/CXCR3 antagonist TAK-779 prevents diffuse alveolar damage of the lung in murine model of the SARS-CoV-2-related acute respiratory distress syndrome,"Aleksandr S. Chernov, Maksim V. Rodionov, Vitaly A. Kazakov, Karina A. Ivanova, Fedor A. Mesheryakov, Anna A. Kudriaeva, Alexander G. Gabibov, Georgii B. Telegin, Alexey A. Belogurov",2023-11-15
https://www.biorxiv.org/content/10.1101/2023.12.01.569363v1#comment-6469048113,biorxivstage,0,"The authors show in Figures 3 - 4 and in Table 2 in silico-docking studies with an alphafold2-model of PURA as template. In this model, PUR-repeat III is shown as a monomer with an awkward-looking fold. The authors use this docking to suggest a direct interaction between PURA and GLUT1. Unfortunately, the authors seem to ignore that PUR repeats do not exist as single, monomeric repeats but require dimerization. For repeat III of Drosophila PURA, a high-resolution structure of its homodimeric domain has been reported already in 2016: https://elifesciences.org/a... PDB-ID: 5FGO For repeat III of the human PURA (as used in this study), more recently the homodimeric high-resolution domain structure has also been published: https://elifesciences.org/a... PDB-ID: 8CHW Considering these experimental structures, Figures 3-4 and Table 2 refer to unphysiological folds. As a result, conclusions drawn from these figures have to be considered as entirely wrong.",2024-05-29T06:50:45,disqus_yDLD90f9dY,theNiessingLabs,10.1101/2023.12.01.569363,PURA and GLUT1: Sweet partners for brain health,"Rocío B. Colombo, Clarisa Maxit, Diego Martinelli, Mel Anderson, Diego Masone, Lía Mayorga",2023-12-02
https://www.biorxiv.org/content/10.1101/2024.05.24.595859v1#comment-6468775528,biorxivstage,2,"Really interesting work, and I hope to see it move from preprint to publication soon! We've had similar ideas about the ACC and LC in the past, but didn't have the refined techniques available today to test these hypotheses in nearly as much detail. Gompf et al., 2010, PMID 20980612: https://www.jneurosci.org/c...",2024-05-28T20:17:09,coeruleus,coeruleus,10.1101/2024.05.24.595859,A cortical locus for modulation of arousal states,"Nithik Chintalacheruvu, Anagha Kalelkar, Jöel Boutin, Vincent Breton-Provencher, Rafiq Huda",2024-05-26
https://www.biorxiv.org/content/10.1101/2024.05.23.595608v1#comment-6468763766,biorxivstage,1,"Thank you for your comment! To clarify the intention behind the statement, that sentence should read ""...coupled to growth in either methanogens or ANME in their natural state...""",2024-05-28T19:59:05,,Philip Woods,10.1101/2024.05.23.595608,Convergence and horizontal gene transfer drive the evolution of anaerobic methanotrophy in archaea,"Philip H. Woods, Daan R. Speth, Rafael Laso-Pérez, Daniel R. Utter, S. Emil Ruff, Victoria J. Orphan",2024-05-24
https://www.biorxiv.org/content/10.1101/2024.05.15.594353v1#comment-6468275344,biorxivstage,0,"As a specialist in earthworm phylogenetics and taxonomy, I would really like to see an expanded taxon set within earthworms, including several cases where aquatic to terrestrial (and back) habitat shifts have taken place.  There are even some where earthworms have colonized marine shore habitats. My colleague Christer Erseus who works on non-earthworm clitellates could also make some intelligent suggestions for future work on lineages that have transitioned from fresh to marine water environments or vice versa, as well as aquatic / terrestrial shifts. Nevertheless, terrestrial soils are basically aquatic environments, in that earthworms and Enchytraeidae ( and the soil-dwelling polychaete Hrabiella (I think) depend on free water and water films on soil particles and their body surfaces.",2024-05-28T03:20:10,,Samuel W. James,10.1101/2024.05.15.594353,Annelid comparative genomics and the evolution of massive lineage-specific genome rearrangement in bilaterians,"Thomas D. Lewin, Isabel Jiah-Yih Liao, Yi-Jyun Luo",2024-05-18
https://www.biorxiv.org/content/10.1101/2024.05.23.595608v1#comment-6467463270,biorxivstage,0,"Line 47: this statement is false: ""Though there is not yet strong evidence that backwards carbon flow can be coupled to growth in either methanogens or ANME,.."" as ref 20 was seminal in reversing methanogenesis in a methanogen by cloning Mcr and showing growth for the first time on methane in the engineered methanogen.",2024-05-26T21:40:46,Junco7777,Prof. T. K. Wood,10.1101/2024.05.23.595608,Convergence and horizontal gene transfer drive the evolution of anaerobic methanotrophy in archaea,"Philip H. Woods, Daan R. Speth, Rafael Laso-Pérez, Daniel R. Utter, S. Emil Ruff, Victoria J. Orphan",2024-05-24
https://www.biorxiv.org/content/10.1101/2024.04.19.590266v1#comment-6467377110,biorxivstage,0,"Dear authors, Interesting paper. It is good to see that this paper largely confirms our findings published in 2006: https://doi.org/10.1016/j.n... Peter-Bram 't Hoen",2024-05-26T19:15:45,,Peter-Bram 't Hoen,10.1101/2024.04.19.590266,Late-Stage Skeletal Muscle Transcriptome in Duchenne muscular dystrophy shows a BMP4-Induced Molecular Signature,"Hanna Sothers, Xianzhen Hu, David K. Crossman, Ying Si, Matthew S. Alexander, Merry-Lynn N. McDonald, Peter H. King, Michael A. Lopez",2024-04-25
https://www.biorxiv.org/content/10.1101/2020.03.09.983320v1#comment-6466693073,biorxivstage,0,"This manuscript is now published at Hurd, P.J. Al-Swailem, A.M. Bin Dukhyil, A.A.A. Sheikh, Q.I. Al-Ghanim, A.A. Alfageih, L. Matin, M. Yueh Ting, L.u. Abdalgelel, A. Florence, J. Mohammed Al- Shemirti, Al Harbi, S. Brown, P.E. Hornby, D.P. Systemic Mutational Rescue in Escherichia Coli Elicited by a Valency Dependent, High Affinity Protein DNA Interaction. Journal of Bioinformatics and Systems Biology. 6 (2023): 97-109.",2024-05-25T17:46:48,disqus_RVBDFEW1Ou,David Hornby,10.1101/2020.03.09.983320,"Systemic mutational rescue in Escherichia coli elicited by a valency dependent, high affinity protein DNA interaction","P.J. Hurd, A. M. Al-Swailem, A.A.A. Bin Dukhyil, Q.I. Sheikh, A. A. Al-Ghanim, L. Alfageih, M. Matin, Yueh Ting Lu, A. Abdalgelel, J. Florence, Mohammed Al-Shemirti, S. Al Harbi, P.E. Brown, D.P. Hornby",2020-03-09
https://www.biorxiv.org/content/10.1101/2024.05.10.593468v2#comment-6466527744,biorxivstage,0,"Very intersting work. I would like to know the opinion of the author on the paper ""Modulation of alpha-synuclein phase separation by biomolecules"", since the authors were the first to propose the formation of biomolecular condensates of the protein mediated by spermine",2024-05-25T13:05:40,,Leando Cruz,10.1101/2024.05.10.593468,Polyamines promote disordered protein phase separation,"Matthew Percival, Christian F. Pantoja, Maria-Sol Cima-Omori, Stefan Becker, Markus Zweckstetter",2024-05-23
https://www.biorxiv.org/content/10.1101/2023.03.16.532919v4#comment-6465801228,biorxivstage,0,"This paper was peer reviewed and published (May 27, 2024) in the journal ""Viruses"" https://www.mdpi.com/1999-4...",2024-05-24T11:13:50,marceloribeirodasilvabriones,Marcelo R. S. Briones,10.1101/2023.03.16.532919,Reconstructing prehistoric viral genomes from Neanderthal sequencing data,"Renata C. Ferreira, Gustavo V. Alves, Marcello Ramon, Fernando Antoneli, Marcelo R. S. Briones",2024-05-21
https://www.biorxiv.org/content/10.1101/2023.07.26.550755v1#comment-6464912931,biorxivstage,0,This article was already peer-reviewed and published in NAR https://academic.oup.com/na...,2024-05-23T02:12:03,,Adrian,10.1101/2023.07.26.550755,New design strategies for ultra-specific CRISPR-Cas13a-based RNA-diagnostic tools with single-nucleotide mismatch sensitivity,"Adrian M. Molina Vargas, Raven Osborn, Souvik Sinha, Pablo R. Arantes, Amun Patel, Stephen Dewhurst, Giulia Palermo, Mitchell R. O’Connell",2023-07-28
https://www.biorxiv.org/content/10.1101/2023.04.21.537854v2#comment-6464604382,biorxivstage,0,A version of this paper is now published in the journal Epigenetic at the following link https://www.tandfonline.com...,2024-05-22T17:31:24,lfeig,lf,10.1101/2023.04.21.537854,Preimplantation Embryos Amplify Stress-Induced Changes in Sperm-Derived miRNA Content to Mediate Transgenerational Epigenetic Inheritance,"Alexandre Champroux, Tang Yang, David A. Dickson, Alice Meng, Anne Harrington, Lucy Liaw, Matteo Marzi, Francesco Nicassio, Thorsten M. Schlaeger, Larry A. Feig",2023-09-19
https://www.biorxiv.org/content/10.1101/2024.05.17.594778v1#comment-6464490481,biorxivstage,2,"The authors cite a paper in PLOS Biology that was first posted as a preprint paper here in bioRxiv see Johri et al. 2021. The four comments I added to the Johri preprint paper have now been updated, noting the intriguing new k-mer analysis of Roberts and Josephs (2024).",2024-05-22T15:01:07,forsdyke,Donald R. Forsdyke,10.1101/2024.05.17.594778,Previously unmeasured genetic diversity explains part of Lewontin’s paradox in a k-mer-based meta-analysis of 112 plant species,"Miles Roberts, Emily B. Josephs",2024-05-19
https://www.biorxiv.org/content/10.1101/2021.10.27.466171v2#comment-6464477867,biorxivstage,2,"The SSRN preprint mentioned previously (see four comments) has now (2024) been formally published under the same (""three historians"") title in Theory in Biosciences (143(1): 1-26). One of the three (William J. Provine) having died in 2015, I now sadly report the passing of Mark Boyer Adams (May 9th, 2024). The paper included the work of the remaining historian (myself). This built on the DNA studies of Erwin Chargaff and my k-mer and nucleic structure analyses. The formally published final version of Johri et al. is available in PLOS Biology. Their admonition to ""carefully define ... underlying uncertainties"" has resurfaced regarding ""Lewontin's paradox.""  Citing this, Roberts and Josephs have posted a new bioRxiv preprint (May 19th 2024) entitled: ""Previously unmeasured genetic diversity explains part of Lewontin’s paradox in a k-mer-based meta-analysis of 112 plant species"" (see: Roberts and Josephs 2024).",2024-05-22T14:43:59,forsdyke,Donald R. Forsdyke,10.1101/2021.10.27.466171,Recommendations for improving statistical inference in population genomics,"Parul Johri, Charles F. Aquadro, Mark Beaumont, Brian Charlesworth, Laurent Excoffier, Adam Eyre-Walker, Peter D. Keightley, Michael Lynch, Gil McVean, Bret A. Payseur, Susanne P. Pfeifer, Wolfgang Stephan, Jeffrey D. Jensen",2022-05-06
https://www.biorxiv.org/content/10.1101/2024.05.13.590697v1#comment-6464310500,biorxivstage,2,If you download it.... and read it...please comment it ! We really need your feedback ! Thank you. Grégory et al. !,2024-05-22T09:19:21,,Mouille,10.1101/2024.05.13.590697,“Galacturonic acid oxidation: a radical way to stick together”,"Cyril Grandjean, Aline Voxeur, Salem Chabout, Stéphanie Boutet, Jérôme Pelloux, Sophie Bouton, Grégory Mouille",2024-05-13
https://www.biorxiv.org/content/10.1101/2024.01.03.573994v1#comment-6464264115,biorxivstage,0,"In the methods, you write""HDF5 files with the approximations for each organism are available on FigShare at https://figshare.com/accoun...."" But the figshare link doesn't work :(",2024-05-22T06:46:04,marcrobinsonrechavi,Marc RobinsonRechavi,10.1101/2024.01.03.573994,Fast and lightweight cell atlas approximations across organs and organisms,"Ying Xu, Joanna Ahn, Fabio Zanini",2024-01-03
https://www.biorxiv.org/content/10.1101/2021.01.20.427526v1#comment-6464016105,biorxivstage,0,Our manuscript is now published and open-access! Please go to https://doi.org/10.1152/jn....,2024-05-21T20:38:40,audreybrumback,Audrey Brumback,10.1101/2021.01.20.427526,Two contrasting mediodorsal thalamic circuits target the medial prefrontal cortex,"Polina Lyuboslavsky, Alena Kizimenko, Audrey C. Brumback",2021-01-20
https://www.biorxiv.org/content/10.1101/2022.09.28.509587v1#comment-6463708474,biorxivstage,0,This work has now been published in BBA Molecular Mechanisms of Disease: https://authors.elsevier.co...,2024-05-21T13:13:17,johnhulleman,John Hulleman,10.1101/2022.09.28.509587,"Important anatomical, age-related, and species considerations regarding ocular fibulin-3 (EFEMP1) analysis","Steffi Daniel, John D. Hulleman",2022-09-28
