comment url,comment forum,comment keywords,comment message,comment date,comment username,comment name,paper doi,paper title,paper authors,paper date
https://www.biorxiv.org/content/10.1101/2024.05.29.595696v1#comment-6583077328,biorxivstage,2,"Dear Authors, Thank you for sharing this exciting work on the role of ABA and GI in recruiting CO at FT promoter to activate its transcription (and flowering). I appreciate the detailed analysis and valuable insights you've provided. I have a few questions and observations that may help clarify some aspects of the study: 1.	Higher CO in aba1-6 mutants at ZT12 In figure 2A, a slight increase in CO expression could be observed in aba1-6 mutants compared to WT plants though this expression declines at ZT16. Further, a higher CO expression is detected at ZT12 and ZT16 in SUC2::CO:CIT-aba1-6 compared with SUC2::CO:CIT (in WT background). It remains somewhat unclear as to why the lack of ABA is leading to a slight (yet) increase in CO transcription. It is noted that in 9 days old seedlings at ZT16 (figure 2B), there is a decline in CO expression yet aba1-6 mutants transformed with SUC2:CO:CIT in figure 2A have a higher CO at ZT16 than WT transformed with SUC2:CO:CIT. What could be the reason behind that. Finally, it will be valuable if authors could measure the CO-FT expression at ZT12 in 9 days old seedlings (like they did for 13 days old). 2.	Higher Pol-II occupancy at CORE in WT In figure 4B, a higher enrichment/occupancy of RNA Pol II could be detected at TSS of FT in WT compared with SUC2::HA:CO aba1-6 and SUC2::HA:CO gi100. Yet, these lines flower much earlier than WT (figure 5B). How do authors explain this discrepancy as low Pol II occupancy would lead to a lower FT (and delayed flowering). Moreover, it will be interesting if authors could quantify and compare the FT expression in WT (Col-0), WT (with either SUC2::CO:CIT or SUC2::HA:CO), aba1-6 (with either SUC2::CO:CIT or SUC2::HA:CO), and gi-100 (with either SUC2::CO:CIT or SUC2::HA:CO). For example, do authors expect FT levels to be same in aba1-6, gi-100 (transformed with SUC2::HA:CO) as they flower nearly at the same time (Figure 5B). Moreover, as SUC2::HA:CO aba1-6 gi-100 show a slight delay in flowering compared with either SUC2::HA:CO aba1-6  or SUC2::HA:CO gi-100, it will be interesting to analyse FT transcript accumulation between genotypes. Taken together, addressing these points will increase the readers understanding and make the paper more concise. 3.	 ChIP and RNA Pol II occupancy assayed at ZT12 (not ZT16) In figure 3,4, and 5 the ChIP assays and RNA Pol II occupancy was quantified at ZT12. CO transcript peaks around that time point in long day (LD) conditions but the FT peak is observed at ZT16. Previously, it has been shown that reduced FT peak at ZT16 leads to delay in flowering ( https://doi.org/10.1111/pce.13557). Authors mention CO binding is observed at ZT12 at CORE (line 329-331) but the delayed flowering phenotype is justified by FT levels so it will be interesting to check CO binding together with RNA Pol II enrichment at ZT16 and then compare both these assays (ZT 12 and ZT16). 4.	RNA Pol II Occupancy at TSS in WT vs. SUC2::HA:CO abi1-6 and SUC2::HA:CO gi-100 with Delayed Flowering in WT SUC2::HA:CO: gi-100 and SUC2::HA:CO: abi1-6 lines show a drastic decline in Pol II occupancy at TSS of FT, yet these lines flower significantly earlier than WT.  Would you consider discussing possible mechanisms by which this delay occurs, despite higher Pol II occupancy, to help clarify this interesting finding? Finally, the  SUC2::CO:CIT gi-100 lines flower nearly at same time as SUC2::CO:CIT (figure 5B). Although in supplementary figure 9, an increase in bolting time (flowering in terms of number of days) in SUC2::CO:CIT gi-100 lines could be seen. A few additional details or a discussion of possible mechanisms might help contextualize this observation. Thank you again for sharing this preprint. I hope these comments are helpful and supportive of your ongoing work. Please feel free to reach out if you'd like further clarification on any of my points. Thanks Saqlain",2024-11-01T16:14:55,haidersaqlain,"Haider, Saqlain",10.1101/2024.05.29.595696,Abscisic acid and GIGANTEA signalling converge to regulate the recruitment of CONSTANS to the FT promoter and activate floral transition,"Alice Robustelli Test, Giorgio Perrella, Sara Colanero, Beatrice Landoni, Aldo Sutti, Paolo Korwin Krukowski, Elisa Vellutini, Giulia Castorina, Massimo Galbiati, Damiano Martignago, Eirini Kaiserli, Chiara Tonelli, Lucio Conti",2024-05-31
https://www.biorxiv.org/content/10.1101/2024.10.30.621061v1#comment-6582986500,biorxivstage,0,Hello. May I respectfully recommend a few relevant references for the discussion of SAR11 recombination and speciation? Natural variation in SAR11 marine bacterioplankton genomes inferred from metagenomic data https://biologydirect.biomedcentral.com/articles/10.1186/1745-6150-2-27 High intraspecific recombination rate in a native population of Candidatus Pelagibacter ubique (SAR11) https://enviromicro-journals.onlinelibrary.wiley.com/doi/abs/10.1111/j.1462-2920.2007.01361.x The Evolutionary Success of the Marine Bacterium SAR11 Analyzed through a Metagenomic Perspective https://journals.asm.org/do... A comparison of homologous recombination rates in bacteria and archaea https://academic.oup.com/ismej/article/3/2/199/7588207?login=false,2024-11-01T14:02:04,,Cameron Thrash,10.1101/2024.10.30.621061,Promiscuous and unbiased recombination underlies the sequence-discrete species of the SAR11 lineage in the deep ocean,"Jianshu Zhao, Maria Pachiadaki, Roth E. Conrad, Janet K. Hatt, Laura A. Bristow, Luis M. Rodriguez-R, Ramon Rossello-Mora, Frank J. Stewart, Konstantinos T. Konstantinidis",2024-10-30
https://www.biorxiv.org/content/10.1101/2023.09.14.557729v1#comment-6582952499,biorxivstage,0,"Hello, this paper has now been published in Nat Struct Mol Bio. https://doi.org/10.1038/s41594-024-01405-4 Thank you!",2024-11-01T13:06:13,maxim_greenberg,Maxim Greenberg,10.1101/2023.09.14.557729,DNA methylation shapes the Polycomb landscape during the exit from naïve pluripotency,"Julien Richard Albert, Teresa Urli, Ana Monteagudo-Sánchez, Anna Le Breton, Amina Sultanova, Angélique David, Mathieu Schulz, Maxim V.C. Greenberg",2023-09-14
https://www.biorxiv.org/content/10.1101/2023.11.16.567349v1#comment-6582951327,biorxivstage,0,"Hello, This paper has now been published in Nucleic Acids Research: https://doi.org/10.1093/nar/gkae724 Thank you!",2024-11-01T13:04:11,maxim_greenberg,Maxim Greenberg,10.1101/2023.11.16.567349,The embryonic DNA methylation program modulates the cis-regulatory landscape via CTCF antagonism,"Ana Monteagudo-Sánchez, Julien Richard Albert, Margherita Scarpa, Daan Noordermeer, Maxim V.C. Greenberg",2023-11-16
https://www.biorxiv.org/content/10.1101/2024.05.15.593193v1#comment-6582859084,biorxivstage,1,"Dear Authors, Thank you for sharing your impressive work in the form of a preprint. I have a question regarding one aspect of the study that I found a bit confusing. Could you clarify why it was necessary to decontaminate the samples from mouse cells? If two samples were excluded from downstream analysis due to high mouse cell content (over 65%), could you please provide information on the mouse cell content in the remaining samples? Additionally, I am curious about how this type of contamination could have occurred. Best regards, David Zihala",2024-11-01T09:15:08,davidihala,David Žihala,10.1101/2024.05.15.593193,A single-cell atlas characterizes dysregulation of the bone marrow immune microenvironment associated with outcomes in multiple myeloma,"William C. Pilcher, Lijun Yao, Edgar Gonzalez-Kozlova, Yered Pita-Juarez, Dimitra Karagkouni, Chaitanya R. Acharya, Marina E Michaud, Mark Hamilton, Shivani Nanda, Yizhe Song, Kazuhito Sato, Julia T. Wang, Sarthak Satpathy, Yuling Ma, Jessica Schulman, Darwin D’Souza, Reyka G. Jayasinghe, Giulia Cheloni, Mojtaba Bakhtiari, Nick Pabustan, Kai Nie, Jennifer A. Foltz, Isabella Saldarriaga, Rania Alaaeldin, Eva Lepisto, Rachel Chen, Mark A. Fiala, Beena E Thomas, April Cook, Junia Vieira Dos Santos, I-ling Chiang, Igor Figueiredo, Julie Fortier, Michael Slade, Stephen T. Oh, Michael P. Rettig, Emilie Anderson, Ying Li, Surendra Dasari, Michael A Strausbauch, Vernadette A Simon, Immune Atlas Consortium, Adeeb H Rahman, Zhihong Chen, Alessandro Lagana, John F. DiPersio, Jacalyn Rosenblatt, Seunghee Kim-Schulze, Madhav V Dhodapkar, Sagar Lonial, Shaji Kumar, Swati S Bhasin, Taxiarchis Kourelis, Ravi Vij, David Avigan, Hearn J Cho, George Mulligan, Li Ding, Sacha Gnjatic, Ioannis S Vlachos, Manoj Bhasin",2024-05-17
https://www.biorxiv.org/content/10.1101/2023.07.07.547920v1#comment-6582782783,biorxivstage,0,peer-reviewed and published: https://dx.doi.org/10.1038/s41564-024-01716-8,2024-11-01T04:07:38,,Christoph Hagen,10.1101/2023.07.07.547920,NECing goes: flexibility of the herpesvirus nuclear egress complex,"Vojtěch Pražák, Yuliia Mironova, Daven Vasishtan, Christoph Hagen, Ulrike Laugks, Yannick Jensen, Saskia Sanders, John M. Heumann, Jens B. Bosse, Barbara Klupp, Thomas C. Mettenleiter, Michael Grange, Kay Grünewald",2023-07-07
https://www.biorxiv.org/content/10.1101/2024.02.29.582673v1#comment-6582671213,biorxivstage,0,"This has now been published here: Lin HP, Petersen JD, Gilsrud AJ, Madruga A, D'Silva TM, Huang X, Shammas MK, Randolph NP, Johnson KR, Li Y, Jones DR, Pacold ME, Narendra DP. DELE1 maintains muscle proteostasis to promote growth and survival in mitochondrial myopathy. EMBO J. 2024 Oct 8. doi: 10.1038/s44318-024-00242-x. Epub ahead of print. PMID: 39379554.",2024-10-31T23:46:29,dereknarendra,Derek Narendra,10.1101/2024.02.29.582673,"DELE1 promotes translation-associated homeostasis, growth, and survival in mitochondrial myopathy","Hsin-Pin Lin, Jennifer D. Petersen, Alexandra J. Gilsrud, Angelo Madruga, Theresa M. D’Silva, Xiaoping Huang, Mario K. Shammas, Nicholas P. Randolph, Yan Li, Drew R. Jones, Michael E. Pacold, Derek P. Narendra",2024-02-29
https://www.biorxiv.org/content/10.1101/2024.10.28.620557v1#comment-6582658862,biorxivstage,0,"Thank you for your interest in this paper and for sharing your thoughts. My perspective is as follows: The examples of programmed aging you provided, such as the death of octopuses after laying eggs, are indeed programmed, as we also mentioned in this paper. In fact, we do not deny the widespread existence of programmed aging. What we aim to illustrate is the diversity of aging mechanisms. This diversity inevitably leads to the reality that some species experience completely programmed aging, while in others, aging is triggered by a systemic collapse induced by accumulated damage, and in yet others, it may be activated by assessing the extent of damage and environmental conditions. In the latter two cases, non-programmed aging could result from an initial adaptation to deficiencies in damage repair mechanisms. Alternatively, it could arise from the evolutionary loss of programmed mechanisms found in species with programmed aging, as the diversity in aging programs implies the possibility for such mechanisms to both emerge and be lost in the course of evolution. In cases of damage-induced aging, the continuous occurrence of damage, along with species-specific levels of repair and adaptations to repair deficiencies, can also produce aging processes with programmed characteristics. However, viewing this type of aging solely as a fully programmed process would clearly hinder our understanding of aging mechanisms across different species.",2024-10-31T23:21:31,disqus_HDwK8oiOzj,Li Chen,10.1101/2024.10.28.620557,"Cross-Species Analysis Reveals No Universal Programmed Aging Mechanism: Insights from Single-Cell Transcriptomics in Zebrafish, Fruit Fly, and Nematode","Yunhui Niu, Dongzhi Wu, Sen Zhang, Hong Zheng, Xing Wu, Jiansong Chen, Yunze Zhang, Tao Zhang, Wenhui He, Li Chen",2024-10-29
https://www.biorxiv.org/content/10.1101/2024.09.16.613342v4#comment-6582464852,biorxivstage,1,See detailed comments here https://prereview.org/reviews/14019384,2024-10-31T18:13:20,aviflamholz,Avi Flamholz,10.1101/2024.09.16.613342,Deep learning-based predictions of gene perturbation effects do not yet outperform simple linear methods,"Constantin Ahlmann-Eltze, Wolfgang Huber, Simon Anders",2024-10-28
https://www.biorxiv.org/content/10.1101/2024.10.28.620557v1#comment-6582360575,biorxivstage,0,"The comparison you have made supports the conclusion ""that aging is not governed by a conserved universal program"" but not the specific alternative you propose, ""adaptations to damage and environmental conditions."" I suggest that it may be that the ecological need for managing length of life is universal, but that it is implemented differently in different species. Salmon destroy their bodies with glucocorticoids; elephants fail to grow a 7th set of teeth and can't chew their food; mice get cancer; rats get heart disease -- but the underlying adaptive motivations might be universal. The best evidence for this is the role of insulin signaling, which accelerates aging across the animal kingdom.",2024-10-31T15:54:51,joshmitteldorf,Josh Mitteldorf,10.1101/2024.10.28.620557,"Cross-Species Analysis Reveals No Universal Programmed Aging Mechanism: Insights from Single-Cell Transcriptomics in Zebrafish, Fruit Fly, and Nematode","Yunhui Niu, Dongzhi Wu, Sen Zhang, Hong Zheng, Xing Wu, Jiansong Chen, Yunze Zhang, Tao Zhang, Wenhui He, Li Chen",2024-10-29
https://www.biorxiv.org/content/10.1101/2022.10.21.513299v2#comment-6582349915,biorxivstage,1,"In your methods you state that you purchased C57BL/J mice from the four vendors. These mice are only available from Jackson Lab. The other mice you purchased are C57BL/6N substrains that specific to the vendor. NTac, NCrl, and NHsd. The biggest factor you need to address is the B6J have a mutation in the Nnt (nicotinamide nucleotide transhydrogenase) gene that dramatically influences metabolism. You should address this in your interpretation of bacterial community shifts. There is a good review of these differences that Jax has published on their web site and in various publications. https://www.genengnews.com/sponsored/heres-what-you-need-to-know-about-the-c57bl-6-substrains/",2024-10-31T15:40:16,jamesamoslandgraf,James Amos-Landgraf,10.1101/2022.10.21.513299,Spatiotemporal dynamics during niche remodeling by super-colonizing microbiota in the mammalian gut,"Guillaume Urtecho, Thomas Moody, Yiming Huang, Ravi U. Sheth, Miles Richardson, Hélène C. Descamps, Andrew Kaufman, Opeyemi Lekan, Florencia Velez-Cortes, Yiming Qu, Lucas Cohen, Deirdre Ricaurte, Travis E. Gibson, Georg K. Gerber, Christoph A. Thaiss, Harris H. Wang",2024-06-17
https://www.biorxiv.org/content/10.1101/2024.09.16.613289v1#comment-6582312310,biorxivstage,0,"This study holds considerable promise, but its findings are significantly undermined by the notable delay in developmental stages observed in embryos injected with CRISPRi/a + sgRNAs, as evident in Figures 1-3. For instance, the embryo injected with CRISPRi + tyr sgRNAs marked with 48 hpf in Figure 1B, appears to be developmentally equivalent to a 30 hpf wild-type embryo, which exhibits substantially fewer pigment cells than embryos at 48 hpf. This discrepancy raises concerns about the direct impact of the CRISPRi/a + sgRNAs injection, whether or not the delay development was caused by an unintended consequence. I strongly recommend that the authors reexamine their results and conduct a comparative analysis of CRISPRi/a + sgRNAs-injected and control embryos at equivalent conventional developmental stages, as described by Kimmel et al (1995, PMID: 8589427). This crucial consideration will not only enhance the study's rigor but also provide valuable insights to the zebrafish research community.",2024-10-31T14:51:48,haytcb,YC Han,10.1101/2024.09.16.613289,Optimized CRISPR inhibition and activation opens key avenues for systematic biological exploration in zebrafish,"Nelson B. Barrientos, Elyse A. Shoppell, Rachel J. Boyd, Valeria C. Culotta, Andrew S. McCallion",2024-09-19
https://www.biorxiv.org/content/10.1101/2024.10.25.620249v1#comment-6582304450,biorxivstage,0,"It’s been known for decades that Blue Jay kents and IBWO kents differ spectrographically… duhhh. And a LOT of other sounds may mimic IBWO kents to the human ear as well (though the paper explores but one single avian species)… all being spectrographically different.  This paper adds little to the known literature, except to try to reach further conclusions (actually redundant, re-stated conclusions in previous work) from unsubstantiated assumptions. I’d be amazed if one can find 2 or 3 (or even one) PhD. level scientists in the entire country who will defend the methods and exaggerated conclusions put forth here.",2024-10-31T14:41:16,disqus_WoskI0gNB3,CT,10.1101/2024.10.25.620249,Ivory-billed Woodpecker and Blue Jay kent comparisons at spectrogram level reveal differences,John D Williams,2024-10-25
https://www.biorxiv.org/content/10.1101/2024.06.26.600856v1#comment-6581861224,biorxivstage,0,The paper is now available at https://link.springer.com/article/10.1007/s42770-024-01512-w,2024-10-30T21:32:37,,Vanesa Amarelle,10.1101/2024.06.26.600856,Identification of novel broad host-range promoter sequences functional in diverse Pseudomonadota by a promoter-trap approach,"Diego M. Roldán, Vanesa Amarelle",2024-06-27
https://www.biorxiv.org/content/10.1101/2024.05.08.593127v1#comment-6581714840,biorxivstage,0,"This article has now been published in Microbial Genomics, under doi: https://doi.org/10.1099/mgen.0.001297",2024-10-30T18:03:54,,Verónica Kovacec,10.1101/2024.05.08.593127,Revisiting typing systems for group B Streptococcus (GBS) prophages: an application in prophage detection and classification in GBS isolates from Argentina,"Verónica Kovacec, Sabrina Di Gregorio, Mario Pajón, Chiara Crestani, Tomás Poklepovich, Josefina Campos, Uzma Basit Khan, Stephen D. Bentley, Dorota Jamrozy, Marta Mollerach, Laura Bonofiglio",2024-05-10
https://www.biorxiv.org/content/10.1101/2024.08.06.606813v2#comment-6581644487,biorxivstage,0,(Update from the corresponding author) Published online at: https://doi.org/10.1021/acs.jproteome.4c00667,2024-10-30T16:28:38,disqus_MpyEq3E4IG,Julian C,10.1101/2024.08.06.606813,Variability of 7K and 11K SomaScan plasma proteomics assays,"Julián Candia, Giovanna Fantoni, Francheska Delgado-Peraza, Nader Shehadeh, Toshiko Tanaka, Ruin Moaddel, Keenan A. Walker, Luigi Ferrucci",2024-09-25
https://www.biorxiv.org/content/10.1101/2024.07.23.604321v1#comment-6581542824,biorxivstage,1,"Dear authors, as part of a group activity in our lab we discussed your very interesting paper with the goal to review it. The below review is the result of this exercise and therefor reflects the thoughts and concerns of several people. We hope this helps you with your way forward to publish the paper in a good journal. Review: The manuscript by De Tito et al. reports a hitherto unknown role for ATG9 in recruitment of PI4K2A to damaged lysosomes to control the levels of PI(4)P, lysosomal membrane contact site formation with the ER, and lipid transfer from ER to damaged lysosomes. They report that this mechanism is controlled by ARFIP2, which shuttles between the Golgi where it anchors ATG9 and lysosomes, and by the AP-3 complex, which mediates retrieval of ATG9 from lysosomes. Finally, the authors show a role for their proposed mechanism in lysosome damage induced by Salmonella infection. The manuscript deals with the timely topic of lysosomal damage repair and PI4K2A was recently emerging as a key player in this process. Mechanisms for PI4K2A recruitment to the sites of damaged lysosomes were so far elusive. Although the manuscript is certainly of interest for the field, the presented evidence on which the claims and the proposed model are based on seem not always substantial enough and further work is required. Major concerns •	Novelty and generalization: Although the findings suggest new functions for ATG9A and ARFIP2, they overlap significantly with previous work on autophagic and lysosomal repair pathways. The novelty of these findings, in comparison to earlier research, could be emphasized more clearly. •	The claim that ARFIP2 ""modulates lipid transfer for lysosomal repair"" could benefit from additional direct evidence linking lipid transfer to lysosomal recovery and ARFIP2's specific role in this process. There is only one in vitro experiment directly showing lipid transfer modulation by ARFIP2 (Fig. 5K). The authors should use the ARFIP2 W99A mutant in this experiment to test whether lipid transfer modulation is specific and according to their model. •	A central claim of the manuscript is a role for ARFIP2 in the repair of damaged lysosomes. The gold standard assay in the field is recovery of lysotracker fluorescence after LLOME-induced damage as shown in Fig. 2G. The way the experiment is presented does not instill confidence. The effects are relatively modest, it is unclear how the statistics were done, the representative images in the supplement only remotely resemble lysotracker stainings, how a reliable lysosome number from these images could be extracted is unclear, it is not shown whether and how much the cells express GFP-ARFIP2, the time points of the images do not match the relevant time points in the quantification, and the lysosome number in the different samples before LLOME treatment is not factored in. •	The major lysosome repair assay in the manuscript is Galectin staining. This is a rather indirect assay as compared to the lysotracker recovery assay as it shows the damage rather than the repair. Could there be repaired lysosomes that still are positive for Galectin? Is the total Galectin expression level the same in the cell lines and conditions used?  Furthermore, spot quantification for lysosomal damage markers like LGALS3 (Figure 2f) does not account for cell size or density, potentially leading to misinterpretation of the data. The authors further need to show lysotracker recovery in ATG9 loss of function to substantiate their claims. •	The authors show that ARFIP2 and ATG9 affect PI4K2A localization in cells. The “delivery” of PI4K2A to lysosomes, however, which is a central claim in this manuscript, is insufficiently demonstrated. Same is true for the “retrieval” of ATG9: The authors claim that AP-3 and ARFIP2 are important for the retrieval of ATG9A vesicles. Even though they show effects of these proteins on ATG9A presence at the lysosomes, they never manage to show that retrieval really is impaired. I am not fully sure if it is possible to make videos that convincingly show this. Either they should try that, or they should not hammer so hard on the word retrieval when they never show it specifically. •	The dynamic interactions of the relevant components need to be better demonstrated and characterized. E.g. interactions ATG9-PI4K2A interaction needs to be proven and characterized better (e.g. by co-IP, immunogold or similar techniques). Otherwise the role of ATG9 is much secondary, and should be a ARFIP2-mainly focused paper. The experiments in figure 4H and 4G seem ideally suited for this purpose but the authors fail to show the relevant components in the same blot. •	The increased formation of membrane contact sites is insufficiently demonstrated. The authors need to use electron microscopy, super resolution microscopy, SPLICS or other appropriate techniques to make this claim •	The way of quantifying protein localization to lysosomes (intensity lysosomes/total) seems heavily dependent on the lysosome coverage of the cells. In conditions where to my impression the overall number of lysosomes also changes, I would like to see a negative control that demonstrates that the enhanced lysosome localization is not just by chance, since there are more lysosomes. This applies for instance to Figure 4E+F and 5A+B. •	I am not satisfied with the data analysis they presented. The authors should indicate the statistical test for each piece of data they analysed including an explanation, why did they chose particular test. For instance, in fig. 2g they compare the amount of puncta or lysosomes (it is not clear as well) in the cell in a pairwise manner. It would be more appropriate to implement a statistical test that can compare the curves fitted with the data points or a test which can compare each time point individually, i.e. Kaplan-Meier plot. Minor comments •	The zooms generally miss scalebars •	Which part of the picture the zoom is from is often not indicated •	Many of the images are hard to interpret because of low contrast, I would recommend to put their individual channels in grey •	Fig3f. requires a better representative image and although there is a line indicated there is no line plot •	Fig. 1c: show quantification for pS6K •	Fig. 2b: data points are the same as figure 1b •	Fig. 3: Live-imaging of ATG9A with AP-3D1 is needed",2024-10-30T14:15:51,disqus_USVOnz2Dvr,Anonymous,10.1101/2024.07.23.604321,ATG9A and ARFIP2 cooperate to regulate PI4P levels for lysosomal repair,"Stefano De Tito, Eugenia Almacellas, Daniel Dai Yu, Wenxin Zhang, Emily Millard, Javier H. Hervás, Enrica Pellegrino, Ioanna Panagi, Ditte Fodge, Theresa L.M Thurston, Maximiliano Gutierrez, Sharon A. Tooze",2024-07-24
