comment url,comment forum,comment keywords,comment message,comment date,comment username,comment name,paper doi,paper title,paper authors,paper date
https://www.biorxiv.org/content/10.1101/2022.08.15.503964v1#comment-6589982679,biorxivstage,2,"Dear bioRxiv team, this preprint has been published in PNAS now. https://www.pnas.org/doi/abs/10.1073/pnas.2301366120 It will be great to link this preprint to the final publication. Thanks. Yi Shen (First and corresponding author)",2024-11-10T23:56:25,disqus_vyFlWdsWyD,Yi Shen,10.1101/2022.08.15.503964,Solid/liquid coexistence during aging of FUS condensates,"Yi Shen, Anqi Chen, Wenyun Wang, Yinan Shen, Francesco Simone Ruggeri, Stefano Aime, Zizhao Wang, Seema Qamar, Jorge R. Espinosa, Adiran Garaizar, Peter St George-Hyslop, Rosana Collepardo-Guevara, David A. Weitz, Daniele Vigolo, Tuomas P. J. Knowles",2022-08-15
https://www.biorxiv.org/content/10.1101/2023.11.15.566305v1#comment-6589801487,biorxivstage,0,"Hi! DataSAIL seems to be working well for me -- at least on protein structures using the built-in FoldSeek-based clustering. Regarding the paper: I believe there is something amiss with the coloring in Figure 2. In the lower sub-panel for the identity-based 1D cold split, shouldn't the rows be colored instead of the columns? Right now you are showing the same protein-identity-based split as in the upper sub-panel, and I believe you meant to show sub-optimal partitioning w.r.t. the ""ligands"" / chemical scaffolds.",2024-11-10T18:38:49,michelebonus,Michele Bonus,10.1101/2023.11.15.566305,DataSAIL: Data Splitting Against Information Leakage,"Roman Joeres, David B. Blumenthal, Olga V. Kalinina",2023-11-17
https://www.biorxiv.org/content/10.1101/2024.09.23.614540v1#comment-6586728340,biorxivstage,0,"I recommend to read the paper by Alnouri et al. https://pubmed.ncbi.nlm.nih.gov/39365815/ and this one: https://pubmed.ncbi.nlm.nih.gov/35125345/. From the experimental data, it is rather unlikely that there is a functional high affinity binding site for LXA4 and RvD1 at FPR2 and that the SPM ligands are functional at the mentioned GPCRs",2024-11-06T13:37:11,dietersteinhilber,Dieter Steinhilber,10.1101/2024.09.23.614540,"Structural basis for the access and binding of resolvin D1 (RvD1) to formyl peptide receptor 2 (FPR2/ALX), a class A GPCR","Brian Mun, Peter Obi, Christopher T. Szlenk, Senthil Natesan",2024-09-25
https://www.biorxiv.org/content/10.1101/2024.11.01.618995v1#comment-6586571010,biorxivstage,0,"Very interesting work. I was curious about the surface tension being applied. For semi-isotropic pressure coupling, the tension is automatically set to zero, and does not need to be set explicitly. Why is this being done? We previously demonstrated that even ATP could bind to lipid membranes.  10.1021/acs.langmuir.9b01240. So does UMP (shown by both scattering, fluorescence and simulations ( https://doi.org/10.1039/C9S.... One caveat is that the charge on these nucleotide phosphates are most likely overestimated (see for example https://doi.org/10.1021/acs.jpcb.2c06077 and https://doi.org/10.1016/j.xcrp.2021.100343. One way to address this is the rescale charges on the P and O atoms, as well as ions. However, a more systematic force field approach may be needed in the future. Pavel Jungwirth is working on this. https://www.developmentaid.org/organizations/awards/view/470320/doing-charges-right-modelling-ioncontrolled-biological-processes-with-the-correct-toolbox-q-scaling",2024-11-06T08:57:18,himanshukhandelia,himanshukhandelia,10.1101/2024.11.01.618995,All-atom simulations elucidate the molecular mechanism underlying RNA-membrane interactions,"Salvatore Di Marco, Jana Aupič, Giovanni Bussi, Alessandra Magistrato",2024-11-01
https://www.biorxiv.org/content/10.1101/2024.10.28.620632v1#comment-6586306372,biorxivstage,0,"The results of this paper are not credible. Based on the gel result, we can see that only introns are removed by oligo dT purification, lots of precursor and nicked RNA still in the products. Obviously, there will be a decrease in dsRNA compared with RNA kit purification which    removed nothing from the crude circRNA products. When it comes to in vitro expression test, I am surprised to see even the expression of RNA kit circRNA is better than HPLC purified circRNA.We have also tested and compared RP-HPLC purified circRNA (circEGFP and circFLuc from GenScript) before, they got much higher expression than RNA kit purified circRNA or RNase R treatment crude circRNA. As the purity of circRNAs is very important for their expression (which can reduce their immunogenicity) based on previous reports, the in vitro or in vivo data in this paper are not convincing.",2024-11-06T01:23:49,disqus_41Eitj2OYf,sun zhen,10.1101/2024.10.28.620632,A complete approach for circRNA therapeutics from purification to lyophilized delivery using novel ionizable lipids,"Esther Broset, Verónica Lampaya, Ana Larraga, Víctor Navarro, Alexandre López, Diego de Miguel, Álvaro Peña, Juan Martínez-Oliván, Diego Casabona",2024-10-28
https://www.biorxiv.org/content/10.1101/2024.10.31.621407v1#comment-6585932148,biorxivstage,0,I am also interested in looking at the supplementary data & figures. Is there any possibility of getting access to the TFBM meme format data for specific TF families? Thank you for the very nice & impactful work presented in the manuscript!,2024-11-05T17:06:50,johnefowlerjr,John E Fowler Jr,10.1101/2024.10.31.621407,Many transcription factor families have evolutionarily conserved binding motifs in plants,"Sanja Zenker, Donat Wulf, Anja Meierhenrich, Prisca Viehöver, Sarah Becker, Marion Eisenhut, Ralf Stracke, Bernd Weisshaar, Andrea Bräutigam",2024-11-03
https://www.biorxiv.org/content/10.1101/2021.10.01.462782v1#comment-6585785027,biorxivstage,0,The article has been published please link the archive to the published manuscript. https://doi.org/10.1093/plphys/kiab529,2024-11-05T13:53:35,,Damien Garcia,10.1101/2021.10.01.462782,A NYN domain protein directly interacts with DCP1 and is required for phyllotactic pattern in Arabidopsis,"Marlene Schiaffini, Clara Chicois, Aude Pouclet, Tiphaine Chartier, Elodie Ubrig, Anthony Gobert, Hélène Zuber, Jérôme Mutterer, Johana Chicher, Lauriane Kuhn, Philippe Hammann, Dominique Gagliardi, Damien Garcia",2021-10-03
https://www.biorxiv.org/content/10.1101/2024.01.31.578142v1#comment-6585781909,biorxivstage,1,The article has been published could you link it to the publication: https://doi.org/10.1093/plcell/koae175,2024-11-05T13:49:01,,Damien Garcia,10.1101/2024.01.31.578142,A multi-transcriptomics approach reveals the coordinated action of the endoribonuclease DNE1 and the decapping machinery in orchestrating mRNA decay,"Aude Pouclet, David Pflieger, Rémy Merret, Marie-Christine Carpentier, Marlene Schiaffini, Hélène Zuber, Dominique Gagliardi, Damien Garcia",2024-02-01
https://www.biorxiv.org/content/10.1101/2024.02.10.579778v3#comment-6585702869,biorxivstage,0,The paper has been published as below Proc Natl Acad Sci U S A. 2024 Nov 5;121(45):e2408345121. doi: 10.1073/pnas.2408345121. Epub 2024 Oct 30. Characterization of RNA editing and gene therapy with a compact CRISPR-Cas13 in the retina,2024-11-05T11:17:02,gueisheungliu,Guei-Sheung Liu,10.1101/2024.02.10.579778,Characterisation of RNA editing and gene therapy with a compact CRISPR-Cas13 in the retina,"Satheesh Kumar, Yi-Wen Hsiao, Vickie H Y Wong, Deborah Aubin, Jiang-Hui Wang, Leszek Lisowski, Elizabeth P Rakoczy, Fan Li, Luis Alarcon-Martinez, Anai Gonzalez-Cordero, Bang V Bui, Guei-Sheung Liu",2024-04-26
https://www.biorxiv.org/content/10.1101/2024.11.01.621620v1#comment-6585650885,biorxivstage,2,"We greatly appreciate your constructive feedback and the recognition of Professor Imachi's significant contributions, which we have acknowledged in our manuscript. We fully agree that, ideally, certain wet lab experiments might have strengthened our findings to provide additional insights. However, there was no funding for our ongoing effort. If adequate funding were to be available, we would have pursued a certain set of experiments that we thought would add value to our work. This limitation is transparently discussed in our manuscript, and we consider our current data a valuable ""stepping stone"" for additional work in this exciting area of research. Looking ahead, we are well-positioned to undertake follow-up experiments, contingent upon the availability of appropriate funding and other resources such as access to the strains. However, we do recognize the challenges involved in maintaining and rearing such specialized organisms in the laboratory setting. For example, replicating their native hydrothermal vent conditions and performing wet lab operations under those constraints condition pose additional significant technical and logistical hurdles. These unique challenges underscore the complexity and significance of our research. With support, we would eagerly and carefully advance this aspect of our research in the future. Regarding your comment on sleep and circadian cycles in this organism, the identified sleep orthologs underscore that their functional characteristics diverge from those in human sleep processes. From the circadian clock perspectives, organisms whose circadian clocks have periodicities that correspond with those of their cyclic surroundings have survival advantage than those whose periodicities do not. If the development of circadian clocks was driven by circadian resonance, then animals with ~24h periodicity should be more fit in a 24-hour environment than in any other periodic or aperiodic time scale. Alternatively, the persistence of functional clocks and photoentrainment mechanisms implies that circadian clocks provide some ""intrinsic adaptive advantage"" to organisms in the absence of cyclical environments, where there is no apparent need to synchronize behavioral and metabolic processes with the geophysical cycles ( https://doi.org/10.1186/1740-3391-3-7). The inherent benefit of clock mechanisms, there, is most likely derived from their ability to help coordinate the organisms' numerous internal metabolic functions. In extreme habitats like hydrothermal vents, in the absence of photic cues, organisms likely rely on alternative timing mechanisms, such as temperature or chemical gradients, adapted to their unique environmental niche. In organisms such as Lokiarchaeota, the absence of circadian regulation due to the extreme hydrothermal environment may have driven the evolution of alternative timing mechanisms. Without light cycles, these organisms likely rely on other environmental cues, such as temperature fluctuations or chemical gradients, to regulate physiological processes. This adaptation might provide them with flexible metabolic and behavioural responses suited to their habitat. This suggests that evolutionary forces and selective environmental pressures unique to hydrothermal vents shaped a different evolutionary pathway for metabolic, and chemosynthetic mechanisms for survival than light-regulated, temporal mechanisms seen in surface-dwelling and terrestrial species. It's possible that daily and seasonal variations during evolution further honed the organisms for survival.",2024-11-05T08:41:43,seithikurippurpandiperumal,Seithikurippu R Pandi-Perumal,10.1101/2024.11.01.621620,Unraveling the Mysteries of Sleep: Exploring Phylogenomic Sleep Signals in the Recently Characterized Archaeal Phylum Lokiarchaeota near Loki’s Castle,"Seithikurippu R Pandi-Perumal, Konda Mani Saravanan, Sayan Paul, David Warren Spence, Saravana Babu Chidambaram",2024-11-03
https://www.biorxiv.org/content/10.1101/2024.10.15.618329v1#comment-6585409856,biorxivstage,1,"Hello! My journal club recently read your paper, and we were very impressed by how thorough your experiments were. We also appreciated how much converging evidence you included for elucidating the role of the ADGRG1 gene in Alzheimer’s disease pathology. Here are some comments I wanted to provide as possible room for improvement. Starting in Figure 1 but present in the whole paper— is there a reason why female mice were not included in your inducible knockout line P2ry12? Without female mice included from this genotype, it seems hard to make conclusions about the data that also extend to females. In Figure 3, I was a bit confused why you used unpaired two-tailed t-tests to analyze this data. The data doesn’t appear to be normally distributed (specifically in figures 3b and 3d), and t-tests assume the data is normally distributed. Additionally, it was unclear whether you accounted for technical replicates in dendrites from the same animal. I would recommend a nested ANOVA be performed to better analyze this data set because it could account for dependency in your dendrite measurements. In Figure 4, it was difficult to interpret the results of the Morris water maze given that ANOVAs do not perfectly analyze percentages. It would be helpful if, in this section, the data was analyzed by a chi-square test or another statistical test that can more accurately depict frequency differences. As another suggestion, it may be more easily understandable if the target quadrant were compared to each of the three non-target quadrants separately as opposed to all at once. It currently seems as though the non-target quadrant results are skewed by the 3:1 ratio of non-target to target quadrant presence. Overall, I really enjoyed reading this paper. I can tell a lot of time was put into this research and I wish you the best with your work moving forward!",2024-11-04T22:58:21,makennathomas,Makenna Thomas,10.1101/2024.10.15.618329,Adhesion G protein-coupled receptor ADGRG1 promotes protective microglial response in Alzheimer’s disease,"Beika Zhu, Andi Wangzhou, Diankun Yu, Tao Li, Rachael Schmidt, Stacy L. De Florencio, Lauren Chao, Yonatan Perez, Lea T. Grinberg, Salvatore Spina, Richard M. Ransohoff, Arnold R. Kriegstein, William W. Seeley, Tomasz Nowakowski, Xianhua Piao",2024-10-18
https://www.biorxiv.org/content/10.1101/2024.10.19.619233v2#comment-6585400113,biorxivstage,0,"typo in Sequence section?    ""pester and mortal""    Did you mean pestle and mortar?",2024-11-04T22:41:00,,Michael,10.1101/2024.10.19.619233,"Mosaic of Somatic Mutations in Earth’s Oldest Living Organism, Pando","Rozenn M. Pineau, Karen E. Mock, Jesse Morris, Vachel Kraklow, Andrea Brunelle, Aurore Pageot, William C. Ratcliff, Zachariah Gompert",2024-10-24
https://www.biorxiv.org/content/10.1101/2023.02.27.529887v1#comment-6585391954,biorxivstage,0,Link to published manuscript https://www.cell.com/iscience/fulltext/S2589-0042(24)02240-5,2024-11-04T22:27:12,,Brian Meckes,10.1101/2023.02.27.529887,Nanoparticle targeting of mechanically modulated glycocalyx,"Afia Ibnat Kohon, Kun Man, Katelyn Mathis, Jade Webb, Yong Yang, Brian Meckes",2023-02-27
https://www.biorxiv.org/content/10.1101/2024.07.25.604800v2#comment-6585074531,biorxivstage,0,"With my group we have been using this to 3D segment confocal timeseries, it works great! Recently, it has been updated and also works again via a Google colab form, so very low user threshold.",2024-11-04T15:18:52,kaspervangelderen,Kasper van Gelderen,10.1101/2024.07.25.604800,"Biom3d, a modular framework to host and develop 3D segmentation methods","Guillaume Mougeot, Sami Safarbati, Hervé Alégot, Pierre Pouchin, Nadine Field, Sébastien Almagro, Émilie Pery, Aline Probst, Christophe Tatout, David E. Evans, Katja Graumann, Frédéric Chausse, Sophie Desset",2024-10-28
https://www.biorxiv.org/content/10.1101/2024.10.31.621407v1#comment-6585069732,biorxivstage,0,"Dear authors, is there a way to access the supplementary data? I am looking for all the Marchantia TFs tried to express as HALO fusions. Thanks in advance!",2024-11-04T15:12:37,disqus_mDdEABVDEU,Jorge Hernández,10.1101/2024.10.31.621407,Many transcription factor families have evolutionarily conserved binding motifs in plants,"Sanja Zenker, Donat Wulf, Anja Meierhenrich, Prisca Viehöver, Sarah Becker, Marion Eisenhut, Ralf Stracke, Bernd Weisshaar, Andrea Bräutigam",2024-11-03
https://www.biorxiv.org/content/10.1101/2021.07.17.452800v3#comment-6584958897,biorxivstage,0,This paper was published in GigaScience in July 2023. https://doi.org/10.1093/gigascience/giad044,2024-11-04T12:14:36,disqus_coScdfUZlT,Chris Hunter,10.1101/2021.07.17.452800,Causal inference using deep-learning variable selection identifies and incorporates direct and indirect causalities in complex biological systems,"Zhenjiang Fan, Kate F. Kernan, Panayiotis V. Benos, Scott W. Canna, Joseph A. Carcillo, Soyeon Kim, Hyun Jung Park",2021-11-01
https://www.biorxiv.org/content/10.1101/2024.11.01.621620v1#comment-6584954709,biorxivstage,0,Sleep in bacteria and archae is usually associated with a state of dormancy or persistency. But that is different from the circadian cycle of sleep. It is therefore surprising to see orthologs of human sleep genes in the deep sea vent dweller like this archae. Unless they had a different function there. It would be interesting to mutate some of the identified genes and see the effect in the cultures grown in the lab of Hiroyuki Imachi,2024-11-04T12:05:23,skrishnaswamy,S. Krishnaswamy,10.1101/2024.11.01.621620,Unraveling the Mysteries of Sleep: Exploring Phylogenomic Sleep Signals in the Recently Characterized Archaeal Phylum Lokiarchaeota near Loki’s Castle,"Seithikurippu R Pandi-Perumal, Konda Mani Saravanan, Sayan Paul, David Warren Spence, Saravana Babu Chidambaram",2024-11-03
https://www.biorxiv.org/content/10.1101/2024.09.09.612013v1#comment-6584917891,biorxivstage,1,There are open reviews of this preprint Qeios: https://www.qeios.com/read/WPW9WN https://www.qeios.com/read/EHRP24 https://www.qeios.com/read/MGCKD5,2024-11-04T10:28:20,disqus_HvSNo2fH7v,MRR,10.1101/2024.09.09.612013,Evolution of venom production in marine predatory snails,"Giulia Zancolli, Maria Vittoria Modica, Nicolas Puillandre, Yuri Kantor, Agneesh Barua, Giulia Campli, Marc Robinson-Rechavi",2024-09-10
https://www.biorxiv.org/content/10.1101/2024.11.01.621455v1#comment-6584356067,biorxivstage,0,"I think you mean ""potency"". ""Pluripotency"" refers to the ability to make all cell types in the embryo. Trophectoderm stem cells cannot do that.",2024-11-03T15:04:26,bhendrich,B. Hendrich,10.1101/2024.11.01.621455,Maternal Med12 safeguards trophoblast pluripotency and placental development,"Michelle M. Halstead, Jyoti Goad, Amina Khan, Rutuja Deshmukh, Aleksandar Rajkovic",2024-11-01
https://www.biorxiv.org/content/10.1101/2023.06.01.543231v1#comment-6583111458,biorxivstage,1,"Dear Alexis, We processed the data using CryoSPARC, and we spoke with Ali Punjani (the author of this widely used software) in person during a conference about the over-estimation of resolution in this particular study. Ali basically said that over-estimation sometimes happens. Indeed, we agree that the map provides the best judgement of resolution; however we did not have a way to report a different numerical estimate of the resolution. In our case, the map, despite its limited resolution, was able to provide us with the biological insights reported in the paper. First, we used the AlphaFold predicted structure of the monomer, which is also highly similar to the structure of that in the bundled NINJ1 filament (Nature 2023), to assist model building. All we needed to do was to bend the helices as guided by the positions of the glycine residues in these two transmembrane (TM) helices. Second, the bend in the TM helices is obvious in the map even at a resolution lower than reported by the program. Third, we performed extensive mutagenesis on NINJ1 to validate its structure. Fourth, the observation that the concave side of NINJ1 oligomers is hydrophobic (suggesting a nanodisc model), rather than hydrophilic (suggesting a hydrophilic pore model), is clear even in the 2D classes, which strongly supports our nanodisc or cookie cutter model for NINJ1 to induce membrane loss as the mechanism of NINJ1-mediated membrane rupture. Fifth, our membrane staining that showed NINJ1 structures released to the culture supernatant as containing membranes inside further supports our conclusion of the nanodisc model. Finally, a couple of currently lab members (not authors in the paper) have tried to reprocess the data: single particle processing did not yield anything interpretable, and helical processing (as performed in the paper) without symmetry gave a lower resolution volume with less artifacts if more cycles of heterogeneous refinement were used to remove more junk particles. Nonetheless the map showed the same general features as the published map with strikingly bend at both TM helices. We have deposited all primary data (EMPIAR-12325), so please feel free to reprocess the data to see if you could obtain a better map – it would be great! I waited to respond to your comment because despite we deposited the primary data months ago, they are still not approved or released. We are trying our best to get them released by EMPIAR - if you want to use the data, please also reach out to EMPIAR or we can send you the data. Please refer to our published paper for more details, and feel free to write to me directly if you have more questions (wu@crystal.harvard.edu). Hao Wu, on behalf of Liron David (former Wu lab member and first author of the paper), and others",2024-11-01T17:03:55,disqus_j2ibLybN63,Hao Wu,10.1101/2023.06.01.543231,NINJ1 mediates plasma membrane rupture through formation of nanodisc-like rings,"Liron David, Jazlyn P Borges, L. Robert Hollingsworth, Allen Volchuk, Isabelle Jansen, Benjamin E Steinberg, Hao Wu",2023-06-05
