comment url,comment forum,comment keywords,comment message,comment date,comment username,comment name,paper doi,paper title,paper authors,paper date
https://www.biorxiv.org/content/10.1101/2023.03.14.532528v1#comment-6186685337,biorxivstage,1,"Summary. Since the emergence of SARS-CoV-2, the causative agent of the disease COVID 19, various vaccines and treatments have been developed that have been shown to be effective in reducing risk and severity of clinical outcome. Some limitations of current COVID19 treatment options is the inconsistency of their therapeutic efficacy across strains as well as possible unknown off-targets. To address these concerns, the use of llama-derived nanobodies (Nbs) has become of interest. Nbs have been shown to have a high affinity and specificity for targets, therefore decreasing risk of effects coming from possible unknown off-targets. In this study, llama-derived Nbs capable of neutralizing several SARS-CoV-2 strains were identified. In the In vivo model, Nbs were indicated to effectively induce protection in several lung tissues including the brain. These findings suggest Nbs as possible therapeutic agents for protection and treatment of SARS-CoV-2. Positive feedback. This paper looked at the exciting research area of advancement upon monoclonal antibodies through Nbs. The researchers did a thorough job of explaining the genomic structure of SARS-CoV-2 as well as the interaction occurring during the initial attachment phase (lines 58-66). An exciting advancement of this study was the identification and characterization of SARS-CoV-2 neutralizing Nbs. These findings were made more impressive with their consistency found among varying strains as well as in both in vivo and in vitro design models. The use of several strains is important as individual strains can have very different effects and outcomes. The figures were nice with the appropriate size (not too small) being used for readability and the layout was not overwhelming with not too many figures being placed together (example Figure 3). I also liked the color scheme used as even though similar ones were used, varying shades were used to clearly contrast such as magenta as opposed to a lighter pink (example Figure 3 D). I especially liked Figure 10 for its ability to encapsulate a lot of information. The authors did a good job of explaining their research to those outside the field. The methods used to derive antibodies was well explained and will be helpful for those who would like to expand upon the research using this methodology. Major Concerns Different sources of S protein were used for different immunization points. Example the first two immunizations used were from one source and then third immunization is obtained using S protein from a different source. Moreover, they mention that the S protein parts encoded on expressed vectors are slightly different, how? (page 5 line 110) Authors should provide more detail into plasmids used, a table of recombinant proteins being used would be good. This is important as it probably represents the variability observed in Figure 2 when showing S protein binding of nanobodies. For Figure 6, an interpretation was not given in the discussion. It was mentioned that the Delta variant was not able to be neutralized by any of the non-RBD binders (pg. 11 line 279), but the researchers did not revisit this to share any hypothesis as to why this might be happening. In Figure 2, it might be good to see raw data and a correlation coefficient (R^2) to see how good the fit is. It might be helpful to include Km in the figure instead of just in a table. Proper positive controls in protection experiments are missing. For example, protection against various SARS-CoV2 variants with new nAbs could be compared with existing tools, e.g., mAbs used in clinic and/or current antivirals. Otherwise, it is hard to know whether the new tools are better than existing ones. Minor concerns The researchers briefly discussed ways in which their current work could be expanded upon (line 443-446), but did not mention the current limitations of their study. Discussing limitations is helpful for the reader in better understanding the results from the paper. What are some other routes that nanobodies can be introduced into the mouse besides intranasally? Will this route translate to humans? Full organs were used for calculating SARS-CoV2 titers. Was different localization of the virus seen in different areas of the brain? It might be interesting to discuss if they saw any differences and suggest this as a future direction. https://www.nature.com/arti... Figure 2 A-data points for NB-45 are difficult to see. Perhaps the data and the fits could be divided into classes instead of all in one figure. Figure 4 B, it is not made clear why the concentrations of nanobodies being used was chosen. Example NB-39 and Nb-43 is at 10 ug while the other nanobodies are administered at 20ug. It would be good to be more clear about the criteria for mice to be euthanized (such as the amount of weight needed to be lost). Some of the weight loss seems to be small (according to our standards) for euthanization. Figure 4 legend could include the amount of mice (assume 5), but this is not clear. In Figure 2, the variability of Nbs binding to Spike protein is very different (2A.) This is in contrast to the little variability noted between Nbs binding to RBD (2B.) This finding is not discussed in the paper. This may not need to be expanded upon, but I was curious why 4 days post-challenge was chosen to harvest tissues to evaluate the effect of nanobodies on virus titers (line 716 pg.28). It would be good to compare this time point to other time points. Do you have samples from surviving mice that you could look back at? In Figure 5, are the statistical values noted in Figure 4 also supposed to apply to Figure 5? Also, the significant difference between treatment groups in the same tissues with different letters is noted in figure legend 5, but it is somewhat confusing what is meant. More clarification in the figure legend would be helpful. The discussion portion did not reference all figures that were discussed. For example, the Biliverdin competition assay was mentioned, but not properly referenced (page 15, line 378). Animals only have clinical signs and cannot have symptoms as is described in (line 716). A clear distinction should be made between symptoms and clinical signs. https://jamanetwork.com/jou.... Figure 5, you could add a figure for each tissue and connect data points by mouse for each nanobody. This will help to see if specific mice have a consistency in nanobodies across tissue types. Figure 9, orientation of protein is flipped frequently (Figure 9A). Some papers may require the structure be kept the same throughout the figure. S1D, a caption stating what genes or products are being amplified (like a schematic) would be helpful. S3, states that length of antibodies ~133 nucleotides. Why did they amplify 700 nucleotides? It should be 400 nucleotides only. In SF. 5, maybe determine a better way to present Western blot data and revisit to describe why there are dots and not strong bands. Could WB be quantified using something like densitometry?",2023-05-16T23:37:19,,MICR 603,10.1101/2023.03.14.532528,"Nanobodies against SARS-CoV-2 reduced virus load in the brain of challenged mice and neutralized Wuhan, Delta and Omicron Variants","María Florencia Pavan, Marina Bok, Rafael Betanzos San Juan, Juan Pablo Malito, Gisela Ariana Marcoppido, Diego Rafael Franco, Daniela Ayelen Militello, Juan Manuel Schammas, Sara Bari, Argentinian AntiCovid Consortium, William B. Stone, Krisangel López, Danielle L. Porier, John Muller, Albert J. Auguste, Lijuan Yuan, Andrés Wigdorovitz, Viviana Parreño, Lorena Itatí Ibañez",2023-03-14
https://www.biorxiv.org/content/10.1101/2023.02.01.526705v1#comment-6186420750,biorxivstage,2,"Thank you for reading and providing a review of our preprint! I think that open discourse is an important part of the scientific enterprise. I have provided responses to your major points below: We are unsure what new information the plots in Figures 1G and 1H provide relative to Figures 1E and 1F. It makes sense that the 2DTM SNR values plateau in the thicker lamella, as there is a larger region of undisturbed particles. However, because the 2DTM SNR is also included in Figures 1E and 1F in an untransformed and more intuitive coordinate frame, we are unsure what new interpretations come out of Figures 1G and 1H, and why this coordinate frame is necessary. Fair enough, we have had opposite comments from different people so ultimately decided to leave it in. We are trying to make what we see as clear as possible and lead into the following figures which show the data in the coordinate frame in G and H. Although Figure 3 shows that damage from FIB milling is distinct from typical radiation damage in cryoEM, the statement “This is consistent with a model in which the FIB-damaged targets have effectively lost a fraction of their structure, compared to undamaged targets, possibly due to displacement of a subset of atoms by colliding ions” currently relies solely on the use of 2DTM SNR as a measure. This could be more strongly supported by solving structures or 2D classes of LSUs from varying depths in the lamella to observe the damage. Solving these structures from the datasets and low pass filtering them to different spatial frequencies (as done in Figure 3) would be helpful to see if there are consistent changes at the molecular level that could explain the propagation of radiation damage as a result of displacement of atoms due to colliding Ga+3 ions. We thought about doing this. The trouble is that by averaging we lose the single molecule read out making it a bulk measurement which may obscure differences. This would look like a lower resolution reconstruction from particles at the edge, but we would not know whether this was because of preferential loss of high spatial frequencies or from less overall signal across all spatial frequencies. I agree that alternate methods for comparison are needed. I am open to suggestions of alternate single molecule readouts! Could we use changes in signal from a fluorophore? Figure 2A illustrates how variable 2DTM SNR values can be. Outlining potential workflows for experimental validation of this ribosome dataset and other datasets would be helpful for those wishing to benchmark cryo-FIB milling damage on their own particular system of interest. We agree, the boxplots don’t perfectly show the density of the data. This is why we performed Gaussian fits and reported the fit statistics to capture the distribution of the data. If there is insufficient data or it is skewed for some reason, the Gaussian fits will be poor. We encourage others to use this approach In the discussion section, the practical recommendation that particles more than 30 nm deep can be used for subtomogram averaging seems at odds with the earlier observation that damage can be seen up to 60 nm deep from each lamella surface. The reason why we say this is because there is a balance between total number of particles and the quality of the particles. Since the loss of information seems to be relatively evenly distributed across different spatial frequencies, and the number of particles in situ is often limiting, including these particles can contribute information to the reconstruction, we’ll just need more of them to get the same amount of signal. Excluding all damaged particles would only be an ideal strategy if there are enough undamaged particles to go to high resolution. The 2DTM approach and the estimation of radiation damage relies on the reduction in correlation between the ideal, undamaged template and SNR. Can there by any other reasons for a reduction in this correlation other than FIB milling and/or electron exposure? e.g. stacking of multiple particles in Z-direction in case of higher ice thicknesses leading to reduced detectability. This is something that we thought a lot about. Stacking multiple particles in Z does affect the detectability but it affects all particles, not just those on the edge. We also considered implantation of Ga+ ions causing distortions to the e beam, but that would not explain the relatively invariant signal loss across different spatial frequencies. The effect that we saw is consistent with the expected effect from a series of collisions causing local deviations in atomic positions, which is consistent with what has been described in the materials science literature, so this is what we said. Of course it is always possible that there are alternatives that we have not considered! Investigating the mechanism in detail will require further work, this is only the beginning. The fact that the damage makes it impossible to pick entire particles suggests that the scale of radiation damage due to Gallium ions makes the entire particle explode. Are there any instances in which you see differential damage meaning that only a part of the particle is damaged and the rest is intact? I would expect this since different parts of particle are exposed at different points along Y axis. Otherwise, it can be concluded that the damage is always of “whole” particles but there is no conclusion clearly stating this. This could be worth exploring. It would be very difficult to look at the signal from parts of the molecule in single particles. We are still limited by the low dose regime just like in single particle cryo-EM. The lack of detection does not necessarily mean the particle is completely destroyed. This goes to the difficulty in detecting particles with 2DTM. We use a 2DTM SNR threshold to identify significant detections and avoid false positives. Lack of detection in this case does not mean that the particle is completely destroyed, only that it is below the threshold where we can effectively make a call relative to noise. Closer to the surface the particles have a higher chance of being exposed to multiple rounds of collision cascades. Figure 3F: it is well established that at low scattering angles, the electron scattering factors of negatively charged atoms can be negative. Was this considered when calculating the SNR from phosphorous atoms in the phosphodiester bond? This would have been something to consider for the negatively charged oxygens in the phosphate. We only considered the phosphorous atoms in this case. I hope this answers your questions! Always happy to discuss more online or offline. This paper aims to set out a way of thinking about and approaching the question of FIB damage. I agree that it is an important area and there is much more work to be done to understand the mechanism in more detail! Cheers, Bronwyn",2023-05-16T17:22:53,bronwynaylalucas,Bronwyn Ayla Lucas,10.1101/2023.02.01.526705,Quantification of gallium cryo-FIB milling damage in biological lamella,"Bronwyn A. Lucas, Nikolaus Grigorieff",2023-02-03
https://www.biorxiv.org/content/10.1101/2023.01.18.524560v1#comment-6186242832,biorxivstage,1,"Dear Benedikt, Thank you for taking the time to read our work and for providing such insightful comments. We sincerely appreciate your engagement with our research and the valuable perspective you have shared. 1.	As for the first point raised, indeed, our method cannot be extended to models that include random slopes. In the new version of the manuscript, this is explicitly stated and presented as a limitation. ""Nevertheless, despite not being exhaustive, we believe that having the ability to model crossed random intercepts is a better solution compared to ignoring the variability of items."" Regarding the permutation scheme, we apologize if it was not very clear, but we now explicitly state that the permutation was performed within subjects and items. 2.	We assumed that PermFull could be considered as the gold standard, as we have no reason to doubt it. In fact, the cluster-based correction operates on the statistics, which should not depend on the specific statistical method used to generate them (it is a correction for multiple comparisons, not an NHST method). However, since there is no existing literature on this, we evaluated the performance of PermFull, which we present in the supplementary materials of the new manuscript. PermFull showed a power of .821 (that is, better than other methods to correct for multiple comparisons: uncorrected: .875; Bonferroni: .370; FDR: .486), a precision of .868 (uncorrected: .735; Bonferroni: 1; FDR: .984), a false positive rate (FPR) of .017 (uncorrected: .044; Bonferroni: 0; FDR: .001), and a Matthews correlation coefficient (MCC) of .823 (uncorrected: .772; Bonferroni: .583; FDR: .667). 3.	Even considering an estimated time of 2 ms per Linear Mixed-Effects Model (LMM) computation, even with a relatively simple LMM model, the analysis of a standard dataset (64 channels x 500 time points) with 2000 permutations would require approximately 1.5 days. This number of permutations is considered the minimum recommendation to obtain reliable estimates of alpha. Additionally, it is worth mentioning that Julia is not commonly utilized for EEG data analysis, especially when compared to more widely used tools such as Matlab. We would like to thank you once again for your constructive comments, which we believe have allowed us to improve the manuscript. Sincerely, Antonino",2023-05-16T13:33:42,antonino_visalli,Antonino Visalli,10.1101/2023.01.18.524560,lmeEEG: Mass linear mixed-effects modeling of EEG data with crossed random effects,"Antonino Visalli, Maria Montefinese, Giada Viviani, Livio Finos, Antonino Vallesi, Ettore Ambrosini",2023-01-20
https://www.biorxiv.org/content/10.1101/2020.12.12.422516v1#comment-6186217669,biorxivstage,0,Not is is still in the process. And probably will never be accepted.,2023-05-16T12:56:38,disqus_C7jI9xZJpv,pierre,10.1101/2020.12.12.422516,SARS-CoV-2 RNA reverse-transcribed and integrated into the human genome,"Liguo Zhang, Alexsia Richards, Andrew Khalil, Emile Wogram, Haiting Ma, Richard A. Young, Rudolf Jaenisch",2020-12-13
https://www.biorxiv.org/content/10.1101/2020.12.12.422516v1#comment-6186217151,biorxivstage,0,"DNA transcription take place with the transcriptase related to the RNA. There is NO transcriptase associated to any MRNA. Furthermore, as MRNA cannot enter the cell nucleus, transcription of MRNA cannot ""take place""",2023-05-16T12:55:52,disqus_C7jI9xZJpv,pierre,10.1101/2020.12.12.422516,SARS-CoV-2 RNA reverse-transcribed and integrated into the human genome,"Liguo Zhang, Alexsia Richards, Andrew Khalil, Emile Wogram, Haiting Ma, Richard A. Young, Rudolf Jaenisch",2020-12-13
https://www.biorxiv.org/content/10.1101/2020.12.12.422516v1#comment-6186215513,biorxivstage,0,It has been explained so many time why this cannot be true.,2023-05-16T12:53:21,disqus_C7jI9xZJpv,pierre,10.1101/2020.12.12.422516,SARS-CoV-2 RNA reverse-transcribed and integrated into the human genome,"Liguo Zhang, Alexsia Richards, Andrew Khalil, Emile Wogram, Haiting Ma, Richard A. Young, Rudolf Jaenisch",2020-12-13
https://www.biorxiv.org/content/10.1101/2020.12.12.422516v1#comment-6186214835,biorxivstage,0,"It has been explained so many time that there is not ONE retro-transcriptase, but one for each RNA, and none for MRNA. Furthermore, the MRNAs cannot enter the cell nucleus, thus cannot interact with the human genome. In conclusion, this paper is false, and need not to be followed.",2023-05-16T12:52:12,disqus_C7jI9xZJpv,pierre,10.1101/2020.12.12.422516,SARS-CoV-2 RNA reverse-transcribed and integrated into the human genome,"Liguo Zhang, Alexsia Richards, Andrew Khalil, Emile Wogram, Haiting Ma, Richard A. Young, Rudolf Jaenisch",2020-12-13
https://www.biorxiv.org/content/10.1101/2021.07.28.453724v2#comment-6186112719,biorxivstage,1,"Dear Scott We greatly appreciate your valuable comments. We have responded to each comment below. COMMENT 1 Firstly, I would like to congratulate the authors on their study. I really love the inventiveness of the experimental set up! The results are really unexpected. The finding that phosphate starvation proceeds ABA mediated drought responses is interesting on a mechanistic basis and will likely have direct implications for crop management practices. The field-to-lab experimental pipeline looks really effective and I look forward to more people taking up this approach. RESPONSE 1 Firstly, we would like to apologize for the very late reply. Thank you so much for your interest in our research and your positive evaluation. Our data presented here showed that PSR response occurs earlier than ABA response under mild drought. We used to study drought stress in artificially controlled environments, but we have always been interested in what happens in the actual field, at the molecular level. We had heard a lot about the lab-to-field concept, but we would like to take our research from the field to the lab. The first and corresponding authors have actually interviewed farmers about drought conditions around the world, collaborated with drought researchers around the world, and traveled to drought research sites to see the realities. In listening to such voices in the field, we have been warming up our thoughts about what we should do as plant molecular biologists for a long time. Each year we conduct field trials of mild drought induction by ridges in soybean in the same way as in the paper, and we hope to find many new and important mechanisms in many more years of data. We would appreciate your continued advice, comments, and guidance. COMMENT 2 I do have a couple of points that I believe the authors could discuss in more depth. In their ridge trials, the geometry of the soil may play a role. Phosphate starvation induces a lot of lateral roots close to the soil surface, to maximise phosphate capture. In the ridge set-up, lateral roots are restricted to only a single plane. Is it possible that this contributes to the PSR in ridge-grown plants? It is also possible that increased rooting depth under mild-drought treatment also reduces phosphate uptake. If the authors see a reduction in PSR gene expression after re-watering ridge plants, this may help to rule out geometric explanations. It should be noted that the pot experiments do already indicate this to some extent. RESPONSE 2 Thank you for your interesting comments. Since the beginning of the ridge system, we have always carefully examined the possibility of unintended effects, such as changes in root morphology, caused by mild drought in the ridge system. In this light, we showed that irrigation compensates for the growth reduction caused by ridges (Fig. 2) , suggesting that various factors, such as slight changes in root shape due to ridges, are not substantially affected. As you also mentioned, we also used pot tests to substantiate our conclusions, as it is sometimes difficult to perform detailed molecular physiological analyses using only ridges. We therefore have analyzed Pi and ABA levels and PSR gene expression after re-hydration from pot tests with different plant species and soil types and have obtained results that can rule out geometric explanations, which we will update soon. COMMENT3 I am also not so sure about the authors’ conclusion on why PSR is induced at mild drought but suppressed under severe drought “Under severe drought conditions, given the circumstantial evidence, our observations would support the notion that PSR induction is suppressed by a relative increase in Pi concentration due to a decrease in leaf water content (Fig. 4).” I would argue an alternative, more straight forward hypothesis, that plants simply prioritise drought stress over this level of phosphate starvation when drought is severe. Would the authors expect to see a recovery of the PSR if Pi levels dropped even lower? RESPONSE 3 Thank you for pointing this out. We have also analyzed Pi and ABA levels and PSR and ABA-responsive gene expressions in response to changes in soil moisture content to demonstrate whether this hypothesis is true and will update the data soon. Research on the link between PSR and mild drought is just getting started, so future in-depth studies may provide data to support your hypothesis. COMMENT 4 Once again, thanks to the authors for their very through-provoking study! I look forward to hearing from you, Scott RESPONSE 4 We greatly appreciate your great interest and appreciation of our work. Yasu",2023-05-16T09:26:53,yasunarifujita,Yasunari Fujita,10.1101/2021.07.28.453724,Phosphate starvation response precedes abscisic acid response in response to mild drought in plants,"Yukari Nagatoshi, Kenta Ikazaki, Nobuyuki Mizuno, Yasufumi Kobayashi, Kenichiro Fujii, Eri Ogiso-Tanaka, Masao Ishimoto, Yasuo Yasui, Tetsuji Oya, Yasunari Fujita",2022-09-04
https://www.biorxiv.org/content/10.1101/2020.12.12.422516v1#comment-6186112191,biorxivstage,0,"As the MRNA cannot enter the nucleus, there is absolutely no chance than it can interact with the DNA. Furthermore, even if MRNA was by some miracle be in presence of DNA, interaction would require a specific reverse transcriptase, as you know that there is not one RT, but one for any MRN, which come associated with the RNA of the retroviruses.",2023-05-16T09:25:26,disqus_C7jI9xZJpv,pierre,10.1101/2020.12.12.422516,SARS-CoV-2 RNA reverse-transcribed and integrated into the human genome,"Liguo Zhang, Alexsia Richards, Andrew Khalil, Emile Wogram, Haiting Ma, Richard A. Young, Rudolf Jaenisch",2020-12-13
