comment url,comment forum,comment keywords,comment message,comment date,comment username,comment name,paper doi,paper title,paper authors,paper date
https://www.biorxiv.org/content/10.1101/2023.06.01.543133v2#comment-6680897622,biorxivstage,0,https://uploads.disquscdn.c...,2025-04-02T09:04:49,disqus_tCcavDh7hB,Lee Berger,10.1101/2023.06.01.543133,"An initial report of c241,000 to 335,000 Year old Rock Engravings and their relation to Homo naledi in the Rising Star cave system, South Africa","Lee R. Berger, John Hawks, Agustín Fuentes, Dirk van Rooyen, Mathabela Tsikoane, Maropeng Mpete, Samuel Nkwe, Keneiloe Molopyane",2025-04-01
https://www.biorxiv.org/content/10.1101/2023.06.01.543133v2#comment-6680896282,biorxivstage,0,https://uploads.disquscdn.c...,2025-04-02T08:59:43,disqus_tCcavDh7hB,Lee Berger,10.1101/2023.06.01.543133,"An initial report of c241,000 to 335,000 Year old Rock Engravings and their relation to Homo naledi in the Rising Star cave system, South Africa","Lee R. Berger, John Hawks, Agustín Fuentes, Dirk van Rooyen, Mathabela Tsikoane, Maropeng Mpete, Samuel Nkwe, Keneiloe Molopyane",2025-04-01
https://www.biorxiv.org/content/10.1101/2023.06.01.543133v2#comment-6680896175,biorxivstage,0,https://uploads.disquscdn.c...,2025-04-02T08:59:13,disqus_tCcavDh7hB,Lee Berger,10.1101/2023.06.01.543133,"An initial report of c241,000 to 335,000 Year old Rock Engravings and their relation to Homo naledi in the Rising Star cave system, South Africa","Lee R. Berger, John Hawks, Agustín Fuentes, Dirk van Rooyen, Mathabela Tsikoane, Maropeng Mpete, Samuel Nkwe, Keneiloe Molopyane",2025-04-01
https://www.biorxiv.org/content/10.1101/2022.05.18.492497v1#comment-6680529890,biorxivstage,0,Published as https://link.springer.com/article/10.1186/s13046-024-03075-y,2025-04-01T17:52:03,mathurin_dorel,Mathurin Dorel,10.1101/2022.05.18.492497,Enhancer plasticity sustains oncogenic transformation and progression of B-Cell Acute Lymphoblastic leukemia,"G Corleone, C Sorino, M Caforio, S Di Giovenale, F De Nicola, V Bertaina, A Pitisci, C Cortile, F Locatelli, V Folgiero, M Fanciulli",2022-05-19
https://www.biorxiv.org/content/10.1101/2024.05.16.594542v2#comment-6680458490,biorxivstage,1,"Authors' Note: This preprint was thoroughly rewritten (including the title) after submission for review. The revised version was published in SciRep: Bagchi et. al. A multifaceted examination of the action of PDE4 inhibitor rolipram on MMP2/9 reveals therapeutic implications. Sci Rep 15, 10963 (2025). DOI: 10.1038/s41598-025-95549-y",2025-04-01T15:53:37,disqus_IKKXCKtd5k,Analabha  Roy,10.1101/2024.05.16.594542,The Hidden Potential of PDE4 Inhibitor Rolipram: A Multifaceted Examination of its Inhibition of MMP2/9 Reveals Therapeutic Implications,"Arka Bagchi, Analabha Roy, Anindya Halder, Arunima Biswas",2024-05-23
https://www.biorxiv.org/content/10.1101/2023.06.01.543135v1#comment-6680444769,biorxivstage,0,"Two points which strengthen your argument are 1) we see socio-emotional differences in great apes, showing different emotional evolution trajectories are possible in hominids despite similar brain sizes, and 2) orbitofrontal cortex is very important for socio-emotional behavior and control- and relative orbitofrontal cortex expansion and reorganization is easy to compare in both living great apes and fossil hominin endocasts, where lateral OFC is smallest in orangutans, appears inflated in A. sediba relative to African apes, and appears similar in relative size between Homo naledi and Homo sapiens.",2025-04-01T15:31:09,disqus_QCs2GCfktv,Shawn Hurst,10.1101/2023.06.01.543135,"Burials and engravings in a small-brained hominin, Homo naledi, from the late Pleistocene: contexts and evolutionary implications","Agustin Fuentes, Marc Kissel, Penny Spikins, Keneiloe Molopyane, John Hawks, Lee R. Berger",2023-06-05
https://www.biorxiv.org/content/10.1101/2025.02.26.640265v1#comment-6680374606,biorxivstage,0,Are the supplementary tables available at this time? I'm looking for Table S2. Thank you!,2025-04-01T13:27:43,,Katelyn Begany,10.1101/2025.02.26.640265,Le Petit Prince (LPP) Multi-talker: Naturalistic 7T fMRI and EEG Dataset,"Qixuan Wang, Qian Zhou, Zhengwu Ma, Nan Wang, Tianyu Zhang, Yaoyao Fu, Jixing Li",2025-02-26
https://www.biorxiv.org/content/10.1101/2025.02.25.640092v1#comment-6680071756,biorxivstage,0,"Thanks! Yes, potentially. We ourselves have seen connections between APA and RNA localization (PMC4798900 and PMC8234626), so this certainly seems like a reasonable hypothesis. We haven't looked at APA in this TDP-43 data yet, though.",2025-03-31T21:39:19,matthew_taliaferro,Matthew Taliaferro,10.1101/2025.02.25.640092,TDP-43 directly inhibits RNA accumulation in neurites through modulation of RNA stability,"Charlie Moffatt, Ankita Arora, Katherine F. Vaeth, Bryan B. Guzman, Gurprit Bhardwaj, Audrey Hoelscher, Levi B. Gifford, Holger A. Russ, Daniel Dominguez, J. Matthew Taliaferro",2025-03-01
https://www.biorxiv.org/content/10.1101/2024.07.05.602183v1#comment-6679963796,biorxivstage,0,This paper has been published now in Ecological Processes: https://doi.org/10.1186/s13717-025-00593-1,2025-03-31T18:29:21,,Christian Schürings,10.1101/2024.07.05.602183,Drivers of recovery and degradation of riverine benthic macroinvertebrate communities: A nationwide analysis of time series,"Christian Schürings, Willem Kaijser, Svenja Gillmann, Kristin Peters, Jens Kiesel, Armin W. Lorenz, Daniel Hering",2024-07-09
https://www.biorxiv.org/content/10.1101/2023.11.28.569145v1#comment-6679881591,biorxivstage,0,"Hi, I'm an author. This has been published in Nature Plants https://www.nature.com/articles/s41477-024-01738-4",2025-03-31T16:09:17,,Michael,10.1101/2023.11.28.569145,Coexpression enhances cross-species integration of scRNA-seq across diverse plant species,"Michael John Passalacqua, Jesse Gillis",2023-11-30
https://www.biorxiv.org/content/10.1101/2024.10.09.617390v1#comment-6679833939,biorxivstage,0,"Published in Plant Physiology and Biochemistry Volume 222, May 2025, 109679 with DOI: https://doi.org/10.1016/j.plaphy.2025.109679",2025-03-31T14:46:25,neeleshpatra,Neelesh Patra,10.1101/2024.10.09.617390,Knockout of fatty acid elongase1 homeoalleles in amphidiploid Brassica juncea leads to undetectable erucic acid in seed oil,"Neelesh Patra, Guy C. Barker, Mrinal K. Maiti",2024-10-14
https://www.biorxiv.org/content/10.1101/2025.03.26.645364v1#comment-6679765488,biorxivstage,0,"Our observations from a detailed, quantitative comparisons of pathway databases can help scientists make rational choices among a plethora of options!",2025-03-31T12:37:24,kshitishacharya,Kshitish Acharya,10.1101/2025.03.26.645364,Systematic Comparative Analysis of Pathway Databases from a User’s Perspective,"Moushumi Goswami, Divya Dosemane, Sravanthi Davuluri, Akhilesh Bajpai, Kshitish K Acharya",2025-03-29
https://www.biorxiv.org/content/10.1101/2024.12.26.628516v1#comment-6679726284,biorxivstage,1,"Dear authors, We enjoyed discussing this preprint in our Layer Seminar Journal Club. The draft provides good arguments about the importance of developing and the capabilities of denoising methods to improve the quality of high-resolution fMRI data. To further strengthen the impact of this work, we would suggest openly sharing the code with the fMRI community. We believe that there is a high need for improvement in data quality that may come not only from better data acquisition but also from data denoising. If code becomes available, we would love to explore this methodology on our own datasets. With best regards, The Layer Seminar Journal Club Marco Barilari, Renzo Huber, Omer Faruk Gulban, Kenshu Koiso, Alessandra Pizzuti",2025-03-31T10:55:42,marcobarilari,Marco Barilari,10.1101/2024.12.26.628516,Differentiating BOLD and non-BOLD signals in fMRI time series using cross-cortical depth delay patterns,"Jingyuan E. Chen, Anna I. Blazejewska, Jiawen Fan, Nina E. Fultz, Bruce R. Rosen, Laura D. Lewis, Jonathan R. Polimeni",2024-12-26
https://www.biorxiv.org/content/10.1101/2025.03.23.644841v1#comment-6679706291,biorxivstage,0,This article appears to omit citation and discussion of Rotating coherent scattering microscopy (ROCS) from Alexander Rohrbach's group apart from a brief mention in the methods section. This is highly relevant to this manuscript. https://www.nature.com/articles/srep30393,2025-03-31T09:48:48,,Stephen Thorpe,10.1101/2025.03.23.644841,Using rotational integration of oblique interferometric scattering (RO-iSCAT) to track axial spatiotemporal responses of membrane protrusions,"Junyu Liu, Yean Jin Lim, David Herrmann, Paul Timpson, Tri G. Phan, Huafeng Liu, Min Guo, Woei Ming Lee",2025-03-25
https://www.biorxiv.org/content/10.1101/2024.04.01.587589v1#comment-6679359195,biorxivstage,0,Currently undergoing major revisions. Advisable to wait until final draft is published before citing.,2025-03-30T17:03:43,esaitta,Evan Saitta,10.1101/2024.04.01.587589,DO BIRDS SHOW UNIQUE MACROEVOLUTIONARY PATTERNS OF SEXUAL SIZE DIMORPHISM COMPARED TO OTHER AMNIOTES?,Evan Thomas Saitta,2024-04-02
https://www.biorxiv.org/content/10.1101/2021.02.23.432393v1#comment-6679234719,biorxivstage,1,May I suggest a look at https://pubmed.ncbi.nlm.nih.gov/34832944/ (though I can see that the published version of this came out about the published version of this preprint came out about the same time as the recommended article; must have been in the air!),2025-03-30T13:00:42,stephentabedon,MicroDude,10.1101/2021.02.23.432393,Clinical Phage Microbiology: A suggested in-vitro framework for phage therapy,"Daniel Gelman, Ortal Yerushalmy, Shira Ben-Porat, Chani Rakov, Sivan Alkalay-Oren, Karen Adler, Leron Khalifa, Mohanad Abdalrhman, Shunit Coppenhagen-Glazer, Saima Aslam, Robert T Schooley, Ran Nir-Paz, Ronen Hazan",2021-02-23
https://www.biorxiv.org/content/10.1101/2025.03.14.643340v1#comment-6678478638,biorxivstage,0,Say prototaxites is something that came from mud or volcanic ash sludge from water- could it be..instead of the whole tadpole/ (frogs)..it could be the slime that these creatures use.. I'm so curious.. 🤔 .. maybe the beginnings of even jellyfish?? Old coral?,2025-03-28T22:11:44,,Carmen Nieves,10.1101/2025.03.14.643340,Prototaxites was an extinct lineage of multicellular terrestrial eukaryotes,"Corentin C. Loron, Laura M. Cooper, Sean McMahon, Seán F. Jordan, Andrei V. Gromov, Matthew Humpage, Laetitia Pichevin, Hendrik Vondracek, Ruaridh Alexander, Edwin Rodriguez Dzul, Alexander T. Brasier, Alexander J. Hetherington",2025-03-17
https://www.biorxiv.org/content/10.1101/2024.06.07.597930v1#comment-6678340961,biorxivstage,0,"Hi, I'm noticing that this reference does not seem to be cited here: https://www.sciencedirect.com/science/article/pii/S0167701211003952 I'm also noticing a lack of referencing to my/our own antibiotic-mediated antagonism of phage infection activities: https://www.mdpi.com/2079-6382/8/4/182 https://www.mdpi.com/1424-8247/14/11/1162",2025-03-28T18:03:10,stephentabedon,MicroDude,10.1101/2024.06.07.597930,Extreme diversity of phage amplification rates and phage-antibiotic interactions revealed by PHORCE,"Yuval Mulla, Janina Müller, Denny Trimcev, Tobias Bollenbach",2024-06-07
https://www.biorxiv.org/content/10.1101/2023.04.06.535875v1#comment-6678099477,biorxivstage,1,This preprint has now been published: https://www.nature.com/articles/s41586-024-08222-1,2025-03-28T10:09:01,biocs,Michael Kuhn,10.1101/2023.04.06.535875,Detailed Social Network Interactions and Gut Microbiome Strain-Sharing Within Isolated Honduras Villages,"Jackson Pullman, Francesco Beghini, Marcus Alexander, Shivkumar Vishnempet Shridhar, Drew Prinster, Ilana L. Brito, Nicholas A. Christakis",2023-04-07
https://www.biorxiv.org/content/10.1101/2025.02.22.639662v1#comment-6678005122,biorxivstage,0,"Hi Simone, Good catch -- indeed, the modified oligo was ordered through http://biosyn.com. After looking in the notes of the quote (italics below), they translated our IDT mod naming conventions. /5BiosG/AAGCAGTGGTATCAACGCAGAGTACATrGrG{3dG} ""Mixed DNA/RNA strand /5Biosg/= 5' Biotin {3dG} = 3' deoxyguanosine""",2025-03-28T03:18:36,azizalkhafaji,Aziz Al'Khafaji,10.1101/2025.02.22.639662,Multi-platform evaluation and optimization of single-cell RNA isoform sequencing,"James T. Webber, Daniel A. Bartlett, Ghamdan Al-Eryani, Akanksha Khorgade, Asa Shin, Christophe Georgescu, Houlin Yu, Brian J. Haas, Victoria Popic, Aziz Al’Khafaji",2025-02-27
https://www.biorxiv.org/content/10.1101/2025.02.17.638712v1#comment-6677851484,biorxivstage,1,"The methodology presented in this paper is obscure and outdated. Mechanistic modeling is the by far preferred method of choice for translating in silico models to in vivo PK predictions (like the HTPK module in ADMET Predictor). Furthermore, the actual performance characteristics of all ADMET Predictor models are publicly available and are generally poorly represented by the limited datasets tested in this manuscript.",2025-03-27T21:21:39,,Jeremy Jones,10.1101/2025.02.17.638712,Human ADME/PK is lost in translation and prediction from in silico to in vitro to in vivo,"Urban Fagerholm, Sven Hellberg",2025-02-22
https://www.biorxiv.org/content/10.1101/2025.03.20.644440v1#comment-6677732212,biorxivstage,0,"I would like to respectfully point out a misrepresentation regarding our work cited as reference [16] (Raspopovic et al., 2014). In your manuscript, you write: “In contrast, many studies with realistic biological geometries either neglect growth or fail to explore how growth rate influences the emergence of patterns [16, 20, 21, 22].” However, this characterization does not accurately reflect our study. In Raspopovic et al. (2014), we explicitly analyzed the influence of growth on pattern formation, as shown in Figure 3A and Figure 23 of the supplementary data. This analysis was based on a limb growth model derived from experimental clonal data (see also Marcon et al., 2011), and understanding how growth modulates pattern emergence was one of the central aims of that work. We kindly ask you to consider correcting this point to more accurately reflect the content and focus of our study.",2025-03-27T18:10:43,luciano_marcon,Luciano Marcon,10.1101/2025.03.20.644440,Growth and patterning in vertebrate limb development A timescale perspective on skeletal specification,"S Ben Tahar, E Comellas, TJ Duerr, JR Monaghan, JJ Munoz, SJ Shefelbine",2025-03-20
https://www.biorxiv.org/content/10.1101/2024.03.25.586685v2#comment-6677603973,biorxivstage,0,"A revised version of this paper has been published in IEEE/ASME Transactions on Mechatronics under the title ""Design and Characterization of the AdjuSST: An Adjustable Surface Stiffness Treadmill"". https://ieeexplore.ieee.org/document/10816726",2025-03-27T14:41:07,mprice138,Mark Price,10.1101/2024.03.25.586685,AdjuSST: An Adjustable Surface Stiffness Treadmill,"Mark Price, Dominic Locurto, Banu Abdikadirova, Meghan E. Huber, Wouter Hoogkamer",2024-05-02
https://www.biorxiv.org/content/10.1101/2024.08.20.608711v1#comment-6677195928,biorxivstage,0,It has been published at Science Advances: https://www.science.org/doi/10.1126/sciadv.ads6021,2025-03-26T20:06:47,disqus_lIon9PN4zJ,Peng Xu,10.1101/2024.08.20.608711,An in vivo screen identifies NAT10 as a master regulator of brain metastasis,"Jocelyn F Chen, Peng Xu, Wesley L Cai, Huacui Chen, Emily Wingrove, Wenxue Li, Giulia Biancon, Meiling Zhang, Amer Balabaki, Ethan D Krop, Yangyi Zhang, Mingzhu Yin, Toma Tebaldi, Jordan L Meier, Thomas F Westbrook, Stephanie Halene, Yansheng Liu, Don X Nguyen, Qin Yan",2024-08-21
https://www.biorxiv.org/content/10.1101/2023.07.27.550892v1#comment-6677033455,biorxivstage,0,a published version of this paper can be found here - DOI https://doi.org/10.1038/s41467-024-48648-9,2025-03-26T15:46:16,,Daniela Schiller ,10.1101/2023.07.27.550892,Hippocampal timestamp for goals,"Alison Montagrin, Denise E. Croote, Maria Giulia Preti, Liron Lerman, Mark G. Baxter, Daniela Schiller",2023-07-28