comment url,comment forum,comment keywords,comment message,comment date,comment username,comment name,paper doi,paper title,paper authors,paper date
https://www.biorxiv.org/content/10.1101/2024.12.20.629649v1#comment-6693488441,biorxivstage,0,"This article has now been published in Microbial Genomics, under doi: https://doi.org/10.1099/mgen.0.001399",2025-04-23T18:47:32,,Verónica Kovacec,10.1101/2024.12.20.629649,"Genomic Characterisation of Group B Streptococcus from Argentina: Insights into Prophage Diversity, Virulence Factors and Antibiotic Resistance Genes","Veronica Kovacec, Sabrina Di Gregorio, Mario Pajon, Uzma Basit Khan, Tomas Poklepovich, Josefina Campos, Chiara Crestani, Stephen D. Bentley, Dorota Jamrozy, Marta Mollerach, Laura Bonofiglio",2024-12-23
https://www.biorxiv.org/content/10.1101/2023.06.27.546670v1#comment-6693261779,biorxivstage,1,this preprint has been published at Nature Genetics https://www.nature.com/articles/s41588-025-02155-9,2025-04-23T12:15:36,,Lingzhao Fang,10.1101/2023.06.27.546670,The ChickenGTEx pilot analysis: a reference of regulatory variants across 28 chicken tissues,"Dailu Guan, Zhonghao Bai, Xiaoning Zhu, Conghao Zhong, Yali Hou, The ChickenGTEx Consortium, Fangren Lan, Shuqi Diao, Yuelin Yao, Bingru Zhao, Di Zhu, Xiaochang Li, Zhangyuan Pan, Yahui Gao, Yuzhe Wang, Dong Zou, Ruizhen Wang, Tianyi Xu, Congjiao Sun, Hongwei Yin, Jinyan Teng, Zhiting Xu, Qing Lin, Shourong Shi, Dan Shao, Fabien Degalez, Sandrine Lagarrigue, Ying Wang, Mingshan Wang, Minsheng Peng, Dominique Rocha, Mathieu Charles, Jacqueline Smith, Kellie Watson, Albert Johannes Buitenhuis, Goutam Sahana, Mogens Sandø Lund, Wesley Warren, Laurent Frantz, Greger Larson, Susan J. Lamont, Wei Si, Xin Zhao, Bingjie Li, Haihan Zhang, Chenglong Luo, Dingming Shu, Hao Qu, Wei Luo, Zhenhui Li, Qinghua Nie, Xiquan Zhang, Zhe Zhang, Zhang Zhang, George E. Liu, Hans Cheng, Ning Yang, Xiaoxiang Hu, Huaijun Zhou, Lingzhao Fang",2023-06-29
https://www.biorxiv.org/content/10.1101/2024.10.31.621233v1#comment-6693261505,biorxivstage,0,It is now published at https://doi.org/10.1093/nargab/lqaf049,2025-04-23T12:14:52,filippovalle,Filippo Valle,10.1101/2024.10.31.621233,Exploring the latent space of transcriptomic data with topic modeling,"Filippo Valle, Michele Caselle, Matteo Osella",2024-11-03
https://www.biorxiv.org/content/10.1101/2024.04.28.591221v1#comment-6693069398,biorxivstage,0,Article now published online https://doi.org/10.1016/j.devcel.2025.02.015,2025-04-23T01:05:32,pragathim,Pragathi M,10.1101/2024.04.28.591221,Characterization of the mesendoderm progenitors in the gastrulating mouse embryo,"V. Pragathi Masamsetti, Nazmus Salehin, Hani Jieun Kim, Nicole Santucci, Megan Weatherstone, Hilary Knowles, Jane Sun, Riley McMahon, Josh B. Studdert, Nader Aryamanesh, Ran Wang, Naihe Jing, Pengyi Yang, Pierre Osteil, Patrick P.L Tam",2024-04-30
https://www.biorxiv.org/content/10.1101/2025.04.08.647810v1#comment-6692595452,biorxivstage,2,"We are pleased to note that this multi-institutional investigation using wild-type mice confirms our earlier reports that psilocybin does not significantly increase sociability (social preference) in normal mice (Mollinedo-Gajate, I. et al. Psilocybin rescues sociability deficits in an animal model of autism. Preprint at doi:10.1101/2020.09.09.289348 (2020); Song, C. et al, Lasting effect of psilocybin on sociability can be blocked by DNA methyltransferase inhibition. Preprint at doi: 2025.03.10.642385). Our studies in fact described that psilocybin increased sociability in animal models of autism and noted the absence of such effects in control (normal) mice. We therefore respectfully point out that the citation of Mollinedo-Gajate et al (2020) appears misleading here when cited as to support simply the statement “Psychedelics have been reported to influence social interactions” without specifying context of our studies’ s conclusion (namely, psilocybin rescues a deficit and does not rebalance what is in balance). The implication of questioning the therapeutic efficacy of psilocybin in neuropsychiatric conditions - built on observations in the absence of such conditions to begin with - would be misleading and illogical. We hope the authors may consider this feedback during the revision of the text, and together we may facilitate the generation of not only replicable and reliable results but also meaningful implications to constructively progress the field as a whole. Chenchen Song & Thomas Knöpfel",2025-04-22T08:18:19,thomasknopfel,Thomas Knopfel,10.1101/2025.04.08.647810,A multi-institutional investigation of psilocybin’s effects on mouse behavior,"Odilia D. Lu, Katrina White, Kendall Raymond, Christine Liu, Alexandra S. Klein, Nathaniel Green, Sam Vaillancourt, Austin Gallagher, Lena Shindy, Alyssa Li, Kira Wallquist, Ruoxian Li, Mila Zou, Austen B. Casey, Lindsay P. Cameron, Matthew B. Pomrenze, Vikaas Sohal, Mazen A. Kheirbek, Andrea M. Gomez, Stephan Lammel, Boris D. Heifets, Robert Malenka",2025-04-09
https://www.biorxiv.org/content/10.1101/2022.06.27.497806v8#comment-6692435576,biorxivstage,0,"This pre-print has been published in the journal PLOS ONE, March 28, 2025.  It is under a new title: 'Newcomb-Benford number law and ecological processes.'  The pre-print has been significantly modified. The 2022 pre-print serves only as a historical record of the 2025 argument.  Posted by the author, RD Davic (4/21/2025, 7:51 pm).",2025-04-21T23:51:58,robertddavic,Robert D. Davic,10.1101/2022.06.27.497806,Correspondence of Newcomb-Benford Number Law with Ecological Processes,Robert D. Davic,2022-10-29
https://www.biorxiv.org/content/10.1101/2025.04.16.648420v1#comment-6692400255,biorxivstage,0,"Great work. One quick point ""For additional model comparisons precomputed Enformer 1KG predictions were downloaded from ( https://console.cloud.google.com/storage/browser/dm-enformer/variant-scores/1000-genomes/enformer) and filtered for significant ASE variants (HepG2 n = 331, K562: n = 855)."" There are major problems with Enformer's pre-computed variant effect scores. The main summary is that in Enformer's precomputed scores they estimate the variant effect by comparing the allelic differences in total signal of predicted profiles of ~100 Kb length. So the effect of variants is greatly dampened. If u estimate the local effect size i.e the allelic effect of signal over 1Kb around the variant, you get much better predictions. We discuss this in detail in https://www.biorxiv.org/content/10.1101/2024.12.25.630221v2 I would recommend you recompute Enformer's variant scores in your benchmarks.",2025-04-21T22:25:16,anshulkundaje,Anshul Kundaje,10.1101/2025.04.16.648420,Identifying non-coding variant effects at scale via machine learning models of cis-regulatory reporter assays,"John C. Butts, Stephen Rong, Sager J. Gosai, Rodrigo I. Castro, Mackenzie Noon, Kehinde Adeniran, Rohit Ghosh, Pardis C. Sabeti, Ryan Tewhey, Steven K. Reilly",2025-04-18
https://www.biorxiv.org/content/10.1101/2025.04.08.647810v1#comment-6691969873,biorxivstage,0,"Congratulations on your outstanding multi-site study. This work exemplifies exactly what preclinical research requires to advance knowledge in a replicable and more translational manner. I would like to bring to your attention our previous research, which reported similar findings. In Meinhard et al. (NPP, 2000 doi: 10.1038/s41386-020-0694-z.), we investigated the effects of psilocybin on alcohol relapse behavior and found that while there were some acute effects, there were no long-lasting effects beyond 24 hours, regardless of dose, treatment schedule, or sex. This study began as a multi-institutional investigation into the effects of psilocybin on rat behavior, funded by the EU in 2019-2022 ( https://www.neuron-eranet.eu/projects/Psi-Alc/). Following the lack of long-term effects observed with psilocybin, we transitioned our focus to R-ketamine. We recently published a multi-institutional preclinical randomized controlled trial (referred to as a pre-RCT) in Meinhardt et al. (NPP, 2025 doi: 10.1038/s41386-025-02071-w.) with R-ketamine.",2025-04-21T07:14:30,rainerspanagel,Rainer Spanagel,10.1101/2025.04.08.647810,A multi-institutional investigation of psilocybin’s effects on mouse behavior,"Odilia D. Lu, Katrina White, Kendall Raymond, Christine Liu, Alexandra S. Klein, Nathaniel Green, Sam Vaillancourt, Austin Gallagher, Lena Shindy, Alyssa Li, Kira Wallquist, Ruoxian Li, Mila Zou, Austen B. Casey, Lindsay P. Cameron, Matthew B. Pomrenze, Vikaas Sohal, Mazen A. Kheirbek, Andrea M. Gomez, Stephan Lammel, Boris D. Heifets, Robert Malenka",2025-04-09
https://www.biorxiv.org/content/10.1101/2024.01.20.576416v1#comment-6691654979,biorxivstage,0,Link to the published paper: https://onlinelibrary.wiley.com/doi/full/10.1002/ece3.70782,2025-04-20T17:44:05,,Romain Dejeante,10.1101/2024.01.20.576416,Can overlooking ‘invisible landscapes’ bias habitat selection estimation and population distribution projections?,"Romain Dejeante, Rémi Lemaire-Patin, Simon Chamaillé-Jammes",2024-01-23
https://www.biorxiv.org/content/10.1101/2023.05.02.538526v1#comment-6691465020,biorxivstage,0,This article is now published: https://doi.org/10.1128/mbio.01326-23,2025-04-20T09:38:58,,Decourcelle Mathilde,10.1101/2023.05.02.538526,Tetraspanin CD82 maintains HTLV-1 biofilm polarization and is required for efficient viral transmission,"Coline Arone, Samuel Martial, Julien Burlaud-Gaillard, Maria-Isabel Thoulouze, Philippe Roingeard, Hélène Dutartre, Delphine Muriaux",2023-05-02
https://www.biorxiv.org/content/10.1101/2024.12.09.627531v1#comment-6690606341,biorxivstage,0,"Hi, there is a 404 ERROR regarding the database DOI (DATABASES.tar.gz).",2025-04-18T18:33:51,disqus_vYUMxxACJW,Davion,10.1101/2024.12.09.627531,"PathoFact 2.0: An Integrative Pipeline for Predicting Antimicrobial Resistance Genes, Virulence Factors, Toxins and Biosynthetic Gene Clusters in Metagenomes","Júlia Ortís Sunyer, Luis F. Delgado, Oskar Hickl, Cedric C. Laczny, Patrick May, Paul Wilmes",2024-12-11
https://www.biorxiv.org/content/10.1101/2023.11.23.568398v2#comment-6690582586,biorxivstage,0,I really like your work and I'm very interested to use your trained model on the organisms I work with. I did not do the experiment to measure reactivity on my organisms. I was wondering if the method use to determined the base reactivity mattered? I'm not set yet wether I'll be using DMS-MaP-seq or SHAPE-MaP-seq or if I will use ONT.,2025-04-18T17:51:29,franck_dumetz,Franck Dumetz,10.1101/2023.11.23.568398,Identification of potential riboswitch elements in Homo Sapiens mRNA 5’UTR sequences using Positive-Unlabeled machine learning,"William S. Raymond, Jacob DeRoo, Brian Munsky",2024-12-06
https://www.biorxiv.org/content/10.1101/2025.03.18.643910v1#comment-6690574755,biorxivstage,1,"In this manuscript, Feng et al. explores the roles of autophagy and programmed cell death in the lifespan of Arabidopsis thaliana root hairs. The authors found that wild type Arabidopsis root hair cells feature high levels of autophagy, measured by the presence of autophagic bodies while mutants in autophagy genes (ATG2, ATG5, and ATG7) show diminished levels of autophagic bodies. The root hairs of these autophagy mutants deteriorate at earlier time points than those of wild type seedlings, while displaying markers of developmental programmed cell death which are not found in young wild type root hair cells. They also found that, unlike similar phenotypes in other tissues, the premature degradation of root hair cells is not dependent on salicylic acid, jasmonic acid, or ethylene signaling, as double mutants in these pathways still presented early root hair collapse. Finally, they examined triple mutants in ATG2 and programmed cell death transcription factors ANAC046 and ANAC087 and found that mutations in these genes suppressed the early root hair cell death phenotype. This study reports interesting results that advance the field of developmental biology in roots with elegant single-cell resolution, we provide below some suggestions to increase the reproducibility of the work and clarity for a broader audience. Major comments - In the Introduction, there could be more elaboration on what the functions of the chosen autophagy genes are, as well as if there is any redundancy between them. In the text of the Results or the Methods section, an explanation of the types of mutations of each atg mutant would be helpful, as well as a justification for using a specific atg mutant in one experiment but not others (atg7 in Fig2A, and atg5 or atg2 throughout), using ATG8a as the autophagy reporter (Fig1) and using mutant atg7-2 with the H2A-GFP reporter, while the TOIM reporter was used for the other atg mutants (Fig2D, E). - In the text of the Results or the Methods section, more detail of how the confocal images were taken would be required for reproducibility, such as contrast settings, how software (ex: Fiji) was used, camera type. - To strengthen the conclusion that ATG5 expression in the xylem does not complement, although probably technically challenging, consider including evidence that it is expressed. - The Discussion section could benefit from a deeper discussion of the results that were obtained e.g. are there other mutations that cause a root-hair less phenotype? If so, what is the phenotype of such mutants? What happens if you grow the plants longer, would an atg mutant eventually have more root hairs? It would also be interesting to include your thoughts on some of the mechanisms behind the antagonistic relationship of autophagy and programmed cell death, could there be a direct interaction between a given ATG and ANAC046 and/or 087? A discussion of the possible redundancy between ANAC046 and 087 would be of interest. Would the single mutation of either in the atg2 background not rescue the premature root hair cell death? In Figure 4F, the ANAC046 line L7 has a few root hair tips remaining at the root junction, compared to line L4, which seems to have no root hairs. Could this be due to variable level of expression under the pE7 promoter? Minor comments - dPCD and ePCD are described in the introduction, and the meanings can be inferred, but it might be clearer to explain those abbreviations outright. - Supplemental Figure 2A, dotted line in atg5-1 image is not explained, so it is not clear if it is the same as the dotted line in earlier figures (which outline the root profile). - Figure 2 heading, “The loss function of autophagy...” should read “The loss of function.” - At the end of the results section “... the premature dPCD of root hairs in atg mutants dependents on canonical” should read depends. - Supplementary Figure 1H is missing a caption. It seems that the caption for Figure 1G may have been intended to address both figure panels from its description. - To fully validate the new atg2-8 and atg2-9 mutants, consider including ATG2 RNA or protein expression compared to atg2-2. - Define what the TOIM reporter is and what the acronym stands for. - Fig1A, B, C: Each of the representative confocal images has a right-hand panel showing a merged image, but their purpose is not fully clear. An explanation in the figure legend would be helpful for clarity. The cytosolic level of fluorescence makes it difficult to distinguish the difference between autophagic bodies and background fluorescence, consider including the details of image acquisition in this case to ensure the comparison between WT and mutants is suitable. - Figure 1E: Longitudinal is spelt wrong. - Figure 1E: In the figure caption atg7-2 and atg5-1 are mentioned but not shown. - Figure 3B: The figure is cut off and is written as “mCher”. Figure 2A, 3D, 3G, 3H, and 4F: The scale bars were also cut off (or are lacking). - Could you explain the nomenclature pPASPA3>>H2A-GFP reporter name written with the “>>” symbol instead of a colon. - In Figure 3B and 3F, the y-axis shows the number of cells expressing pPASPA3. It is not entirely clear in the text how this was counted: was this done using the H2A-GFP reporter? - In Figure 3F, the line L1 appears to have a slightly lower number of cells expressing pPASPA3. Are there any possible reasons for this (such as differences in Cas9 targeting in different lines)? - Statistical analyses: consider including an explanation for using t-test or ANOVA. - The cross section of the root seen in Figure 3 could be helpful in Figure 1, since Figure 1E features a cross section confocal as part of the ConA imaging and/or include a symbol to indicate orientation on both the transverse and longitudinal section views. Michael Kwakye and Warren Wilson (Indiana University Bloomington) - not prompted by a journal; this review was written within a Peer Review in Life Sciences graduate course led by Alizée Malnoë with input from group discussion including Sally Abulaila, Kim Kissoon, Madaline McPherson, Madison McReynolds, Mandkhai Molomjamts, Habib Ogunyemi and Octavio Origel.",2025-04-18T17:37:31,alizee_malnoe,Alizée Malnoë,10.1101/2025.03.18.643910,Root hair lifespan is antagonistically controlled by autophagy and programmed cell death,"Qiangnan Feng, Shihao Zhu, Xinchao Wang, Yujie Liu, Jierui Zhao, Yasin Dagdas, Moritz K. Nowack",2025-03-19
https://www.biorxiv.org/content/10.1101/2023.01.15.524136v2#comment-6690515686,biorxivstage,0,This work has now been published in the Journal of Cell Biology. Link below: https://pubmed.ncbi.nlm.nih.gov/40239066/,2025-04-18T15:51:00,miketatham,Mike Tatham,10.1101/2023.01.15.524136,PML mutants resistant to arsenic induced degradation fail to generate the appropriate SUMO and ubiquitin signals required for RNF4 and p97 recruitment,"Ellis G. Jaffray, Michael H. Tatham, Alejandro Rojas-Fernandez, Adel Ibrahim, Graeme Ball, Ronald T. Hay",2023-03-30
https://www.biorxiv.org/content/10.1101/2020.06.24.168781v1#comment-6690412693,biorxivstage,0,Have you published the results of the genome analysis of the Lchashen-Metzsamor culture?,2025-04-18T12:34:15,B_Michael,B_Michael,10.1101/2020.06.24.168781,AN ADMIXTURE SIGNAL IN ARMENIANS AROUND THE END OF THE BRONZE AGE REVEALS WIDESPREAD POPULATION MOVEMENT ACROSS THE MIDDLE EAST,"Anahit Hovhannisyan, Eppie Jones, Pierpaolo Maisano Delser, Joshua Schraiber, Anna Hakobyan, Ashot Margaryan, Peter Hrechdakian, Hovhannes Sahakyan, Lehti Saag, Zaruhi Khachatryan, Levon Yepiskoposyan, Andrea Manica",2020-06-24
https://www.biorxiv.org/content/10.1101/2022.09.08.507179v1#comment-6690335568,biorxivstage,1,This work has now been published (with a slightly modified title) here: https://doi.org/10.1093/bib/bbae527. Please update the preprint status to point to the final published version.,2025-04-18T08:12:20,disqus_oACrYKP8Jt,Felipe Campelo,10.1101/2022.09.08.507179,Phylogeny-aware linear B-cell epitope predictor detects candidate targets for specific immune responses to Monkeypox virus,"Felipe Campelo, João Reis-Cunha, Jodie Ashford, Anikó Ekárt, Francisco P. Lobo",2022-09-09
https://www.biorxiv.org/content/10.1101/2025.03.31.646294v1#comment-6690317159,biorxivstage,0,A timely study that sheds light on the evolution of secondary plastids originating from red algal endosymbiosis,2025-04-18T06:52:54,disqus_ugG06HFv9L,Eric Marechal,10.1101/2025.03.31.646294,Molecular phylogeny of the SELMA translocation machinery recounts the evolution of complex photosynthetic eukaryotes,"Rafael I. Ponce-Toledo, David Moreira, Purificación López-García, Philippe Deschamps",2025-04-02
https://www.biorxiv.org/content/10.1101/2025.03.03.641048v1#comment-6690282300,biorxivstage,0,"Published on 11 April 2025 as: Dioguardi E., Stsiapanava A., Fahrenkamp E., Han L., De Sanctis D., Inzunza J. & Jovine L. Structural basis of ZP2-targeted female nonhormonal contraception Proc. Natl. Acad. Sci. U.S.A. 122 (15):e2426057122 (2025) DOI: https://doi.org/10.1073/pnas.2426057122 PubMed: https://pubmed.ncbi.nlm.nih.gov/40215272/",2025-04-18T04:12:11,lucajovine,Luca Jovine,10.1101/2025.03.03.641048,Structural basis of ZP2-targeted immunocontraception,"Elisa Dioguardi, Alena Stsiapanava, Eileen Fahrenkamp, Ling Han, Daniele de Sanctis, José Inzunza, Luca Jovine",2025-03-06
https://www.biorxiv.org/content/10.1101/2023.07.02.547450v1#comment-6689895035,biorxivstage,1,This preprint has been published in a journal. https://translational-medicine.biomedcentral.com/articles/10.1186/s12967-025-06191-1,2025-04-17T15:06:41,minwoo_kang,Minwoo Kang,10.1101/2023.07.02.547450,Differential expression of tension-sensitive HOX genes in fibroblasts is associated with different scar types,"Minwoo Kang, Ung Hyun Ko, Eun-Jung Oh, Hyun Mi Kim, Ho Yun Chung, Jennifer H. Shin",2023-07-03
https://www.biorxiv.org/content/10.1101/2025.03.28.645877v1#comment-6689776136,biorxivstage,1,"Comment from Olivier Putelat: In this study, a cat mandibule is used as a reference to which other mandibles are compared. It is named « the felid from Iron Age Entzheim, France ». Apart from the absence of any citation of the analysis of this specimen that needs to be introduced, there are several scientific problems in the way it is used: 1.	It is not clear which specimen was used in this analysis. No measurements are indicated in tables S3 and S4 and the specimen is used in Fig. S2 simply named « the felid from Iron Age Entzheim, France », but there are two mandibles that I analyzed: one comes from site 4752 Entzheim-Geispolsheim ""Aéroparc-Lidl"" excavated in 2006 and the other from site 5046 Entzheim-Geispolsheim ""Lotissement d’activités Entzheim 4"" excavated in 2008. As the authors of the present study did not contact me, they did not have my measurements. Therefore, it is not clear how the indicated measurements were taken and on which specimen. 2.	In legend of Fig. S2 « A) Mandible and B) cheektooth row lengths (P4 - M1) (numbers upper case) » are problematic. First, as it is a mandible, these measurements should be indicated as (P4 - M1) (i.e., numbers as lower case) and not as (P4 - M1) (numbers as upper case). Second, it is unclear why the authors measured (P4 - M1) and not (P3 – M1), as they did in table S4 and for the axis of Fig. S2B. Finally, the length (P3 – M1) is shown as to be ~24,5mm, while the measurements of this trait I took on the complete mandibles before sampling for the paleogenetic study (published in 2017) are very different. Therefore, these various issues must be corrected.",2025-04-17T11:02:02,evamariageigl,Eva-Maria Geigl,10.1101/2025.03.28.645877,"Redefining the timing and circumstances of cat domestication, their dispersal trajectories, and the extirpation of European wildcats","Sean Doherty, Magdalena Krajcarz, Alberto Carmagnini, Evangelos Dimopoulos, Alexandra Jamieson, Joel M. Alves, Adrian Bălăşescu, Polydora Baker, Piotr Baranowski, Fiona Beglane, Julie Bitz-Thorsen, Angie Bolton, Will Bowden, Hannah Britton, Bea De Cupere, Marco De Martino, Ben Donnelly-Symes, Allowen Evin, Tom Fowler, Michael Fulford, Anne Birgitte Gotfredsen, Yu Han, Andrew C. Kitchener, Zoe Knapp, Shu-Jin Luo, Ingrid Mainland, Darko Maričević, Sian Moody, Tereza Nesnídalová, Terry O’Connor, David Orton, Joris Peters, Felix Sadebeck, AB Siegenthaler, Riley Smallman, Zdeňka Sůvová, Rob Symmons, Jack Sudds, Gabor Thomas, Wim Van Neer, Jarosław Wilczyński, Claudio Ottoni, Danijela Popović, Laurent A.F. Frantz, Greger Larson, Naomi Sykes",2025-03-29
https://www.biorxiv.org/content/10.1101/2025.03.24.645001v1#comment-6689746356,biorxivstage,0,"Dear Authors, This is an impressive study that achieves direct visualization of PHB complexes in their native cellular context through cryo-ET. The integration of structural analysis with comprehensive biochemical approaches provides important insights into mitochondrial organization during depolarization. In the discussion of SPFH domain family proteins, the manuscript would be further strengthened by including the work of Ma et al. (Cell Research, 2022; https://doi.org/10.1038/s41422-021-00598-3), which provides complementary structural insights into membrane microdomain organization by SPFH family members.",2025-04-17T09:16:09,,Dingyi Luo,10.1101/2025.03.24.645001,In situ cryo-ET visualization of mitochondrial depolarization and mitophagic engulfment,"Kevin Rose, Eric Herrmann, Eve Kakudji, Javier Lizarrondo, A. Yasemin Celebi, Florian Wilfling, Samantha C. Lewis, James H. Hurley",2025-03-25
https://www.biorxiv.org/content/10.1101/2023.10.24.563691v1#comment-6689376626,biorxivstage,0,Final draft has now been published after peer review: https://academic.oup.com/evolut/advance-article-abstract/doi/10.1093/evolut/qpaf020/7997201?redirectedFrom=fulltext,2025-04-16T17:51:15,esaitta,Evan Saitta,10.1101/2023.10.24.563691,RELAXING SELECTIVE PRESSURES ON DEVELOPMENTALLY COMPLEX INTEGUMENTARY STRUCTURES: FEATHER VANE SYMMETRY EVOLVES IN ADDITION TO BODY MASS AND WING LENGTH AFTER FLIGHT LOSS IN RECENT BIRDS,"Evan T. Saitta, Lilja Carden, Jonathan S. Mitchell, Peter J. Makovicky",2023-10-27
https://www.biorxiv.org/content/10.1101/2025.04.09.647750v1#comment-6689243558,biorxivstage,1,A hosted and GDPR-compliant instance of the appli- cation including all mentioned public data is accessible to the public free of charge under https://braintrawler- http://circuit.vrvis.at/,2025-04-16T14:22:51,amin_cheikhi,Amin Cheikhi,10.1101/2025.04.09.647750,Circuit Mining in Transcriptomics Data,"Tobias Peherstorfer, Sophia Ulonska, Bianca Burger, Simone Lucato, Bader Al-Hamdan, Marvin Kleinlehner, Till F. M. Andlauer, Katja Bühler",2025-04-15
