comment url,comment forum,comment keywords,comment message,comment date,comment username,comment name,paper doi,paper title,paper authors,paper date
https://www.biorxiv.org/content/10.1101/2021.11.04.467277v2#comment-5889233927,biorxivstage,1,"This is a fascinating article to read, and I look forward to learning more.  I'm going to take it step by step, commenting on clarity as I read through the paper. - I stumbled a few times in the abstract.  "" A deeper sampling of individual ants from two colonies that included all available castes (pupae, larvae, workers, female and male alates), from both before and after adaptation to controlled laboratory conditions, revealed that ant microbiomes from each colony, caste, and rearing condition were typically conserved within but not between each sampling category."" What does ""deeper"" mean, is it that you sampled ants from each caste?  (the way it's phrased now, it sounds somewhat detached, like stating that the colony had castes without stating that you sampled them) So colony number, caste, and wild vs lab are sampling categories?  What would it mean ""within, but not between each sampling category""? - What kind of sequencing did you do?  I'd like to see at a glance which -omics you are doing, right at the start of the paper, because I sometimes look for papers that use a particular method. - You use ""Tenericute"" in the abstract, and ""Mollicute"" in the Importance section.  For the readers unfamiliar with the two, it might be good to disambiguate. - The Importance section is somewhat long and repeats a lot of the abstract.  What made you want to do this study?  That no one has studied this ant's microbiomes?  That the findings might extrapolate to other ants?  That you could say something about individuality and colonial organization or evolution from the members' microbiomes? - ""Honey bee queens, workers, and drones also each have unique gut microbiomes, where worker microbiomes are more diverse than those of queens and drones, possibly due to worker foraging (9).""  ""Unique"" has the connotation of being individual, rather than a group characteristic.  Would ""discrete"" be a better term?  And I'm a bit confused by ""more diverse"".  Diverse how?  Is the meaning that the range of species within the microbial community is somehow wider on the taxonomic tree?  Or something else? - But now reading that honey bees have a core microbiome that is found in all colonies and castes.  But were we not talking about ""more diverse""? - ""However, strains [...]""  just need to be a bit clearer on what are these strains of. - What makes these microbiomes ""low-diversity""? - "" the samples collected from each colony were not differentiated from each other"" is unclear.  Do you mean that the team collected ants of caste X from all 25 colonies into a single blended sample?  Try to rephrase "" Whether the 19 common bacteria found in Texas T. septentrionalis and form a conserved microbiome that is found in other geographic regions or castes is also unknown."" is unclear to me.  Maybe try to break it up into shorter sentences. - ""major driver"" might suggest causality.  I think you mean that the differences in the presence or absence of those symbionts are producing the statistical effect of seeing differences between microbiomes, is that correct? - ""Colony JKH000270 lab-maintained ants were sampled after a year and 4 months (some male alates were sampled earlier) and Colony JKH000307 lab-maintained ants were sampled after 4 months."" I'm wondering if the time factor would be important in microbiome adaptation.  If it is, can the two colonies really be compared to each other?  Would you mind adding a couple of sentences to explain the procedure? - I'm not sure I understand how pupae and ant guts and whole ants will act as confirmatory datasets.  Would you mind elaborating? - ""Reads that were not classified as belonging to the kingdom Bacteria (i.e., those identified as Archaea or Eukaryote) using the SILVA database v128 (43, 44) were removed.""  I understand that including viruses, other fungi, diatoms, etc. would change the scope of the project.  I'd be interested in learning about that part of the microbiome, and hope you write the next paper on it.",2022-06-16T02:27:16,disqus_CWWMMIAu8i,Sciency,10.1101/2021.11.04.467277,Trachymyrmex septentrionalis ant microbiome assembly is unique to individual colonies and castes,"Emily A. Green, Jonathan L. Klassen",2022-06-09
https://www.biorxiv.org/content/10.1101/2021.12.16.472840v2#comment-5889228941,biorxivstage,0,"If you look at Fig.4F, what is interesting is that kindled WT obviously made fewer errors than Sham. Can kindling make animals smarter?",2022-06-16T02:18:49,,Toshiya,10.1101/2021.12.16.472840,Chronic Seizures Induce Sex-Specific Cognitive Deficits with Loss of Presenilin 2 Function,"Kevin M. Knox, Megan Beckman, Carole L. Smith, Suman Jayadev, Melissa Barker-Haliski",2022-06-02
https://www.biorxiv.org/content/10.1101/2020.08.09.243238v5#comment-5889174595,biorxivstage,2,"Overall, I love this paper.  It's an original approach, and an important topic.  The language is clear and engaging.  I do have some questions and comments that I hope might be helpful. - ""integral parts of an imperialist enterprise [20]. Imperialism granted Western scientists unprecedented access to the world, which they translated into scientific authority, power, and wealth,""  When I first read that, I  thought you meant ""power and wealth"" as in technology that spurred the Industrial Revolution.  Later on in the paper, you elaborate that it is the power of Global North academics over academics in the Global South.  I'm also thinking that maybe applied science, such as concentration of Big Pharma exploration and production would generate power and wealth today?  Later on, you write "" Implicit in this perspective is that first authorship, and authorship of publications in general, are ways to establish authority and accumulate power in knowledge production, which in itself is worth questioning. For example, how do established authorship norms promote inequity and dominance in Western science (e.g. [74])?"" Pretty much the question I had.  So, would it be possible to phrase the statement that is at the start of the paper in some way that lets me know to wait for that discussion at the end of the paper? You go on to explain:  ""The imperialistic dynamics that created the current structures of access and power within Western science between the Global North and South have also enabled Western science to assert dominance in global knowledge production [76], while erasing, appropriating, and subjugating Indigenous knowledge and authority. "" Which leads me to believe that you only meant academia power.  So, basically, I'm a bit confused by the flow.  But the ideas themselves are powerful and I'm glad to read them. - ""through foundational practices""  I understand that you mean foundational to science, not the imperialism here? - ""as expertise about the natural world continues to be disproportionately claimed by the Global North through publication practices.  Our findings serve as a case study that reflects the inequitable structures at the core of Western biodiversity science and their resulting disparities, e.g. in access, labor, collaboration, power, and designations of expertise and authority."".  To me, this is the most important statement.  And yet it's pretty far down, at the very end of the Introduction section.  On the one hand, I understand that it is the last step in a logical chain.  On the other, I would still like it to be one of the first things I see, to let me know what I'm reading towards. - ""This study shows how historical inequity continues to shape present day research practices""  I'm not sure it does?  To me, it shows the historical inequity, and it shows that inequity is still here today.  But I don't know if the paper describes the mechanism by which one generates the other.  And don't think it needs to, what the paper focuses on is far more important.  So I'd just rephrase that a bit to remove the suggestion of causality.  ""Things are bad.  Things are still bad.  We should think about that and fix it."" - ""1960"".  I'm cool with missing the years between 1950 and 1960, I just want to see a phrase acknowledging that, and saying you accounted for it in the statistics. - ""we did not include descriptions in which the species was extinct at the time of description""  Could you add a quick phrase explaining why?  As a fresh reader, I thought ""I'd feel it an honor to have a dinosaur named after me"".  And I'm genuinely curious what is the quality of that honor that makes it different from having a current species. - ""The prevalence of first authors from the Global South increases significantly toward the present (R2 = 0.143, p = 0.014), but the prevalence of first authors from the Global North remains consistent (R2 = 6.749e-5, p = 0.947) "" Is it not a zero-sum calculation?  Earlier, you make a similar statement, but without the word ""first"", so I concluded that Global South authors were being included as author lists generally grew in length.  But there can be only one first author per paper, so I'm confused by the calculation here. - In this paper, you speak of inclusion of Global South stakeholders in Western science.  You also speak of inclusion of Indigenous knowledge and worldviews in science.  So the ""The patterns of authorship we observed show that researchers from the Global South have increasing opportunities to participate in Western science""  statement feels like it's missing a piece. - ""prioritizes the Global North’s power to theorize and conceptualize [...] frames the value of people and their perspectives in terms of how they can benefit those currently in power"" and""Paradoxically, as taxonomic work has been devalued, [...] the roles of different individuals, and how different roles are supported and valued (intellectually and materially)""  Loved reading this. - ""Adhering to the fallacy of neutrality (which is in fact a non-neutral stance and one embedded in white supremacy;""  I understand that thinking one is neutral is a fallacy.  But how is it a non-neutral stance embedded in white supremacy?  Is it because privileged people have the ability to not see problems and therefore think they're being neutral?  I would want to see a bit more clarity in this phrasing. Thank you for writing the paper, look forward to seeing it in print.",2022-06-16T00:58:14,disqus_CWWMMIAu8i,Sciency,10.1101/2020.08.09.243238,Global inequity in scientific names and who they honor,"Shane DuBay, Daniela H. Palmer Droguett, Natalia C. Piland",2022-06-02
https://www.biorxiv.org/content/10.1101/2020.09.18.304139v2#comment-5889098946,biorxivstage,0,"Hi Merbecovirus include MERS (https://www.ncbi.nlm.nih.go... if so and that one is s2mless ""Distribution and Evolutionary History of the Mobile Genetic Element s2m in Coronaviruses"" doi:10.3390/diseases4030027 please contact. Thank you Torstein",2022-06-15T23:07:26,luismatheuwyld,Luis Matheu Wyld,10.1101/2020.09.18.304139,The stem loop 2 motif is a site of vulnerability for SARS-CoV-2,"Valeria Lulla, Michal P. Wandel, Katarzyna J. Bandyra, Rachel Ulferts, Mary Wu, Tom Dendooven, Xiaofei Yang, Nicole Doyle, Stephanie Oerum, Rupert Beale, Sara M. O’Rourke, Felix Randow, Helena J. Maier, William Scott, Yiliang Ding, Andrew E. Firth, Kotryna Bloznelyte, Ben F. Luisi",2021-03-11
https://www.biorxiv.org/content/early/2018/10/23/450825#comment-5888583591,biorxivstage,0,This article was published 15 June 2022: https://journals.plos.org/p...,2022-06-15T13:31:55,jespersjstrm,Jesper Sjöström,10.1101/450825,Pre- and postsynaptically expressed spiking-timing-dependent plasticity contribute differentially to neuronal learning,"Beatriz E. P. Mizusaki, Sally S. Y. Li, Rui Ponte Costa, P. Jesper Sjöström",2018-10-23
https://www.biorxiv.org/content/10.1101/2022.06.02.494602v1#comment-5888374621,biorxivstage,4,"The manuscript entitled “Feasibility of 3T layer-dependent fMRI with GE-BOLD using NORDIC and phase regression” explores whether 3T sub-millimeter MRI with 3D-EPI readouts can be a reliable tool for human layer-fMRI. The results suggest that it is indeed feasible. I find this very exciting and an impactful message to the emerging field of mesoscopic (laminar) fMRI. While most layer-fMRI studies are being conducted at one of the ≈ 100 installed 7T, this study shows that layer-fMRI can be extended to a much larger user base of ≈ 10.000 3T scanners installed worldwide. There are about a dozen 3T layer-fMRI studies published already (most are referenced in the manuscript). The study here stands out in the way it aims to generate voxel-wise activation scores with efficient EPI readout and produces layer profiles from small ‘columnar’ patches of the cortex. Most other previous studies used FLASH-based readouts to investigate fMRI signal mechanisms at very long TRs and/or had to collapse fMRI data from large brain areas together to generate one layer-profile. The approach presented here makes layer-fMRI at 3T more feasibly applicable for conventional neuroscience studies. It becomes apparent that the authors paid a lot of attention to high-level fMRI processing strategies and the highest possible quality of applying those. For example, the authors developed and employed a layer-fMRI quality score of inter-trial beta consistency across depth. I really like this measure on multiple levels: A) it can account for potential statistical inflation in NORDIC, B) it can provide a measure of data quality in absence of a ground truth layer profile, C) it allows comparisons across different analysis pipelines with different voxel-wise noise levels. Overall, I find the layer-profiles of the raw data quite convincing already (right panel in Fig. 3a). They are also quite reproducible across trials. While I appreciate the application of phase regression and NORDIC, these processing steps come along with some level of uncertainty and additional dependencies of their precise application setup and inherent assumptions. Thus, I admired the author's approach to show raw and filtered data next to each other. Furthermore, I appreciated the studies focus on high-quality pre-processing and acquiring a structural VASO scan to guide the alignment between BOLD-EPI and MP2RAGE data. I also appreciated the author's decision to only use half of the trials for the main analysis, while performing the ROI selection on the other half of the trials. Sacrificing half of the data to minimize the risk of circularity is an admirably choice. Especially in the tSNR limited regime of layer-fMRI. I enthusiastically encourage the publication of this manuscript. If the authors agree, I think they could improve the clarity of the manuscript by adding a few further details of acquisition and analysis. And maybe, they can also add a few additional discussion points about the generalizability of their findings. Itemized below. 1.) I find that the manuscript has a bit of a disconcerting message too. Namely, the authors find that the quantitative (beta-score) layer-profiles are substantially altered when phase-regression is combined with or without NORDIC. This means that the layer-fMRI profiles after phase-regression and after NORDIC-denoising are not reproducible across noise levels of the MRI data. The authors describe this as CNR-dependency in lines 103, 317, 348, 452, 516. This limits the generalizability of the results. It means that the profiles will not be reproducible for slightly different experimental settings (different RF coil, different flip angle, different GRAPPA factor etc.). The authors apply the phase regression for exploratory purposes. And they also show the results without phase regression. Thus, I think they provide a comprehensive and balanced overview in the current manuscript already. If the authors agree, they could add a few sentences in the discussion section about the implications of the CNR dependence for the generalizability of the results. How valuable are de-veining methods if the resulting quantitative profiles are not reproducible across different scanning and noise levels. 2.) I was a bit surprised about the choice of the excitation flip angle of 45 deg. For a 3D-EPI with a (shot-to-shot) TR of 84 ms at 3T, I would have expected the Ernst angle to be less than half of this (approx. 20 deg). All the other parameters including the flip angle of 45 deg are a perfect match with the 3T layer-fMRI Protocol that I have developed in Feb 2020: ( https://github.com/layerfMR... second protocol in pdf). So I think the authors must have used this as a start and retrospectively removed the VASO inversion pulse from the protocol for the purpose of BOLD. Though, the excitation flip angle for a BOLD fMRI time series should be differently optimized than for a VASO inversion-recovery protocol. Thus, I am afraid that the authors did not use a protocol that would have provided the best tSNR for BOLD. I do not think that this disqualifies the conclusions of the paper. I just think that the impressive results could have even been more impressive with a more appropriate excitation flip angle. Maybe the authors want to include a brief discussion about the expected effect of overflipping? E.g. There might be an advantageous effect of suppressing physiological noise of CSF (as discussed here: https://index.mirasmart.com.... Or maybe it’s just a typo? 3.) I was surprised that the analysis pipeline uses a ROI selection criteria that is based on the layer-activation. Described on line 249: :4 the peak signal in depths 0.3-0.4 should not exceed that of depths 0.6-0.8 {...}"". This has the potential to affect the resulting layer-profiles. I appreciate that the authors investigate this potential circularity in supplementary figure S3. They find that this selection criterion is not responsible for the slope modulation with phase regression, by defining the slope solely on upper layers. This solves the issue for me. Though, I am still wondering why the selection criterion was used? Is the reason related to the difficulty to isolate the Brodman area 4a from Brodman area 4p (​​ https://layerfmri.com/findi... Showing the slopes of ROIs that were extracted without this criterion might have been even more convincing in proving that there are no circularity effects. 4.) I am a bit surprised about the application of RETRO>I K layerfmri.com ="""" vaso_ve="""" ).="""" e.g.="""" was="""" “prescan="""" normalize”="""" employed?="""" 6.)="""" this="""" study="""" employs="""" a="""" rather="""" liberal="""" nordic="""" noise="""" threshold="""" of="""" arg.factor_error=""1.15."" i="""" think="""" it="""" might="""" help="""" the="""" manuscript="""" to="""" educate="""" the="""" reader="""" what="""" this="""" means.="""" does="""" this="""" mean="""" that="""" the="""" spatially="""" varying="""" noise="""" level="""" (g-factor)="""" is="""" globally="""" scaled="""" and="""" that="""" the="""" threshold="""" for="""" removed="""" principal="""" components="""" is="""" the="""" same="""" across="""" all="""" patches?="""" figure="""" s1="""" and="""" s2="""" seem="""" to="""" be="""" interpreted="""" in="""" a="""" way="""" that="""" this="""" slightly="""" more="""" aggressive="""" denoising="""" does="""" not="""" affect="""" the="""" temporal="""" autocorrelation="""" too="""" much="""" and="""" leaves="""" the="""" beta="""" scores="""" almost="""" unchanged.="""" it="""" is="""" not="""" clear="""" if="""" this="""" result="""" is="""" generalizable="""" to="""" other="""" stimulation="""" paradigms.="""" e.g.="""" other="""" stimulation="""" tasks="""" (e.g.="""" naturalistic="""" tasks,="""" not="""" block="""" designs)="""" might="""" not="""" be="""" so="""" clearly="""" separable="""" from="""" gaussian="""" noise.="""" thus,="""" for="""" these="""" tasks,="""" the="""" aggressive="""" thresholding="""" might="""" become="""" more="""" challenging?="""" in="""" line="""" 223f,="""" the="""" authors="""" state="""" that="""" an="""" even="""" higher="""" fe="""" was="""" used="""" for="""" roi="""" selection="""" in="""" order="""" to="""" suppress="""" the="""" effect="""" of="""" large="""" veins.="""" it="""" is="""" not="""" clear="""" to="""" me="""" how="""" the="""" application="""" of="""" nordic="""" suppresses="""" vein="""" effects.="""" 7.)="""" there="""" are="""" three="""" versions="""" of="""" nordic="""" available="""" on="""" https:="""" github.com ="""" steenmoeller="""" nordic_raw="""" releases.="""" they="""" were="""" all="""" available="""" at="""" the="""" stated="""" download="""" date.="""" it="""" is="""" not="""" clear="""" which="""" one="""" was="""" used.="""" stylistic="""" comments="""" -=""""> line “there ->is<- obvious cases” -> Steen Müller -> Steen Moeller -> It’s a matter of style who to cite and who not to cite. But the authors could consider also including references to other previously published human 3T layer-fMRI papers. E.g. Scheeringa 2022 ( https://doi.org/10.1093/cer..., Taso 2021 ( https://doi.org/10.1177%2F0..., Wu 2018 ( https://www.nature.com/arti..., Kim 2017 ( http://linkinghub.elsevier..... Personal message authors: In line 399, you mention that you used a NORDIC version without the need of an appended noise scan. If you are interested in using the approach with noise scans (as advised by the developers of NORDIC) in future experiments, just request an updated sequence version. NORDIC noise scans are included in the very sequence that is used here since the last few versions. However, for 0.8mm 3T layer-fMRI it does not seem to be overly critical: https://youtu.be/cB6v0Dn2Fk... in other cases, it seemed more relevant. ---- As submitted to the journal. I want to thank Lonike Faes for discussions about the preprint version of this manuscript. Her input was particularly valuable with respect to details on NORDIC.",2022-06-15T07:02:49,renzohuber,Renzo Huber,10.1101/2022.06.02.494602,Feasibility of 3T layer-dependent fMRI with GE-BOLD using NORDIC and phase regression,"Lasse Knudsen, Christopher J. Bailey, Jakob U. Blicher, Yan Yang, Peng Zhang, Torben E. Lund",2022-06-04
https://www.biorxiv.org/content/10.1101/2022.01.21.477271v1#comment-5888162763,biorxivstage,0,"MPST provides sulfur to the downstream enzymes such as MOCS3 which then transfers to Urm1. Urm1 then transfers the sulfur to CTU1/CTU2 complex that thiolates the tRNA at U34 position. How just the shMPST could be concluded as the main enzyme playing the role in oxidative stress in glioblastama. There is clearly a possibility that shMPST knockdown decreases the tRNA thiolation levels which then leads to the effect seen here. And the Dimedone switch labelling method for detecting the persulfided proteins is not selective as claimed in the method. A coomassie stained gel for the Figure 5 A, B would be helpful since the P-SSH lane seems to have degraded/low molecular proteins alone persulfided (from the intensity).",2022-06-14T23:54:40,,Raj_Operon,10.1101/2022.01.21.477271,Human glioblastoma cell motility depends on the activity of the cysteine metabolism enzyme 3-Mercaptopyruvate sulfurtransferase,"Mirca S. Saurty-Seerunghen, Thomas Daubon, Léa Bellenger, Virgile Delaunay, Gloria Castro, Joris Guyon, Ahmed Rezk, Sylvie Fabrega, Ahmed Idbaih, Fabien Almairac, Fanny Burel-Vandenbos, Laurent Turchi, Thierry Virolle, Jean-Michel Peyrin, Christophe Antoniewski, Hervé Chneiweiss, Elias A. El-Habr, Marie-Pierre Junier",2022-01-23
https://www.biorxiv.org/content/10.1101/2020.12.01.405894v4#comment-5888158699,biorxivstage,0,"This dataset looks pretty interesting, and I like the basic analysis provided in the manuscript. Figures 3B and 3C (PCA of smRNA-Seq and CAGE-Seq) appear to be identical. Can the authors please double check this?",2022-06-14T23:48:19,disqus_XkRikNMGsL,Brad Friedman,10.1101/2020.12.01.405894,A multi-omics dataset for the analysis of Frontotemporal Dementia genetic subtypes,"Kevin Menden, Margherita Francescatto, Tenzin Nyima, Cornelis Blauwendraat, Ashutosh Dhingra, Melissa Castillo-Lizardo, Noémia Fernandes, Lalit Kaurani, Deborah Kronenberg-Versteeg, Burcu Atasu, Eldem Sadikoglou, Barbara Borroni, Salvador Rodriguez-Nieto, Javier Simon-Sanchez, Andre Fischer, David Wesley Craig, Manuela Neumann, Stefan Bonn, Patrizia Rizzu, Peter Heutink",2022-06-09
