comment url,comment forum,comment keywords,comment message,comment date,comment username,comment name,paper doi,paper title,paper authors,paper date
https://www.biorxiv.org/content/10.1101/2021.08.10.455821v2#comment-5805933205,biorxivstage,0,Our work has been accepted by Briefings in Bioinformatics here: https://doi.org/10.1093/bib....,2022-03-25T15:14:03,wenjingma,Wenjing Ma,10.1101/2021.08.10.455821,LRcell: detecting the source of differential expression at the sub-cell type level from bulk RNA-seq data,"Wenjing Ma, Sumeet Sharma, Peng Jin, Shannon L. Gourley, Zhaohui Qin",2021-09-25
https://www.biorxiv.org/content/10.1101/2022.01.21.477302v1#comment-5805844361,biorxivstage,0,and also if you used the one with a C or U at postion 25,2022-03-25T13:52:01,nikolaj_koch,Nikolaj Koch,10.1101/2022.01.21.477302,Virus-assisted directed evolution of enhanced suppressor tRNAs in mammalian cells,"Rachel E. Kelemen, Delilah Jewel, Rachel L. Huang, Zeyu Zhu, Xiaofu Cao, Muhammad Pasha, Jon Anthony, Tim van Opijnen, Abhishek Chatterjee",2022-01-22
https://www.biorxiv.org/content/10.1101/2022.01.21.477302v1#comment-5805835569,biorxivstage,0,"Hi guys, could specify were you got your tRNA structure from in Figure 2a since the base 25 is a C in your case but for mazei or barkeri wildtype you have a U there. Best, Niko",2022-03-25T13:43:20,nikolaj_koch,Nikolaj Koch,10.1101/2022.01.21.477302,Virus-assisted directed evolution of enhanced suppressor tRNAs in mammalian cells,"Rachel E. Kelemen, Delilah Jewel, Rachel L. Huang, Zeyu Zhu, Xiaofu Cao, Muhammad Pasha, Jon Anthony, Tim van Opijnen, Abhishek Chatterjee",2022-01-22
https://www.biorxiv.org/content/10.1101/2022.03.08.482778v1#comment-5805807101,biorxivstage,2,"While it is difficult to judge the content based on an abstract, Prof. Bruce has kindly shared a preprint with us. The paper shows that Desmodium releases volatiles, as we also demonstrate. However, it is quite apparent from their data that it does not do so constitutively: the various extracts that were used were highly variable in release rates, which is typical for induction. The high levels of green-leaf volatiles reported, which were absent in our samples, are also a telltale sign of damage. In the paper, maize also released some volatiles, indicating some above or below ground herbivore induction too. But, without the critical data on volatile release following controlled herbivore damage (i.e. a positive control) or internal standards, it is difficult to assess the results. In contrast, our carefully collected data shows that when unchallenged, neither Desmodium, nor maize release volatiles. We have analyzed hundreds of samples from various geographic locations (Sweden, Tanzania, Uganda, South Africa), from the greenhouse and the field, using different soils and microbial augmentations, using entrainments as well as SPME. All these samples, without exception, show that undamaged Desmodium does not release the reported ‘push’ volatiles constitutively (monoterpenes and sesquiterpenes), while Melinis does constitutively release a diversity of terpenes in very large quantities. As we know, plants generally do not release volatiles constitutively. Some do, often through glandular trichomes (e.g. Melinis), which Desmodium lacks. Upon induction Desmodium indeed releases volatiles, but it is low compared to induced maize and Melinis. Between brackets, the above also shows that differences in methodology (SPME versus entrainments) can explain the differences between the studies, which was perhaps implied by Prof. Bruce’s comment. However, most significant is that our large number of field collections demonstrate that Desmodium rarely and minimally releases volatiles in the field, whereas maize releases substantial amounts and a large diversity. If Desmodium would be repellent, evidently maize would do a much better job. But indeed, our data also show that whole Desmodium plants did not repel S. frugiperda from ovipositing on maize at all. Our research provides the first experimental evidence that Desmodium does not constitutively release volatiles, and only minimally and unreliably in the field, where there may be herbivory. This is very different from what has been suggested over the last two decades (in the absence of data), and implies that the pest suppressive role of Desmodium is due to other mechanisms. We provide such an alternative mechanism: Desmodium is a catch crop that truncates larval development and kills insects. Such observations have been made in the somewhat grey literature data, with even vertebrates found to be captured by Desmodium. Obviously, how the mechanism exactly plays out in the field under various conditions needs further detailed field studies. Knowing the exact mechanisms of pest suppression is critical to further improve the maize intercropping system, and to rationally translate the urgently needed sustainable pest suppressive intercropping methods in other cropping systems. We are keen on researching the interplay of mechanisms together. Teun Dekker",2022-03-25T13:13:16,teundekker,Teun Dekker,10.1101/2022.03.08.482778,"The push-pull intercrop Desmodium does not repel, but intercepts and kills pests","Anna Laura Erdei, Aneth Bella David, Eleni C. Savvidou, Vaida Džemedžionaitė, Advaith Chakravarthy, Béla Péter Molnár, Teun Dekker",2022-03-08
https://www.biorxiv.org/content/10.1101/2020.08.28.262550v3#comment-5805782854,biorxivstage,0,"This manuscript has been published under a new title and in a revised form: Livermore, J.J.A., Holmes, C.L., Moga, G. et al. A single oral dose of citalopram increases interoceptive insight in healthy volunteers. Psychopharmacology (2022). https://doi.org/10.1007/s00...",2022-03-25T12:45:09,danielcampbellmeiklejohn,Daniel Campbell-Meiklejohn,10.1101/2020.08.28.262550,Serotonergic Effects on Interoception,"James J A Livermore, Clare L Holmes, Gyorgy Moga, Kristian Adamatzky, Hugo D Critchley, Sarah N Garfinkel, Daniel Campbell-Meiklejohn",2021-01-14
https://www.biorxiv.org/content/10.1101/2022.03.09.483685v2#comment-5805686233,biorxivstage,0,"This study does not describe the tested population characteristics, number of participants or exclusion criteria used (as is the case with previous published research of Sudarshan Kriya). Nine published studies of adverse effects over 15 years are not acknowledged or referenced here. These omitted studies are known to the author's institution 'Sri Sri Institute for Advanced Research' and are cited in and form the basis of their partner organisation's Art of Living online Health Policy for paid participants to learn their trademarked Sudarshan Kriya. Adverse effects are described there by Clinical Psychiatrists Dr Gerbarg and Dr Brown after observing 200+ people after 2004 tsunami and describe as contraindications the following; PTSD with significant dissociative symptoms, Dissociative Identity Disorder, bipolar disorder, schizophrenia, seizure disorders, psychosis. Previous published research describing the health benefits of Sudarshan Kriya further omit the 9 published studies which describe these adverse effects however typically employ a variety of exclusion criteria for the purpose of their research which are based on the adverse effects described in those omitted studies.",2022-03-25T10:19:30,meditatenotdissociate,meditate not dissociate,10.1101/2022.03.09.483685,Electroencephalographic dynamics of rhythmic breath-based meditation,"Vaibhav Tripathi, Lakshmi Bhasker, Chhaya Kharya, Manvir Bhatia, Vinod Kochupillai",2022-03-24
https://www.biorxiv.org/content/10.1101/2022.03.18.484948v1#comment-5805409535,biorxivstage,1,That's a very good point! We expect the artificiality of the treadmill to indeed play a role in the effects that we see. Thanks for your feedback!,2022-03-25T01:19:36,elenipatelaki,Eleni Patelaki,10.1101/2022.03.18.484948,Young adults who improve performance during dual-task walking show more flexible reallocation of cognitive resources: A Mobile Brain-Body Imaging (MoBI) study,"Eleni Patelaki, John J. Foxe, Kevin A. Mazurek, Edward G. Freedman",2022-03-20
https://www.biorxiv.org/content/10.1101/2021.12.13.472426v1#comment-5805288608,biorxivstage,0,"Hi Miguel, congratulations on such a nice and expansive study. I quickly glanced through your manuscript and am intrigued by supplementary Figure 12. It looks to me that in some cell types Yap (transcript?) level correlates extraordinarily well with total transcript level (if I understood those panels correctly) whereas in others there is no correlation at all. This pattern is not seen with Myc or Mtor. I am wondering if these data suggest that the correlation between Yap and hypertranscription is selective for cell-type, whereas Mtor (and maybe Myc) is more generic. Furthermore, YAP protein activity/stability is highly regulated, which may also affected your analysis, which I assume is based on transcript levels. For the ChEA data analysis, I wonder whether YAP's preferential binding for enhancers (versus Myc for promoters) may have an effect on the result.",2022-03-24T22:51:01,xinweicao,Xinwei Cao,10.1101/2021.12.13.472426,Absolute Scaling of Single-Cell Transcriptomes Reveals Pervasive Hypertranscription in Adult Stem and Progenitor Cells,"Yun-Kyo Kim, Miguel Ramalho-Santos",2021-12-13
https://www.biorxiv.org/content/10.1101/861260v1#comment-5804928283,biorxivstage,0,"Hello, your research intrigues me. To think that worker bees and queen bees are not only distinct in their roles within the colony and their biology, but also display diverging gut microbiomes specific to the ecological niche to which it resides and thus a varying metabolism is quite fascinating. I do have some questions concerning quality control of your methods, though. What was the PCR target region, and how many PCR cycles were run? Minimizing the number of rounds of PCR reduces the sequencing error rate and fraction of chimeric sequences. I did see that you used universal primers to amplify the V4 region of the 16sRNA gene. Likewise, your methods section mentions quality filtering with VSEARCH, but other specifics are limited. I appreciate you considering both the dominant and rare taxa appropriately, and your handling and preparation of samples prior to DNA extraction was spot on. Further, OTU abundance was calculated by mapping the total quality-filtered paired reads to the final clusters, with the resulting abundances normalized by the total 16s rRNA gene copy numbers as estimated through qPCR, and differences in copy numbers across samples were evaluated with an aligned Rank Transformation of a Factorial Model with the R package ARTool. This method was explained well and is thorough. What about measuring sequencing coverage of the communities? Also, I did not see any mention of internal standards at the PCR step or the DNA extraction step. While I did see that resulting sequence reads were quality-trimmed, what was the total number of sequences obtained per sample and how many after quality filtering (and what criteria are used for quality filtering)? Thank you in advance, as I look forward to hearing back from you.",2022-03-24T17:28:30,disqus_sKGT69OJhz,Amanda Walton,10.1101/861260,Acetobacteraceae in the honey bee gut comprise two distant clades with diverging metabolism and ecological niches,"G Bonilla-Rosso, C Paredes Juan, S Das, KM Ellegaard, O Emery, M Garcia-Garcera, N Glover, N Hadadi, JR van der Meer, SAGE class 2017-18, F Tagini, P Engel",2019-12-06
https://www.biorxiv.org/content/10.1101/2022.03.21.485153v1#comment-5804843429,biorxivstage,0,"Figure 6: Microrheological properties of bladder cancer cells. Storage G' (filled points) and loss modulus G"" (empty points) plotted as a function of oscillation frequency. Black: untreated. Red: treated with 5 uM cytochalasin D. The oscillation amplitude was 50 nm, and the frequency varied from 1-100 Hz for single cells- (A, D, G) and monolayers (B, E, H) and 1-250 Hz for the spheroids (C, F, I). Lines represent fits of the power-law function to the obtained data.",2022-03-24T16:12:37,kanjikajangi,Kanji Kajangi,10.1101/2022.03.21.485153,Nanomechanical and microrheological properties of bladder cancer cells at cellular and spheroid levels,"Kajangi Gnanachandran, Sylwia Kędracka-Krok, Joanna Pabijan, Małgorzata Lekka",2022-03-22
https://www.biorxiv.org/content/10.1101/2022.03.23.485489v1#comment-5804570517,biorxivstage,0,Reading notes from Forderer et al. Sr35 resistosome. See Twitter thread. https://twitter.com/KamounL...,2022-03-24T11:26:05,kamounlab,kamounlab,10.1101/2022.03.23.485489,A wheat resistosome defines common principles of immune receptor channels,"Alexander Förderer, Ertong Li, Aaron Lawson, Ya-nan Deng, Yue Sun, Elke Logemann, Xiaoxiao Zhang, Jie Wen, Zhifu Han, Junbiao Chang, Yuhang Chen, Paul Schulze-Lefert, Jijie Chai",2022-03-23
https://www.biorxiv.org/content/10.1101/2022.03.18.484948v1#comment-5804269511,biorxivstage,0,"Really interesting study, I enjoyed reading this paper. I am surprised however that no mention is made of the possible influence of the treadmill on these effects. We have shown that both dual-task costs and task prioritization differ between overground and treadmill walking in healthy adults and therefore, presumably, their ability to reallocate resources. I would expect this to have some implication for these findings.",2022-03-24T01:19:50,james_wrightson,James Wrightson,10.1101/2022.03.18.484948,Young adults who improve performance during dual-task walking show more flexible reallocation of cognitive resources: A Mobile Brain-Body Imaging (MoBI) study,"Eleni Patelaki, John J. Foxe, Kevin A. Mazurek, Edward G. Freedman",2022-03-20
http://www.biorxiv.org/content/early/2017/06/29/092304#comment-5804146411,biorxivstage,1,"The commentary is sorted into a question and answer format for ease of writing. 1. What is the PCR target region, primers used, # of cycles? The PCR target region was V4 and 30 cycles were run. The primers used were never listed. The article also failed to provide the temperatures and duration of the cycles. 2. Does the bioinformatics method include steps to minimize PCR errors and chimeras? The “quality screening” in mothur should be explicit as to the filtering procedures. 3. Given that microbial communities are uneven and dominated, does the analysis focus on the dominant taxa, and consider the rate taxa appropriately? The relative abundance of C. diff was shown in supp fig 2, but no data or analysis of dominate taxa was given. 4. How are samples taken and handled before DNA extraction? Mice were given antibiotics and orally given C. difficile spores, then cecal samples were removed from their corpses. The cecal samples were then ground in a mortar and stored at -80 degrees. 5. Are OTU abundances corrected for variance in 16S copy number and for variances in genome size? No. 6. Is sequencing coverage of the communities measured and it is complete? No coverage measures were mentioned. # of sequence per sample not given. No rarefaction curves shown. 7. Does the PCR step contain internal standards? the DNA extraction step? the sequencing step? No, none of the three steps contained internal standards. 8. Is the sampling strategy well described and appropriate for the microbiome of interest? Yes, a description can be found in question 2, and it is appropriate for the microbiome. 9. Can you see total number of sequences obtained per sample and how many after quality filtering (and what criteria are used for quality filtering)? No and filtering steps were not described in detail. 10. 16S profile is normalized. Does the study also use some method to quantify total bacterial numbers, like qPCR or culture? The study measures bacterial metabolites as a quantification method. Additional Comments: The experiment lacked an obvious control group. The method of chimera screening was not stated, only the database used.",2022-03-23T22:47:26,trey_baker,Trey Baker,10.1101/092304,Clostridium difficile colonizes alternative nutrient niches during infection across distinct murine gut microbiomes,"Matthew L. Jenior, Jhansi L. Leslie, Vincent B. Young, Patrick D. Schloss",2017-06-29
https://www.biorxiv.org/content/10.1101/2022.02.22.481457v1#comment-5803808074,biorxivstage,0,This has now been published in Metabolites: https://doi.org/10.3390/met...,2022-03-23T17:36:36,disqus_6QZRSMAq3a,Joram,10.1101/2022.02.22.481457,MetaboListem and TABoLiSTM: Two Deep Learning Algorithms for Metabolite Named Entity Recognition,"Cheng S. Yeung, Tim Beck, Joram M. Posma",2022-02-23
https://www.biorxiv.org/content/10.1101/2021.07.29.454155v1#comment-5803720608,biorxivstage,0,"Did the authors not see our reviews? The statistics are wrong in Fig 5, but the published version made ZERO effort to fix this problem. Very disappointing.",2022-03-23T16:24:04,disqus_kKyMzL7lX1,Sam Lord,10.1101/2021.07.29.454155,Vimentin Intermediate Filaments and Filamentous Actin Form Unexpected Interpenetrating Networks That Redefine the Cell Cortex,"Huayin Wu, Yinan Shen, Suganya Sivagurunathan, Miriam Sarah Weber, Stephen A. Adam, Jennifer H. Shin, Jeffrey J. Fredberg, Ohad Medalia, Robert Goldman, David A. Weitz",2021-07-29
https://www.biorxiv.org/content/10.1101/2020.09.30.320317v3#comment-5803594241,biorxivstage,0,"The methods to this experiment are very well thought out but can use clarification in certain areas to aid in the reproducibility and accuracy of the science behind your data collection. The DNA extraction, amplification and sequencing steps utilize many internal standards and controls to ensure that each step is accurately producing the desired outcomes. The PCR amplification step utilizes 35 cycles which is quite high and can lead to the introduction of more errors within the DNA that is amplified therefore reducing the number of cycles to 25 would be beneficial in avoiding this possibility. The sequencing step on an Illumina MiSeq platform using the MiSeq Reagent Kit v3 300PE is normalized but fails to convey the number of reads that are taken per sample as well as what program is being used to randomly draw each sample. Next, further explanation of how the number of overlapping random OTUs between all pairs of compartments are calculated and why was this step repeated a 10,000 times. Often data sets that have a very large sample size can produce data that appears to be normally distributed but is actually not therefore it is important to determine the effective sample size sample of 10000 to determine the normality of the collected data. A Shapiro wilks test for normality will be useful determining the normality of your data. For statistical analysis, a chi squared test is used to determine the significance of the highest number of random overlapping OTUs among the 10,000 permutations against the number of observed overlapping OTUs for that pair of compartments but there is no mention of an analysis of Alpha, Beta or gamma diversity among the sampled microbiome as well as a designation of goods coverage. To further analyze the soil microbiome, a quantification of the total bacteria community can be done using qPCR or culturing techniques in order to determine the abundance of the bacteria and their mechanisms used to manipulate the community’s ecology. #SHSU3594",2022-03-23T14:34:58,jonathoncorral,Jonathon Corral,10.1101/2020.09.30.320317,Soil microbial diversity impacts plant microbiota more than herbivory,"Antonino Malacrinò, Alison J. Karley, Leonardo Schena, Alison E. Bennett",2021-04-26
https://www.biorxiv.org/content/10.1101/2020.06.16.155226v3#comment-5803558071,biorxivstage,1,"The first comment I have pertains to the antibiotic treatment that the ABX mice received. In the study the mice were given water that contained four different antibiotics. Is this combination of antibiotics truly representative of what is given to human patients. Do human patients receive this strong antibiotic treatment for the same two week duration? The next comments I have apply to the 16S rDNA sequencing methodology. For stool collection, I would provide more details about if the mice were sacrificed in order collect stool samples or if stool was simply collected from the cage. As mice are known to be coprophagic. Adding an internal standard step for the DNA extraction step would help confirm that there are no errors with the DNA extraction method. I would also include the forward and reverse primers and primer sequences that were used for your study. The number of sequences per sample and total number of sequences is a detail that should also be found within this section.  If and how PCR errors and chimeras were addressed is another addition to consider. With this, I would include the specific program for this step (i.e. ChimeraSlayer).  I would include whether or not there was a step conducted to address the sequencing coverage of your samples. Inclusion of PCR details such as the number cycles, temperature, and time is a detail that should be included. Clarification of how taxa diversity and abundance were decided would be beneficial for the reader. Were Operational Taxonomical Units, OTUs, created for the calculation of alpha and beta diversity. If so, what was the similarity threshold set at for forming OTUs. There should also be inclusion if OTUs abundance was corrected for 16S copy number and genome size.",2022-03-23T14:02:25,,Marcus,10.1101/2020.06.16.155226,Disruption of the gut microbiota attenuates epithelial ovarian cancer sensitivity to cisplatin therapy,"Laura M. Chambers, Emily L. Esakov, Chad Braley, Lexie Trestan, Zahraa Alali, Defne Bayik, Justin D. Lathia, Naseer Sangwan, Peter Bazeley, Amy S. Joehlin-Price, Mohammed Dwidar, Adeline Hajjar, Philip P. Ahern, Jan Claesen, Peter Rose, Roberto Vargas, J. Mark Brown, Chad Michener, Ofer Reizes",2022-02-08
https://www.biorxiv.org/content/10.1101/2022.01.21.477271v1#comment-5803334120,biorxivstage,0,"Great article, congratulations. Could you also share the supplementary tables? Thank you.",2022-03-23T08:32:38,,Julieta Alfonso,10.1101/2022.01.21.477271,Human glioblastoma cell motility depends on the activity of the cysteine metabolism enzyme 3-Mercaptopyruvate sulfurtransferase,"Mirca S. Saurty-Seerunghen, Thomas Daubon, Léa Bellenger, Virgile Delaunay, Gloria Castro, Joris Guyon, Ahmed Rezk, Sylvie Fabrega, Ahmed Idbaih, Fabien Almairac, Fanny Burel-Vandenbos, Laurent Turchi, Thierry Virolle, Jean-Michel Peyrin, Christophe Antoniewski, Hervé Chneiweiss, Elias A. El-Habr, Marie-Pierre Junier",2022-01-23
https://www.biorxiv.org/content/10.1101/2021.09.18.460647v1#comment-5803270643,biorxivstage,1,"Addressed to the writers, Overall, the research is extremely strong and interesting, but there are some things that might improve the paper before publication as well as some personal questions to learn more about the choices in the methods. Grammar throughout the paper can be improved, this can easily be done by a third-party program such as Grammarly or within Word program.  Beta diversity was explained in detail and was well received but I was unable to find data bout alpha diversity. I will propose the following questions to personally learn more about the research as well as they may aid in expanding on the data: Were there any internal steps to preserve the samples? How were the singletons and doubletons dealt with? Were the patients screened for other diseases that may impact the gut microbiome? Such as diabetes, inflammatory bowel disease, or irritable bowel syndrome. How were the methods for sequencing the V4 hypervariable region of the 16s rRNA gene adapted? How many cycles were there in the qPCR step? I hope these questions aid in the progress of the research, Best Regards, Sebastian Juarez",2022-03-23T05:55:17,sebastianjuarezcasillas,Sebastian Juarez Casillas,10.1101/2021.09.18.460647,Diet-derived metabolites and mucus link the gut microbiome to fever after cytotoxic cancer treatment,"Zaker Schwabkey, Diana H. Wiesnoski, Chia-Chi Chang, Wen-Bin Tsai, Dung Pham, Saira S. Ahmed, Tomo Hayase, Miriam R. Ortega Turrubiates, Rawan K. El-Himri, Christopher A. Sanchez, Eiko Hayase, Annette C. Frenk Oquendo, Takahiko Miyama, Taylor M. Halsey, Brooke E. Heckel, Alexandria N. Brown, Yimei Jin, Philip L. Lorenzi, Marc O. Warmoes, Lin Tan, Alton G. Swennes, Vanessa B. Jensen, Christine B. Peterson, Kim-Anh Do, Liangliang Zhang, Yushu Shi, Yinghong Wang, Jessica R. Galloway-Pena, Pablo C. Okhuysen, Carrie R. Daniel-MacDougall, Yusuke Shono, Marina Burgos da Silva, Jonathan U. Peled, Marcel R.M. van den Brink, Nadim Ajami, Jennifer A. Wargo, Gabriela Rondon, Samer A. Srour, Rohtesh S. Mehta, Amin M. Alousi, Elizabeth J. Shpall, Richard E. Champlin, Samuel A. Shelburne, Jeffrey J. Molldrem, Mohamed A. Jamal, Jennifer L. Karmouch, Robert R. Jenq",2021-09-18
