comment url,comment forum,comment keywords,comment message,comment date,comment username,comment name,paper doi,paper title,paper authors,paper date
https://www.biorxiv.org/content/10.1101/2023.11.08.566158v1#comment-6348952147,biorxivstage,3,"Ong et al. 2023 present an image analysis pipeline for 3D cell culture data. They use this pipeline to segment single cells and extract both single-cell and 3D-based features. The authors also pursue three application experiments, in which they expose cells to osmotic stress, topology modifications, and different gravity forces. We read this paper as part of a journal club, and have decided to compile a collective review and publicly share it with the authors. This was inspired by the Arcadia Science Preprint Review Pizza Party Initiative, and this represents our third preprint review. Overall, our review focuses on the need for additional clarity, strengthening methodological justifications, and an increased discussion about potential implications of the findings and techniques used. We provide several specific comments below: - The authors discuss “database architecture” (line 99, and throughout) but they do not provide any additional details on the architecture nor the technology used. Without these details, it is difficult to understand the role and functionality of the database in relation to the pipeline. - The authors describe their pipeline effectively, but they do not disclose any potential limitations or challenges. How user-friendly is the pipeline? Is it reproducible and interpretable? Will the pipeline work with other spheroid or organoid types? - The pipeline tool describes the power of flexibility. Users can enrich the database with additional features of their choice, but what benefit does this flexibility provide? Does having more features improve results? Does the software provide guidance to a user on how to decide these parameters? - The authors discuss that previous tools do not disclose compute time, but then they use a publicly available tool (StarDist) and report compute time. It is unclear how the authors improve compute time independently of these other tools. The authors also do not benchmark the full run time and resource usage of their framework. - The authors extensively discuss quality control, but they do not describe any impact of uneven illumination on the cell images. Do the images suffer from uneven illumination? Would illumination correction improve segmentation and feature extraction? - It appears that the authors are actually using spheroids and not organoids, but the terms are used interchangeably, which could be misleading. - The authors should consider making OrganoProfiler open source to increase community impact, and the authors should properly cite other open source software like VTAE and KNIME. Many other software tools are properly cited, thank you! - In line 546, the authors state: “...realistic simulated 3D image data…” but details on how they created the images and indicators if the simulation worked are lacking. Similarly, because the model was trained on these simulated images, how do the authors understand and trust accuracy metrics? - In line 610 the authors state: “In each image, an expert counted the nuclei that were missing and those with a significant precision issue in their contours, which exceeded 30% of the total nucleus area.” It is unclear why the authors chose precision over other metrics (e.g., IoU). Also, what were the expected error rates of the expert annotator and how might this impact performance interpretation? - We had several comments about clarity and claims that the paper makes in the discussion. The paper states: “Overall, our approach demonstrates a powerful and efficient methodology for imaging, analyzing, and extracting biological information from 3D cellular microsystems.” These are a lot of different focus areas, and it is not clear in which area the tool specifically innovates. Furthermore, the authors state that “large amounts of data can be analyzed with their approach”, but there are no benchmarking or resource usage details. Additionally, the authors state that they have developed a “groundbreaking method” but it is not clear what the authors are doing differently than what is already known/standard practice. Is it the collection of tools in a framework? Lastly, the authors declare no conflict of interests, but it is unclear how QuantaCell might factor in. For example, is QuantaCell a private company selling the software presented here? - We have several specific comments on select figures: Figure 1: The authors segment cytoplasm with Actin, but this may not be the best stain for all cell types. How would a user determine which cytoplasm stain to use if Actin is not a good option or is unavailable? Figure 2d is not mentioned in the text, and there is a typo in the y axis “median z-plan” Figure 3: The authors need to state how many organoids they used for the roundness analysis in Figure 3a - if this shows a single organoid then this approach may not be generalizable. Figure 3b says “2 distinct organoids per condition”, but there are only two curves. Showing one curve per organoid would help determine generalizability. Figure 3c depicts 10 organoids but the authors do not specify how they were selected Figure 4: Could the changes in cellular topology and morphology be due to the changes in oxygen exchange in the molds? Figure 5: Methodological details on measurements would help us understand what was transformed via PCA? Additionally, more details on controls are needed. We also have concerns about extensive user modification of data. We suggest making these modifications transparent and public. Without access to software it will be difficult to determine how the software works given that the data are modified.Without access to software it will be difficult to determine how the software discourages this practice. Also, the authors show only PC1; what is the expected explained variance of PC1? What signals are left in the other components? We could not find Supplementary Video 1, which is referenced in the text Collective review performed by: Gregory P. Way, PhD, University of Colorado, Department of Biomedical Informatics Erik Serrano Jenna Tomkinson Dave Bunten Michael J. Lippincott Cameron Mattson",2023-12-20T20:44:07,gregoryway,Gregory Way,10.1101/2023.11.08.566158,Digitalized organoids: integrated pipeline for 3D high-speed analysis of organoid structures using multilevel segmentation and cellular topology,"Hui Ting Ong, Esra Karatas, Gianluca Grenci, Florian Dilasser, Saburnisha Binte Mohamad Raffi, Damien Blanc, Titouan Poquillon, Elise Drimaracci, Dimitri Mikec, Cora Thiel, Oliver Ullrich, Victor Racine, Anne Beghin",2023-11-08
https://www.biorxiv.org/content/10.1101/2023.12.18.572249v1#comment-6348863648,biorxivstage,0,"our lab works on DNA replication initiation and we looked into the ""neighbor network graph"" for several key proteins in this process and I am sad to say that those graphs do not capture the well known protein-protein interaction networks. I am curious if there is a way to ""filter"" the results for the interactions with the highest significance/confidence. I am happy to talk about it with the authors if they're interested. Gheorghe Chistol, Assistant Prof. Stanford Chemical and Systems Biology",2023-12-20T18:45:20,georgechistol,George Chistol,10.1101/2023.12.18.572249,Global organelle profiling reveals subcellular localization and remodeling at proteome scale,"Marco Y. Hein, Duo Peng, Verina Todorova, Frank McCarthy, Kibeom Kim, Chad Liu, Laura Savy, Camille Januel, Rodrigo Baltazar-Nunez, Sophie Bax, Shivanshi Vaid, Madhuri Vangipuram, Ivan E. Ivanov, Janie R. Byrum, Soorya Pradeep, Carlos G. Gonzalez, Yttria Aniseia, Eileen Wang, Joseph S. Creery, Aidan H. McMorrow, James Burgess, Sara Sunshine, Serena Yeung-Levy, Brian C. DeFelice, Shalin B. Mehta, Daniel N. Itzhak, Joshua E. Elias, Manuel D. Leonetti",2023-12-18
https://www.biorxiv.org/content/10.1101/2022.10.06.510405v2#comment-6348212159,biorxivstage,1,"This preprint has not undergone peer review or any post-submission improvements or corrections. The Version of Record of this article is published in Nature Communications, and is available online at https://doi.org/10.1038/s41...",2023-12-19T21:57:32,amandajanesick,Amanda Janesick,10.1101/2022.10.06.510405,"High resolution mapping of the breast cancer tumor microenvironment using integrated single cell, spatial and in situ analysis of FFPE tissue","Amanda Janesick, Robert Shelansky, Andrew D. Gottscho, Florian Wagner, Morgane Rouault, Ghezal Beliakoff, Michelli Faria de Oliveira, Andrew Kohlway, Jawad Abousoud, Carolyn A. Morrison, Tingsheng Yu Drennon, Seayar H. Mohabbat, Stephen R. Williams, 10x Development Teams, Sarah E.B. Taylor",2022-11-03
https://www.biorxiv.org/content/10.1101/2022.10.06.510405v1#comment-6348183239,biorxivstage,1,"This preprint has not undergone peer review or any post-submission improvements or corrections. The Version of Record of this article is published in Nature Communications, and is available online at https://doi.org/10.1038/s41...",2023-12-19T21:15:00,amandajanesick,Amanda Janesick,10.1101/2022.10.06.510405,"High resolution mapping of the breast cancer tumor microenvironment using integrated single cell, spatial and in situ analysis of FFPE tissue","Amanda Janesick, Robert Shelansky, Andrew Gottscho, Florian Wagner, Morgane Rouault, Ghezal Beliakoff, Michelli Faria de Oliveira, Andrew Kohlway, Jawad Abousoud, Carolyn Morrison, Tingsheng Yu Drennon, Syrus Mohabbat, Stephen Williams, 10x Development Teams, Sarah Taylor",2022-10-07
https://www.biorxiv.org/content/10.1101/2023.12.14.571730v1#comment-6348122048,biorxivstage,0,"Cool paper, but I think there's a small problem: In the Methods section you say you're using 0.125 mM PD0325901  and 0.375 mM CHIR99021 for mESC culture. Are you sure those concentrations are correct? They are 125 times higher than the typical concentrations (1 and 3 µM, see for example https://www.sciencedirect.c...)",2023-12-19T19:50:21,merrickpiersonsmela,Merrick Pierson Smela,10.1101/2023.12.14.571730,ChIP-DIP: A multiplexed method for mapping hundreds of proteins to DNA uncovers diverse regulatory elements controlling gene expression,"Andrew A. Perez, Isabel N. Goronzy, Mario R. Blanco, Jimmy K. Guo, Mitchell Guttman",2023-12-18
https://www.biorxiv.org/content/10.1101/2023.12.13.571314v1#comment-6347855504,biorxivstage,0,"N=2? Please explain how your results are ""direct and decisive""?",2023-12-19T13:40:24,disqus_6es1yFn79h,John Neuron,10.1101/2023.12.13.571314,Stable Cortical Body Maps Before and After Arm Amputation,"Hunter R. Schone, Roni O. Maimon Mor, Mathew Kollamkulam, Craig Gerrand, Alexander Woollard, Norbert V. Kang, Chris I. Baker, Tamar R. Makin",2023-12-14
https://www.biorxiv.org/content/10.1101/2021.06.25.449879v2#comment-6347749418,biorxivstage,0,"This article has been published by Nature Communications, DOI: https://doi.org/10.1038/s41...",2023-12-19T09:12:21,disqus_1my0l4tHrK,Thomas Tan,10.1101/2021.06.25.449879,Essential role of translation factor eIF5a in cytokine production and cell cycle regulation in primary CD8 T lymphocytes,"Thomas CJ Tan, Van Kelly, Xiaoyan Zhou, Tony Ly, Rose Zamoyska",2021-11-12
https://www.biorxiv.org/content/10.1101/2021.09.25.461815v3#comment-6347274288,biorxivstage,0,"I need to point out a mistake you made in reference to infrequent singing by Amazonian birds.  You say 'Some Amazonian species have been shown to sing as infrequently as twice in 50 days (Jirinec et al. 2018).' This is not correct- from the second sentence of the paper you cite: ' Tracking was spread over 23 discrete days during July and August 2017...'  The total number of days was 23, not 50.   It is true that the bird only vocalized twice while it was being located, but the paper also notes that it was tracked during daylight hours to determine its space use throughout the day.  In contradiction to the point you are trying to make, Grallaria varia seems to sing quite reliably before dawn (e.g. https://pstoufferbirds.file....  Thus it is not accurate at all to say that the species sings 'as infrequently as twice in 50 days.' I hope this clumsy interpretation of our anecdotal paper does not somehow get repeated as gospel. Phil Stouffer",2023-12-18T17:15:46,,Phil Stouffer,10.1101/2021.09.25.461815,Simultaneous passive acoustic monitoring uncovers evidence of potentially overlooked temporal variation in an Amazonian bird community,"W. Alexander Hopping, Christopher J. Sayers, Noe Roger Huaraca-Charca, Holger Klinck",2023-09-23
https://www.biorxiv.org/content/10.1101/2023.03.02.530854v1#comment-6346861799,biorxivstage,0,This paper was published in Science Advances in Ocotober 2023: DOI: 10.1126/sciadv.adh4819,2023-12-18T01:11:51,timstasevich,Tim Stasevich,10.1101/2023.03.02.530854,"Live-cell imaging uncovers the relationship between histone acetylation, transcription initiation, and nucleosome mobility","Matthew N. Saxton, Tatsuya Morisaki, Diego Krapf, Hiroshi Kimura, Timothy J. Stasevich",2023-03-03
https://www.biorxiv.org/content/10.1101/2023.11.14.566975v1#comment-6346235587,biorxivstage,0,"This is a nice paper, old effector but explore the function from a new angle. BUT, it is known that Nudix effectors is wildly spread in plant pathogen species, including oomycete, bacteria, and fungus. It appears authors do not mention and cite the early research.",2023-12-17T02:34:02,,Vivianne Zoe,10.1101/2023.11.14.566975,Plant pathogenic fungi hijack phosphate starvation signaling with conserved enzymatic effectors,"Carl L. McCombe, Alex Wegner, Chenie S. Zamora, Florencia Casanova, Shouvik Aditya, Julian R. Greenwood, Louisa Wirtz, Samuel de Paula, Eleanor England, Sascha Shang, Daniel J. Ericsson, Ely Oliveira-Garcia, Simon J. Williams, Ulrich Schaffrath",2023-11-14
