comment url,comment forum,comment keywords,comment message,comment date,comment username,comment name,paper doi,paper title,paper authors,paper date
https://www.biorxiv.org/content/10.1101/2022.05.18.492418v1#comment-5895425178,biorxivstage,3,"Review coordinated via ASAPbio’s crowd preprint review This review reflects comments and contributions by Ruchika Bajaj, Michael Robicheaux, Akihito Inoue, Justin Ouedraogo and Kunal Shah. Review synthesized by Ruchika Bajaj. The paper reports the use of an optimized computational model, GMMA, by preparing a randomly mutated protein library and screening the mutant library using an in-vivo genetic sensor for folding for successful protein engineering efforts. Here are a few points of feedback on the paper. 1. In the second paragraph of section, “Resilience towards mutations reflects thermodynamic stability”, the manuscript refers to the design of degenerate primers, “These were designed to cover the C-terminal half of edF106, amino acid residues 48-97”. Further explanation for designing degenerate primers for these specific positions would be helpful to the reader, for example by adding references from the literature. In the same paragraph, when mentioning the size of the library (10,000 - 20,000), it would be good to explain the reason for the specified size of this library. 2. The section, “GMMA analysis discovers stability effects”, mentions that, “Reliable stability effects could be assigned to 374 out of the 838 unique substitutions in the library”. Further explanation may be provided in this regard, for example to describe why/what variables could lead to unreliable stability scores for tested substitutions. 3. The study evaluated MM3 and MM6 combinations for the additivity of stability. It would be relevant to mention if other combinations like MM4 and MM5 were evaluated. 4. Fig 2b: more points could be taken on the steep regions. 5. For Supplementary Figures 4 and 5, please provide an explanation of curves or straight lines and explain the angle of fitted lines. 6. In the section “stability measurements validate GMMA”, in the sentence, “Thus, mutations which could be stabilizing in the fusion might behave differently outside of the CPOP context.”, would it be possible to elaborate more on this statement to clarify how the behavior may differ?. 7. Please indicate specific mutated amino acids in multiple mutants: MM3, MM6 and MM9, for comparison. 8. Please label residues in Figure 6b. 9. In the section, “Crystal structures show increased similarity to the 1FB0 design template”, the statement, “Only one or two would yield crystals indicative of a conformational change taking place in order to stabilize the crystal lattice.” Conformational change is questionable here, especially with low RMSD values. Would it be possible to elaborate on the statement or reframe it. 10. “showed much better agreement with its original design template spinach thioredoxin (PDB: 1FB0).” It may be helpful to provide some further context about this in the Introduction and conclusions sections. 11. In the section, “structure and sequence-based methods do not predict most stabilizing variants”, the text mentions the discrepancies in rosetta and GMMM. It may be relevant to provide some further discussion on what may be behind those discrepancies. 12. Although the mutated protein has been crystallized, a discussion on protein expression or oligomerization after the mutation and its relation to thermal stability would be helpful for the study. 13. A major point which has not been mentioned in this study is scoring of these mutations according to their function, functional aspects are important for the purpose of protein engineering and thus this could be relevant. It will also be good to correlate the stability of these mutants with its function to comprehend the protein engineering effort. 14. Minor point: In the section, “Initial library transformation”, please change “scraped off” to picked off. 15, Supplementary Table 4: Wilson B factor value is missing for eMM9. A possible explanation for the difference in the number of macromolecules in MM9 and eMM9 variants would be helpful. Is there a possibility of change in crystallographic oligomerization ? Any information regarding regions of protein where Ramachandran outliers are located would be helpful.",2022-06-22T20:32:02,iratxepuebla,Iratxe Puebla,10.1101/2022.05.18.492418,Increasing protein stability by inferring substitution effects from high-throughput experiments,"Rasmus Krogh Norrild, Kristoffer Enøe Johansson, Charlotte O’Shea, Jens Preben Morth, Kresten Lindorff-Larsen, Jakob Rahr Winther",2022-05-18
https://www.biorxiv.org/content/10.1101/2022.06.21.496935v1#comment-5895036753,biorxivstage,0,Simply no evidence ANY of these phage systems cause cell death. When did we stop seeking evidence for something before invoking it?,2022-06-22T13:39:06,Junco7777,Prof. T. K. Wood,10.1101/2022.06.21.496935,The coordination of innate and adaptive immunity in bacteria,"Clemente F. Arias, Francisco J. Acosta, Federica Bertocchini, Miguel A. Herrero, Cristina Fernández-Arias",2022-06-21
https://www.biorxiv.org/content/10.1101/2022.06.09.495436v1#comment-5894976062,biorxivstage,0,Highly significant research done by authors and this manuscript may encourage the researchers to develop precise strategies for treating the pan-resistant bacteria.,2022-06-22T12:18:53,disqus_0I6pTtauF4,shashi shekhar singh,10.1101/2022.06.09.495436,Rescue of transcriptional pausing in metabolic genes jumpstarts Salmonella antioxidant defenses,"Sashi Kant, James Karl A Till, Lin Liu, Ju-Sim Kim, Andres Vazquez-Torres",2022-06-09
https://www.biorxiv.org/content/10.1101/2022.04.28.489980v1#comment-5894806292,biorxivstage,1,This preprint has been published and a link will be forthcoming,2022-06-22T06:51:59,agustinarimondi,Agustina Rimondi,10.1101/2022.04.28.489980,Few amino acid mutations in H6 influenza A virus from South American lineage increase pathogenicity in poultry,"Agustina Rimondi, Valeria S. Olivera, Ivana Soria, Gustavo D. Parisi, Martin Rumbo, Daniel R. Perez",2022-04-29
https://www.biorxiv.org/content/10.1101/2021.12.03.471086v1#comment-5894798388,biorxivstage,0,Now published in eLife https://doi.org/10.7554/eLi...,2022-06-22T06:31:57,jakub_gemperle,Jakub Gemperle,10.1101/2021.12.03.471086,"DExCon, DExogron, LUXon: on-demand expression control of endogenous genes reveals differential dynamics of Rab11 family members","Jakub Gemperle, Thomas Harrison, Chloe Flett, Antony Adamson, Patrick Caswell",2021-12-03
https://www.biorxiv.org/content/10.1101/2021.05.07.443052v2#comment-5894036960,biorxivstage,3,"In the manuscript entitled: “Modelling the depth-dependent VASO and BOLD responses in human primary visual cortex”, the authors address one of the most important open research questions in the emerging field of human layer-fMRI. Namely, how neuroscientists should interpret functional MRI signals at very high spatial resolutions with respect to the underlying neuronal and vascular activation changes. This manuscript extends previously described models of the conventional BOLD fMRI contrast and augments it to incorporate the additional (partly orthogonal) information about blood volume changes. This advanced model makes it possible to provide a more comprehensive understanding of various compartments of the brain's vascular tree. The authors then uses a combination of self-acquired/self-analyzed cutting-edge layer-fMRI data, to investigate the model parameters and draw novel conclusions about both: (1) the plausible range of vascular features (e.g. CBVrest) and (2) the working principle and interpretability of common layer-fMRI acquisitions methods (GE-BOLD and VASO). Some of the most important take-home messages are: -> The modeling work confirms that GE-BOLD is contaminated by locally un-specific draining veins, while the VASO-method is mostly insensitive to those contaminations, as expected. -> Novel insights about the emerging VASO technique are: A) the VASO signal is partly coming from diving arterioles with reduced layer-specific localization specificity. B) the empirically measured CBV changes are somewhat plausible with a wide range of possible baseline CBV values. while preferring larger baseline values. Overall, I think it makes a lot of sense that the authors find the best correspondence of simulated and empirical data for larger baseline CBV values than previously assumed. These previously assumed values were based on ex-vivo data. And it is known that cadavers have less blood in the parenchyma (dead people are pale). -> This is the first comprehensive layer-fMRI VASO paper of the human primary visual system. While exploratory studies in previous publications have already implied the feasibility of layer-fMRI VASO in human V1 (Huber et al., 2021: Progress in Neurobiology), this manuscript is the first study to show its robust applicability across groups of participants. This has important implications for a large user base (readership of this journal). I am sure that many other layer-fMRI VASO users will soon jump on this brain too. I want to acknowledge that an earlier BioRxiv version of this manuscript was discussed in the Maastricht layer seminar. I want to acknowledge input of other seminar attendees for their insights in discussing this paper (particularly Faruk Gulban, Alessandra Pizzuti, and Sebastian Dresbach). I have reviewed as previous version of this manuscript as being part of a PhD Thesis containing a chapter (3) referring to this manuscript: https://espace.library.uq.e.... I want to thank my co-assessors for discussing this manuscript. My comments during the thesis viva are already included in this revised version of the manuskript (e.g. discussions about segmentation quality). Thus, I do not have any remaining major concerns about the manuscript. Though, I have two stylistic comments: -> In light of B1-inhomogeneities, potential inflow effects, BOLD contaminations and many other constraints, it is not trivial to set up a VASO sequence at 7T. Maybe it would be appropriate to cite the first VASO study at 7T (Hua et al. 2013, MRM, 10.1002/mrm.24334). -> When I had discussed figure 4 with my department head, he was suspicious whether or not a GM mask was applied to make the VASO results look like they are more specific to the GM. Maybe the authors can explicitly state in the figure caption if this was the case or not. I encourage the publication of the manuscript with great enthusiasm. Conflict of interest statement: I am in a loose collaboration with the second author Saskia Bollman: We share co-authorship as middle authors for the preprint by Faruk Gulban ( https://www.biorxiv.org/con.... I have myself invested a bit of effort to make layer-fMRI VASO feasible in V1 with Eli Merriam in 2018 ( https://layerfmri.com/ss-si.... I believe that the sequence protocol ( https://github.com/layerfMR... and data ( https://openneuro.org/datas... that I developed, has inspired the authors of this paper too. However, my collaborator has not yet found the time to publish our study. Thus, I am pleased that the feasibility of layer-fMRI VASO is shown in this paper, instead. I do not have mixed feelings that the credit goes to Queensland now, this is well deserved. _______________ as submitted to Journal",2022-06-21T13:46:13,renzohuber,Renzo Huber,10.1101/2021.05.07.443052,Modelling the depth-dependent VASO and BOLD responses in human primary visual cortex,"Atena Akbari, Saskia Bollmann, Tonima S Ali, Markus Barth",2021-10-17
https://www.biorxiv.org/content/10.1101/2022.05.13.491805v1#comment-5894013077,biorxivstage,0,"Hello authors, Thanks for making the genotype data available so quickly. A few points after running the data, copy pasting from my blog... - in terms of fine scale ancestry, the Erfurt Jews show enough variation to be divided into three or four clusters, as opposed to just two as per Waldman et al. - some of the Erfurt Jews show excess ""Mediterranean"" ancestry, while others excess ""North African"" ancestry, and this cannot be explained with ancestral populations similar to Lebanese and/or South Italians, but rather with significant gene flow from the western Mediterranean and possibly North Africa - several of the Erfurt Jews show relatively high levels of ""East Asian"" ancestry that cannot be explained with admixture from Russians, or even any Russian-like populations, because such populations almost lack this type of ancestry, and instead show significant ""Siberian"" admixture - as far as I can see, there are no correlations between any of the observations above and the quality of the samples. That is, low coverage doesn't appear to be causing the aforementioned excess ""Mediterranean"", ""North African"" and/or ""East Asian"" ancestry proportions. More at this link: https://eurogenes.blogspot.... Cheers, David Wesolowski",2022-06-21T13:17:37,disqus_Og9I1KoklL,Davidski,10.1101/2022.05.13.491805,Genome-wide data from medieval German Jews show that the Ashkenazi founder event pre-dated the 14th century,"Shamam Waldman, Daniel Backenroth, Éadaoin Harney, Stefan Flohr, Nadia C. Neff, Gina M. Buckley, Hila Fridman, Ali Akbari, Nadin Rohland, Swapan Mallick, Jorge Cano Nistal, Jin Yu, Nir Barzilai, Inga Peter, Gil Atzmon, Harry Ostrer, Todd Lencz, Yosef E. Maruvka, Maike Lämmerhirt, Leonard V. Rutgers, Virginie Renson, Keith M. Prufer, Stephan Schiffels, Harald Ringbauer, Karin Sczech, Shai Carmi, David Reich",2022-05-16
https://www.biorxiv.org/content/10.1101/2021.10.26.465926v1#comment-5893793835,biorxivstage,0,A truly elegant piece of work on the role of KIBRA in learning and memory. Congratulations to the team on combining evidence from rodent and human research and on interpreting GWAS data.,2022-06-21T06:16:50,andreaspapassotiropoulos,Andreas Papassotiropoulos,10.1101/2021.10.26.465926,KIBRA-PKCγ signaling pathway modulates memory performance in mice and humans,"Mengnan Tian, Qiang Chen, Austin R. Graves, Hana L. Goldschmidt, Richard C. Johnson, Daniel R. Weinberger, Richard L. Huganir",2021-10-28
https://www.biorxiv.org/content/10.1101/2022.03.10.483785v1#comment-5893792381,biorxivstage,0,In Figure 3h the figure legend is correct but in the actual figure you need to correct the colors. I.e. blue should be the local isotropic stress and red the change in the area of the hole!,2022-06-21T06:12:51,effiebastounis,Effie Bastounis,10.1101/2022.03.10.483785,Mechanical stress driven by rigidity sensing governs epithelial stability,"Surabhi Sonam, Lakshmi Balasubramaniam, Shao-Zhen Lin, Ying Ming Yow Ivan, Irina Pi Jaumà, Cecile Jebane, Marc Karnat, Yusuke Toyama, Philippe Marcq, Jacques Prost, René-Marc Mège, Jean-François Rupprecht, Benoît Ladoux",2022-03-12
https://www.biorxiv.org/content/10.1101/2022.03.26.485934v1#comment-5893754942,biorxivstage,0,There is no Figure legend in Fig1 and  p245 (which is appeared in Fig.1) in not found in Table 5 (plasmid list).,2022-06-21T04:30:22,kunioihara,Kunio Ihara,10.1101/2022.03.26.485934,Differences in homologous recombination and maintenance of heteropolyploidy between Haloferax volcanii and Haloferax mediterranei,"Ambika Dattani, Itai Sharon, Ella Shtifman-Segal, Shachar Robinzon, Uri Gophna, Thorsten Allers, Neta Altman",2022-03-27
https://www.biorxiv.org/content/10.1101/2020.10.19.346429v1#comment-5892749580,biorxivstage,0,Hello! Has this work eventually been published?:),2022-06-20T01:43:16,disqus_EOszpdSiAv,Artem B,10.1101/2020.10.19.346429,Phylostems: a new graphical tool to investigate temporal signal of heterochronous sequences at various evolutionary scales,"Anna Doizy, Amaury Prin, Guillaume Cornu, Frederic Chiroleu, Adrien Rieux",2020-10-21
https://www.biorxiv.org/content/10.1101/2022.06.14.496027v1#comment-5891814120,biorxivstage,0,"Nice article. However as a suggestion, you should expand the ADMET table as it is not covering all the ADMET properties. Also you can do metadynamics analysis of the trajectory (Free energy landscape, PCA, mode vector etc), MMGB/PBSA calculations, Network analysis of the residues, density distribution of RMSD/RMSF/RG, Binding pocket dynamics in terms of appearance/disappearance of pocket/change in pocket volume. Such kind of additional trajectory analysis will support your manuscript. Best Regards, Gagandeep Singh Assistant Research Officer CCRAS, Ministry of AYUSH, Gov. of India, Ph.D. Scholar KSBS, IIT Delhi gagan.sk.1994@gmail.com",2022-06-18T21:26:56,disqus_MKg7TlvYwQ,Gagandeep singh,10.1101/2022.06.14.496027,In Silico insight to identify Potential Inhibitors of BUB1B from Mushroom bioactive compounds to Prevent Breast cancer metastasis,"Divya Mishra, Ashish Mishra, M.P. Singh",2022-06-16
https://www.biorxiv.org/content/10.1101/2021.10.29.466462v1#comment-5891720126,biorxivstage,0,Published in Plos Genetics: https://doi.org/10.1371/jou...,2022-06-18T19:15:13,disqus_Nf6vqhKIlD,Alex Cope,10.1101/2021.10.29.466462,Intragenomic variation in mutation biases causes underestimation of selection on synonymous codon usage,"Alexander L. Cope, Premal Shah",2021-11-01
https://www.biorxiv.org/content/10.1101/2022.06.16.496444v1#comment-5891471792,biorxivstage,1,"Dear Yamaguchi et al, You write under Data accessibility : All code necessary to repeat the analysis described in this study have been made available. SLiM source codes of our model for speciation dynamics will be hosted on Dryad Digital Repository upon acceptance. There are no data to be archived. This is a publication, i.e. it is made public as part of the scientific record and is citable, thus I strongly invite you to make the corresponding source code available without delay.",2022-06-18T13:53:05,marcrobinsonrechavi,Marc RobinsonRechavi,10.1101/2022.06.16.496444,The phoenix hypothesis of speciation,"Ryo Yamaguchi, Bryn Wiley, Sarah P. Otto",2022-06-17
https://www.biorxiv.org/content/10.1101/2022.06.15.496131v1#comment-5890870039,biorxivstage,0,"After months' negotiation with the manufacturer, the Solution A, one of the key reagent of this protocol for the success of obtaining pure eccDNA, has become globally available now.",2022-06-17T19:18:38,yuangaowang,Yuangao Wang,10.1101/2022.06.15.496131,"eccDNA purification, full-length sequencing, and genomic mapping","Yuangao Wang, Meng Wang, Yi Zhang",2022-06-17
https://www.biorxiv.org/content/10.1101/2022.03.04.482978v1#comment-5890405946,biorxivstage,0,The peer reviewed version of this paper is now published in the Journal of Chemical Theory and Computation (JCTC). https://pubs.acs.org/doi/fu...,2022-06-17T09:46:09,nvanhilten,N van Hilten,10.1101/2022.03.04.482978,Efficient quantification of lipid packing defect sensing by amphipathic peptides; comparing Martini 2 &amp; 3 with CHARMM36,"Niek van Hilten, Kai Steffen Stroh, Herre Jelger Risselada",2022-03-05
https://www.biorxiv.org/content/early/2018/12/06/488825#comment-5890180418,biorxivstage,0,"A version of this article has been published with Scientific Reports, and is available here: https://doi.org/10.1038/s41...",2022-06-17T01:31:40,angierenton,Angie Renton,10.1101/488825,An open interface system for non-invasive brain-to-brain free communication between naïve human participants,"Angela I. Renton, Jason B. Mattingley, David R. Painter",2018-12-06
https://www.biorxiv.org/content/10.1101/2022.03.05.483098v1#comment-5889744771,biorxivstage,2,"Leading corresponding authors are not available for contact/comments No citation of our earlier studies on the tryptamine-related subject: https://pubmed.ncbi.nlm.nih... Tryptamine induces tryptophanyl-tRNA synthetase-mediated neurodegeneration with neurofibrillary tangles in human cell and mouse models https://pubmed.ncbi.nlm.nih... Diet-Related Metabolic Perturbations of Gut Microbial Shikimate Pathway-Tryptamine-tRNA Aminoacylation-Protein Synthesis in Human Health and Disease Abstract Human gut bacterial Na(+)-transporting NADH:ubiquinone reductase (NQR) sequence is associated with Alzheimer disease (AD). Here, Alzheimer disease-associated sequence (ADAS) is further characterized in cultured spore-forming Clostridium sp. Tryptophan and NQR substrate ubiquinone have common precursor chorismate in microbial shikimate pathway. Tryptophan-derived tryptamine presents in human diet and gut microbiome. Tryptamine inhibits tryptophanyl-tRNA synthetase (TrpRS) with consequent neurodegeneration in cell and animal models. Tryptophanyl-tRNA synthetase inhibition causes protein biosynthesis impairment similar to that revealed in AD. Tryptamine-induced TrpRS gene-dose reduction is associated with TrpRS protein deficiency and cell death. In animals, tryptamine treatment results in toxicity, weight gain, and prediabetes-related hypoglycemia. Sequence analysis of gut microbiome database reveals 89% to 100% ADAS nucleotide identity in American Indian (Cheyenne and Arapaho [C&A]) Oklahomans, of which ~93% being overweight or obese and 50% self-reporting type 2 diabetes (T2D). Alzheimer disease-associated sequence occurs in 10.8% of C&A vs 1.3% of healthy American population. This observation is of considerable interest because T2D links to AD and obesity. Alzheimer disease-associated sequence prevails in gut microbiome of colorectal cancer, which linked to AD. Metabolomics revealed that tryptamine, chorismate precursor quinate, and chorismate product 4-hydroxybenzoate (ubiquinone precursor) are significantly higher, while tryptophan-containing dipeptides are lower due to tRNA aminoacylation deficiency in C&A compared with non-native Oklahoman who showed no ADAS. Thus, gut microbial tryptamine overproduction correlates with ADAS occurrence. Antibiotic and diet additives induce ADAS and tryptamine. Mitogenic/cytotoxic tryptamine cause microbial and human cell death, gut dysbiosis, and consequent disruption of host-microbe homeostasis. Present analysis of 1246 participants from 17 human gut metagenomics studies revealed ADAS in cell death diseases. More links to our relevant published articles available and delivered to corresponding authors. Our earlier studies demonstrated that tryptamine induces glucose metabolism alterations in blood and in brain. Furthermore, human gut microbial tryptamine increases revealed in the human population with a high prevalence of diabetes. More references are at the web site: www.stopalzheimerstest.com I have more comments on this preprint.",2022-06-16T16:47:00,elenalpaley,Elena L. Paley,10.1101/2022.03.05.483098,Gut microbiota-derived tryptamine impairs insulin sensitivity,"Lixiang Zhai, Haitao Xiao, Chengyuan Lin, Yan Y. Lam, Hoi Leong Xavier Wong, Mengxue Gong, Guojun Wu, Yusheng Deng, Ziwan Ning, Chunhua Huang, Yijing Zhang, Min Zhuang, Chao Yang, Eric Lu Zhang, Ling Zhao, Chenhong Zhang, Xiaodong Fang, Wei Jia, Liping Zhao, Zhao-xiang Bian",2022-03-05
