comment url,comment forum,comment keywords,comment message,comment date,comment username,comment name,paper doi,paper title,paper authors,paper date
https://www.biorxiv.org/content/10.1101/2023.03.06.531268v1#comment-6150375497,biorxivstage,1,"Very interesting approach! I have a few questions/comments: 1. I am a bit confused by the approach for neighborhood definition: if I understand correctly you search for the w vector with the maximum absolute correlation with ∆g, and then you sort the cells along w. But why not instead just sort the cells according to ∆g? 2. If I understand correctly, the neighborhood is strongly driven by the two cells that define the v to which the selected w corresponds. Have you tested the robustness of the results to this choice? How would you go about testing that? For example, what happens if you remove all cells that belong to  the neighborhood defined for g and then run the process again? Are there no DEGs? Or maybe you can find a different neighborhood that represent cells that are affected by the contrasting variable in a different way as compared to the cells in the original neighborhood. 3. According to your understanding/experience what happens in cases where for a specific gene g and a specific contrast, there are two cell populations for which there is differential expression population A includes cells for which the expression increases by a lot and population B includes cells for which the expression increases by a little? What about if the signs are opposite (i.e. expression increases for population A and decreases for population B)? To clarify, when I say population, I am thinking of some cell type/state. 4. I think it would be helpful to explicitly define what does ∆gQg represents. I assume it is the submatrix of ∆ that includes the row corresponding to g and columns representing cells in Q, but (assuming I got it right) in my opinion it would help to be explicit. 5. I think it would be interesting to see the cumulative Z-score curves for a collection of genes (representing neighborhood of a variety of sizes). What is the expectation in terms of the shape of these curves? Are there outlier cases? Is this something that could be used to identify cases in which the defined neighborhood may be suboptimal? 6. More generally I think the paper would benefit from a more thorough discussion of approaches to examine the results and identify cases in which the embedding in general and/or specific neighborhoods may be suboptimal. Thanks again for the very interesting read and for making everything open and available!",2023-03-31T02:39:32,alonshaiber,Alon Shaiber,10.1101/2023.03.06.531268,Analysis of multi-condition single-cell data with latent embedding multivariate regression,"Constantin Ahlmann-Eltze, Wolfgang Huber",2023-03-07
https://www.biorxiv.org/content/10.1101/2022.04.14.488397v1#comment-6150250848,biorxivstage,1,Figure 1 from this preprint was removed and published as part of another paper in Scientific Reports ( https://www.nature.com/arti...).,2023-03-30T23:28:00,susanparkhurst,Susan Parkhurst,10.1101/2022.04.14.488397,Cell wound repair requires the coordinated action of linear and branched actin nucleation factors,"Justin Hui, Mitsutoshi Nakamura, Julien Dubrulle, Susan M. Parkhurst",2022-04-14
https://www.biorxiv.org/content/10.1101/2022.07.07.499219v2#comment-6150108704,biorxivstage,0,"Please note that this article was recently published on 15th March, 2023. It can be found here with this doi : https://doi.org/10.22270/jd...",2023-03-30T20:27:27,williamckmak,William Mak,10.1101/2022.07.07.499219,Comparisons between the Hydro Distillation and the Steam Distillation in the Extraction of Volatile Compounds from and the Anti-oxidative Activity of Prunella Vulgaris,William Chi Keung Mak,2022-09-21
https://www.biorxiv.org/content/10.1101/2023.02.16.528841v1#comment-6149899948,biorxivstage,0,"JJM & JVC: We enjoyed reading this paper, which contains an excellent dataset profiling HCD tissue content and distribution across species, using sensitive methods. We have some recommendations to make the manuscript clearer and some questions, which we’d be grateful if you could answer. The results include a wide range of tissues from mice, rats, and humans. At times, it is difficult to follow how many samples (independent people/animals) were used and which data corresponds to which specific sample, this is an issue given that some data are from tissues known to have higher/lower HCD contents e.g., old vs young participants, TI vs TII dominant muscle fibres, and healthy vs diseased populations. As the focus is on characterising HCD content, the exact source used to determine that content is important. For example, human heart values are from patients undergoing heart surgery, it is not clear what pathology these participants had and how that could affect HCD content, or whether contents would differ in compartments other than the right atrial appendage; human adipose tissue are combined values from lean, and obese people undergoing surgery; liver samples are from people with obesity undergoing gastric bypass surgery, it is possible that they also have other pathologies (e.g., NAFLD) here; and kidney samples are from cancer patients undergoing nephropathy, while you mention that tissue was sampled away from the tumor (in cases of cancer), it is possible that the metabolic changes (pH and glycolytic flux) influenced the tissue HCD contents, and it should be clear this values may not represent healthy human kidney values. All participants should be described in full, especially for factors that are known to influence HCD content (sex, age, BMI, disease state/pathology etc.). As well as this, the beta-alanine supplementation dose needs to be made clear, as this will influence tissue and circulating contents. This additional information could either be fully described in the figure legend, or perhaps with a summary table that contains the various populations, characteristics, and the figure that the data corresponds to. Interpretation and conclusions should also reflect the participant characteristics e.g., HCD concentrations reflect tissue from X, Y, Z pathology or population, rather than assuming these are representative of healthy human values. There is a really interesting finding that using a CARNS1 KO tissue matrix leads to much lower HCD estimations than using water. This has implications for all prior HCD content research, and potentially means we need to correct prior estimations for measurement error. An example of this are the data in Fig 1F, where skeletal muscle concentrations are approx. 2 mM w/w, which is substantially lower than prior research, including the current authors own HMRS data. It would be great for the authors to expand on this, explain the method in detail and the importance of using a CARNS1 KO tissue matrix, and how this should influence future work. The line numbers below correspond to the original version of the paper (which has since been updated with a newer version). Some descriptors in the text appear to overstate the corresponding data e.g., lines 89-90 ‘HCD levels were overestimated by 2-3-fold’ – this is true for the rat CNS data, but the human muscle data difference is an approx. 90% increase. Line 124 also states ‘2-fold higher CARNS1 mRNA’ – but the actual difference here is approx. 60-65%. Line 168 ‘no CARNS1 could be detected’ (in non-excitable tissues). The corresponding data in Figure 4, appears to show a CARNS1 protein band in the adipose/kidney tissue lane – of a similar magnitude to the heart tissue lane. Was this below the limit of detection? Further, it appears that there was very little (perhaps insufficient) protein loaded in the heart and adipose tissue lanes. Did you explore whether this was a measurement issue? There are some inconsistencies in the data presented in Figure 7. The percentages reported in panel A do not match the corresponding data e.g., BAL/NAC increases as +97/199%. Panels A and B have 11 carnosine datapoints, whereas panel C has ~42 datapoints. It is unclear why these numbers should differ, as they appear to be from the same samples. It would be helpful if the authors could clarify this disparity. The paper uses the term ‘systematic approach’ and estimates that 99.1% of total HCDs are contained in skeletal muscle. We are unsure the language should be that strident, given the range of tissues measured, the overall small N per population, and that various tissues are from pathological tissues. From the analysis, it would be possible to say that ‘of the tissues measured’… 99.1% of the HCD content was found in skeletal muscle samples. The methods state that the human CNS tissue was from ‘non-demented controls, indicating the absence of neurological and psychiatric disease’ – was absence of disease confirmed from the participant characteristics? If not, then the term ‘non-demented’ may not be indicate of people free from neurological and psychiatric disease. Figure 7. From the methods used (i.e., NAC not labelled), is it possible to determine that this was specifically NAC release/reuptake, or could it be reflective of a general appearance? The discussion mentions ‘there appears to be a relationship between CARNS1 expression and HCD content on a whole-body level… However, the correlation between CARNS1 expression and HCD content was not perfect, suggesting that there might be inter-organ exchange…’ – the statement appears to relate to data from Figure 4, but it is not clear where the statistical analyses of these correlations/relationships are. Did the authors perform these analyses?",2023-03-30T16:05:24,disqus_0MYVPRM3Xm,Joe Matthews,10.1101/2023.02.16.528841,"Extensive profiling of histidine-containing dipeptides reveals species-specific distribution and metabolism in mice, rats and humans","Thibaux Van der Stede, Jan Spaas, Sarah de Jager, Jana De Brandt, Camilla Hansen, Bjarne Vercammen, Siegrid De Baere, Siska Croubels, Ruud Van Thienen, Kenneth Verboven, Dominique Hansen, Thierry Bové, Bruno Lapauw, Charles Van Praet, Karel Decaestecker, Bart Vanaudenaerde, Bert O Eijnde, Lasse Gliemann, Ylva Hellsten, Wim Derave",2023-02-19
https://www.biorxiv.org/content/10.1101/2022.03.02.482658v4#comment-6149829451,biorxivstage,0,"a)	Increase the sample size: The results may not be as generalizable as they could be because the study only included a small sample of mice. The probability of false-positive or false-negative results may be decreased and statistical power may be increased by increasing the sample size. b)	Incorporate extra controls: The study utilized wild-type and knockout mice as controls. Including other control groups, however, such as mice with a heterozygous deletion of the PCYT2 gene or mice with a knockout of a different gene, may be advantageous. This would assist in eliminating any possible confusing effects. c)	The study used mice as a model organism, and it is uncertain whether the results can be generalized to human populations to validate the findings. By examining gene expression patterns in muscle biopsies or carrying out clinical trials with PCYT2 modulators, additional studies could examine the function of PCYT2 in muscle health and aging in human populations. d)	Employ more sophisticated methods for data analysis: The study examined levels of gene and protein expression using Western blotting and qPCR. Yet, further approaches like RNA sequencing, proteomics, or metabolomics may offer a more thorough comprehension of the molecular pathways governing muscle health and aging. e)	Perform functional studies: The study did not look into the underlying mechanisms, despite demonstrating the importance of PCYT2 in muscle health and aging. Functional assays could be used in future research to examine PCYT2's effects on muscle structure and function, including muscle fiber size, contractile characteristics, and fatigue resistance.",2023-03-30T14:34:49,,Nikola,10.1101/2022.03.02.482658,Critical role of PCYT2 in muscle health and aging,"Domagoj Cikes, Kareem Elsayad, Erdinc Sezgin, Erika Koitai, Torma Ferenc, Michael Orthofer, Rebecca Yarwood, Leonhard X. Heinz, Vitaly Sedlyarov, Nasser Darwish Miranda, Adrian Taylor, Sophie Grapentine, Fathiya al-Murshedi, Anne Abott, Adelheid Weidinger, Candice Kutchukian, Colline Sanchez, Shane J.F. Cronin, Maria Novatchkova, Anoop Kavirayani, Thomas Schuetz, Bernhard Haubner, Lisa Haas, Astrid Hagelkruys, Suzanne Jackowski, Andrey Kozlov, Vincent Jacquemond, Claude Knauf, Giulio Superti-Furga, Eric Rullman, Thomas Gustafsson, John McDermot, Martin Lowe, Zsolt Radak, Jeffrey S. Chamberlain, Marica Bakovic, Siddharth Banka, Josef M. Penninger",2023-03-12
https://www.biorxiv.org/content/10.1101/2022.03.24.485659v2#comment-6149825140,biorxivstage,0,The final version of this paper has been published in ACS Chemical Biology and can be found at https://pubs.acs.org/doi/10...,2023-03-30T14:29:15,quinlinhanson,Quinlin Hanson,10.1101/2022.03.24.485659,Target class profiling of small molecule methyltransferases,"Quinlin M Hanson, Min Shen, Hui Guo, Ig-Jun Cho, Matthew D Hall",2022-04-13
https://www.biorxiv.org/content/10.1101/2023.02.21.529406v1#comment-6149668548,biorxivstage,0,If there are not all data included for each person that you are analyzing how can you compare these results?,2023-03-30T10:04:09,tinabarea,Tina Bareša,10.1101/2023.02.21.529406,Socio-cultural practices affect sexual dimorphism in stature in Early Neolithic Europe,"Samantha L Cox, Nicole Nicklisch, Michael Francken, Joachim Wahl, Harald Meller, Wolfgang Haak, Kurt W Alt, Eva Rosenstock, Iain Mathieson",2023-02-21
https://www.biorxiv.org/content/10.1101/2023.03.24.533984v1#comment-6149446332,biorxivstage,0,"Interesting paper, in your methods section you state ""For the SNPs we calculated the heterozygosity, the FST, and three categories of segregating sites: per population, private, and fixed for opposite sites"" but those values are never presented, nor are any tables with those values given. Be interesting to see what those values are.",2023-03-30T00:13:37,peterunmack,Peter Unmack,10.1101/2023.03.24.533984,Unravelling the mystery of endemic versus translocated populations of the endangered Australian lungfish (Neoceratodus forsteri),"Roberto Biello, Silvia Ghirotto, Daniel J. Schmidt, Silvia Fuselli, David T. Roberts, Tom Espinoza, Jane M. Hughes, Giorgio Bertorelle",2023-03-25
https://www.biorxiv.org/content/10.1101/2023.03.22.530066v1#comment-6149273015,biorxivstage,0,Check out also this latest work as a part of the literature review: https://doi.org/10.1002/pro...,2023-03-29T19:29:44,disqus_CBZ7DNfzet,Krzysztof Kotowski,10.1101/2023.03.22.530066,Lightweight Fine-tuning a Pretrained Protein Language Model for Protein Secondary Structure Prediction,"Wei Yang, Chun Liu, Zheng Li",2023-03-23
https://www.biorxiv.org/content/10.1101/2023.03.13.532436v1#comment-6149159470,biorxivstage,0,"We appreciate your work on investigating the different speeds of evolution in developmental and defence-related LRR-RLKs. The following are suggestions from a group of students from The Sainsbury Laboratory who read and discussed your pre-print with great interest: It would be helpful to provide an explanation for the large variation in quantities of hits for each selected LRR-RLK in Figure 1 and define which species are represented for each LRR-RLK hit from your pipeline for added transparency. Additionally, could the small number of hits found for some LRR-RLKs indicate higher divergence between proteins and thus a difficulty in identifying more members? We were wondering if it makes sense to query the phylogenetically represented database (1K Transcriptomes) with a Hidden Markov Model based on LRR-RLKs from a small subset of species that are not phylogenetically representative. We suggest using ""kinase"" or ""intracellular"" domain instead of ""RLK domain"" in the paper for better clarity. Could you please provide more transparency on how you selected the LRR-RLKs you studied in the paper? Ideally, using members from more than one clade and being clear about clade/subfamily/subclade notation would be beneficial. Additionally, having equal representation from both functional groups (development and defence) would allow presenting a more comprehensive conclusion on the comparison between LRR-RLKs involved in development and defence. Do most genomes have more developmental LRR-RLKs than defence LRR-RLKs? We wanted to know if your hypothesis about the divergent rates between defence and developmental receptors would change if the defence LRR-RLKs bind to ligands that do not quickly evolve since LRR-RLKs including FLS2 and EFR bind to highly conserved epitopes from pathogens, not effectors. The main finding of the paper that there was no significant difference between LRR domain evolution in developmental and defence LRR-RLKs is not well-reflected in the title. Including a discussion of the ligands for each receptor and whether these are present natively in the plant would be useful along with Figure 3. We hope these suggestions are helpful, and we appreciate your effort in advancing the understanding of LRR-RLK evolution.",2023-03-29T17:06:48,tslpreprintgroup,TSL pre-print group,10.1101/2023.03.13.532436,Asymmetric evolution of protein domains in the leucine-rich repeat receptor-like kinase (LRR-RLK) family of plant developmental coordinators,"Jarrett Man, Thomas Harrington, Kyra Lally, Madelaine E. Bartlett",2023-03-14
https://www.biorxiv.org/content/10.1101/2022.05.06.490864v1#comment-6149051119,biorxivstage,0,"Typo in the first sentence of the second paragraph of ""Intraclaustral projections favor a crossmodular attangement"": CLA neurons frequently form excitatory syanpses synapses with each other",2023-03-29T14:54:54,,Gabriel Charbonnet,10.1101/2022.05.06.490864,Single neurons and networks in the claustrum integrate input from widespread cortical sources,"Andrew M. Shelton, David K. Oliver, Joachim S. Grimstvedt, Ivan P. Lazarte, Ishaan Kapoor, Jake A. Swann, Caitlin A. Ashcroft, Simon N. Williams, Niall Conway, Amy Robinson, Clifford G. Kentros, Menno P. Witter, Simon J.B. Butt, Adam M. Packer",2022-05-06
https://www.biorxiv.org/content/10.1101/2023.03.28.534522v1#comment-6149012396,biorxivstage,0,"Thanks for sharing these important insights. It is unfortunately not surprising that race/ethnicity and socioeconomic status are not frequently reported. Most sleep and circadian studies come from study samples comprised of individuals who are white, middle-class and from high-income countries. Hence, there is a historic imbalance that perpetuates until today. One of the perks of addressing this issue is that it will help foster more research into the socioeconomic determinants of health.",2023-03-29T14:06:54,,Sarah Chellappa,10.1101/2023.03.28.534522,"Inclusion, reporting and analysis of demographic variables in chronobiology and sleep research","Selma Tir, Rhiannon White, Manuel Spitschan",2023-03-28
https://www.biorxiv.org/content/10.1101/853994v1#comment-6148513587,biorxivstage,1,"The authors would like to add Blaine A. Harlan and Minseok Kim as co-authors of this manuscript. The list of authors in this preprint should read as Dah-Jiun Fu, Andrea J. De Micheli, Blaine A. Harlan, Mallikarjun Bidarimath, Minseok Kim, Lora H. Ellenson, Benjamin D. Cosgrove, Andrea Flesken-Nikitin and Alexander Yu. Nikitin, with DJF, AJDM and BAH indicated as equal contributors.",2023-03-28T20:25:39,,Alexander Nikitin,10.1101/853994,PAX8 expressing epithelial cells are a cancer-prone source of clonal cyclical regeneration of endometrial epithelium,"Dah-Jiun Fu, Andrea J. De Micheli, Mallikarjun Bidarimath, Lora H. Ellenson, Benjamin D. Cosgrove, Andrea Flesken-Nikitin, Alexander Yu. Nikitin",2019-11-25
https://www.biorxiv.org/content/10.1101/2022.11.23.517609v1#comment-6148452187,biorxivstage,0,"I could not find, even vaguely,  where BtSY1 and BtSY2, the SARS-like coronaviruses were obtained. This would be very valuable info for phylogeographic analysis. A precise coordinate would be best.",2023-03-28T19:08:52,JRLatham,JRLatham,10.1101/2022.11.23.517609,"Individual bat viromes reveal the co-infection, spillover and emergence risk of potential zoonotic viruses","Jing Wang, Yuan-fei Pan, Li-fen Yang, Wei-hong Yang, Chu-ming Luo, Juan Wang, Guo-peng Kuang, Wei-chen Wu, Qin-yu Gou, Gen-yang Xin, Bo Li, Huan-le Luo, Yao-qing Chen, Yue-long Shu, Deyin Guo, Zi-Hou Gao, Guodong Liang, Jun Li, Edward C. Holmes, Yun Feng, Mang Shi",2022-11-23
https://www.biorxiv.org/content/10.1101/2020.03.06.980300v1#comment-6148265530,biorxivstage,0,Is it possible to access the data used? thanks !,2023-03-28T15:25:13,,Theo Cheung,10.1101/2020.03.06.980300,Wide awake at bedtime? The effects of caffeine on sleep and circadian timing in teenagers - a randomized crossover trial,"Carolin F. Reichert, Simon Veitz, Miriam Bühler, Georg Gruber, Sophia S. Rehm, Katharina Rentsch, Corrado Garbazza, Martin Meyer, Helen Slawik, Yu-Shiuan Lin, Janine Weibel",2020-03-06
https://www.biorxiv.org/content/10.1101/2023.03.19.531228v2#comment-6148175314,biorxivstage,0,It is such an important paper about CYTOF and IMC! Could you please also upload the supplementary figures? Thank you!,2023-03-28T13:26:53,,Wenxi Xu,10.1101/2023.03.19.531228,Standardization of suspension and imaging mass cytometry readouts for clinical decision making,"Ruben Casanova, Shuhan Xu, Sujana Sivapatham, Andrea Jacobs, Stefanie Engler, Tumor Profiler Consortium, Mitchell P. Levesque, Reinhard Dummer, Bernd Bodenmiller, Stéphane Chevrier",2023-03-24
https://www.biorxiv.org/content/10.1101/2023.03.14.532526v1#comment-6148045983,biorxivstage,0,"Thanks for posting this manuscript. However, I think you forgot to post the supplementary information that is mentioned in the main text of the article.",2023-03-28T08:52:41,,Michael,10.1101/2023.03.14.532526,"Step-wise mechanical unfolding and dissociation of the GAIN domains of ADGRG1/GPR56, ADGRL1/Latrophilin-1 and ADGRB3/BAI3: insights into the mechanical activation hypothesis of adhesion G protein-coupled receptors","Chaoyu Fu, Wenmao Huang, Qingnan Tang, Minghui Niu, Shiwen Guo, Tobias Langenhan, Gaojie Song, Jie Yan",2023-03-15
https://www.biorxiv.org/content/10.1101/2023.02.06.527237v1#comment-6147827842,biorxivstage,0,"Hi, great paper! Just one point: it is not possible to download the Supplementary Tables. Thanks",2023-03-28T00:08:01,,OB,10.1101/2023.02.06.527237,Constitutive protein degradation induces acute cell death via proteolysis products,"Si-Han Chen, Sumit Prakash, Elizabeth Helgason, Caroline L. Gilchrist, Lillian R. Kenner, Rajini Srinivasan, Tim Sterne-Weiler, Marc Hafner, Robert Piskol, Erin C. Dueber, Habib Hamidi, Nicholas Endres, Xin Ye, Wayne J. Fairbrother, Ingrid E. Wertz",2023-02-06
https://www.biorxiv.org/content/10.1101/2023.03.25.534016v2#comment-6147726523,biorxivstage,0,Supplemental material is available from the initial version which can be found on the Info/History page Or you can download all (including large files) from here: https://www.dropbox.com/scl...,2023-03-27T21:28:16,ashokpatowary,Ashok Patowary,10.1101/2023.03.25.534016,Cell-type-specificity of isoform diversity in the developing human neocortex informs mechanisms of neurodevelopmental disorders,"Ashok Patowary, Pan Zhang, Connor Jops, Celine K. Vuong, Xinzhu Ge, Kangcheng Hou, Minsoo Kim, Naihua Gong, Michael Margolis, Daniel Vo, Xusheng Wang, Chunyu Liu, Bogdan Pasaniuc, Jingyi Jessica Li, Michael J. Gandal, Luis de la Torre-Ubieta",2023-03-26
https://www.biorxiv.org/content/10.1101/2021.10.15.464557v3#comment-6147451818,biorxivstage,1,Accepted for publication at Development https://doi.org/10.1242/dev...,2023-03-27T15:47:46,,Ephraim F Trakhtenberg,10.1101/2021.10.15.464557,Post-injury born oligodendrocytes integrate into the glial scar and inhibit growth of regenerating axons by premature myelination,"Jian Xing, Bruce A. Rheaume, Juhwan Kim, Agnieszka Lukomska, Muhammad S. Sajid, Ashiti Damania, Ephraim F. Trakhtenberg",2022-03-18
https://www.biorxiv.org/content/10.1101/2023.03.18.533286v1#comment-6147396246,biorxivstage,0,"The authors of this very interesting study might want to consider the papr by Olson et al., PMID: 31915250 In that study they used  LC-MS to quanitfy UDP-GlcNAc levels in the heart.  In Figure 8 they report the concentration of UDP-GlcNAc to be about 500 nmoles/g heart protein, which is the equivalent to approx.  25 pmoles/mg tissue.  This is a little lower than reported here, but is in roughly the same range and therefore supportive of the methods described here.",2023-03-27T14:32:48,,Jphn Chatham,10.1101/2023.03.18.533286,Enzymatic assay for UDP-GlcNAc and its application in the parallel assessment of substrate availability and protein O-GlcNAcylation,"Marc Sunden, Divya Upadhyay, Rishi Banerjee, Nina Sipari, Vineta Fellman, Jukka Kallijärvi, Janne Purhonen",2023-03-19
https://www.biorxiv.org/content/10.1101/2021.04.03.438311v1#comment-6147293288,biorxivstage,1,"Dear Pablo, thank you for your comments (and sorry for seeing them 2 years later...!). Sorry for the imprecision about shape and size in Arabidopsis petals in the L1 AP3 chimeras, this has been modified in the revised version of the manuscript. In wico flowers, the tube shape seems normal but there are some signs of growth conflicts between layers, and the epidermis tends to buckle. Thanks a lot for your thoughts on the manuscript!",2023-03-27T11:38:42,mariemonniaux,Marie Monniaux,10.1101/2021.04.03.438311,Cell layer-specific expression of the B-class MADS-box gene PhDEF drives petal tube or limb development in petunia flowers,"M. Chopy, Q. Cavallini-Speisser, P. Chambrier, P. Morel, J. Just, V. Hugouvieux, S. Rodrigues Bento, C. Zubieta, M. Vandenbussche, M. Monniaux",2021-04-04
