comment url,comment forum,comment keywords,comment message,comment date,comment username,comment name,paper doi,paper title,paper authors,paper date
https://www.biorxiv.org/content/10.1101/847996v2#comment-5982027291,biorxivstage,0,"Please note that this work has undergone substantial improvement and is now published as two separate articles; one focusing on C16orf72/HAPSTR1 ( https://www.pnas.org/doi/10... and one on the coessentiality method, FIREWORKS ( https://www.life-science-al...",2022-09-14T19:27:49,,David Amici,10.1101/847996,Coessential Genetic Networks Reveal the Organization and Constituents of a Dynamic Cellular Stress Response,"David R. Amici, Jasen M. Jackson, Kyle A. Metz, Daniel J. Ansel, Roger S. Smith, Sonia Brockway, Seesha R Takagishi, Shashank Srivastava, Brendan P. O’Hara, Byoung-Kyu Cho, Young Ah Goo, Neil L. Kelleher, Issam Ben-Sahra, Daniel R. Foltz, Marc L. Mendillo",2019-11-22
https://www.biorxiv.org/content/10.1101/2022.07.25.501368v1#comment-5981537945,biorxivstage,0,"It's not the topic of the paper but I'd love to see the STRUCTURE results for k < 6. Your reference data are another mosaic stone in revising the species concept of western Eurasian beeches. Also, I wonder, given the fit of your reference data (Fig. 1) with studies that focussed on western Eurasian beeches and the underestimating current species concept (cited Denk 1999a,b; Gömöry & Paule 2010; Cardoni et al. 2022), whether one should still use ""Oriental beech"" in the singular. I'd write ""Oriental beeches"" to stress the fact it's more than one biological entity. Especially given that you can identify introduced hybrids between Greater Caucasus Oriental beeches (i.e. F. orientalis s.str.) and European beech ( F. sylvatica s.str.) and not just between Oriental ( F. sylvatica subsp. orientalis) and European beech ( F. sylvatica subsp. sylvatica); and in the light of of this being indeed a showcase for the genetic diversity in the Oriental beeches, which, indeed, surpass that in the European beech, in all data assembled so far and highlighted in this study. Regarding the aspect of level of diversity (especially with regard to F. sylvatica and detection-capacity for [introduced] hybrids), adding the STRUCTURE profiles with k < 6 (it says, you run with k = [1,10]) as supplementary information could be an additional selling point for highlighting the different Oriental beeches as not a single but several, possibly also climatically non-identical, and differentially related to the European beech, genetic resources for the European beech forests and with respect to climate change and AGF potential (which may differ between the Oriental beech spp.)",2022-09-14T14:47:30,disqus_zsUCS40CXR,Grimm,10.1101/2022.07.25.501368,Tracing the origin of Oriental beech stands across Western Europe and reporting hybridization with European beech – implications for assisted gene flow,"Mirjam Kurz, Adrian Kölz, Jonas Gorges, Beatriz Pablo Carmona, Peter Brang, Yann Vitasse, Martin Kohler, Fabio Rezzonico, Theo H. M. Smits, Jürgen Bauhus, Andreas Rudow, Ole Kim Hansen, Mohammad Vatanparast, Hakan Sevik, Petar Zhelev, Dušan Gömöry, Ladislav Paule, Christoph Sperisen, Katalin Csilléry",2022-07-25
https://www.biorxiv.org/content/10.1101/2021.08.15.456414v2#comment-5980119595,biorxivstage,0,"In this paper, the authors attribute the wrong null hypothesis to the standard TWAS approach. The issue seems to stem from a confusion between the true parameter (a number) with its estimator (a continuous random variable). They state that the null hypothesis is that the estimator = 0, which is an event of probability 0. The better way to think about the error in the genetic predictors of gene expression is not to change the null hypothesis but in terms of an error in variables problem. Under reasonable assumptions of independence between reference and target sets, error in variables leads to attenuation and not inflation. Many papers have addressed this problem. More details",2022-09-13T22:06:06,haekyungim,Hae Kyung Im,10.1101/2021.08.15.456414,Reconsidering the validity of transcriptome-wide association studies,"Christiaan de Leeuw, Josefin Werme, Jeanne E. Savage, Wouter J. Peyrot, Danielle Posthuma",2022-06-03
https://www.biorxiv.org/content/10.1101/2021.06.15.447525v2#comment-5980086768,biorxivstage,1,"Acknowledgements The authors gratefully acknowledge Géraldine Bossard and Valérie Rodrigues for technical assistance in the development of ELISA assays. Funding information The authors acknowledge the financial support from Franco-Slovak bilateral project PHC Stephanik 2014 n°31798XB and from European Union in the framework of the European Regional Development Fund (ERDF), n° 2015-FED-186, MALIN project “Surveillance, diagnosis, control and impact of infectious diseases of humans, animals and plants in tropical islands”. Conflict of interest disclosure The authors declare they have no conflict of interest relating to the content of this article. Author contributions VP and DFM conceived the original idea. NV and MB acquired the funding. VP, EB, IM, OG, CP and DFM performed. VP, EB, IM, CP and DFM analysed data. VP and DFM drafted the manuscript. All authors read and approved the final manuscript. Data availability Data are available on Zenodo public repository at the following address https://zenodo.org/record/5...",2022-09-13T21:46:19,damienfmeyer,Damien F. Meyer,10.1101/2021.06.15.447525,Ehrlichia ruminantium uses its transmembrane protein Ape to adhere to host bovine aortic endothelial cells,"Valérie Pinarello, Elena Bencurova, Isabel Marcelino, Olivier Gros, Carinne Puech, Mangesh Bhide, Nathalie Vachiery, Damien F. Meyer",2022-09-13
https://www.biorxiv.org/content/10.1101/2022.09.05.506197v1#comment-5979761289,biorxivstage,0,"Hi Romain, thanks! Just read, very interesting nice and short! We are mainly interested in sequences, and the dendrites offer simple and powerful mechanism to break temporal symmetries, as we show in the results (last sections). If you are interested in testing tasks that have a temporal structure just drop me an email and we can have a chat Best, Alessio, first author",2022-09-13T18:54:19,,Alessio Quaresima,10.1101/2022.09.05.506197,The Tripod neuron: a minimal structural reduction of the dendritic tree,"Alessio Quaresima, Hartmut Fitz, Renato Duarte, Dick van den Broek, Peter Hagoort, Karl Magnus Petersson",2022-09-06
https://www.biorxiv.org/content/10.1101/2022.09.04.506528v1#comment-5979718608,biorxivstage,0,Thanks for providing Ingres tool for GRN. I am wondering did you guys also compared it with the other existing tools? If yes which one and how was your experience? Thanks,2022-09-13T18:32:44,disqus_3XtDtmF2bV,ABHINAV JAIN,10.1101/2022.09.04.506528,Ingres: from single-cell RNA-seq data to single-cell probabilistic Boolean networks,"Pedro Victori, Francesca M. Buffa",2022-09-05
https://www.biorxiv.org/content/10.1101/2022.09.12.507692v1#comment-5979494603,biorxivstage,0,"Great work, I enjoyed reading it. One suggestion is to split the graph with the 'Bleaching profile' (figure 1D) according to the laser line that was used for excitation. I don't think it is fair to compare FPs that are excited with different laser lines as the illumination intensity of the lines may differ (as far as I can tell the power of the lines was not measured). It would also simplify the comparison between different spectral classes.",2022-09-13T16:39:13,,Joachim Goedhart,10.1101/2022.09.12.507692,Optimized fluorescent proteins for 4-color and photoconvertible live-cell imaging in Neurospora crassa,"Ziyan Wang, Bradley M. Bartholomai, Jennifer J. Loros, Jay C. Dunlap",2022-09-12
https://www.biorxiv.org/content/10.1101/2022.09.08.507184v1#comment-5979300978,biorxivstage,0,"Nice study. Some related work that impacts the interpretation of your results is below. Is the underlying neural issue of identification of the disturbance one of variability of body state sensation or one of control expectations not matching the current body state? Are these actually the same or are they different? I don't know the answer, just pondering. Ahmed, A. A., & Ashton-Miller, J. A. (2007). On use of a nominal internal model to detect a loss of balance in a maximal forward reach. Journal of neurophysiology, 97(3), 2439-2447. Ahmed, A. A., & Ashton-Miller, J. A. (2004). Is a “loss of balance” a control error signal anomaly? Evidence for three-sigma failure detection in young adults. Gait & posture, 19(3), 252-262.",2022-09-13T14:56:24,daniel_ferris,Daniel Ferris,10.1101/2022.09.08.507184,Young Adults Use Whole-Body Feedback to Perceive Small Locomotor Disturbances,"Daniel J. Liss, Hannah D. Carey, Jessica L. Allen",2022-09-10
https://www.biorxiv.org/content/10.1101/859454v1#comment-5979216544,biorxivstage,0,"Dear Reader, Please note that the two bioRxiv manuscripts with doi: https://doi.org/10.1101/859454 https://doi.org/10.1101/202... Have been published as one paper in EMBO J 2022, please check out https://www.embopress.org/d... Thanks, Stephan",2022-09-13T14:09:31,stephanemmrich,Stephan Emmrich,10.1101/859454,The hematopoietic landscape at single-cell resolution reveals unexpected stem cell features in naked mole-rats,"Stephan Emmrich, Marco Mariotti, Masaki Takasugi, Maggie E. Straight, Alexandre Trapp, Vadim N. Gladyshev, Andrei Seluanov, Vera Gorbunova",2019-11-29
https://www.biorxiv.org/content/10.1101/2022.06.16.496373v1#comment-5979153312,biorxivstage,0,"In this interesting paper, earlier studies are referred to in which it was concluded that the first Plasmodium vivax malarial relapses early in life are genetically homologous; and that parasites which gave rise to sequential recurrences in a particular patient with P. vivax malaria were hypnozoite-associated meiotic siblings. The previous authors’ conclusions might or might not be correct. An alternative possibility is that some or all of these recurrences are/were, in fact, hypnozoite-unrelated in that they were recrudescences (not relapses), homologous recurrences being highly suggestive of a clonal merozoite (perhaps non-circulating) origin. SEE ( try clicking on the link below): Markus, M.B. 2022. Theoretical origin of genetically homologous Plasmodium vivax malarial recurrences. Southern African Journal of Infectious Diseases 37 (1): 369. https://doi.org/10.4102/saj...",2022-09-13T13:34:43,disqus_8lDEAegmaA,Miles Markus,10.1101/2022.06.16.496373,Liver stage fate determination in Plasmodium vivax parasites: characterization of schizont growth and hypnozoite fating from patient isolates,"Amélie Vantaux, Julie Péneau, Caitlin A. Cooper, Dennis E. Kyle, Benoit Witkowski, Steven P. Maher",2022-06-16
https://www.biorxiv.org/content/10.1101/2022.09.05.506197v1#comment-5978643062,biorxivstage,0,"Cool name. You might be interested by my last article: https://f1000research.com/a.... Searching for collabs, always. Best, Romain",2022-09-13T08:13:48,romaincaz,Romain Cazé,10.1101/2022.09.05.506197,The Tripod neuron: a minimal structural reduction of the dendritic tree,"Alessio Quaresima, Hartmut Fitz, Renato Duarte, Dick van den Broek, Peter Hagoort, Karl Magnus Petersson",2022-09-06
https://www.biorxiv.org/content/10.1101/2022.09.01.504601v1#comment-5973845604,biorxivstage,3,"I read this preprint with vivid interest and took the opportunity here to comment on a couple of issues. I like the approach of performing repellency tests with a higher throughput assay but having an exit hands-on-cage (real-world) assay. A few relevant issues occurred to me, which the authors may want to consider: 1) It might be more appropriate to report repellency in terms of protection (per EPA & WHO guidelines). Also, it seems that 75% repellency is too low. A good repellent should provide approximately 100% protection for a couple of hours. 2) As you know, the core principle of scientific publication is to provide enough information that a qualified person can perform the work. Several qualified researchers could test whether the newly discovered repellents are indeed more effective than DEET. However, the names of the new repellents, their sources, and chemical characterization (if newly synthesized) were not disclosed. {Is there a SI file I missed?] 3) Suppose there is an issue of intellectual property. In that case, this issue should be addressed first, and then the work should be considered for publication with a complete list of compounds tested, particularly those claimed to be more effective than DEET. Other minor issues for your consideration: 1) In the introduction, the sentence referring to the discovery of picaridin needs to be re-phrased. Picaridin was developed before insect ORs were discovered, let alone the co-receptor Orco. 2) Insect ORs are not G-protein coupled receptors, as implied in the introduction. Thank you for sharing a preprint in BioRxiv. It is a remarkable development. Walter Leal",2022-09-08T22:06:06,,Walter S Leal,10.1101/2022.09.01.504601,A deep learning and digital archaeology approach for mosquito repellent discovery,"Jennifer N. Wei, Marnix Vlot, Benjamin Sanchez-Lengeling, Brian K. Lee, Luuk Berning, Martijn W. Vos, Rob W.M. Henderson, Wesley W. Qian, D. Michael Ando, Kurt M. Groetsch, Richard C. Gerkin, Alexander B. Wiltschko, Koen J. Dechering",2022-09-03
https://www.biorxiv.org/content/10.1101/2021.12.16.472948v1#comment-5973339200,biorxivstage,1,"This preprint has been now published in Developmental Cell: Dalmasso et al., 4D reconstruction of murine developmental trajectories using spherical harmonics, DevelopmentalCell (2022) https://doi.org/10.1016/j.devcel.2022.08.005",2022-09-08T13:36:55,,Giovanni Dalmasso,10.1101/2021.12.16.472948,4D reconstruction of developmental trajectories using spherical harmonics,"Giovanni Dalmasso, Marco Musy, Martina Niksic, Alexandre Robert-Moreno, Claudio Badía-Careaga, Juan J. Sanz-Ezquerro, James Sharpe",2021-12-17
https://www.biorxiv.org/content/10.1101/2022.08.24.505130v1#comment-5972360647,biorxivstage,3,"I am the corresponding author of the original study. [Journal name redacted to follow bioRxiv's policy] rejected this Preprint based on our Concerns on their concern. Unfortunately, I do not know how to publish the PDF file of our response (it does not fit BioRxiv since our PDF file does not contain additional experimental data). I am pasting it below. We welcome open discussion based on solid experimental data and are looking forward to more independent studies in this area. Re: On the therapeutic potential of MAPK4 in triple-negative breast cancer Feng Yang Department of Molecular and Cellular Biology, Baylor College of Medicine, Houston, Texas * Corresponding Author: Feng Yang, Baylor College of Medicine, One Baylor Plaza, Houston, TX, 77030. Phone: 713-798-8022; Fax: 713-790-1275; E-mail: fyang@bcm.edu Boudghene-Stambouli et al. recently published “On the therapeutic potential of MAPK4 in triple-negative breast cancer” in BioRxiv concerning our Nature Communications publication, “MAPK4 promotes triple negative breast cancer growth and reduces tumor sensitivity to PI3K blockade.”, published 11 January 2022 (1). We want to reply to their comments as follows. Boudghene-Stambouli et al. essentially detected a similar MAPK4 protein expression pattern (Our report (1) vs. Boudghene-Stambouli et al., Fig. 1c) in the human TNBC cells, when using the same commercially available antibody AP7298b. However, they claimed, “We failed to detect a specific ERK4 band in any of the cell lines, including Hs578T cells transfected with human ERK4 cDNA.” They then used their own “validated custom polyclonal ERK4 antibody that we use routinely in our laboratories” to produce a different MAPK4 expression pattern (Boudghene-Stambouli et al., Fig. 1c). They provided a siRNA knockdown for the “validation” of their antibody. In this case, Boudghene-Stambouli et al. largely ignored our previous publications using the commercially available AP7298b to successfully confirm the overexpression, knockdown (up to five independent shRNAs), and knockout of MAPK4 in many human cancer cell lines and in “normal” cells (1-4). AP7298b can also detect a purified GST-MAPK4 fusion protein in the GST pulldown assays and the purified Flag/His-tagged wild-type and mutated MAPK4 proteins in the in vitro kinase assays (2). It should be noted that instead of our extensive validation of AP7298b using many MAPK4-overexpressing, knockdown (up to five independent shRNAs), and knockout cells as well as purified MAPK4 proteins (overexpressed/purified from both prokaryotic and eukaryotic cells), Boudghene-Stambouli et al. only used a single siRNA to “validate” their un-named custom antibody. Besides, they did not confirm HA-MAPK4/Erk4 overexpression in their Hs578T cells (Boudghene-Stambouli et al., Fig. 1c). Please note, due to the sensitivity of different antibodies, even if an HA-positive western blot is provided, it may not confirm significantly increased ectopically overexpressed MAPK4 expression over the endogenous MAPK4. Finally, their custom antibody detected many non-specific bands compared to AP7298b (Boudghene-Stambouli et al., Suppl. Fig. 1c, which was included in their submission recently rejected by [Journal name redacted to follow bioRxiv's policy] after peer-review). Therefore, we have concerns over Boudghene-Stambouli et al.’s concern on MAPK4 protein expression levels in the MAPK4-high TNBC cell lines that we used in our study (1). It is well-known that mRNA and protein abundances may not correlate well in biological systems. Therefore, Boudghene-Stambouli et al.’s concern about the variation of MAPK4 mRNA expression across the cell lines will not carry that much weight. We also noticed that Boudghene-Stambouli et al. used our reported 5’ primer but a modified 3’ primer for their qPCR data in Fig. 1a. We wonder whether they have performed qPCR using our reported 5’ and 3’ primers to detect MAPK4 expression (3), and what were the results? Besides, although we have not systematically examined MAPK4 mRNA expression in human TNBC cell lines as we did for human prostate cancer cell lines (3), we did qPCR confirmed MAPK4 expression in MDA-MB-231, SUM159, as well as the non-small cell lung cancer H1299 cells. Besides, Zheng et al. independently showed MAPK4 mRNA and protein expression in HCC1937 and MDA-MB-231 cells (5), two of the TNBC cell lines concerned by Boudghene-Stambouli et al. Without knowing the quality of Boudghene-Stambouli et al.’s RNA-seq data, we could not comment on their Fig. 1b data. Another concern of Boudghene-Stambouli et al. is their failure to verify our reported MAPK4-AKT signaling axis, a conclusion drawn from their Fig. 2 data. Without providing their data, the corresponding author Dr. Meloche has communicated with me about this issue. At that time, I provided the following answer. “I am not sure if you did a transient transfection in the 293 cells. Unlike MK5, phosphorylation of AKT is subjected to many more direct and indirect regulations in the cells. It is hard to imagine that you can easily detect MAPK4 phosphorylation of cell endogenous AKT in the transiently transfected 293 cells. It can be a hit and miss, especially if you do not carefully monitor cell confluency. I think that we only reported data from the stable 293T cells overexpressing MAPK4 or MAPK4 phosphorylating a co-transfected AKT in 293T cells. In the latter case, we suspect that these ectopically overexpressed AKT are less susceptible to endogenous cellular posttranslational modifications and more susceptible to the regulation of overexpressed MAPK4. Again, unless you can’t repeat our data, such as MAPK4 phosphorylating a co-transfected AKT in 293T cells, I do not see a common ground for our debate here either.” Now I see the experimental data, and Boudghene-Stambouli et al. did perform a transient transfection and tried to detect phosphorylation change of endogenous AKT, which we have already expressed concern about in our previous personal communications. Interestingly, as a positive control for their Fig. 2 data, Boudghene-Stambouli et al. showed MAPK4 enhanced the phosphorylation of an ectopically overexpressed but not endogenous MK5, raising concern about this so-called positive control per se. We are also unsure how much MAPK4 was overexpressed compared to endogenous MAPK4 (Western blots on GFP could not provide that information) nor the nature of the seemingly increased AKT T308 phosphorylation in the MAPK4 transfected 293 cells (Boudghene-Stambouli et al., Fig. 2). I want to finish this discussion using what I wrote to Dr. Meloche in another email. “Without detailed information from your side, it is hard for me to guess what happened. I want to emphasize several technical details that may help. 1. Please collect cells at about 50%-70% confluency. If your lab collected cells at very high confluency, please try this. 2. We have been using Dox-inducible knockdown and overexpression approaches. We typically maintain the cell culture without Dox induction and do a couple of days (such as three days) induction just before the experiments. 3. If you use a non-induction system as we did in some of our studies, please ensure that you only use the engineered cell lines at early passages. You can do this by freezing down many vials from a very early passage and only using the thawed-out cells for minimal additional passage(s). The cancer cells in culture may adapt to the cellular “stress” from long-term MAPK4 overexpression or knockdown.” We welcome open discussions based on solid experimental data. We will do our best to help if any group meets technical difficulty in repeating our data under the reported experimental conditions. We have validated our MAPK4-AKT signaling in more than 20 human cancer cell lines (Ref. (1-3), and unpublished data), and additional independent reports also confirmed MAPK4 phosphorylates/activates AKT in human cancer cells (5, 6). We welcome and are looking forward to more independent studies in this area. References 1. Wang W, et al. MAPK4 promotes triple negative breast cancer growth and reduces tumor sensitivity to PI3K blockade. Nat Commun. 2022;13(1):245. 2. Wang W, et al. MAPK4 overexpression promotes tumor progression via noncanonical activation of AKT/mTOR signaling. The Journal of clinical investigation. 2019;129(3):1015-1029. 3. Shen T, et al. MAPK4 promotes prostate cancer by concerted activation of androgen receptor and AKT. The Journal of clinical investigation. 2021;131(4). 4. Cai Q, et al. MAPK6-AKT signaling promotes tumor growth and resistance to mTOR kinase blockade. Sci Adv. 2021;7(46):eabi6439. 5. Zeng X, et al. MAPK4 silencing together with a PARP1 inhibitor as a combination therapy in triplenegative breast cancer cells. Molecular medicine reports. 2021;24(2). 6. Tian S, et al. MAPK4 deletion enhances radiation effects and triggers synergistic lethality with simultaneous PARP1 inhibition in cervical cancer. J Exp Clin Cancer Res. 2020;39(1):143.",2022-09-07T14:26:19,disqus_sr0PU48Wf9,Feng Yang,10.1101/2022.08.24.505130,On the therapeutic potential of MAPK4 in triple-negative breast cancer,"Fadia Boudghene-Stambouli, Mathilde Soulez, Natalia Ronkina, Anneke Dörrie, Alexey Kotlyarov, Ole-Morten Seternes, Matthias Gaestel, Sylvain Meloche",2022-08-26
https://www.biorxiv.org/content/10.1101/2022.07.13.499967v1#comment-5972339842,biorxivstage,0,Is this article's code open-sourced?,2022-09-07T14:03:33,disqus_ixbdjiwL3d,Tobias Lee,10.1101/2022.07.13.499967,ProteinSGM: Score-based generative modeling for de novo protein design,"Jin Sub Lee, Philip M. Kim",2022-07-13
