comment url,comment forum,comment keywords,comment message,comment date,comment username,comment name,paper doi,paper title,paper authors,paper date
https://www.biorxiv.org/content/10.1101/2022.10.03.510577v1#comment-6023705992,biorxivstage,0,"By referring to ""experimental and ecological approaches"" we want to acknowledge that to understand the changes in the genomes, we need to know how they affect physiology of bacterial cells and their interactions with other components of the environment. An example we touch upon are the changes in properties of inferred proteomes. Expression of the proteins and their modifications can profoundly impact the  real-life situation. I agree, including other  brackish basins is an important way forward. High quality Black Sea MAGs are now available (link below). Whey are an important resource for any follow-up studies, as it is not only more data, but qualitatively different ecosystem (different salinity, around 22PSU). What do you mean by Salian Sea? (I could not Google it) https://link.springer.com/a...",2022-10-27T10:35:21,krzysztofjurdzinski,Krzysztof Jurdzinski,10.1101/2022.10.03.510577,Large-scale phylogenomics of aquatic bacteria reveal molecular mechanisms for adaptation to salinity,"Krzysztof T Jurdzinski, Maliheh Mehrshad, Luis Fernando Delgado, Ziling Deng, Stefan Bertilsson, Anders F Andersson",2022-10-03
https://www.biorxiv.org/content/10.1101/2022.10.22.513349v1#comment-6023537326,biorxivstage,0,"Please consider using plotted datum color, shape, or size to distinguish recipients of Moderna vs. Pfizer bivalent boosters (and, ideally, to also distinguish recipients of 4 Pfizer founder-monovalent doses vs. 4 Moderna founder-monovalent doses vs. 4 founder-monovalent doses including at least one Moderna and one Pfizer dose -- as well as recipients known to have recovered from a COVID bout in the _ months prior to assay). Currently your main plot does not independently use color and shape (e.g., in Fig. 1B all squares are blue and all triangles red); as such, you have some flexibility to include more information in the plot that might help at least anecdotally highlight further factors (such as brand) that may shape quantitative findings. Thanks.",2022-10-27T03:23:18,genomenathan,Nathan Pearson,10.1101/2022.10.22.513349,Antibody responses to Omicron BA.4/BA.5 bivalent mRNA vaccine booster shot,"Qian Wang, Anthony Bowen, Riccardo Valdez, Carmen Gherasim, Aubree Gordon, Lihong Liu, David D. Ho",2022-10-24
https://www.biorxiv.org/content/10.1101/2022.03.30.486498v1#comment-6023073647,biorxivstage,1,This preprint is published now in AAC. https://journals.asm.org/do...,2022-10-26T17:03:46,rubayetelahi,Rubayet Elahi,10.1101/2022.03.30.486498,Screening the Pathogen Box Compounds for Activity Against Plasmodium falciparum Sporozoite Motility,"Sachie Kanatani, Rubayet Elahi, Sukanat Kanchanabhogin, Natasha Vartek, Abhai K. Tripathi, Sean T. Prigge, Photini Sinnis",2022-03-31
https://www.biorxiv.org/content/10.1101/2022.10.06.511083v1#comment-6022868981,biorxivstage,0,"Regarding the statistics, were the student t-tests controlled for multiple testing? Perhaps this could be expanded on in the material & methods section.",2022-10-26T13:05:02,dianacamilagmezdelacruz,Diana Camila Gómez De La Cruz,10.1101/2022.10.06.511083,Convergent evolution of plant pattern recognition receptors sensing cysteine-rich patterns from three microbial kingdoms,"Yuankun Yang, Christina E. Steidele, Birgit Löffelhardt, Dagmar Kolb, Thomas Leisen, Weiguo Zhang, Christina Ludwig, Georg Felix, Michael F. Seidl, Thorsten Nürnberger, Matthias Hahn, Bertolt Gust, Harald Gross, Ralph Hückelhoven, Andrea A. Gust",2022-10-07
https://www.biorxiv.org/content/10.1101/2022.10.06.511083v1#comment-6022868400,biorxivstage,0,"There appears to be no strong conservation of either RE02 in Solanaceae, or RLP30 in Brassicaceae. Perhaps the authors could go more into the phylogeny of these receptors, which might highlight putative receptors in Brassica and tomato involved in the recognition of SCPSs. Also, in the Arabidopsis accessions that do recognize SCPSs, is there sequence variation in RLP30?",2022-10-26T13:04:17,dianacamilagmezdelacruz,Diana Camila Gómez De La Cruz,10.1101/2022.10.06.511083,Convergent evolution of plant pattern recognition receptors sensing cysteine-rich patterns from three microbial kingdoms,"Yuankun Yang, Christina E. Steidele, Birgit Löffelhardt, Dagmar Kolb, Thomas Leisen, Weiguo Zhang, Christina Ludwig, Georg Felix, Michael F. Seidl, Thorsten Nürnberger, Matthias Hahn, Bertolt Gust, Harald Gross, Ralph Hückelhoven, Andrea A. Gust",2022-10-07
https://www.biorxiv.org/content/10.1101/2022.10.06.511083v1#comment-6022867728,biorxivstage,0,"In figure 3 the authors show that different mutants and fragments of SCPSs are differentially recognized by different plant species. In this figure it is not immediately clear how these mutant proteins were produced (extended data 7 makes clear this is from Pichia), this should be highlighted in the figure 3 legend. Additionally, the western blots for the truncations appear to be missing and perhaps the western blots for the individual cysteine mutations should be moved to the main figure. Finally, the interpretation of this data is that there is differential recognition of these SCPSs mutants and fragments between species, indicating that either there are additional receptors, or different epitopes are recognized by SCPSs-recognizing receptors in these species, or the SCPSs-recognizing receptors differ in their robustness of recognition. One alternative interpretation is that the apoplastic conditions are different between these species, and therefore these SCPSs mutants/fragments may behave differently depending on the species. Either this could be mentioned in the text, or a western blot should be added after infiltration to show the stability of these mutants in the apoplast of the different species.",2022-10-26T13:03:22,dianacamilagmezdelacruz,Diana Camila Gómez De La Cruz,10.1101/2022.10.06.511083,Convergent evolution of plant pattern recognition receptors sensing cysteine-rich patterns from three microbial kingdoms,"Yuankun Yang, Christina E. Steidele, Birgit Löffelhardt, Dagmar Kolb, Thomas Leisen, Weiguo Zhang, Christina Ludwig, Georg Felix, Michael F. Seidl, Thorsten Nürnberger, Matthias Hahn, Bertolt Gust, Harald Gross, Ralph Hückelhoven, Andrea A. Gust",2022-10-07
https://www.biorxiv.org/content/10.1101/2022.10.06.511083v1#comment-6022865412,biorxivstage,0,"The paper does not go into structural similarities between the cysteine-rich effectors from the different pathogens, specially between SCP and VmE02. Given that this effector family is widely distributed, it is likely that Alphafold2 would be able to produce high-confidence models. This might also help to narrow down candidate proteins recognized in the fractions from Pseudomonads",2022-10-26T13:00:13,dianacamilagmezdelacruz,Diana Camila Gómez De La Cruz,10.1101/2022.10.06.511083,Convergent evolution of plant pattern recognition receptors sensing cysteine-rich patterns from three microbial kingdoms,"Yuankun Yang, Christina E. Steidele, Birgit Löffelhardt, Dagmar Kolb, Thomas Leisen, Weiguo Zhang, Christina Ludwig, Georg Felix, Michael F. Seidl, Thorsten Nürnberger, Matthias Hahn, Bertolt Gust, Harald Gross, Ralph Hückelhoven, Andrea A. Gust",2022-10-07
https://www.biorxiv.org/content/10.1101/2022.10.06.511083v1#comment-6022863435,biorxivstage,0,"In figure 1E the authors show a CoIP, where they pulled-down on the receptor-side to show that SCPSs-Myc specifically interacts with RLP30-GFP, and not RLP23-GFP (used as a control). However, this experiment requires a Myc-tagged secreted protein as a negative control, rather than no control at all on the effector side. Finally, a less cropped version of the CoIP (as a supplemental, if needed), and a ponceau stain or similar for loading control would be appreciated.",2022-10-26T12:57:34,dianacamilagmezdelacruz,Diana Camila Gómez De La Cruz,10.1101/2022.10.06.511083,Convergent evolution of plant pattern recognition receptors sensing cysteine-rich patterns from three microbial kingdoms,"Yuankun Yang, Christina E. Steidele, Birgit Löffelhardt, Dagmar Kolb, Thomas Leisen, Weiguo Zhang, Christina Ludwig, Georg Felix, Michael F. Seidl, Thorsten Nürnberger, Matthias Hahn, Bertolt Gust, Harald Gross, Ralph Hückelhoven, Andrea A. Gust",2022-10-07
https://www.biorxiv.org/content/10.1101/2022.10.06.511083v1#comment-6022862235,biorxivstage,1,"This paper nicely characterised the previously reported SCFE1 as the small cysteine-rich protein SCPSs, and showed its recognition by RLP30 in Arabidopsis. This is demonstrated using T-DNA knockout lines, complementation, and CoIP. The authors show that SCPSs-like effectors from fungi other than S. sclerotiorum, oomycete and bacterial pathogens are also recognized by RLP30. In addition, they also show that SCPSs is recognized by different plant species. Based on sequence similarity to VmE02, the authors identify that the N. benthamiana receptor RE02 (also known as NbCSPR) can also recognize SCPSs. The authors then go on to delineate the recognized peptide from SCPSs, showing there is variation between plant species in the ability to recognize fragments derived from SCPSs. Finally, the authors show that RLP30 can also recognize an unknown elicitor found in small molecule fractions from Pseudomads, unlike the NbRE02. We enjoyed reading this well-written paper! The data were nicely presented, and generally well controlled. We have some comments that could improve the manuscript, although these would not affect the overall message. The following comments and suggestions were made by J. Kourelis, D. Gómez De La Cruz and J. Bennett.",2022-10-26T12:55:54,dianacamilagmezdelacruz,Diana Camila Gómez De La Cruz,10.1101/2022.10.06.511083,Convergent evolution of plant pattern recognition receptors sensing cysteine-rich patterns from three microbial kingdoms,"Yuankun Yang, Christina E. Steidele, Birgit Löffelhardt, Dagmar Kolb, Thomas Leisen, Weiguo Zhang, Christina Ludwig, Georg Felix, Michael F. Seidl, Thorsten Nürnberger, Matthias Hahn, Bertolt Gust, Harald Gross, Ralph Hückelhoven, Andrea A. Gust",2022-10-07
https://www.biorxiv.org/content/10.1101/2022.10.13.511487v1#comment-6022780896,biorxivstage,0,"Here are some potential future questions/avenues of exploration that arose in our discussion of the study: It would be super interesting in future works to identify the receptor/s involved in perception of plant and parasite derived PSY peptides. This would enable many new lines of questioning. Are MigPSY peptides triggering an immune response or mediating any sort of PTI-like response (i.e. triggering a ROS burst) in any root knot nematode hosts (i.e. rice)? How do plant receptors (such as Xa21) distinguish between endogenous and parasite derived PSY peptides? What are the molecular determinants for this specificity? It would be super interesting to study the potential co-evolutionary arms race between pathogen PSYs and host receptors. How did plant pathogens acquire PSY peptide mimics, evolutionarily speaking? Do non-plant pathogenic nematodes also have PSY peptides? Is it possible that non-plant pathogenic nematodes also produce these or similar peptides for other unrelated endogenous processes and then these were co-opted over evolutionary time to fulfil a role in pathogenesis?",2022-10-26T10:34:06,mauriciocontreras4,Mauricio P. Contreras,10.1101/2022.10.13.511487,Root-knot nematodes produce functional mimics of tyrosine-sulfated plant peptides,"Henok Zemene Yimer, Dee Dee Luu, Alison Coomer Blundell, Maria Florencia Ercoli, Paulo Vieira, Valerie M. Williamson, Pamela C. Ronald, Shahid Siddique",2022-10-16
https://www.biorxiv.org/content/10.1101/2022.10.13.511487v1#comment-6022780679,biorxivstage,1,General comments A sentence highlighting that this appears to be a case of convergent evolution in the discussion/conclusions would be nice! Would be interesting to test whether there is an additive effect between the nematode PSY peptides and the endogenous plant peptide (AtPSY1). This may help clarify if MigPSY peptides are functioning via the same signaling pathway as AtPSY1as performed in Figure 3 of the cited paper (Pruitt et al. 2017).,2022-10-26T10:33:37,mauriciocontreras4,Mauricio P. Contreras,10.1101/2022.10.13.511487,Root-knot nematodes produce functional mimics of tyrosine-sulfated plant peptides,"Henok Zemene Yimer, Dee Dee Luu, Alison Coomer Blundell, Maria Florencia Ercoli, Paulo Vieira, Valerie M. Williamson, Pamela C. Ronald, Shahid Siddique",2022-10-16
https://www.biorxiv.org/content/10.1101/2022.10.13.511487v1#comment-6022780071,biorxivstage,0,"Figure 5 In Figure 5, are graphs B and D independent? Does the number of galls affect the number of females with egg masses? Are these two independent processes? Is nematode fitness affected by silencing the PSY peptides? Is it correct to conclude that the silencing of the PSY peptides is affecting pathogenicity of the nematode and not the fitness? In Figure 5, GFP targeting siRNAs are used as a negative control. Could an improved negative control be used that knocks down a sequence that is expressed in nematode that does not impact nematode development or pathogenicity?",2022-10-26T10:32:20,mauriciocontreras4,Mauricio P. Contreras,10.1101/2022.10.13.511487,Root-knot nematodes produce functional mimics of tyrosine-sulfated plant peptides,"Henok Zemene Yimer, Dee Dee Luu, Alison Coomer Blundell, Maria Florencia Ercoli, Paulo Vieira, Valerie M. Williamson, Pamela C. Ronald, Shahid Siddique",2022-10-16
https://www.biorxiv.org/content/10.1101/2022.10.13.511487v1#comment-6022779684,biorxivstage,0,"Figure 4 Based on the in situ hybridization assay against the mRNA of the PSY mimics, the authors hypothesize that the PSY peptides are sulphated in the nematode. Is this enough evidence to hypothesize that the peptides are sulphated inside the nematode? The location of MigPSY transcripts and the location of sulfation may be completely different. Could the peptides be sulphated in the host?",2022-10-26T10:31:31,mauriciocontreras4,Mauricio P. Contreras,10.1101/2022.10.13.511487,Root-knot nematodes produce functional mimics of tyrosine-sulfated plant peptides,"Henok Zemene Yimer, Dee Dee Luu, Alison Coomer Blundell, Maria Florencia Ercoli, Paulo Vieira, Valerie M. Williamson, Pamela C. Ronald, Shahid Siddique",2022-10-16
https://www.biorxiv.org/content/10.1101/2022.10.13.511487v1#comment-6022779469,biorxivstage,0,"Figure 2 Mock is currently the only negative control, as even the truncated peptide exhibite an effect. As all peptides used influenced root growth, would there be a different and more stringent negative control that could be included? Does mutating one of the conserved residues in the PSY peptides abrogate their root growth promoting effects? If so, maybe this could be a nice control. Really liked the inclusion of the truncated peptide! Cool to see that even this variant retains root growth promoting activity. Also related to Figure 2, it would be helpful for any readers trying to build on these data or trying to design similar experiments what the rationale for using 100 nM concentration of the peptides in the growth medium in Figure 2. Was this decision based on the bibliography or was this found experimentally?",2022-10-26T10:31:07,mauriciocontreras4,Mauricio P. Contreras,10.1101/2022.10.13.511487,Root-knot nematodes produce functional mimics of tyrosine-sulfated plant peptides,"Henok Zemene Yimer, Dee Dee Luu, Alison Coomer Blundell, Maria Florencia Ercoli, Paulo Vieira, Valerie M. Williamson, Pamela C. Ronald, Shahid Siddique",2022-10-16
https://www.biorxiv.org/content/10.1101/2022.10.13.511487v1#comment-6022779150,biorxivstage,0,"Figure 1 •Would it be possible to model these MigPSY peptides with AlphaFold2? This would be nice to include in Figure 1. If not, is there any other in silico approach that could be used to have an insight about the structure of these small peptides? We would find any exploration of structural homology between plant and parasite PSY peptides from very exciting. Do MigPSYs exhibit structural homology to other proteins, either from the host or the pathogen?",2022-10-26T10:30:30,mauriciocontreras4,Mauricio P. Contreras,10.1101/2022.10.13.511487,Root-knot nematodes produce functional mimics of tyrosine-sulfated plant peptides,"Henok Zemene Yimer, Dee Dee Luu, Alison Coomer Blundell, Maria Florencia Ercoli, Paulo Vieira, Valerie M. Williamson, Pamela C. Ronald, Shahid Siddique",2022-10-16
https://www.biorxiv.org/content/10.1101/2022.10.13.511487v1#comment-6022778679,biorxivstage,2,"We highly enjoyed reading this preprint, the study was well written and easy to read! We find the idea of convergent evolution of plant PSY peptide mimics in both bacteria and nematodes super interesting and look forward to any follow-up studies. All comments/suggestions by M. Bergum, M. P. Contreras, L. Feng, X. Lyu, S. Muniyandi, A. Posbeyikian and H. Pai",2022-10-26T10:29:27,mauriciocontreras4,Mauricio P. Contreras,10.1101/2022.10.13.511487,Root-knot nematodes produce functional mimics of tyrosine-sulfated plant peptides,"Henok Zemene Yimer, Dee Dee Luu, Alison Coomer Blundell, Maria Florencia Ercoli, Paulo Vieira, Valerie M. Williamson, Pamela C. Ronald, Shahid Siddique",2022-10-16
https://www.biorxiv.org/content/10.1101/2022.10.18.512756v1#comment-6022648243,biorxivstage,0,"Your admission that you chose to use maximum fragment length because it works for engineered clones but has high variance for random subcloning emphasizes that this is data dredging explained away as ""60% of the time it works every time."" Either way, please give a reason why you ""had to choose just one"" statistic other than that this one returns the most ""significant"" SARS-CoV-2 z-score. One could just as easily argue that minimum fragment length contains equivalently important information on even-spaced-ness and synthesizability (because no engineer would want to construct anything using tiny fragments). Using this statistic, SARS-CoV-2 would obviously not appear engineered. Using a more appropriate statistic such as your suggested broken stick model combining all fragment lengths would give some z-score in the middle. Even if this statistic does return a significant z-score, please explain why any engineer would want or need to separate the tiny, highly conserved nsp13 fragment in SARS-CoV-2.",2022-10-26T04:42:39,disqus_8AVEuorTBu,disqus_8AVEuorTBu,10.1101/2022.10.18.512756,Endonuclease fingerprint indicates a synthetic origin of SARS-CoV-2,"Valentin Bruttel, Alex Washburne, Antonius VanDongen",2022-10-20
https://www.biorxiv.org/content/10.1101/2022.05.26.493596v1#comment-6022538760,biorxivstage,0,Revised manuscript available here and here,2022-10-26T01:12:31,rekvar,Rek Var,10.1101/2022.05.26.493596,Seeing social: A neural signature for conscious perception of social interactions,"Rekha S. Varrier, Emily S. Finn",2022-05-29
https://www.biorxiv.org/content/10.1101/2022.10.18.512756v1#comment-6022046361,biorxivstage,0,"You are correct Marlise, when Type IIS restriction sites are used for cloning CoV genomes they are placed external to the viral sequence in the individual plasmids so they are not maintained in the genome. This is very common practice for those that use this method. Type IIG restriction sites are maintained but those enzymes are not the topic of this article",2022-10-25T15:18:57,thefehrlab,The Fehr Lab,10.1101/2022.10.18.512756,Endonuclease fingerprint indicates a synthetic origin of SARS-CoV-2,"Valentin Bruttel, Alex Washburne, Antonius VanDongen",2022-10-20
https://www.biorxiv.org/content/10.1101/2022.10.03.510577v1#comment-6021701005,biorxivstage,0,"The article strikes me as a well-written analysis of aquatic bacterial evolution.  I think that this article was incredibly effective in proving the points hypothesized in the introduction and abstract. All of the information in the article tied back to information first brought up in the introduction, which helped me as the reader follow along and see the significance of the information being provided. I also appreciate how clearly the thesis statement is addressed in the introduction of the paper. The main idea of the paper is that physicochemical factors largely contribute to the phylogeny of aquatic bacteria. This is proven by the methods mentioned in the thesis, which is a phylogenetic and MAGs analysis. Although the purpose of this paper was briefly mentioned in the introduction as relating to climate change and understanding how changing environmental conditions might affect bacteria, the authors could have been a bit more explicit about how these findings affect this field of study. I would rate the significance of this paper as a modest contribution, because although the authors did tie its importance to climate change, more context regarding its place in the field would allow me to have a better understanding of its significance. The findings are important for understanding how climate change affects ecosystems and the organisms such as bacteria living within them, but again, more context would help in understanding the gravity of these findings. The methodology in this paper is convincing, and the only area I find questionable is the validity of MAGs in acting as an accurate representation of bacterial genomes. This question however is one addressed by the authors and accounted for in the data collection. The writing quality is a particular strength of this paper, and I thought the figures and thought process behind the data collection was well communicated to the reader. A strength of this article is that it does incite intrigue regarding the question of how climate change might affect the environment, leaving open further questions about how studying the past evolution of organisms might provide insight into their potential future evolution.",2022-10-25T04:27:57,,Amanda Maldonado,10.1101/2022.10.03.510577,Large-scale phylogenomics of aquatic bacteria reveal molecular mechanisms for adaptation to salinity,"Krzysztof T Jurdzinski, Maliheh Mehrshad, Luis Fernando Delgado, Ziling Deng, Stefan Bertilsson, Anders F Andersson",2022-10-03
https://www.biorxiv.org/content/10.1101/2022.06.27.497797v1#comment-6021691290,biorxivstage,0,"Hello! This was a very interesting and captivating paper. It was very educational and understandable, even with limited knowledge of the field of Trypanosomes and parasitology. The contribution of the paper to really delve into the immunogenic capabilities of antigen variability of Trypanosoma is really providing a different perspective as to how it undergoes immune evasion. This detail really aided in surmising the paper's focal target of Trypanosoma responding to cells within extravasuclar spaces and their respective capabiltiies of changing their VSGs in such an environmental niche to best suit their survival as a whole. I was a bit curious of whether the tissue-dependency of this organism could be affected by different tissue types and extravascular conditions? For instance, would meningital tissue and extravascular spaces in the cranium feature a different response than enteroid tissue in the gut, and extravascular spaces there? The writing overall was very thorough and really helped to build my understanding. I feel one important and arbitrary takeaway from this work could be the clinical capability of recognizing this antigenic shifting, and maybe finding a means to classify the pattern of shifts to determine an effective means of possibly quantifying and curing sleeping sickness.",2022-10-25T04:04:37,disqus_dGRP4WIZyb,Pooja Ravi,10.1101/2022.06.27.497797,Extravascular spaces are reservoirs of antigenic diversity in Trypanosoma brucei infection,"Alexander Beaver, Nathan P. Crilly, Jill Hakim, Bailin Zhang, Bryce Bobb, Filipa Rijo-Ferreira, Luisa Figueiredo, Monica R. Mugnier",2022-06-27
https://www.biorxiv.org/content/10.1101/2022.10.03.510577v1#comment-6021638975,biorxivstage,0,"It was a pleasure reading your paper! Not only did confirm a lot of speculations that were proposed in prior studies, but it also highlighted a lot of new information about an aquatic environment (ie. brackish biomes) that has not previously been elucidated. It is intriguing that the transitions of bacterial communities both into and out of brackish bodies have glossed over in the field despite such type of environments taking up such a large portion of global waters. Some strong points of the paper that I noticed was that I liked how for the most part the figures in the paper were properly explained in the written portion and that the conclusions drawn were easily traced back to the data in the figures. It made going through the findings of the study a pretty straightforward process. In addition, I liked how you acknowledged the missing information from this experiment in your discussion section, such as exactly why transitions were more frequent into than out of brackish biomes. These kinds of acknowledgements paves the way for future research to build off of this study and come up with answers to these gaps in knowledge. In the end, you mention that ""phylogenomic analyses should be supplemented with experimental and ecological approaches"" in future studies, but what exactly did you have in mind? One suggestion I had was maybe repeating the experiment in other brackish bodies of water such as the Black Sea/Salian Sea to see if the results can be reproduced? Overall, great work!",2022-10-25T02:19:08,zeyadelnaghy,Zeyad El-Naghy,10.1101/2022.10.03.510577,Large-scale phylogenomics of aquatic bacteria reveal molecular mechanisms for adaptation to salinity,"Krzysztof T Jurdzinski, Maliheh Mehrshad, Luis Fernando Delgado, Ziling Deng, Stefan Bertilsson, Anders F Andersson",2022-10-03
