comment url,comment forum,comment keywords,comment message,comment date,comment username,comment name,paper doi,paper title,paper authors,paper date
https://www.biorxiv.org/content/10.1101/2023.10.20.563110v1#comment-6307639993,biorxivstage,0,"We’ve discussed this note today and we have a question regarding Figure 1G. It's essential to ensure that RBA1 doesn't negatively affect the agroinfiltration process itself, which could potentially lead to reduced accumulation of the virus and reduced fluorescence, thereby impacting the interpretation of the results. To address this issue, the experimental design should include appropriate controls to rule out any interference of RBA1 with agroinfiltration.",2023-10-24T15:20:08,kamounlab,kamounlab,10.1101/2023.10.20.563110,A simplified disease resistance assay using YFP-expressing Potato Virus X in N. benthamiana reveals a cell death-independent immune function of RBA1,"Keiichi Hasegawa, Ton Timmers, Jijie Chai, Takaki Maekawa",2023-10-21
https://www.biorxiv.org/content/10.1101/2020.04.07.029009v2#comment-6307523632,biorxivstage,0,"Apparently, EMT means change of cellular states/properties but not of gene/protein symbols. In the case of EMT, what are epithelial and especially mesenchymal states/properties are not known. What it the scientific meaning of the so-called epithelial-mesenchymal transition?",2023-10-24T12:41:18,disqus_qXQjSplv5J,Ying Cao,10.1101/2020.04.07.029009,Disseminating cells in human oral tumours acquire an EMT cancer stem cell state that is predictive of metastasis,"Gehad Youssef, Luke Gammon, Leah Ambler, Sophia Lunetto, Alice Scemama, Hannah Cottom, Kim Piper, Ian C. Mackenzie, Michael P. Philpott, Adrian Biddle",2023-05-03
https://www.biorxiv.org/content/10.1101/2023.09.12.557347v1#comment-6307413990,biorxivstage,0,"Hello! I found this paper very compelling. Nice work! It is really exciting to see that receiving both vaccines concurrently enhances the protectiveness of the COVID-19 booster. I have two questions: 1. Why is it that the group that received the two vaccines on different days were not administered the flu vaccine on the same number of days apart after the COVID vaccine? In the study it was stated that the flu shot just needed to be administered any time within 4 weeks from the time of the COVID booster. Could this have made the results more difficult to interpret? If you were to redo the study, do you think that the data would be more reliable if the second group all had the later flu shot administer on the same day, or does that not seem to matter? 2. Why was the Ebola vaccine used as the control vaccine in this case? Thank you! And again, nice job!! :)",2023-10-24T08:15:41,,CDSL JHSPH,10.1101/2023.09.12.557347,Concurrent administration of COVID-19 and influenza vaccines enhances Spike-specific antibody responses,"Susanna E. Barouch, Taras M. Chicz, Ross Blanc, Domenic R. Barbati, Lily J. Parker, Xin Tong, Ryan P. McNamara",2023-09-12
https://www.biorxiv.org/content/10.1101/2023.10.19.563117v1#comment-6307274819,biorxivstage,0,"Very nice work. There have been recent reports of immune cells invading the skull marrow during brain (broadly defined) inflammation, and if the bone marrow is a reservoir and transit point for immune cells, it would be very interesting to see the changes, since fortunately the skull marrow can be depicted on TSPO PET.",2023-10-24T01:29:36,hironakaigarashi,Hironaka Igarashi,10.1101/2023.10.19.563117,Neuroinflammation in post-acute sequelae of COVID-19 (PASC) as assessed by [11C]PBR28 PET correlates with vascular disease measures,"Michael B. VanElzakker, Hannah F. Bues, Ludovica Brusaferri, Minhae Kim, Deena Saadi, Eva-Maria Ratai, Darin D. Dougherty, Marco L. Loggia",2023-10-20
https://www.biorxiv.org/content/10.1101/2023.07.27.550875v1#comment-6307272372,biorxivstage,0,"Hello! This is a good piece of work, and the value to the field is very evident. It is great to see novel sequencing methods like Oxford Nanopore sequencing being validated more and more, and by employing a Nanopore-only approach, you have probably helped to assuage some of the anxieties of others in the field regarding this technique. I had a few questions and recommendations regarding this technique. Have you sequenced T. cruzi, or the Tulahuen strain specifically, with short-read sequencing? Are there any hurdles involved with that? Also, do you think that by assembling this genome using the help of short-read sequencing, you would have gotten a better result? Additionally, I think that it would be helpful to show in a figure which coding regions are not impacted by transposable elements, as that would increase the significance of your work. Other than that, I really liked this work, and congratulations!",2023-10-24T01:24:43,anshuletakyar,Anshule Takyar,10.1101/2023.07.27.550875,Whole Genome Assembly of a Hybrid Trypanosoma cruzi Strain Assembled with Nanopore Sequencing Alone,"Jill M.C. Hakim, Sneider A Gutierrez Guarnizo, Edith Málaga Machaca, Robert H. Gilman, Monica R. Mugnier",2023-07-27
https://www.biorxiv.org/content/10.1101/2023.01.26.525810v1#comment-6306987478,biorxivstage,0,now published in npj Biofilms and Microbiomes! https://www.nature.com/arti...,2023-10-23T17:43:58,vernitagordon,Vernita Gordon,10.1101/2023.01.26.525810,Bacterial mechanosensing of surface stiffness promotes signaling and growth leading to biofilm formation by Pseudomonas aeruginosa,"Liyun Wang, Yu-Chern Wong, Joshua M. Correira, Megan Wancura, Chris J Geiger, Shanice S Webster, Benjamin J. Butler, George A. O’Toole, Richard M. Langford, Katherine A. Brown, Berkin Dortdivanlioglu, Lauren Webb, Elizabeth Cosgriff-Hernandez, Vernita D. Gordon",2023-01-27
https://www.biorxiv.org/content/10.1101/2022.12.05.519235v1#comment-6306761227,biorxivstage,1,"This preprint article is now published, please see: Priya P, Patil M, Pandey P, Singh A, Babu V, Senthil-Kumar M. (2023). Stress Combinations and their Interactions in Plants Database: A one-stop resource on combined stress responses in plants. The Plant Journal, https://doi.org/10.1111/tpj...",2023-10-23T12:27:01,senthilkumarmuthappa,Senthil-Kumar Muthappa,10.1101/2022.12.05.519235,Stress Combinations and their Interactions in Plants Database (SCIPDb): A one-stop resource for understanding combined stress responses in plants,"Piyush Priya, Mahesh Patil, Prachi Pandey, Anupriya Singh, Vishnu Sudha Babu, Muthappa Senthil-Kumar",2022-12-08
https://www.biorxiv.org/content/10.1101/2023.10.16.562570v1#comment-6306664689,biorxivstage,0,"This is a really interesting study in an ultra-rare syndrome that kills a substantial number of patients through cardiovascular complications. 1. As the authors have acknowledged, we have never seen evidence in any of our studies of sexual dimorphism in adult presentation with disease or on cardiovascular imaging, either by echocardiography or cardiac MRI. We have seen young men and women suffer cardiovascular complications at similar age of onset in their 20s and 30s. 2. Changes in left atrial area, isovolumic relaxation time and ejection fraction without similar changes in myocardial performance index or global longitudinal strain worry me, as in humans I would expect both to be early indicators of restrictive cardiomyopathy. All of these values are affected by both acute changes in blood pressure (and especially during anaesthesia) and by the longer-term effects of hypertension, so this is an important confounder but again acknowledged. 3. One feature that is expected in human studies of restrictive cardiomyopathy would be corroborative evidence of pulmonary hypertension, occurring as a result of elevated LV end-diastolic pressure, high LA pressure and thereby pulmonary venous hypertension. Was there any TR in the mice model and any measure of TR maximal velocity? 4. I am an adult cardiovascular imaging specialist who practices both echo and CMR. I am only too aware of the variability of echo measures of cardiac function on an intra- and inter-observer basis. At heart rates of 350-450 BPM, I remain very concerned by the reproducibility in small numbers of animals - although I recognise these numbers are considered adequate in the animal physiology world. When I look at the box plots, there is often a wide spread of results, and no idea is given in the manuscript of the intra-observer measurement for example of ejection fraction - I understand that the person was measuring blind and was a single experienced sonographer...but in our practice, we recognise that in experienced hands, EF may vary in humans at up to 10% between scans at heart rates of 70BPM.",2023-10-23T08:13:46,,Richard Steeds,10.1101/2023.10.16.562570,Female Alms1-deficient mice develop echocardiographic features of adult but not infantile Alström Syndrome cardiomyopathy,"Eleanor J. McKay, Ineke Luijten, Adrian Thomson, Xiong Weng, Katya Gehmlich, Gillian A. Gray, Robert K. Semple",2023-10-19
https://www.biorxiv.org/content/10.1101/2023.10.19.563117v1#comment-6306607870,biorxivstage,0,"In Box 1 - on Haptoglobin The gut permeability marker zonulin, which is reduced in the post-acuteCOVID condition multisystem inflammatory syndrome in children (MIS-C) (Yonker et al. 2021) is the precursor for haptoglobin-2. Should that read ""elevated""?",2023-10-23T04:54:51,daviddaviespayne,David Davies-Payne,10.1101/2023.10.19.563117,Neuroinflammation in post-acute sequelae of COVID-19 (PASC) as assessed by [11C]PBR28 PET correlates with vascular disease measures,"Michael B. VanElzakker, Hannah F. Bues, Ludovica Brusaferri, Minhae Kim, Deena Saadi, Eva-Maria Ratai, Darin D. Dougherty, Marco L. Loggia",2023-10-20
https://www.biorxiv.org/content/10.1101/2023.09.12.557347v1#comment-6306602140,biorxivstage,0,"Greating Dr. Barouch and colleagues, First, I want to commend you on investigating this timely research question regarding the immunogenicity of concurrent versus separate COVID-19 and influenza vaccination. As I was reviewing your work, some aspects caught my attention which might further enhance its clarity and comprehensiveness. I understand that the study participants in MassCPR might have enrolled voluntarily. If this is the case, there could be potential selection bias to consider. It might be beneficial for readers to see a demographic table that provides baseline characteristics for both groups. Additionally, it would be helpful to understand the factors that influenced participants to either receive both vaccines simultaneously or at two separate intervals. Clarifying this could help readers discern if there might be any inherent differences between these two groups. It also would be enlightening if you could expand on the potential mechanisms of the specific immune interactions that may be driving the increased IgG1 with concurrent vaccination? This could reveal important biology behind your findings. I believe addressing these points could enhance the comprehensiveness of your paper. I hope these suggestions are helpful as you continue developing this research project. Thank you for sharing your work and for your consideration.",2023-10-23T04:34:17,cdsljhsph,CDSL JHSPH,10.1101/2023.09.12.557347,Concurrent administration of COVID-19 and influenza vaccines enhances Spike-specific antibody responses,"Susanna E. Barouch, Taras M. Chicz, Ross Blanc, Domenic R. Barbati, Lily J. Parker, Xin Tong, Ryan P. McNamara",2023-09-12
https://www.biorxiv.org/content/10.1101/2023.04.20.537604v1#comment-6306136324,biorxivstage,0,This paper has been published in : https://doi.org/10.1371/jou...,2023-10-22T14:38:04,disqus_iaWuFZ2POb,will Huang,10.1101/2023.04.20.537604,Pathfinder: protein folding pathway prediction based on conformational sampling,"Zhaohong Huang, Xinyue Cui, Yuhao Xia, Kailong Zhao, Guijun Zhang",2023-04-21
https://www.biorxiv.org/content/10.1101/540237v1#comment-6305910816,biorxivstage,0,Fig. 2. The maxillary branch (V2) seems to be incorrectly assigned.,2023-10-22T04:14:58,,Boada MD.,10.1101/540237,Mouse trigeminal neurons respond to kokumi substances,"Sara C.M. Leijon, Nirupa Chaudhari, Stephen D. Roper",2019-02-04
https://www.biorxiv.org/content/10.1101/2022.03.18.484889v1#comment-6305657016,biorxivstage,0,"Now published in Genome Biology, doi: 10.1186/s13059-023-02983-0",2023-10-21T20:16:36,bingxinlu,Bingxin Lu,10.1101/2022.03.18.484889,CNETML: Maximum likelihood inference of phylogeny from copy number profiles of spatio-temporal samples,"Bingxin Lu, Kit Curtius, Trevor A. Graham, Ziheng Yang, Chris P. Barnes",2022-03-20
https://www.biorxiv.org/content/10.1101/2023.10.09.561616v1#comment-6305360002,biorxivstage,0,"It would be interesting to know, among women who are incarcerated for murder, at what stage of the cycle they were in at the time of the murder. In the population among these women, are the ages a reflection of their menstrual ability? Higher population of menstrating women than post menopausal? If so, is their a correlation to when in the cycle most murders occurred?",2023-10-21T12:39:11,,"O. Elizabeth Plant-Sexton, PhD",10.1101/2023.10.09.561616,Menstrual cycle-driven hormone concentrations co-fluctuate with white and grey matter architecture changes across the whole brain,"Elizabeth J. Rizor, Viktoriya Babenko, Neil M. Dundon, Renee Beverly-Aylwin, Alexandra Stump, Margaret Hayes, Luna Herschenfeld-Catalan, Emily G. Jacobs, Scott T. Grafton",2023-10-10
https://www.biorxiv.org/content/10.1101/2022.06.08.495370v1#comment-6304783525,biorxivstage,0,Our paper is published in Transactions on Machine Learning Research and can be accessed here: https://openreview.net/pdf?...,2023-10-20T16:06:57,alinaselega,Alina Selega,10.1101/2022.06.08.495370,Multi-objective Bayesian Optimization with Heuristic Objectives for Biomedical and Molecular Data Analysis Workflows,"Alina Selega, Kieran R. Campbell",2022-06-12
https://www.biorxiv.org/content/10.1101/2023.10.09.561616v1#comment-6304725831,biorxivstage,0,"This work is really fascinating and might help explain why women have higher rates of depression, instances of headache and are more susceptible to various forms of dementia. I hope that's being considered in this area of research since the disparity between men/women rates of mental health and brain ailments is somewhat inexplicable. Perhaps this is a breakthrough in explaining the gender disparity.",2023-10-20T14:53:27,avolynfisher,Avolyn Fisher,10.1101/2023.10.09.561616,Menstrual cycle-driven hormone concentrations co-fluctuate with white and grey matter architecture changes across the whole brain,"Elizabeth J. Rizor, Viktoriya Babenko, Neil M. Dundon, Renee Beverly-Aylwin, Alexandra Stump, Margaret Hayes, Luna Herschenfeld-Catalan, Emily G. Jacobs, Scott T. Grafton",2023-10-10
https://www.biorxiv.org/content/10.1101/2023.03.10.532059v3#comment-6304600131,biorxivstage,0,Bacteroides vulgatus was renamed Phocaeicola vulgatus 3 years ago ( https://lpsn.dsmz.de/specie...,2023-10-20T11:33:58,,Tom,10.1101/2023.03.10.532059,2’-Fucosyllactose helps butyrate producers outgrow competitors in infant gut microbiota simulations,"David M. Versluis, Ruud Schoemaker, Ellen Looijesteijn, Jan M. W. Geurts, Roeland M. H. Merks",2023-04-19
https://www.biorxiv.org/content/10.1101/2023.09.12.557347v1#comment-6304397231,biorxivstage,0,"Hello! I hope this message finds you well. I would like to express my sincere appreciation for your paper. Your research on the immunogenicity of these vaccines, especially in the context of concurrent versus separate administration, is of significant importance in the current landscape of emerging COVID-19 strains. I have a couple of queries that I hope you could kindly address: 1. Given that the influenza vaccine undergoes changes each year to adapt to evolving strains, I am curious about the potential impact of these changes on the observed results. Do you believe that the higher and more durable SARS-CoV-2 antibody responses associated with concurrent administration would remain consistent across different influenza seasons? 2. It appears that your study design involves a comparison between concurrent and separate administration, and the results are promising. Could you kindly provide more information on the research methodology? Specifically, was your study a randomized controlled trial (RCT), and if so, was blinding or randomization implemented? Once again, I would like to express my gratitude for your valuable contribution to the field. I understand the dedication and effort that go into such research endeavors, and your work is commendable. I look forward to any insights you can provide regarding my queries. Thank you for your time, and I appreciate your consideration of these questions.",2023-10-20T01:55:50,cdsljhsph,CDSL JHSPH,10.1101/2023.09.12.557347,Concurrent administration of COVID-19 and influenza vaccines enhances Spike-specific antibody responses,"Susanna E. Barouch, Taras M. Chicz, Ross Blanc, Domenic R. Barbati, Lily J. Parker, Xin Tong, Ryan P. McNamara",2023-09-12
https://www.biorxiv.org/content/10.1101/2023.10.09.561414v1#comment-6303951579,biorxivstage,0,"Hi Yichao, You're correct that histone deacetylation is generally perceived as a repressive process, leading to questions like yours. While the sentence you quoted from reference 14 does say that HDACs are generally associated with inactive genes, it's important to read it in context. Just two sentences later, the authors reveal their observation: ""Our data provide evidence that HATs and HDACs are both targeted to transcribed regions of active genes by phosphorylated RNA Pol II."" The presence of HDACs is a dynamic process. In active regions, HDACs and HATs often coexist in a dynamic equilibrium, influencing the acetylation status of histones. So while the action of histone deacetylation usually leads to gene repression, the presence/localization of HDAC itself is not necessarily an indicator of inactive genes. The last statement in the abstract of reference 14 also supports this: ""Silent genes without any H3K4 methylation signal show no evidence of being bound by HDACs."" In our study, we also observed a similar trend, where active marks correlate well with HDAC1/2/3 presence, further supporting this view. Does this answer your question? Best wishes, Nicolas",2023-10-19T15:05:32,nicolas_mathis,Nicolas Mathis,10.1101/2023.10.09.561414,Predicting prime editing efficiency across diverse edit types and chromatin contexts with machine learning,"Nicolas Mathis, Ahmed Allam, András Tálas, Elena Benvenuto, Ruben Schep, Tanav Damodharan, Zsolt Balázs, Sharan Janjuha, Lukas Schmidheini, Desirée Böck, Bas van Steensel, Michael Krauthammer, Gerald Schwank",2023-10-09
https://www.biorxiv.org/content/10.1101/2022.09.27.509818v2#comment-6303855969,biorxivstage,1,I would like to link this preprint to a published article Development. 2023 Sep 15;150(18):dev201381. doi: 10.1242/dev.201381. Epub 2023 Sep 25 https://pubmed.ncbi.nlm.nih...,2023-10-19T12:54:21,maxtischfield,Max Tischfield,10.1101/2022.09.27.509818,Twist1 and balanced retinoic acid signaling act to suppress cortical folding in mice,"Khue-Tu Ho-Nguyen, Manav Jain, Matt J. Matrongolo, Phillip S. Ang, Samantha Schaper, Max A. Tischfield",2022-11-15
https://www.biorxiv.org/content/10.1101/2023.06.13.544731v1#comment-6303854274,biorxivstage,0,It would be good to know the actual titres of polyketides for the different systems in mg/L - then comparisons could be made with other related systems such as DEBS1-TE in various hosts including filamentous fungi ( https://www.mdpi.com/1410198),2023-10-19T12:51:38,,Russell Cox,10.1101/2023.06.13.544731,Maximizing Heterologous Expression of Engineered Type I Polyketide Synthases: Investigating Codon Optimization Strategies,"Matthias Schmidt, Namil Lee, Chunjun Zhan, Jacob B. Roberts, Alberto A. Nava, Leah Keiser, Aaron Vilchez, Yan Chen, Christopher J. Petzold, Robert W. Haushalter, Lars M. Blank, Jay D. Keasling",2023-06-13
https://www.biorxiv.org/content/10.1101/2023.10.11.560955v1#comment-6303587555,biorxivstage,1,"Minor comment - in many parts of the manuscript you refer to ""16S rRNA sequencing data"". It would be more accurate to refer to this as ""16S rRNA gene sequencing data"".",2023-10-19T01:02:59,jonathan_eisen,Jonathan Eisen,10.1101/2023.10.11.560955,"Integration of 168,000 samples reveals global patterns of the human gut microbiome","Richard J. Abdill, Samantha P. Graham, Vincent Rubinetti, Frank W. Albert, Casey S. Greene, Sean Davis, Ran Blekhman",2023-10-11
https://www.biorxiv.org/content/10.1101/2021.01.03.425130v1#comment-6303572891,biorxivstage,0,The paper has been published in GENETICS (see here https://pubmed.ncbi.nlm.nih....,2023-10-19T00:34:34,,Michael Polymenis,10.1101/2021.01.03.425130,Translational control of lipogenesis links protein synthesis and phosphoinositide signaling with nuclear division,"Nairita Maitra, Staci Hammer, Clara Kjerfve, Vytas A. Bankaitis, Michael Polymenis",2021-01-03
https://www.biorxiv.org/content/10.1101/2023.08.17.553094v1#comment-6303364065,biorxivstage,2,"Moura et al. evaluate the loss of suitability areas for non-flying mammals in the Caatinga in two future periods (2060-2100) under climate change effects and what would be the expected changes in the biotic composition of communities. The authors employed an interesting approach with restrictions on species dispersal in the models and the results contribute to predicting the effects of climate change in this biome. We see the importance of focusing on biotic changes and % of range loss, but it is our belief that adding the final predictions for each species in the supplementary material, in terms of maps and range shifts (direction of shift), it would be worth and informative because this information is important for managers and decision makers (those who manage conservation units but also to the researchers working on specific taxa). We also think that including a more detailed discussion about some species that have been modelled in other previous studies could enrich the work and make some of the results obtained here clearer. For example, why species with a wide distribution such as Callicebus barbarabrownae would lose their entire area of suitability in 2060? Other studies, such as Barreto et al. 2021 and Gouveia et al. 2016 found different results, could you attribute this to the methodological choices? We think the words used in the bibliographic review were not wide enough to include studies with mammals in the Caatinga because some important references are out of the included papers. The chosen words are mainly related to the biome or region. Maybe another approach would be to review occurrence records in a systematic way looking for articles with species names (as keyword) based on a preliminary list of mammals. Including latitude and longitude in the maps it would be more informative and including political division of states could help to subside discussion for specific regions of Caatinga. We wrote this comment during a meeting to discuss preprint papers that occurred by September, but I was able to post it just now. I saw that the paper was accepted yesterday, so I am not sure if our suggestions/questions will have some worth to the authors (feel free to reply or not), but we decided to contribute with them anyway. Many congratulations for your article! Although we think that some points could be different, we are sure that article is a nice contribution to understand potential effects of climate change in Caatinga :) Comment written at the Laboratório de Ecologia Vegetal, Evolução e Síntese (LEVES) at the Universidade Federal do Rio Grande do Norte, RN, Brasil. Joined this meeting: Vanessa Staggemeier, Hercília Freitas, Víctor de Paiva, Yan Gabriel, Alexander Chasin, Rhuama Martins, Vitoria Alves, Jose Nilson dos Santos, Rafael Rocha dos Santos, Maria Luiza and João Paulo Câmara. References 1) Barreto, H. F., Jerusalinsky, L., Eduardo, A. A., Alonso, A. C., Júnior, E. M. S., Beltrão-Mendes, R., ... & Gouveia, S. F. (2021). Viability meets suitability: distribution of the extinction risk of an imperiled titi monkey ( Callicebus barbarabrownae) under multiple threats. International Journal of Primatology, 1-19. 2) Gouveia, S. F., Souza‐Alves, J. P., Rattis, L., Dobrovolski, R., Jerusalinsky, L., Beltrão‐Mendes, R., & Ferrari, S. F. (2016). Climate and land use changes will degrade the configuration of the landscape for titi monkeys in eastern Brazil. Global Change Biology, 22(6), 2003-2012.",2023-10-18T18:45:43,vanessa_staggemeier,Vanessa Staggemeier,10.1101/2023.08.17.553094,Climate change should drive mammal defaunation in tropical dry forests,"Mario R. Moura, Gibran A. Oliveira, Adriano P. Paglia, Mathias M. Pires, Bráulio A. Santos",2023-08-17
https://www.biorxiv.org/content/10.1101/2021.12.31.474648v1#comment-6303116711,biorxivstage,0,This manuscript is now published in Nature communications doi.org/10.1038/s41467-023-...,2023-10-18T13:26:37,disqus_8I6X6MC9uJ,Komal Patel,10.1101/2021.12.31.474648,Liquid condensate is a common state of proteins and polypeptides at the regime of high intermolecular interactions,"Manisha Poudyal, Komal Patel, Ajay Singh Sawner, Laxmikant Gadhe, Pradeep Kadu, Debalina Datta, Semanti Mukherjee, Soumik Ray, Ambuja Navalkar, Siddhartha Maiti, Debdeep Chatterjee, Riya Bera, Nitisha Gahlot, Ranjith Padinhateeri, Samir K. Maji",2022-01-02
https://www.biorxiv.org/content/10.1101/2023.06.10.544442v1#comment-6302929532,biorxivstage,0,This manuscript has been recently published at ACS Chemical Neuroscience: https://pubs.acs.org/doi/fu...,2023-10-18T05:35:02,yano_lab,Yano_Lab,10.1101/2023.06.10.544442,A subtle structural modification of a synthetic cannabinoid receptor agonist drastically increases its efficacy at the CB1 receptor,"Hideaki Yano, Rezvan Chitsazi, Christopher Lucaj, Phuong Tran, Alexander F. Hoffman, Michael H. Baumann, Carl R. Lupica, Lei Shi",2023-06-12
