comment url,comment forum,comment keywords,comment message,comment date,comment username,comment name,paper doi,paper title,paper authors,paper date
https://www.biorxiv.org/content/10.1101/2022.10.18.512756v1#comment-6019546560,biorxivstage,0,"In Figure 2, I'd appreciate it if the colors of the dots were more different from each other. I have a hard time telling the difference. Also, when I do Golden Gate cloning, the restriction sites are erased as they are designed to be in in opposite orientations to each other such that the ligated piece no longer has the restriction sites. This enables assembly in one tube by incubating the pieces in the presence of both the restriction enzyme and the ligase. How would introduction of these restriction sites be of benefit for Golden Gate or any other type of cloning? Because the restriction sites aren't removed, one can't simply digest the DNA and ligate the pieces in in one reaction as the restriction enzyme will cut all the sites again as you put each piece in. If one wanted truly scarless cloning, one would do Gibson Assembly or related cloning methods.",2022-10-22T18:19:11,disqus_bUJwfjVXCN,Michael Carpenter,10.1101/2022.10.18.512756,Endonuclease fingerprint indicates a synthetic origin of SARS-CoV-2,"Valentin Bruttel, Alex Washburne, Antonius VanDongen",2022-10-20
https://www.biorxiv.org/content/10.1101/2022.09.26.509600v2#comment-6019506333,biorxivstage,0,"Hi there, This is a very intertesting article for me to read, as it does give me a new perspective on how to tackle AMR other than the endless new inhibitor and new resistance loop. I was also very glad to see that ARM-1 can delay the onset of AMR in multiple strains and even in strains that already devleoped resistance, which looks much promising/hopeful. However, I do have some questions about your experimental design and results. So for your highthrough-put drug screen, I saw that you used two plasmids, one with IPTG-inducible promoter, the other one with LacI/LacO roadblock. I just wonder if IPTG, which mimics allolactose, would have any off-target effect on LacI repressor? I can clearly tell that your ARM-1 inhibits mfd by your following results, but I was just wondering why you did not use any promoter that is inducible by any compounds other than allolactose analog. (Also I could only see panel 1a for supplementary figure 1, did you forget to upload the other panels?) Another question is about Figure 2c. I noticed that with the presence or absence of ARM-1, the EC values are roughly the same in this figure. You reasoned it as ""The reduction in the ECs in the presence of ARM-1 is most likely because, at equilibrium, when RNAP cannot dissociate from DNA, it cannot re-initiate transcription, consequently preventing new EC formation."", which did not make much sense to me at first. If that is the case, the EC value with ARM-1 should still be higher than that of the group without ARM-1, unless ARM-1 is not working at all. So I checked the supplementary material, and found that you repeated the expeiment, and the mean value for ARM-1 -ve group is 0.40, that for ARM-1 +ve group (different conc) range from 0.6-0.8, and this makes much more sense now. So I think if you should put the mean value in Fig 2c instead? (For supplementary figure 3, in panel a I saw two 25 and one 12.5 microM ARM-1 tested, but in panel b I saw two 12.5 microM and one 25 microM in the table, you might want to double check on that.) Again, this is an interesting paper for me to read and I really enjoyed it. Thank you very much for your effort on combating with AMR.",2022-10-22T17:29:44,alwynguan,Alwyn Guan,10.1101/2022.09.26.509600,A small molecule that inhibits the evolution of antibiotic resistance,"Anna E. Johnson, Harrison Bracey, Angel Joel Hernandez Viera, Juan Carvajal-Garcia, Esra N. Simsek, Kwangho Kim, Houra Merrikh",2022-10-03
https://www.biorxiv.org/content/10.1101/2022.10.03.510577v1#comment-6019404011,biorxivstage,1,"I really enjoyed reading this study. I liked that this paper was easy to read if you have a good scientific background. I just thought that there could be some terms that could be defined in the Introduction such as brackish waters and MAGs. I also thought that maybe specifically defining the conditions for the marine filtered genome. I know that there was a supplemental table talking about where the MAGs came from, but I think it would be better to put that somewhere in the paper (either the results or methods) because it has a lot of important information. On another note, I don't know what happened but for some reason for figure 5, I just saw a replicate of figure 1 even though figure 5 was obviously different. Overall though, the paper was very interesting and well written! Also, I know in the preprint you mentioned that climate change has a role in affecting some of the factors in marine environments like salinity. Also, this study shows that bacteria transitioning between different marine biomes is pretty rare. However, the study also showed that there are some species of bacteria that are making these transitions. I guess what my question is do you think that there's still hope that bacteria will survive climate change and be able to adapt to different biomes?",2022-10-22T15:18:45,cdsljhsph,CDSL JHSPH,10.1101/2022.10.03.510577,Large-scale phylogenomics of aquatic bacteria reveal molecular mechanisms for adaptation to salinity,"Krzysztof T Jurdzinski, Maliheh Mehrshad, Luis Fernando Delgado, Ziling Deng, Stefan Bertilsson, Anders F Andersson",2022-10-03
https://www.biorxiv.org/content/10.1101/2022.09.14.506792v2#comment-6019372344,biorxivstage,1,"It might be best to rephrase the conclusion of this preprint. With only 15 participants in each group, only very lage effects would have resulted in a statistically significant result.",2022-10-22T14:34:27,michieltack,M T,10.1101/2022.09.14.506792,Myalgic Encephalomyelitis/Chronic Fatigue Syndrome and fibromyalgia are indistinguishable by their cerebrospinal fluid proteomes,"Steven E. Schutzer, Tao Liu, Chia-Feng Tsai, Vladislav A. Petyuk, Athena A. Schepmoes, Yi-Ting Wang, Karl K. Weitz, Jonas Bergquist, Richard D. Smith, Benjamin H Natelson",2022-10-14
https://www.biorxiv.org/content/10.1101/2022.10.18.512756v1#comment-6019205315,biorxivstage,0,"How are synonymous mutations evidence of manipulation? 1. They encode the same peptide, therefore researchers who would have ""manipulated"" the sequence would have no other reason to do it than ""signing"" the sequence. 2. For the same reason, all intermediate viruses on every path from A to B are viable (in fact functionally identical), which if anything indicates it could be natural. 3. The statistical analysis assumes independence of the mutations, which is a very tall order (linkage disequilibrium, etc.). Are we saying ""SARS-CoV-2 is an anomaly"" (which could just mean ""we have lose ends"") to argue in favor of the laboratory accident hypothesis?",2022-10-22T09:06:50,jacquesbasalda,Jacques Basaldúa,10.1101/2022.10.18.512756,Endonuclease fingerprint indicates a synthetic origin of SARS-CoV-2,"Valentin Bruttel, Alex Washburne, Antonius VanDongen",2022-10-20
https://www.biorxiv.org/content/10.1101/2022.10.18.512756v1#comment-6019066442,biorxivstage,0,"When you test a hypothesis, you are also testing the assumptions that go along with that hypothesis. You describe a lot of assumptions in the methods, but do not say if any effort was made to check the sensitivity of the results to particular assumptions. For that matter, were these methods pre-specified before you looked at the data, or were they tuned to the data you have? If the latter, then you may have a Type I error problem. I strongly suggest you should consult a Biostatistician.",2022-10-22T02:57:06,Tomato_Addict,Tomato Addict,10.1101/2022.10.18.512756,Endonuclease fingerprint indicates a synthetic origin of SARS-CoV-2,"Valentin Bruttel, Alex Washburne, Antonius VanDongen",2022-10-20
https://www.biorxiv.org/content/10.1101/2022.06.27.497797v1#comment-6019042892,biorxivstage,0,"This was a great paper, very informative comparisons and analysis done. The only source of confusion was with the supplementary figures 1A and 1B. You stated that, ""The number of VSGs in a sample did not correlate with either the number of reads aligned or the number of parasites in a sample 1A & B)"" which I agree with but you added on to state that this was ""suggesting that sampling of each population was sufficient"" which I didn't understand. Also the labeling of the x-axes for figures 4B and 4C was really confusing. 4B- I interpreted the label as though this measurement was done in only one mouse, but then this wouldn't be possible because the mouse would have been killed on day 10 and measurements couldn't have been done on day 14. Not until I read the text section. Maybe I'd advise that you add n=4 to this figure to indicate that 4 mice were monitored for each tissue. This was the same case for 4C. Ideally, one is supposed to look at the figure and get all the necessary information from it without checking the text part of the results for more information about what the figure is communicating.",2022-10-22T02:13:33,martinakathryn,Martina Kathryn,10.1101/2022.06.27.497797,Extravascular spaces are reservoirs of antigenic diversity in Trypanosoma brucei infection,"Alexander Beaver, Nathan P. Crilly, Jill Hakim, Bailin Zhang, Bryce Bobb, Filipa Rijo-Ferreira, Luisa Figueiredo, Monica R. Mugnier",2022-06-27
https://www.biorxiv.org/content/10.1101/2022.10.03.510577v1#comment-6018972069,biorxivstage,0,"This is interesting research, not only because it corroborates past findings, but also because it confirms and arouses mixed reactions concerning microbial diversity in equal measure. It is my pleasure to make these remarks. The work is well structured, well researched, and properly presented, easy to read even for non-scientific audiences. When going through the details though, I could not keep the concepts of hospital-acquired infections, antibiotic resistance, and the emergence of novel diseases out of my mind, particularly because of how they are linked to the overall concept of microbial diversity and adaptability. For antimicrobial resistance, for instance, the underlying factor has everything to do with the transfer of mobile genetic elements (MGEs) between two genomes. When MGEs access the chromosomes of new bacterial hosts, the outcome is phenotypical alteration. If the MGEs contained antibiotic resistance then novel or ongoing pathogenesis may result. Nevertheless, your study has demonstrated that bacterial species rarely cross environmental barriers. However, it is interesting to note that this is not the entirety of the results because there are distinct transitions between aquatic biomes, which, noteworthy, are ancient, rare, and often directed towards the brackish biome. At the same time, there are frequent transitions into brackish sites, which are harder to explain. I am just concerned, are there tests that can ascertain these claims? Previous studies have identified that bacteria are opportunistic and may manipulate any loophole to establish supremacy. The concern is further aggravated by your additional findings, that brackish bacteria often exhibit enriched gene functions for various physiological responses, including transcriptional regulation, which is integral in the re-writing genetic information, further begging the question should there be a cause for worry.",2022-10-22T00:15:10,cdsljhsph,CDSL JHSPH,10.1101/2022.10.03.510577,Large-scale phylogenomics of aquatic bacteria reveal molecular mechanisms for adaptation to salinity,"Krzysztof T Jurdzinski, Maliheh Mehrshad, Luis Fernando Delgado, Ziling Deng, Stefan Bertilsson, Anders F Andersson",2022-10-03
https://www.biorxiv.org/content/10.1101/2022.10.18.512756v1#comment-6018921217,biorxivstage,0,Do you think it would be worthwhile redesigning their analysis in any way? Or is the variance too high in all aspects to make any conclusions?,2022-10-21T22:40:34,dorkmo,dorkmo,10.1101/2022.10.18.512756,Endonuclease fingerprint indicates a synthetic origin of SARS-CoV-2,"Valentin Bruttel, Alex Washburne, Antonius VanDongen",2022-10-20
https://www.biorxiv.org/content/10.1101/2022.10.05.510968v1#comment-6018846955,biorxivstage,1,"Hello, I read your article. I knew nothing about whale song before this, but your article helped me realize the mystery and variability of whale song. In addition, I noticed that this research was over two decades. I really appreciate your persistence and dedication. I don't know anything about this area before, but I'd like to leave a few comments here. I apologize if there's anything inappropriate. As for panel 2C, the figure shows the INI song type spatial gradient in transition period. But do whales stay in one place? Can there be repeated measure? Is it possible that a particular whale or group of whales was sampled twice at two adjacent sampling location? Maybe you'd like to do a short one or two sentence discussion of the impact of whale migration on data collection. Also, have you tried using some type of tracer to track a particular whale? I was wondering if you could track the song of one whale, and the songs of other whales around it. If you have data on that, I'm very curious what that looks like. For the discussion section, personally, the reading experience is not that good. I felt like so many assumptions were thrown at me that it took me some time to sort out your central idea. If I may be so bold, would you consider re-section the paragraph, or making it a little bit more concise？ Again, thank you for doing such an amazing research. That was eye-opening for me.",2022-10-21T20:50:34,cdsljhsph,CDSL JHSPH,10.1101/2022.10.05.510968,Fin whale singalong: evidence of song conformity,"Miriam Romagosa, Sharon Nieukirk, Irma Cascão, Tiago A. Marques, Robert Dziak, Jean-Yves Royer, Joanne O’Brien, David K. Mellinger, Andreia Pereira, Arantza Ugalde, Elena Papale, Sofia Aniceto, Giuseppa Buscaino, Marianne Rasmussen, Luis Matias, Rui Prieto, Mónica A. Silva",2022-10-10
https://www.biorxiv.org/content/10.1101/2022.05.01.490203v1#comment-6018827671,biorxivstage,0,"This article ""SARS-CoV-2 Main Protease: a Kinetic Approach"" has been published in the peer-review Journal of Physical Chemistry & Biophysics at the following URL: https://www.longdom.org/ope...",2022-10-21T20:26:49,thierryrebetez,Thierry Rebetez,10.1101/2022.05.01.490203,SARS-CoV-2 Main Protease: a Kinetic Approach,Thierry Rebetez,2022-05-02
https://www.biorxiv.org/content/10.1101/2022.09.26.509600v2#comment-6018804633,biorxivstage,0,"This was a well conducted study to identify a small molecule that could inhibit the development of antimicrobial resistance. The authors identified a small molecule (ARM-1) that inhibited the RNA polymerase-associated DNA translocase Mfd, a protein shown to be involved in the development of antimicrobial resistance, and inhibited its ability to dissociate stalled RNAPs from DNA and had a modest impact on intrinsic ATPase activity of Mfd. The assays used were well suited for the study and revealed ARM-1's ability to inhibit Mfd and reduce the rate of mutation in bacteria grown in culture and during the course of infection of a human cell line. The authors also highlight that there was no detectable resistance of the bacteria to ARM-1 and that ARM-1 is able to deter the development of anitmicrobial resistance in diverse bacterial species. Only minor edits to spelling and grammar would be suggested. For example, the figure caption for Figure 4 says that the ""Concentration of ARM-1 used against S. enterica is 50 uM,"" however, S. enterica was not one of the species indicated in the figure. Overall, this manuscript represents a significant advance in the battle against antimicrobial resistance and opens the door to further studies that explore the effects of this or other similar molecules in a mammalian system during the course of infection.",2022-10-21T19:59:23,disqus_wZwaz0XRhc,Billy,10.1101/2022.09.26.509600,A small molecule that inhibits the evolution of antibiotic resistance,"Anna E. Johnson, Harrison Bracey, Angel Joel Hernandez Viera, Juan Carvajal-Garcia, Esra N. Simsek, Kwangho Kim, Houra Merrikh",2022-10-03
https://www.biorxiv.org/content/10.1101/2022.10.18.512756v1#comment-6018631047,biorxivstage,1,"I appreciate the approach and that your data is public, but I disagree with the conclusion for a few reasons. I really hope you can address these issues before certain “news” organizations gets ahold of this. One criterion for IVGA is even spacing of cut sites, yet the SARS-CoV-2 BsaI/BsmBI fingerprint includes a tiny 643nt fragment within nsp13/helicase. This region is identical to SARS except for a single I->V mutation, so why would anyone engineering this virus want to separate this fragment to then do nothing to it? I prefer to believe this is just a cherry-picked pair of restriction enzymes and random noise. One could argue that this is similar to the less even iWIV1 cuts (Figure 2B), but iWIV1’s shortest fragment is still much larger than SARS-CoV-2’s and is only so short because of plasmid instability reported by Zeng et al. This unstable region is, however, very far from SARS-CoV-2’s short fragment, so again I see no reason why anyone would need this short fragment for engineering. Relatedly, although the longest fragment length is minimized when cuts are perfectly even spaced, statistics based on longest fragment length are not robust against tiny fragments and lead to false positives. Accounting for all fragment length by fitting to Poisson/exponential distributions would give better statistics, and I’m sure that SARS-CoV-2 would become less significant i.e. nothing in Figure 3A looks at all like Figure 2A.",2022-10-21T16:40:50,disqus_8AVEuorTBu,disqus_8AVEuorTBu,10.1101/2022.10.18.512756,Endonuclease fingerprint indicates a synthetic origin of SARS-CoV-2,"Valentin Bruttel, Alex Washburne, Antonius VanDongen",2022-10-20
https://www.biorxiv.org/content/10.1101/2022.10.18.512756v1#comment-6018585636,biorxivstage,0,"The authors state that ""The combined odds of obtaining 5 wobble mutations by chance is likely very low (Table S3), although robust estimation of the odds requires considering a space of possible sites and careful examination of wobble mutation rates in the literature, so we leave this task to future research.”However, it is already known to be the case that RNA viruses are under strong purifying selection (doi: 10.1016/j.gene.2007.09.013), and that synonymous SNPs occur far more often than non-synonymous SNPs. This difference affects the validity of their in silico mutation analysis.",2022-10-21T15:50:35,JackJack25,Jackson Emanuel,10.1101/2022.10.18.512756,Endonuclease fingerprint indicates a synthetic origin of SARS-CoV-2,"Valentin Bruttel, Alex Washburne, Antonius VanDongen",2022-10-20
https://www.biorxiv.org/content/10.1101/2022.10.18.512756v1#comment-6018200822,biorxivstage,0,The distribution of random fragment lengths is a beta distribution. (Roach JC. Random subcloning. Genome Res. 1995 Dec;5(5):464-73. doi: 10.1101/gr.5.5.464. PMID: 8808467.) Maximum fragment length is not a robust statistic - it has high variance.,2022-10-21T03:51:47,disqus_vynbxSPwH1,Jared Roach,10.1101/2022.10.18.512756,Endonuclease fingerprint indicates a synthetic origin of SARS-CoV-2,"Valentin Bruttel, Alex Washburne, Antonius VanDongen",2022-10-20
https://www.biorxiv.org/content/10.1101/2022.10.05.510968v1#comment-6018184102,biorxivstage,1,"I had a lot of pleasure reading the article. I knew nothing about fin whales, so I had a lot of questions. If the public targeted by this article are not fin whale specialist, I think it could be helpful to add more information about their reproductive behavior and their immigration pattern. The question I asked myself were: Do the fine whales migrate? If they do what their migration pattern? Do they come back at the same place at the reproduction period? I think the article needs to give us the proof that population that measured overtime at different place are not the same, that there is no replacement of a group by another one, do the group get mixed? Since the authors are looking at evidence of song learning and conformity, I think it is important to ascertain that we are talking about different population across different geographic location and not the same group that would be recorded over different time period at different place. I don't think there was a tracker device, that would have help or at least it more information about the fin whale behavior during the reproduction period need to be clarify. I would suggest providing more information about the data collection, or in the discussion explain why all regions were not sampled in all years and time periods. Why was hydrophone channel used in the Canary Island, but the seismometer preferred for BBIC? The figure 4 does add any information, all seem well described by the 3 first figures. Maybe I missed, but I did not see in the discussion an explanation about the why there were no change in INI with the fin whale population in the Barents Sea. If there is no way to ascertain with this data that they were no population replacement, I would then add it in the limitation section. Those are the main points that I want to share, as a reader who is not the field of animal communication.",2022-10-21T03:13:15,cdsljhsph,CDSL JHSPH,10.1101/2022.10.05.510968,Fin whale singalong: evidence of song conformity,"Miriam Romagosa, Sharon Nieukirk, Irma Cascão, Tiago A. Marques, Robert Dziak, Jean-Yves Royer, Joanne O’Brien, David K. Mellinger, Andreia Pereira, Arantza Ugalde, Elena Papale, Sofia Aniceto, Giuseppa Buscaino, Marianne Rasmussen, Luis Matias, Rui Prieto, Mónica A. Silva",2022-10-10
https://www.biorxiv.org/content/10.1101/2022.09.26.509600v2#comment-6018179296,biorxivstage,0,"It’s very refreshing to interpretate the AMR problem in the evolutionary point of view. The idea of inhibiting the evolution of antimicrobial resistance is fascinating and creative. And I’m very excited to see a brand-new potential solution to AMR. But I think this paper can be even better if there’s more clarification for people without rich related backgrounds. As for the abstract and introduction part, I understand that researchers chose Mfd as a target based on their previous research. But I’m curious if there is any other reason why they chose Mfd as a target? For example, if there is any other advantages of targeting Mfd. Or if there have already been studies focusing on molecules targeting Mfd so there’s already material for this research. Also, I’m curious whether there are any other possible targets for anti-evolution. Maybe going deeper into possible mechanisms of anti-evolution could help me even better understand the importance of this research. As for the methods, I believe it’s already clear enough. One thing I’m interested in but not explained in the article is that, where did the authors get these candidate compounds. Is it based on previous research or specific design. I think giving more information in this part may be helpful for clarifying the origin or differences between theses leading compounds. The figures and results are very clear and closely related to the hypothesis under testing. It may be clearer to me if the authors can briefly explain why the chose these strains of bacteria for detection. For example, for what reasons why they can be representative. The discussion part is clear and thorough. I was hoping there could be more exploration on this result. For example, I am curious whether similar target exist in other pathogens like fungi. If there are any other major limitations for this method or leading compound. Moreover, there could be more explorations on the potential further research directions since this idea is refreshing and inspiring. Overall, I really like the idea of re-thinking solving AMR form the root, and interpretating this problem from evolution’s point of view.",2022-10-21T03:03:05,h_bao,H Bao,10.1101/2022.09.26.509600,A small molecule that inhibits the evolution of antibiotic resistance,"Anna E. Johnson, Harrison Bracey, Angel Joel Hernandez Viera, Juan Carvajal-Garcia, Esra N. Simsek, Kwangho Kim, Houra Merrikh",2022-10-03
