comment url,comment forum,comment keywords,comment message,comment date,comment username,comment name,paper doi,paper title,paper authors,paper date
https://www.biorxiv.org/content/10.1101/2025.04.09.647750v1#comment-6689241771,biorxivstage,0,https://braintrawler-circuit.vrvis.at/ the link above  yields 401 Authorization Required nginx,2025-04-16T14:20:04,amin_cheikhi,Amin Cheikhi,10.1101/2025.04.09.647750,Circuit Mining in Transcriptomics Data,"Tobias Peherstorfer, Sophia Ulonska, Bianca Burger, Simone Lucato, Bader Al-Hamdan, Marvin Kleinlehner, Till F. M. Andlauer, Katja Bühler",2025-04-15
https://www.biorxiv.org/content/10.1101/2024.09.09.612165v1#comment-6688956960,biorxivstage,1,This preprint has now been published in Nature Communications : https://doi.org/10.1038/s41467-025-58856-6. A link to the published version will be added soon.,2025-04-16T00:39:10,ji_woo_park,Ji-Woo Park,10.1101/2024.09.09.612165,"The food–gut axis: the phyllosphere virome of fresh vegetables is diverse, abundant, and transmitted to the human gut virome","Ji-Woo Park, Yeo-Eun Yun, Jin Ah Cho, Su-In Yoon, Su-A In, Eun-Jin Park, Min-Soo Kim",2024-09-10
https://www.biorxiv.org/content/10.1101/2024.04.16.589741v2#comment-6688854549,biorxivstage,0,"“Mi8” is likely an atypical Mi1... I believe, Mi8 is an atypical Mi9 (""shifted"" by one medulla layer), not an Mi1.",2025-04-15T20:56:55,,KK,10.1101/2024.04.16.589741,Connectome-driven neural inventory of a complete visual system,"Aljoscha Nern, Frank Loesche, Shin-ya Takemura, Laura E Burnett, Marisa Dreher, Eyal Gruntman, Judith Hoeller, Gary B Huang, Michał Januszewski, Nathan C Klapoetke, Sanna Koskela, Kit D Longden, Zhiyuan Lu, Stephan Preibisch, Wei Qiu, Edward M Rogers, Pavithraa Seenivasan, Arthur Zhao, John Bogovic, Brandon S Canino, Jody Clements, Michael Cook, Samantha Finley-May, Miriam A Flynn, Imran Hameed, Alexandra MC Fragniere, Kenneth J Hayworth, Gary Patrick Hopkins, Philip M Hubbard, William T Katz, Julie Kovalyak, Shirley A Lauchie, Meghan Leonard, Alanna Lohff, Charli A Maldonado, Caroline Mooney, Nneoma Okeoma, Donald J Olbris, Christopher Ordish, Tyler Paterson, Emily M Phillips, Tobias Pietzsch, Jennifer Rivas Salinas, Patricia K Rivlin, Philipp Schlegel, Ashley L Scott, Louis A Scuderi, Satoko Takemura, Iris Talebi, Alexander Thomson, Eric T Trautman, Lowell Umayam, Claire Walsh, John J Walsh, C Shan Xu, Emily A Yakal, Tansy Yang, Ting Zhao, Jan Funke, Reed George, Harald F Hess, Gregory SXE Jefferis, Christopher Knecht, Wyatt Korff, Stephen M Plaza, Sandro Romani, Stephan Saalfeld, Louis K Scheffer, Stuart Berg, Gerald M Rubin, Michael B Reiser",2024-06-01
https://www.biorxiv.org/content/10.1101/2022.11.09.515610v3#comment-6688653606,biorxivstage,0,This manuscript was published in Proteomics Journal at the following link and the link has not appeared on this page yet after 4 weeks: https://analyticalsciencejournals.onlinelibrary.wiley.com/doi/full/10.1002/pmic.202400238,2025-04-15T15:24:19,,Mohieddin Jafari,10.1101/2022.11.09.515610,Monitoring Functional Post-Translational Modifications Using a Data-Driven Proteome Informatic Pipeline,"Payman Nickchi, Uladzislau Vadadokhau, Mehdi Mirzaie, Marc Baumann, Amir A. Saei, Mohieddin Jafari",2025-03-13
https://www.biorxiv.org/content/10.1101/2025.04.09.647074v1#comment-6688576704,biorxivstage,0,"THE ""ACCENT"" OF DNA You can explain the ""de-extinction"" problem, be it with mice or dire wolf, historically by considering the four bases in DNA sequences: 1. Chargaff circa 1950 discovered that DNA base composition (not sequence) was a species characteristic, simply expressed as GC% (as opposed to AT%). 2. So, there were GC%-rich species and AT%-rich species, with the exact values differing between species. 3. We biochemists and others discovered circa 1990 that actually the difference was due to short sequences (k-mers). 4. Thus, for k=3. GC%-rich species would be enriched in GTC, GGA, GGC, CAG, etc. Whereas for an AT-rich species ACT, AAG, AAT, TGA, etc. 5. Given 4 bases (A, C, G, T), for k=2 there would be 4x4 = 16 possibilities. For k=3 there would be 4x4x4 = 64 possibilities. 6. In practice the range varies from k=3 to k=8. 7. Fragments of DNA from, say, a soil sample, will correspond to a variety of species in the sample. But just by assessing the k-mer patterns in the fragments, those corresponding to each species can be identified. 8. Then you can look at the fragments corresponding to one species and examine long sections to identify gene sequences (viewed as ""sentences"" or ""word strings""). 9. So, k-mers can be seen as the ""accent"" or ""dialect"" of DNA that relates to what species it belongs to. Unless you take that into account you cannot make a new species by just inserting a few genes to change appearance. 10. Just as accent can influence reproductive choices between humans (remember Eliza Doolittle), so it influences the reproductive isolation that is the defining characteristic of a species. [A paper in the December 2024 issue of the Journal of Theoretical Biology goes into more details. Or see my textbook - Evolutionary Bioinformatics (3rd edition, 2016).]",2025-04-15T13:14:47,forsdyke,Donald R. Forsdyke,10.1101/2025.04.09.647074,On the ancestry and evolution of the extinct dire wolf,"Gregory L. Gedman, Kathleen Morrill Pirovich, Jonas Oppenheimer, Chaz Hyseni, Molly Cassatt-Johnstone, Nicolas Alexandre, William Troy, Chris Chao, Olivier Fedrigo, Savannah J. Hoyt, Patrick G.S. Grady, Sam Sacco, William Seligmann, Ayusman Dash, Mithil Chokshi, Laura Knecht, James B. Papizan, Tyler Miyawaki, Sven Bocklandt, James Kelher, Sara Ord, Audrey T. Lin, Brandon R. Peecook, Angela Perri, Mikkel-Holger S. Sinding, Greger Larson, Julie Meachen, Love Dalén, Bridgett vonHoldt, M Thomas P Gilbert, Christopher E. Mason, Rachel J. O’Neill, Elinor K. Karlsson, Brandi L. Cantarel, George R. R. Martin, George Church, Ben Lamm, Beth Shapiro",2025-04-11
https://www.biorxiv.org/content/10.1101/2025.03.03.641227v1#comment-6688574218,biorxivstage,0,"THE ""ACCENT"" OF DNA You can explain the ""de-extinction"" problem, be it mice or dire wolf, historically by considering the four bases in DNA sequences: 1. Chargaff circa 1950 discovered that DNA base composition (not sequence) was a species characteristic, simply expressed as GC% (as opposed to AT%). 2. So, there were GC%-rich species and AT%-rich species, with the exact values differing between species. 3. We biochemists and others discovered circa 1990 that actually the difference was due to short sequences (k-mers). 4. Thus, for k=3. GC%-rich species would be enriched in GTC, GGA, GGC, CAG, etc. Whereas for an AT-rich species ACT, AAG, AAT, TGA, etc. 5. Given 4 bases (A, C, G, T), for k=2 there would be 4x4 = 16 possibilities. For k=3 there would be 4x4x4 = 64 possibilities. 6. In practice the range varies from k=3 to k=8. 7. Fragments of DNA from, say, a soil sample, will correspond to a variety of species in the sample. But just by assessing the k-mer patterns in the fragments, those corresponding to each species can be identified. 8. Then you can look at the fragments corresponding to one species and examine long sections to identify gene sequences (viewed as ""sentences"" or ""word strings""). 9. So, k-mers can be seen as the ""accent"" or ""dialect"" of DNA that relates to what species it belongs to. Unless you take that into account you cannot make a new species by just inserting a few genes to change appearance. 10. Just as accent can influence reproductive choices between humans (remember Eliza Doolittle), so it influences the reproductive isolation that is the defining characteristic of a species. [A paper in the December 2024 issue of the Journal of Theoretical Biology goes into more details. Or see my textbook - Evolutionary Bioinformatics (3rd edition, 2016).]",2025-04-15T13:10:09,forsdyke,Donald R. Forsdyke,10.1101/2025.03.03.641227,Multiplex-edited mice recapitulate woolly mammoth hair phenotypes,"Rui Chen, Kanokwan Srirattana, Melissa L. Coquelin, Rafael Vilar Sampaio, Raphael Wilson, Rakesh Ganji, Jacob Weston, Alba Ledesma, Jessie Beebe, Jacob Sullivan, Yiren Qin, J. Chris Chao, James Papizan, Anthony Mastracci, Ketaki Bhide, Jeremy Mathews, Rorie Oglesby, Mitra Menon, Tom van der Valk, Austin Bow, Brandi L. Cantarel, Matt James, James Kehler, Love Dalén, Ben Lamm, George M. Church, Beth Shapiro, Michael E. Abrams",2025-03-04
https://www.biorxiv.org/content/10.1101/2024.10.30.621174v1#comment-6688569955,biorxivstage,0,"Article has in the meantime been published as: Degryse J, Maas E, Lassaunière R, Geerts K, Kumpanenko Y, Weynand B, Maes P, Neyts J, Thibaut HJ, Alpizar YA, Dallmeier K. Antigenic Imprinting Dominates Humoral Responses to New Variants of SARS-CoV-2 in a Hamster Model of COVID-19. Microorganisms. 2024 Dec 14;12(12):2591. doi: 10.3390/microorganisms12122591. PMID: 39770793; PMCID: PMC11678355.",2025-04-15T13:02:01,,Kai Dallmeier,10.1101/2024.10.30.621174,Antigenic imprinting dominates humoral responses to new variants of SARS-CoV-2 in a hamster model of COVID-19,"Joran Degryse, Elke Maas, Ria Lassaunière, Katrien Geerts, Yana Kumpanenko, Birgit Weynand, Piet Maes, Johan Neyts, Hendrik Jan Thibaut, Yeranddy A. Alpizar, Kai Dallmeier",2024-10-31
https://www.biorxiv.org/content/10.1101/2025.04.10.648184v1#comment-6688518139,biorxivstage,0,"This is amazing. Thank you so much for this work. The paper tantalizingly mentions more detailed images of the structure in supplemental figures, but they are not included in the PDF and do not seem to be available for download. Will they be posted soon? Also, is there any chance your Alphafold models (and manual extension of the model to the full pp1a’-nsp4-nsp10 + pp1ab’-nsp4-nsp16) can be made available for others to view? I'm very interested in the proximity of specific AA residues throughout the complex, which may help explain unusual mutational patterns throughout the replicase complex that have emerged independently hundreds of times.",2025-04-15T10:58:18,ryhisner,ryhisner,10.1101/2025.04.10.648184,A structural roadmap for the formation of the coronavirus nsp3/nsp4 double membrane vesicle pore and its implications for polyprotein processing and replication/transcription,"Jason K. Perry, Samuel Itskanov, John P. Bilello, Eric B. Lansdon",2025-04-11
https://www.biorxiv.org/content/10.1101/2024.03.04.583246v2#comment-6688475036,biorxivstage,0,This paper has been published in Communications Biology: https://www.nature.com/articles/s42003-025-08006-x,2025-04-15T08:24:46,yatangli,Yatang Li,10.1101/2024.03.04.583246,Preference-Independent Encoding of Visual Saliency Within but Not Cross Features in the Mouse Superior Colliculus,"Ruixiang Wu, Jinhuai Xu, Chunpeng Li, Zhaoji Zhang, Ling-yun Li, Ya-tang Li",2024-06-18
https://www.biorxiv.org/content/10.1101/2025.04.01.646460v1#comment-6688342712,biorxivstage,1,Will the GitHub repository be made public?,2025-04-15T00:40:23,gennadygorin,Gennady Gorin,10.1101/2025.04.01.646460,Integrated single-cell and spatial multiomic analysis reveals widespread reactivation of developmental programs in diseased human hearts,"William Gao, Peng Hu, Qi Qiu, Xiangjin Kang, Kenneth C. Bedi, Kotaro Sasaki, Kenneth B. Margulies, Hao Wu",2025-04-07
https://www.biorxiv.org/content/10.1101/2024.11.09.622790v1#comment-6687995214,biorxivstage,0,Interesting new data on the relationship between neuronal firing rate and differential release of SMATs (small molecule amine transmitters) and neuropeptides in a functionally important brainstem to forebrain circuit.,2025-04-14T13:19:56,,L. Eiden,10.1101/2024.11.09.622790,Encoding opposing valences through frequency-dependent transmitter switching in single peptidergic neurons,"Dong-Il Kim, Sukjae J. Kang, Jinho Jhang, Yong S. Jo, Seahyung Park, Mao Ye, Gyeong Hee Pyeon, Geun-Ho Im, Seong-Gi Kim, Sung Han",2024-11-09
https://www.biorxiv.org/content/10.1101/2024.10.18.619131v1#comment-6687982033,biorxivstage,0,paper published in Cell. Mol. Life Sci. https://link.springer.com/article/10.1007/s00018-025-05641-9,2025-04-14T12:53:05,,Cedar,10.1101/2024.10.18.619131,Nicotinamide Metabolism Reprogramming Drives Reversible Senescence of Glioblastoma Cells,"Ashwin Narayanan, Mirca S Saurty-Seerunghen, Jessica Michieletto, Virgile Delaunay, Arnaud Bruneel, Thierry Dupré, Chris Ottolenghi, Clément Pontoizeau, Lucrezia Ciccone, Andreas De La Vara, Ahmed Idbaih, Laurent Turchi, Thierry Virolle, Hervé Chneiweiss, Marie-Pierre Junier, Elias A. El-Habr",2024-10-22
https://www.biorxiv.org/content/10.1101/2025.04.03.646226v1#comment-6687790912,biorxivstage,0,"Are you planning to analyze the Y chromosomes? There is a severe shortage of high-resolution Y chromosomal data from Australia, and patrilines often show very different patterns from matrilines.",2025-04-14T00:54:09,caprainternetensis,Capra internetensis,10.1101/2025.04.03.646226,"A high-resolution genomic study of the Pama-Nyungan speaking Yolngu people of northeast Arnhem Land, Australia","Neville White, Manoharan Kumar, David Lambert",2025-04-03
https://www.biorxiv.org/content/10.1101/2025.03.19.644115v2#comment-6687377729,biorxivstage,0,"Dear PanSpace authors, thank you for this excellent work! I have a few questions related to the benchmark.  The comparison between PanSpace and GSearch for space requirement is not clear to me because it says very clear in the abstract of GSearch paper that, it only requires 2.5G space using the SetSketch option, which is around 6G only for AllThebacteria, but not 80G for the default ProbMinHash option. ProbMinHash is very space inefficient since it considered all kmers and their abundance while SetSketch is very space efficient and also fast (not so fast as the fastest option Densified MinHash). Also, for genus level classification, GSearch can be done in amino acid space (after predicting genes), which ANI in nt space will lose accuracy (a well know problem). Can the genus level benchmark be done also in amino acid space, which is also clearly there in abstract (3-step framework). Thanks! Jianshu",2025-04-13T06:29:39,jianshuzhao,Jianshu Zhao,10.1101/2025.03.19.644115,PanSpace: Fast and Scalable Indexing for Massive Bacterial Databases,"Jorge Avila Cartes, Simone Ciccolella, Luca Denti, Raghuram Dandinasivara, Gianluca Della Vedova, Paola Bonizzoni, Alexander Schönhuth",2025-04-05
https://www.biorxiv.org/content/10.1101/2024.09.02.610911v1#comment-6687196460,biorxivstage,0,This article is now published at https://doi.org/10.1016/j.physbeh.2025.114862,2025-04-12T20:14:01,kalynnschulz,Kalynn Schulz,10.1101/2024.09.02.610911,Adolescent development of anxiety-related behavior and shifts in behavioral responsiveness to estradiol in female mice,"Kalynn M. Schulz, Marcia C. Chavez, Zoey Forrester-Fronstin",2024-09-03
https://www.biorxiv.org/content/10.1101/2024.09.21.613295v3#comment-6686841668,biorxivstage,0,"To appear in J Prot Res (accepted April 11, 2025).",2025-04-12T02:40:33,disqus_MpyEq3E4IG,Julian C,10.1101/2024.09.21.613295,Effects of in vitro hemolysis and repeated freeze-thaw cycles in protein abundance quantification using the SomaScan and Olink assays,"Julián Candia, Giovanna Fantoni, Ruin Moaddel, Francheska Delgado-Peraza, Nader Shehadeh, Toshiko Tanaka, Luigi Ferrucci",2025-04-07
https://www.biorxiv.org/content/10.1101/2022.09.12.507664v1#comment-6686734506,biorxivstage,0,"This work is now published with a slightly different title""Selective attention sharpens population receptive fields in human auditory cortex"" at: https://doi.org/10.1093/cercor/bhac427",2025-04-11T21:41:10,omerfarukgulban,Omer Faruk Gulban,10.1101/2022.09.12.507664,Selective attention reduces responses to relevant sounds in human auditory cortex,"Agustin Lage-Castellanos, Federico De Martino, Geoffrey M. Ghose, Omer Faruk Gulban, Michelle Moerel",2022-09-13
https://www.biorxiv.org/content/10.1101/2024.09.04.611294v1#comment-6686732614,biorxivstage,1,"This preprint is now published with a different title ""Short-term gradient imperfections in high-resolution EPI lead to Fuzzy Ripple artifacts"" at: https://doi.org/10.1002/mrm.30489",2025-04-11T21:36:35,omerfarukgulban,Omer Faruk Gulban,10.1101/2024.09.04.611294,"Fuzzy ripple artifact in high resolution fMRI: identification, cause, and mitigation","Renzo Huber, Rüdiger Stirnberg, A Tyler Morgan, David A Feinberg, Philipp Ehses, Lasse Knudsen, Omer Faruk Gulban, Kenshu Koiso, Stephanie Swegle, Isabel Gephart, Susan G Wardle, Andrew Persichetti, Alexander JS Beckett, Tony Stöcker, Nicolas Boulant, Benedikt A Poser, Peter Bandettini",2024-09-09
https://www.biorxiv.org/content/10.1101/2025.02.27.640495v2#comment-6686539507,biorxivstage,2,"The manuscript by Azulay et al. investigates the cooperative interaction between Listeria monocytogenes (Lm) strain 10403S and its prophage ɸ10403S. The authors identify and characterize a novel anti-phage defense system that is encoded in the genome of the prophage focusing on the ORF65 protein renamed TerI (for terminase inhibitor). The study shows that TerI inhibits phage reproduction by targeting the phage terminase complex of invading phages, thus preventing the packaging of phage DNA. Azulay et al. also discover two other prophage encoded proteins that provide the phage with immunity against its own TerI protein and thus enable packaging of its own genetic material. This preprint is well-written and contains high-quality data that advances the field of phage biology and anti-phage defense systems. We provide below some suggestions to strengthen the methodology, and to increase the clarity in the interpretation of the results. Major comments A loading control is required in Figure 1B, 2F, 2G, and 4D to verify that the amount of protein entered into each well is the same either using an antibody against a protein that does not change or using Coomassie or Ponceau stain of the membrane. Additionally, relative quantification (to the loading control) of immunoblots would be helpful to measure the loss of ORF65 co-sedimentation in the ΔterSL mutant (Figure 2G) to strengthen the finding that ORF65/TerI interacts with TerS. For Figure 2F, a quantification of the immunoblot, ideally including a dilution series, would further support the statement that both the bacterial strains, expressing ORF65 or not, produced or released a similar number of capsids. Page 11: “ectopic expression of each of these genes alone (i.e., without TerI expression) did not affect virion production, as compared to WT bacteria, suggesting that the encoded proteins play a specific role in neutralizing TerI.” In Figure 3D, the ectopic expression of LMRG_01518 shows a large standard deviation reaching about 50%WT in PFU, suggesting that overexpression of LMRG_01518 may impact virion production. We recommend showing individual data points of each replicate and to provide a possible explanation for this high standard deviation. Page 12: “Altogether, these findings indicated that TerI is fully active during 10403S induction and that LMRG_01518 and LMRG_02984 counteract its activity, functioning as self-immunity proteins that allow 10403S DNA packaging and virion assembly”. However, only LMRG_02984 directly interacts with TerI and not LMRG_01518 (Figure 3H). This data may explain the stronger phage ɸ10403S rescue consistently observed when LMRG_02984 is present compared to LMRG_01518 (Figure 3E). There is a question as to whether the results, as currently reported, fully support the direct interaction of LMRG_01518 with TerI. The study could incorporate a BACTH assay between LMRG_02984 and LMRG_01518 to support that conclusion, or the text could be revised to ensure the conclusions tightly align to the findings currently included (e.g. the model in Figure 5 depicts direct interaction between anti-TerI1(01518) and TerI). The discussion, while well-written, reads more like a minireview and could focus more on the findings. It could be expanded by elaborating more on the data presented and how it supports the model presented in Figure 5. Of particular interest is the discussion of LMRG_01518 inhibiting TerI function although not interacting with TerI directly. Other interesting points to discuss include the specificity of the TerI/anti-TerI1, I2 system, could the invading phage encode anti-TerI as well? How about the TerI/TerS specificity, from the data presented, it seems that TerI is able to inhibit TerS from different phages. Is there anything known about the function of LMRG_01518 and LMRG_02984 besides their role as anti-TerI? On Figure 3C, it seems that expression of LMRG_01517 largely decreases PFU compared to control, this result could be discussed. We realize it is beyond the scope of this study, but it would be of interest to perform a BLAST search with terI. This novel anti-phage defense system might be used by other temperate phages in other bacteria. It would be interesting to see how many other phages use this system. Or perhaps this is something exclusive to the Lm phages? Minor comments - Page 6: could you explain the choice of not using the his-tagged ORF65 from Figure 1E and on. We understand this may be technically difficult due to lack of specific antibodies against TerI and anti-TerI1 and 2, but something that was not obvious to us was whether the ectopic expression of ORF65 resulted in overexpression compared to endogenous levels in WT and whether exogenous infection leads to anti-terI1 and anti-terI2 expression. Figure 1F, we would have expected higher PFU than WT in the ATG*orf65 if ORF65 is present in WT to prevent virion production, and Figure 1G, we would have expected some level of PFU if anti-TerI are present to counteract TerI. There is a sentence that could be clarified “To this end, we infected Lm bacteria cured of ɸ10403S and deleted the comKgene with free particles of ɸ10403S in the presence or absence of orf65 ectopic expression (i.e…).” Consider breaking it into two: “We made ΔcomK Lm bacteria cured of ɸ10403S (Lm Δɸ10403S-ΔcomK). We then infected Lm Δɸ10403S-ΔcomK with ɸ10403S particles in the presence or absence of orf65 ectopic expression…” - Page 11: could you clarify the following sentence “cro (corresponding to the first early gene)” and define the acronym cro in the first instance. It is not clear to us whether cro itself is considered an early gene as it represses early genes. - Methods: could you describe how the ATG*orf65 mutation was exactly made and explain the choice of this mutation as opposed to deleting the Shine-Dalgarno sequence of the rpsD promoter (if it contains one). Could you also explain why the mutagenesis of the -10 box of the orf65 promoter involved 5 bases and not less. - Figure 1A (and 3A): LMRG_01515 is labeled as LMRG_1515, include the missing zero in the locus number. - Figure 1C, 1E, 2C, 2D: plot growth curves on a log scale rather than linear as it is standard in the field. - Figure 1F, 3C, 3D: y-axis of PFU (% WT) needs to be consistent and should be put on a linear scale rather than a logarithmic scale as it is standard in the field. Provide number of replicates in the panel (such as N = 3). - Figure 1H: clarify which ones are lytic or temperate (prophages) in the panel by adding labels below the phage names. Also, keep consistent the nomenclature of the phages in the text to match figures (phage names missing phi symbol in text). - Figure 2F: could you explain the choice of quantifying attP rather than attB. - Figure 2E: increase scale size and keep panel sizes consistent and aligned. - Figure 2G: explain the low level of ORF65 detected in the ΔΦ pellet in the first panel. Are the ΔterS and ΔterL mutants available, it would be of interest to test these as well to strengthen the BACTH assay in Figure 2H showing direct interaction with TerS but not L. This may be technically challenging, but all samples could be run on one gel to produce one blot, if possible, for ease of comparison. - Figure 3: for consistency in the panels presented, the nomenclature used to describe LMRG_02984 and LMRG_01518 should not be changed to anti-TerI1 and anti-TerI2. - Figure 3A: make the phage genome image larger and include description in the legend. - Figure 3H: LMRG_01518 was included as part of the negative controls. Maddy McPherson and Octavio Origel (Indiana University Bloomington) - not prompted by a journal; this review was written within a Peer Review in Life Sciences graduate course led by Alizée Malnoë with input from group discussion including Sally Abulaila, Kim Kissoon, Michael Kwakye, Madison McReynolds, Mandkhai Molomjamts, Habib Ogunyemi and Ren Wilson.",2025-04-11T15:45:59,alizee_malnoe,Alizée Malnoë,10.1101/2025.02.27.640495,A prophage-encoded anti-phage defense system that prevents phage DNA packaging by targeting the terminase complex,"Gil Azulay, Nadejda Sigal, Keren Tzohar Rabinovich, Dan Koenigsfeld, Olga Stadnyuk, Avijit Das, Polina Lisitzin, Einat Biderman, Ilya Borovok, Anat A. Herskovits",2025-03-03
https://www.biorxiv.org/content/10.1101/2024.04.08.588272v1#comment-6686383185,biorxivstage,0,Now published in Communications Biology https://doi.org/10.1038/s42003-025-07712-w,2025-04-11T10:18:57,bacillusbiofilms,Bacillus Biofilms,10.1101/2024.04.08.588272,Somatic embryogenesis of grapevine (Vitis vinifera) expresses a transcriptomic hourglass,"Sara Koska, Dunja Leljak-Levanić, Nenad Malenica, Kian Bigović Villi, Momir Futo, Nina Čorak, Mateja Jagić, Anja Tušar, Niko Kasalo, Mirjana Domazet-Lošo, Kristian Vlahoviček, Tomislav Domazet-Lošo",2024-04-11
