comment url,comment forum,comment keywords,comment message,comment date,comment username,comment name,paper doi,paper title,paper authors,paper date
https://www.biorxiv.org/content/10.1101/2022.08.30.505852v1#comment-6001848150,biorxivstage,2,"The labs of Seth Rubin and Carrie Partch at UCSC jointly reviewed this preprint. This manuscript examines how the two transactivation domains (TADs) of β-catenin interact with several domains of CBP/p300 to potentially control transcriptional activation. A combination of biochemistry, NMR, and ITC studies narrow down several binding sites for TAZ1 and TAZ2 domains. Overall, the manuscript is well organized and provides new details on these interactions that may play a role in β-catenin function. We have some suggestions that might enhance the clarity of the work below. Thanks for an enjoyable read! Figure 1: •	The schematics do not depict consistent widths/domain lengths and CBP/p300 is missing some domains, including one implicated in β-catenin binding (Emami et al. 2004, PNAS). •	It would be helpful if your schematic also illustrated all of the constructs used in the study and these names were used consistently. •	If space allows, a simplified diagram of the pathway described in the text could be helpful. Figure 2: •	It would be helpful to add dashed line for predicted secondary structure cut-off at 0.3 in panel B. •	It would enhance the rigor of the work to show expression levels for the constructs used in panel C. Figure 3: •	Labeling the MW markers, light and heavy IgG chains, and proteins (does the 666-781 fragment overlap with the light chain?) in panel A, along with the input, would make this figure easier to read. •	The results of the pulldown seem pretty straightforward so quantification from n = 2 experiments seems unnecessary. If you do so, please define what ‘relative’ means in the quantification and make sure that your statistical methodologies are appropriate for this low n. Figure 4: •	There is some concern that the ITC data might be overfit to a two-site binding model without more information on the fits.  Additional rationale or evidence that justifies use of the two-site model would also be welcome. Figures 5 & 7: •	It might be easier to interpret the binding interface if you used surface representation for the TAZ domains instead of ribbon. Figure 8: •	It was a bit confusing to show an analysis of the NMR data from the construct used in Fig. S3 in panel A,  but then use data in panels B – E from a larger construct. We struggled a bit throughout the manuscript to match domain names and fragments (see Fig. 1 comment above) with the data. •	It could be helpful to conclude with a cartoon or schematic that illustrates what was learned here. Other: •	Discussion text mentions a possible role for phosphorylation of serines; if citations for this exist, please add them or perhaps broaden this to a possible role for PTMs in general. •	Consistent labeling of ITC data throughout the paper would help clarify which fragments of b-catenin were used in each experiment.",2022-10-02T17:56:40,carriepartch,Carrie Partch,10.1101/2022.08.30.505852,β-catenin interacts with the TAZ1 and TAZ2 domains of CBP/p300 to activate gene transcription,"Alexandra D. Brown, Connor Cranstone, Denis J. Dupré, David N. Langelaan",2022-08-30
https://www.biorxiv.org/content/10.1101/539940v1#comment-6001305610,biorxivstage,0,Updated manuscript published in Developmental Cell https://www.cell.com/develo... DOI: https://doi.org/10.1016/j.d...,2022-10-02T00:01:57,jankaslin,Jan Kaslin,10.1101/539940,Early migration of precursor neurons initiates cellular and functional regeneration after spinal cord injury in zebrafish,"Celia Vandestadt, Gilles C. Vanwalleghem, Hozana Andrade Castillo, Mei Li, Keith Schulze, Mitra Khabooshan, Emily Don, Minna-Liisa Anko, Ethan K. Scott, Jan Kaslin",2019-02-04
https://www.biorxiv.org/content/10.1101/2022.09.22.509085v1#comment-6000953446,biorxivstage,0,"This study is an elegant confirmation of the well-established fact that growth cones need dynamic microtubules to execute a turn while providing new optogenetic tools to interrogate +TIP functions.  The demonstration that EB3 cannot substitute for EB1 in maintaining microtubule growth perhaps should not come as a great surprise since EB3 occupies a more proximal position than EB1 at the microtubule plus end as first shown in cell lines (Dart et al; 2017, Oncogene 36, 4111-4123 https://doi.org/10.1038/onc... Roth et al., 2019, J. Cell Sci., 132, 1–18. https://doi.org/10.1242/jcs... and, more recently, in cortical neurons (Poobalsingam et al., 2021 https://doi.org/10.1111/jnc....",2022-10-01T15:44:36,phillipgordonweeks,Phillip Gordon-Weeks,10.1101/2022.09.22.509085,Growth cone advance requires EB1 as revealed by genomic replacement with a light-sensitive variant,"Alessandro Dema, Rabab Charafeddine, Shima Rahgozar, Jeffrey van Haren, Torsten Wittmann",2022-09-23
https://www.biorxiv.org/content/10.1101/2022.09.01.506178v2#comment-6000445927,biorxivstage,0,"Small things: S6, S7,... There's a typo in multiple figures, ""Addative"". The sign of Figure 4D and E might be reversed. In Methods ""rfc"" is supposed to be ""rcf"". The author's point could be strengthened by mentioning the RMSE of the trio models in the text (rather than just in the Figure), as was done for the pair models. Figure 3A is a little confusing regarding the relationship between all the bar graphs-- could be useful to add an ""="" before the 4th bar graph in each series so show what each model predicts the outcome to be.",2022-09-30T22:29:46,mitmicrobiomeclub,MIT Microbiome Club,10.1101/2022.09.01.506178,Interactions between culturable bacteria are highly non-additive,"Amichai Baichman-Kass, Tingting Song, Jonathan Friedman",2022-09-12
https://www.biorxiv.org/content/10.1101/2022.09.01.506178v2#comment-6000445730,biorxivstage,0,"Figure 2D displays nearly bimodal distribution of effect on focal by pairs of affecting species. Could be nice to explore if this difference is consistently (across RP, BI, CF) due to the same groups of affecting species.",2022-09-30T22:29:26,mitmicrobiomeclub,MIT Microbiome Club,10.1101/2022.09.01.506178,Interactions between culturable bacteria are highly non-additive,"Amichai Baichman-Kass, Tingting Song, Jonathan Friedman",2022-09-12
https://www.biorxiv.org/content/10.1101/2022.09.01.506178v2#comment-6000445639,biorxivstage,0,"The authors should clarify if growth rate is included in ""metabolic profile"" in the list of things that correlated with effect size across focal species.",2022-09-30T22:29:17,mitmicrobiomeclub,MIT Microbiome Club,10.1101/2022.09.01.506178,Interactions between culturable bacteria are highly non-additive,"Amichai Baichman-Kass, Tingting Song, Jonathan Friedman",2022-09-12
https://www.biorxiv.org/content/10.1101/2022.09.01.506178v2#comment-6000445491,biorxivstage,0,"It is know that the effect of a drug, and therefore perhaps a bacteria, can be non-linear with concentration, and that dose-additivity (Bliss) predicts drug combinations better than effect-additivity (DOI: 10.1038/s41564-018-0252-1). How might this impact the results? Of course, it can hard to half the concentration of the bacteria in the setup to create the Bliss model (although maybe something with lower glucose might help?) Might the fastest grower in each pair/trio reach the highest concentration, limit the growth of other species, and therefore provide an effect quite similar to itself in isolation? How would a ""fastest grower"" model compare to a ""strongest"" model? The authors note that growth rate did not correlate with effect size for ""some"" focal species, but might such a model work for the remaining focal species?",2022-09-30T22:29:03,mitmicrobiomeclub,MIT Microbiome Club,10.1101/2022.09.01.506178,Interactions between culturable bacteria are highly non-additive,"Amichai Baichman-Kass, Tingting Song, Jonathan Friedman",2022-09-12
https://www.biorxiv.org/content/10.1101/2022.09.01.506178v2#comment-6000445306,biorxivstage,0,"The discussion should mention a limitation of this method is its inability to detect interactions that depend on spatial structure (it is known that higher order interactions can depend on spatial structure DOI: 10.1038/nature14485) to fast growers, and to only single carbon source (DOI: 10.1038/s41559-020-1099-4). It should also be noted that any interactions that affects flourescence rather than growth would be misinterpreted.",2022-09-30T22:28:44,mitmicrobiomeclub,MIT Microbiome Club,10.1101/2022.09.01.506178,Interactions between culturable bacteria are highly non-additive,"Amichai Baichman-Kass, Tingting Song, Jonathan Friedman",2022-09-12
https://www.biorxiv.org/content/10.1101/2022.09.01.506178v2#comment-6000445195,biorxivstage,0,"The selection of 30 strains chosen for the trio experiment seems biased towards negative interactions, for which the strongest model is particularly good in the doublet model. The authors might consider repeating this with a subset biased towards mixed and/or positive interaction to get a more complete picture.",2022-09-30T22:28:34,mitmicrobiomeclub,MIT Microbiome Club,10.1101/2022.09.01.506178,Interactions between culturable bacteria are highly non-additive,"Amichai Baichman-Kass, Tingting Song, Jonathan Friedman",2022-09-12
https://www.biorxiv.org/content/10.1101/2022.09.01.506178v2#comment-6000445127,biorxivstage,0,Please report what method is used for adjusting optical density and what is the potential range in values. Were all cells in stationary phase before renormalizing?,2022-09-30T22:28:26,mitmicrobiomeclub,MIT Microbiome Club,10.1101/2022.09.01.506178,Interactions between culturable bacteria are highly non-additive,"Amichai Baichman-Kass, Tingting Song, Jonathan Friedman",2022-09-12
https://www.biorxiv.org/content/10.1101/2022.09.01.506178v2#comment-6000445019,biorxivstage,0,"The additive interaction model is particularly bad for interactions of negative-negative interaction pairs. Is there a ""floor"" below which negative interactions cannot be measured or realized? This seems to be the case in Figure 3B: all observed effects are -4 or higher. While the authors explored adding a ceiling (carrying capacity) to the model, a floor should be explored as well and might improve the accuracy of the additive and mean models.",2022-09-30T22:28:15,mitmicrobiomeclub,MIT Microbiome Club,10.1101/2022.09.01.506178,Interactions between culturable bacteria are highly non-additive,"Amichai Baichman-Kass, Tingting Song, Jonathan Friedman",2022-09-12
https://www.biorxiv.org/content/10.1101/2022.09.01.506178v2#comment-6000444908,biorxivstage,0,How good were the different models at predicting the *sign* of the interactions? (Minor),2022-09-30T22:28:04,mitmicrobiomeclub,MIT Microbiome Club,10.1101/2022.09.01.506178,Interactions between culturable bacteria are highly non-additive,"Amichai Baichman-Kass, Tingting Song, Jonathan Friedman",2022-09-12
https://www.biorxiv.org/content/10.1101/2022.09.01.506178v2#comment-6000444532,biorxivstage,0,Focal species were transformed to constitutively express a fluorescent protein - is this on a plasmid or integrated in the chromosome?,2022-09-30T22:27:27,mitmicrobiomeclub,MIT Microbiome Club,10.1101/2022.09.01.506178,Interactions between culturable bacteria are highly non-additive,"Amichai Baichman-Kass, Tingting Song, Jonathan Friedman",2022-09-12
https://www.biorxiv.org/content/10.1101/2020.10.21.348169v1#comment-5998870158,biorxivstage,0,now published on https://onlinelibrary.wiley...,2022-09-29T04:07:22,ygc_smu,ygc_smu,10.1101/2020.10.21.348169,Ggtree: a serialized data object for visualization of phylogenetic tree and annotation data,Guangchuang Yu,2020-10-22
https://www.biorxiv.org/content/10.1101/2021.04.13.438468v1#comment-5998733079,biorxivstage,0,This work is now published in iScience: https://www.cell.com/iscien...,2022-09-29T00:11:28,John_Hulleman,John Hulleman,10.1101/2021.04.13.438468,SUFFICIENT ACTIVITY OF THE UBIQUITIN PROTEASOME SYSTEM IN AGED MICE AND DURING RETINAL DEGENERATION SUPPORTS DHFR-BASED CONDITIONAL CONTROL OF PROTEIN ABUNDANCE IN THE RETINA,"Hui Peng, Prerana Ramadurgum, DaNae R. Woodard, Steffi Daniel, Marian Renwick, Bogale Aredo, Shyamtanu Datta, Bo Chen, Rafael Ufret-Vincenty, John D. Hulleman",2021-04-14
https://www.biorxiv.org/content/10.1101/2021.10.30.466573v1#comment-5998731834,biorxivstage,0,This work is now published in Current Eye Research: https://www.tandfonline.com...,2022-09-29T00:09:40,John_Hulleman,John Hulleman,10.1101/2021.10.30.466573,A simple secretion assay for assessing new and existing myocilin variants,"Emi Nakahara, John D. Hulleman",2021-10-30
https://www.biorxiv.org/content/10.1101/2022.06.21.495152v1#comment-5998730995,biorxivstage,0,This work is now published in ACS Chemical Biology: https://pubs.acs.org/doi/10...,2022-09-29T00:08:22,John_Hulleman,John Hulleman,10.1101/2022.06.21.495152,Development of a new DHFR-based destabilizing domain with enhanced basal turnover and applicability in mammalian systems,"Emi Nakahara, Vishruth Mullapudi, Lukasz A. Joachimiak, John D. Hulleman",2022-06-21
https://www.biorxiv.org/content/10.1101/2022.09.27.509776v1#comment-5998530137,biorxivstage,0,"Interesting findings, great to see this translated to mammalian TFs. This was originally shown for the Drosophila TF bicoid in 2000, that the ARM was important for RNA-binding and it was similar to HIV proteins ( https://pubmed.ncbi.nlm.nih.... The authors do not cite this though, it would be great to see that study recognized.",2022-09-28T19:26:59,disqus_t8HKLLN9wJ,Lori O'Brien,10.1101/2022.09.27.509776,Transcription factors interact with RNA to regulate genes,"Ozgur Oksuz, Jonathan E Henninger, Robert Warneford-Thomson, Ming M Zheng, Hailey Erb, Kalon J Overholt, Susana Wilson Hawken, Salman F Banani, Richard Lauman, Adrienne Vancura, Anne L Robertson, Nancy M Hannett, Tong I Lee, Leonard I. Zon, Roberto Bonasio, Richard A. Young",2022-09-28
https://www.biorxiv.org/content/10.1101/2022.09.16.508339v1#comment-5998173506,biorxivstage,1,The snATAC-seq in this preprint seems to be sci-ATAC-seq?( https://www.science.org/doi...,2022-09-28T12:46:20,garyjhe,Gary J. He,10.1101/2022.09.16.508339,Identification of a self-renewing muscle satellite cell state by single-cell chromatin accessibility profiling,"Arinze E. Okafor, Xin Lin, Chenghao Situ, Xiaolin Wei, Xiuqing Wei, Zhenguo Wu, Yarui Diao",2022-09-17
https://www.biorxiv.org/content/10.1101/2020.05.16.099184v1#comment-5997777305,biorxivstage,0,Throughout: it is confusing to shift between common and scientific names. Both Marine Iguana and Amblyrhynchus are fine but switching between them in the discussion is confusing.,2022-09-27T23:04:37,,anonymous,10.1101/2020.05.16.099184,"The Mystery of a Marine Monster: Morphological and Performance Modifications in the World’s only Marine Lizard, the Galápagos Marine Iguana","Kate A. Berry, Juan Pablo Muñoz-Pérez, Cristina P. Vintimilla-Palacios, Christofer J. Clemente",2020-05-16
https://www.biorxiv.org/content/10.1101/2020.05.16.099184v1#comment-5997777213,biorxivstage,0,"line 75: I wonder if it is worth also mentioning valved nostrils/nares here - in fact there is no mention of ""valves"" throughout - why not? This seems like a central secondary adaptation for a transition from terrestrial to aquatic ecosystems.",2022-09-27T23:04:28,,anonymous,10.1101/2020.05.16.099184,"The Mystery of a Marine Monster: Morphological and Performance Modifications in the World’s only Marine Lizard, the Galápagos Marine Iguana","Kate A. Berry, Juan Pablo Muñoz-Pérez, Cristina P. Vintimilla-Palacios, Christofer J. Clemente",2020-05-16
https://www.biorxiv.org/content/10.1101/2020.05.16.099184v1#comment-5997777158,biorxivstage,0,"line 67: What is meant by ""over-coming buoyancy""?",2022-09-27T23:04:22,,anonymous,10.1101/2020.05.16.099184,"The Mystery of a Marine Monster: Morphological and Performance Modifications in the World’s only Marine Lizard, the Galápagos Marine Iguana","Kate A. Berry, Juan Pablo Muñoz-Pérez, Cristina P. Vintimilla-Palacios, Christofer J. Clemente",2020-05-16
https://www.biorxiv.org/content/10.1101/2020.05.16.099184v1#comment-5997777094,biorxivstage,0,"lines 58-59: It might be helpful for some readers if you identify the fossil reptiles you're referring to. Several of them are ""house-hold"" names (like Mosasaurs) so will be useful to some readers not as knowledgeable about such groups.",2022-09-27T23:04:14,,anonymous,10.1101/2020.05.16.099184,"The Mystery of a Marine Monster: Morphological and Performance Modifications in the World’s only Marine Lizard, the Galápagos Marine Iguana","Kate A. Berry, Juan Pablo Muñoz-Pérez, Cristina P. Vintimilla-Palacios, Christofer J. Clemente",2020-05-16
https://www.biorxiv.org/content/10.1101/2020.05.16.099184v1#comment-5997776927,biorxivstage,0,"Lines 54-56: It's not clear to me what you mean here: does ""reptile"" refer to crown-group Reptilia or a more ""evolutionary"" definition of reptiles that includes stem amniotes and synapsids as well? It is not clear to me how a modern clade could have played a role in the origin of other tetrapod clades.",2022-09-27T23:03:56,,anonymous,10.1101/2020.05.16.099184,"The Mystery of a Marine Monster: Morphological and Performance Modifications in the World’s only Marine Lizard, the Galápagos Marine Iguana","Kate A. Berry, Juan Pablo Muñoz-Pérez, Cristina P. Vintimilla-Palacios, Christofer J. Clemente",2020-05-16
https://www.biorxiv.org/content/10.1101/2022.09.09.507046v1#comment-5997760867,biorxivstage,0,"Line 142-144-I had a quick thought about the use of brain tissue for signs of a stress response due to elevational changes. I might expect to see those changes more in the fat body because that's often cited as the main hub of the immune and stress response. If it feels useful, it might be good to describe how the brain response could directly affect behavior more than a gene expression response in the fat body. (Apologies if you do describe this, I might have missed it.) In general, I'm also curious how these gene expression patterns might relate to aging in these bees-do they show similar signatures of aging (perhaps as defined by DEGs related to the Ti-J-LiFE pathway https://royalsocietypublish...",2022-09-27T22:37:19,,hunterk,10.1101/2022.09.09.507046,Mountains as refugia: evidence from bumble bee brain transcriptomes,"Kaleigh Fisher, Michelle A. Duennes, S. Hollis Woodard",2022-09-12
https://www.biorxiv.org/content/10.1101/2022.09.26.509353v1#comment-5997716322,biorxivstage,1,"Hi, Thank you for posting this preprint. I receive an error message when I try to access the following link: https://chenlabgccri.shinya... Is there something in the path that should be changed and/or something on the server that is needed to activate the link? Thank you again! Sincerely, Charles",2022-09-27T21:32:48,charleswarden,Charles Warden,10.1101/2022.09.26.509353,DepLink: an R Shiny app to systematically link genetic and pharmacologic dependencies of cancer,"Tapsya Nayak, Li-Ju Wang, Michael Ning, Gabriela Rubannelsonkumar, Eric Jin, Siyuan Zheng, Peter J. Houghton, Yufei Huang, Yu-Chiao Chiu, Yidong Chen",2022-09-27
https://www.biorxiv.org/content/10.1101/2022.09.20.508687v1#comment-5997174476,biorxivstage,0,"Very cool stuff. If I may make one minor suggestion, I'd have liked a short description of the selection protocol earlier in the manuscript. Fig. 2 kind of shows it, but a sentence or two in the Intro would add to the context for the Results (this is assuming the current order with the Methods at the end).",2022-09-27T10:22:51,matthewherron,Matthew Herron,10.1101/2022.09.20.508687,Bacteria evolve macroscopic multicellularity via the canalization of phenotypically plastic cell clustering,"Yashraj Chavhan, Sutirth Dey, Peter A. Lind",2022-09-20
https://www.biorxiv.org/content/10.1101/2022.09.12.507566v1#comment-5997161552,biorxivstage,1,"Hi, thanks for the feedback. The corresponding zenodo link should work now.",2022-09-27T09:53:01,emmanuelgaquerel,Emmanuel Gaquerel,10.1101/2022.09.12.507566,Evolutionary metabolomics of specialized metabolism diversification in the genus Nicotiana highlights allopolyploidy-mediated innovations in N-acylnornicotine metabolism,"David Elser, David Pflieger, Claire Villette, Baptiste Moegle, Laurence Miesch, Emmanuel Gaquerel",2022-09-14
https://www.biorxiv.org/content/10.1101/2022.04.18.488698v2#comment-5996913471,biorxivstage,0,"This work is now published (22 Sep 2022) at Nature Communications under a variant title ""A fungal tolerance trait and selective inhibitors proffer HMG-CoA reductase as a herbicide mode-of-action"" PMID: 36137996 PMCID: PMC9500038 DOI: 10.1038/s41467-022-33185-0 https://doi.org/10.1038/s41...",2022-09-27T00:29:34,joshuamylne,Joshua Mylne,10.1101/2022.04.18.488698,A resistance-gene-directed tolerance trait and selective inhibitors proffer HMG-CoA reductase as a new herbicide mode of action,"Joel Haywood, Karen J. Breese, Jingjing Zhang, Mark T. Waters, Charles S. Bond, Keith A. Stubbs, Joshua S. Mylne",2022-08-02
https://www.biorxiv.org/content/10.1101/594689v1#comment-5996659302,biorxivstage,0,"A new version of the manuscript can be found in the pre-print server, Research Square ( https://doi.org/10.21203/rs....",2022-09-26T18:50:36,joyalcedo,Joy Alcedo,10.1101/594689,Axonal Transport Of An Insulin-Like Peptide Mrna Promotes Stress Recovery In C. Elegans,"Rashmi Chandra, Lisa Li, Zahabiya Husain, Shashwat Mishra, Joy Alcedo",2019-03-31
https://www.biorxiv.org/content/10.1101/2021.03.03.433746v1#comment-5996463616,biorxivstage,0,"There are some mistakes in the influent column in the tables. The values for S_h2 and S_ch4 should be 1.0E-... instead of 10E-..., and the influent value of S_H+ should be 0.0 instead of 1.0",2022-09-26T15:10:46,,anonym,10.1101/2021.03.03.433746,PyADM1: a Python implementation of Anaerobic Digestion Model No. 1,"P. Sadrimajd, P. Mannion, E. Howley, P. N. L. Lens",2021-03-04
https://www.biorxiv.org/content/10.1101/2022.02.26.482116v1#comment-5996454060,biorxivstage,0,This manuscript has been accepted by Molecular Biology and Evolution: https://doi.org/10.1093/mol...,2022-09-26T14:59:23,xiaoyuweng,Xiaoyu Weng,10.1101/2022.02.26.482116,A pleiotropic flowering time QTL exhibits gene-by-environmental interaction for fitness in a perennial grass,"Xiaoyu Weng, Taslima Haque, Li Zhang, Samsad Razzaque, John T Lovell, Juan Diego Palacio-Mejía, Perla Duberney, John Lloyd-Reilley, Jason Bonnette, Thomas E Juenger",2022-03-01
https://www.biorxiv.org/content/10.1101/2022.09.22.509088v1#comment-5996378527,biorxivstage,0,Where can I find the supplementary data including the species list? They are not supposed to be submitted to biorxiv along with the main text ?,2022-09-26T13:27:22,disqus_OmuWIf2BxR,Gauthier,10.1101/2022.09.22.509088,Diversification is correlated with temperature in white and sulfur butterflies,"Ana Paula S. Carvalho, Hannah L. Owens, Ryan A. St Laurent, Chandra Earl, Kelly M. Dexter, Rebeccah L. Messcher, Keith R. Willmott, Kwaku Aduse-Poku, Steve C. Collins, Nicholas T. Homziak, Sugihiko Hoshizaki, Yu-Feng Hsu, Athulya G. Kizhakke, Krushnamegh Kunte, Dino J. Martins, Nicolás O. Mega, Sadaharu Morinaka, Djunijanti Peggie, Helena P. Romanowski, Szabolcs Sáfián, Roger Vila, Houshuai Wang, Michael F. Braby, Marianne Espeland, Jesse W. Breinholt, Naomi E. Pierce, Akito Y. Kawahara, David J. Lohman",2022-09-23
https://www.biorxiv.org/content/10.1101/2020.03.04.976290v1#comment-5996323514,biorxivstage,0,The final version of this paper has been published at https://doi.org/10.1016/j.biosystems.2022.104778,2022-09-26T12:05:30,mihamokon,Miha Moškon,10.1101/2020.03.04.976290,A Computational Design of a Programmable Biological Processor,"Miha Moškon, Žiga Pušnik, Lidija Magdevska, Nikolaj Zimic, Miha Mraz",2020-03-05
