comment url,comment forum,comment keywords,comment message,comment date,comment username,comment name,paper doi,paper title,paper authors,paper date
https://www.biorxiv.org/content/10.1101/2023.05.17.540900v3#comment-6453225910,biorxivstage,0,"Hi, the manuscript has just been published with open access in the Journal of Sarcopenia, Cachexia and Muscle! Please access https://onlinelibrary.wiley... for the latest version.",2024-05-07T17:57:42,dimitriussantiagopsfguimares,Dimitrius Santiago P. S. F. Gu,10.1101/2023.05.17.540900,Concerted regulation of skeletal muscle metabolism and contractile properties by the orphan nuclear receptor Nr2f6,"Dimitrius Santiago P.S.F. Guimarães, Ninon M.F. Barrios, André Gustavo de Oliveira, David Rizo-Roca, Maxence Jollet, Jonathon A.B. Smith, Thiago R. Araujo, Marcos Vinicius da Cruz, Emilio Marconato Junior, Sandro M. Hirabara, André S. Vieira, Anna Krook, Juleen R. Zierath, Leonardo R. Silveira",2023-10-28
https://www.biorxiv.org/content/10.1101/2024.02.09.579724v1#comment-6453210151,biorxivstage,0,"(From the author) To appear as a book chapter in: Ruiz Romero C, Calamia V and Lourido L (Eds), Protein Arrays: Methods and Applications, Electronic ISSN 1940-6029, Print ISSN 1064-3745, Springer Nature.",2024-05-07T17:37:12,disqus_MpyEq3E4IG,Julian C,10.1101/2024.02.09.579724,"SomaScan Bioinformatics: Normalization, Quality Control, and Assessment of Pre-Analytical Variation",Julián Candia,2024-02-12
https://www.biorxiv.org/content/10.1101/2024.01.10.575094v2#comment-6453206859,biorxivstage,0,(From the corresponding author) To appear in PLOS ONE.,2024-05-07T17:33:00,disqus_MpyEq3E4IG,Julian C,10.1101/2024.01.10.575094,Assessment of Gene Set Enrichment Analysis using curated RNA-seq-based benchmarks,"Julián Candia, Luigi Ferrucci",2024-04-10
https://www.biorxiv.org/content/10.1101/2024.01.23.576958v1#comment-6453036953,biorxivstage,1,This article has now been published in Frontiers in Neuroscience: https://doi.org/10.3389/fni... The LC labels are publicly available: https://www.nitrc.org/proje...,2024-05-07T13:42:17,imanaganj,Iman Aganj,10.1101/2024.01.23.576958,Automatic Geometry-based Estimation of the Locus Coeruleus Region on T1-Weighted Magnetic Resonance Images,"Iman Aganj, Jocelyn Mora, Bruce Fischl, Jean C. Augustinack",2024-01-24
https://www.biorxiv.org/content/10.1101/2024.01.29.577809v2#comment-6452007812,biorxivstage,0,"There is already another CRISPR method out there, called CREATE ( https://pubmed.ncbi.nlm.nih... so maybe the authors want to pick a different acronym so that readers don't get confused.",2024-05-06T11:02:33,romaniwasakicordero,Roman,10.1101/2024.01.29.577809,CRISPR-Enabled Autonomous Transposable Element (CREATE) for RNA-based gene editing and delivery,"Yuxiao Wang, Ruei-Zeng Lin, Meghan Harris, Bianca Lavayen, Bruce McCreedy, Robert Hofmeister, Daniel Getts",2024-05-04
https://www.biorxiv.org/content/10.1101/2024.04.25.591003v1#comment-6451954445,biorxivstage,0,"Your work, CRISPR-GPT is groundbreaking, bridging the gap between complex gene-editing technology and researchers from various fields. The potential for accelerating biological discovery is immense, and I’m excited to see its impact on future research. I am eager to see this technology in action and would greatly appreciate the opportunity to explore a demo of the author’s website. Such hands-on experience would provide invaluable insight into the practical applications of CRISPR-GPT.",2024-05-06T08:20:36,lihengluo,Liheng Luo,10.1101/2024.04.25.591003,CRISPR-GPT: An LLM Agent for Automated Design of Gene-Editing Experiments,"Yuanhao Qu, Kaixuan Huang, Henry Cousins, William A. Johnson, Di Yin, Mihir Shah, Denny Zhou, Russ Altman, Mengdi Wang, Le Cong",2024-04-26
https://www.biorxiv.org/content/10.1101/2024.03.20.585925v1#comment-6451949218,biorxivstage,0,"Congratulations to the team, it is a great article. I found the results very insightful. While reading, I seem to have found an error in the insulin intensity histogram in Figure 3, as both A and C seem to be the same histogram.",2024-05-06T08:02:44,danielguzmanllorens,Daniel Guzman Llorens,10.1101/2024.03.20.585925,Pharmacological inhibition of tyrosine protein-kinase 2 reduces islet inflammation and delays type 1 diabetes onset in mice,"Farooq Syed, Olivia Ballew, Chih-Chun Lee, Jyoti Rana, Preethi Krishnan, Angela Castela, Staci A. Weaver, Namratha Shivani Chalasani, Sofia F. Thomaidou, Stephane Demine, Garrick Chang, Alexandra Coomans de Brachène, Maria Ines Alvelos, Lorella Marselli, Kara Orr, Jamie L. Felton, Jing Liu, Piero Marchetti, Arnaud Zaldumbide, Donalyn Scheuner, Decio L. Eizirik, Carmella Evans-Molina",2024-03-23
https://www.biorxiv.org/content/10.1101/2024.05.01.591375v1#comment-6451065322,biorxivstage,0,Fascinating read! Can’t wait to see where this project goes!,2024-05-04T20:50:43,,Cameron Cohen,10.1101/2024.05.01.591375,Velociraptor: Cross-Platform Quantitative Search Using Hallmark Cell Features,"Claire E. Cross, Cass Mayeda, Stephanie Medina, Madeline J. Hayes, Saara Kaviany, James A. Connelly, Jeffrey C. Rathmell, Kyle D. Weaver, Reid C. Thompson, Lola B. Chambless, Rebecca A. Ihrie, Jonathan M. Irish",2024-05-04
https://www.biorxiv.org/content/10.1101/2024.04.29.591623v1#comment-6450687389,biorxivstage,0,"Thanks! Yes, that would be straight forward!",2024-05-04T08:44:40,mads_albertsen,Mads Albertsen,10.1101/2024.04.29.591623,Nanomotif: Identification and Exploitation of DNA Methylation Motifs in Metagenomes using Oxford Nanopore Sequencing,"Søren Heidelbach, Sebastian Mølvang Dall, Jeppe Støtt Bøjer, Jacob Nissen, Lucas N.L. van der Maas, Mantas Sereika, Rasmus H. Kirkegaard, Sheila I. Jensen, Sabrina Just Kousgaard, Ole Thorlacius-Ussing, Katja Hose, Thomas Dyhre Nielsen, Mads Albertsen",2024-05-02
https://www.biorxiv.org/content/10.1101/2024.03.04.583374v2#comment-6450655860,biorxivstage,0,"All nice, but isn't this significantly similar to what was reported here 3 years ago? https://pubmed.ncbi.nlm.nih...",2024-05-04T06:51:48,,Hernan Lopez-Schier,10.1101/2024.03.04.583374,Sarm1 is not necessary for activation of neuron-intrinsic growth programs yet required for the Schwann cell repair response and peripheral nerve regeneration,"Ligia B. Schmitd, Hannah Hafner, Ayobami Ward, Elham Asghari Adib, Natalia P. Biscola, Rafi Kohen, Manav Patel, Rachel E. Williamson, Emily Desai, Julianna Bennett, Grace Saxman, Mitre Athaiya, David Wilborn, Jaisha Shumpert, Xiao-Feng Zhao, Riki Kawaguchi, Daniel H. Geschwind, Ahmet Hoke, Peter Shrager, Catherine A. Collins, Leif A. Havton, Ashley L. Kalinski, Roman J. Giger",2024-04-17
https://www.biorxiv.org/content/10.1101/2024.03.11.584210v1#comment-6450563570,biorxivstage,1,"In this study the authors comprehensively examined the mutational effects on PLpro proteolytic activity and stability. The authors have designed a FRET-based assay composed of N-terminal mClover3 donor and C-terminal m-Ruby3 acceptor fluorophores separated by a linker containing the Nsp2/3 PLpro cleavage motif to measure the proteolytic activity of PLpro. From DMS data the authors infer PLpro active site mutations ablates activity. Their study also revealed residues required for cleavage of the Nsp2/3 site, identified features of substrate binding pocket and the sequence requirements of the blocking loop. The authors have given explanations for their observations in the Discussion section. Overall, the paper is supported with follow-up enzymology and crystallography experiments of key residues. The major limitation of this study is leaky expression of mutations can mask clinically relevant mutations that can arise due to viral evolution and might have the potential to evade inhibitor treatment. Study of such mutations can provide more information about the potential escape routes open to the virus to evade developing therapeutics. Moreover, incorporation of statistical analysis could strengthen the confidence in inferences drawn from the deep sequencing data and improve the quality of the manuscript. The following points can improve the quality of the manuscript: Major points 1. In Figure 1f, it is unclear that why is the PLpro activity increasing with increase in inhibitor concentration? Perhaps the Y axis is mislabeled as while inhibitor concentration is increasing, PLpro activity should decrease. However, FRET signal would increase (and maybe should be the axis label), since there will be no cleavage. 2. Line 175 – 178 - What does 0 represent in the normalized dataset? What is the rationale used for selecting minimum 10 reads in the unselected library as the read cut-off. 10 reads is pretty low cut-off. From the data, it seems the distribution tails off before cut-off chosen for the s.d.- by eye. 0.3 s.d and 20 as read cut-off might be a  better option to eliminate sequencing artifacts. 3. Line 187-190 – What is the number of reads for the mutants that showed lower activity scores? There is a possibility that due to low read cutoff, these mutants might be lying in the range with low reads in the unselected library. 4.  Line 223-224 – Authors mention they find a good correlation between activity and abundance score. Although this is noticeable from the scatter plot but supporting high-throughput data with statistical parameters like pearson correlation coefficient, a metric that provides comparison between 2 datasets will make this data reporting more quantitative and informative. 5. Line 1340- Figure 3b- What do authors mean by variants with small enough error? Please be precise. 6.  Line 315-319/ Line 1550-1556- Extended data Fig 15c – It is difficult to interpret the inference reported that is based on the data in Extended Fig 15. There is no data reported for Normalized AMC cleavage for Y268W. Interpretation can be more comprehensible by plotting a scatter plot between the Normalized Activity Fitness Scores obtained from DMS data and Normalized AMC cleavage (%). Through this plot, the reader can easily make out the outlier. 7. Line 364-367 – Authors mention “M208W strikingly increases the protein melting temperature by over 5C, indicating a substantial improvement in thermal stability. Increased stability, and thus reduced turnover in cells, may provide a mechanism to explain leaky expression in our cellular assay and increased yield of recombinant protein for E.coli expression.” Since, leaky expression is a different issue, it is confusing why will leaky expression be a plausible reason for increased stability but less activity? 8. Since Extended data Fig 11a shows that variants display substantial amount of leaky expression, how have the authors taken this information into account while inferring results from DMS activity scores, especially since they are quantifying at the RNA level and not at the DNA level? Can the activity scores obtained for the mutants be normalized to leaky expression scores in some way, for example by subtracting the scores obtained from the leaky expression dataset in order to measure the true activity of each mutant? 9. Solvents are known to affect an enzyme’s activity, selectivity and stability. In Figure 5, authors should consider and comment about the role of solvent in understanding the mechanism of Michelis-Menten kinetics of M208 variants using substrates Z-RLRGG-AMC, Ubiquitin-Rhodamine and ISG15-Rhodamine. Minor points 1. Figure numbers need to be reformatted. Figure 3 onwards they are incorrectly labelled. For eg. ‘Fig 3’ is labelled as ‘Fig 1’. 2. Line 426-429 – In Figure 3b, L and R domains of papain should be labelled or highlighted in separate colors for the ease of understanding for the reader. 3. Overall, different DMS datasets obtained from different assays in the paper have different read cut-offs such as 10, 13 and 18. A consistent statistical logic for obtaining different read cut-offs across different DMS datasets will be helpful. Also, increasing the read cut-off might improve the data quality and minimize sequencing artefacts. - Reviewed by Priyanka Bajaj and James Fraser (UCSF)",2024-05-04T01:52:43,disqus_YtOuuM3QDF,priyanka.bajaj3193@gmail.com,10.1101/2024.03.11.584210,"Mutational Profiling of SARS-CoV-2 PLpro in human cells reveals requirements for function, structure, and drug escape","Xinyu Wu, Margareta Go, Julie V. Nguyen, Nathan W. Kuchel, Bernadine G.C. Lu, Kym N. Lowes, Dale J. Calleja, Jeffrey P. Mitchell, Guillaume Lessene, David Komander, Matthew E. Call, Melissa J. Call",2024-03-12
https://www.biorxiv.org/content/10.1101/2023.07.19.549739v1#comment-6450453322,biorxivstage,0,This manuscript has now been combined with https://www.biorxiv.org/con... and published as https://pubmed.ncbi.nlm.nih...,2024-05-03T21:48:51,disqus_W8dCCoqvka,Michael L.,10.1101/2023.07.19.549739,Design of SARS-CoV-2 protease inhibitors with improved affinity and reduced sensitivity to mutations,"Michael Westberg, Yichi Su, Xinzhi Zou, Pinghan Huang, Arjun Rustagi, Jaishree Garhyan, Puja Bhavesh Patel, Daniel Fernandez, Yan Wu, Lin Ning, Aimee Beck, Marwah Karim, Chenzhou Hao, Panatda Saenkham-Huntsinger, Vivian Tat, Aleksandra Drelich, Bi-Hung Peng, Shirit Einav, Chien-Te K. Tseng, Catherine Blish, Michael Z. Lin",2023-07-20
https://www.biorxiv.org/content/10.1101/2020.09.15.275891v2#comment-6450452866,biorxivstage,0,This manuscript has now been combined with https://www.biorxiv.org/con... and published as https://pubmed.ncbi.nlm.nih...,2024-05-03T21:47:59,disqus_W8dCCoqvka,Michael L.,10.1101/2020.09.15.275891,Rational design of a new class of protease inhibitors for the potential treatment of coronavirus diseases,"Michael Westberg, Yichi Su, Xinzhi Zou, Lin Ning, Brett Hurst, Bart Tarbet, Michael Z. Lin",2020-09-16
https://www.biorxiv.org/content/10.1101/2024.04.11.589135v1#comment-6450284990,biorxivstage,0,"For Fig.4, you have trained on VMR 1 and tested on VMR2. Does it work also the other way around (training on VMR 2 and testing on VMR1?",2024-05-03T17:35:12,,JB,10.1101/2024.04.11.589135,Individual variability in sensorimotor learning reflects trait-like neurobehavioral subject factors,"Corson N. Areshenkoff, Anouk J. de Brouwer, Daniel J. Gale, Dominic Standage, Joseph Y. Nashed, J. Randall Flanagan, Jason P. Gallivan",2024-04-15
https://www.biorxiv.org/content/10.1101/2024.04.11.589135v1#comment-6450236640,biorxivstage,0,Why didn't you exclude ppl who showed worse score on TMTa than on TMTb? This is really unusual.,2024-05-03T16:26:10,,JB,10.1101/2024.04.11.589135,Individual variability in sensorimotor learning reflects trait-like neurobehavioral subject factors,"Corson N. Areshenkoff, Anouk J. de Brouwer, Daniel J. Gale, Dominic Standage, Joseph Y. Nashed, J. Randall Flanagan, Jason P. Gallivan",2024-04-15
https://www.biorxiv.org/content/10.1101/2022.10.24.513598v2#comment-6450030978,biorxivstage,1,"Really great and useful work and an astounding tour de force - enjoyed reading it! I was wondering if the authors might please comment on whether the iPT cells expressed significantly higher levels of lncRNAs such as Neat1 or Malat1 when compared to 'normal' PT cells. We have seen these Neat1/Malat1-rich PT cells in our own scRNA-seq dataset (from mice) but were unable to detect HAVCR1 or VCAMI. However, genes associated with VCAM1-positivity were detected and these PT cells (which we called PT Class A) were present in Control kidneys and were seen in situ by RNAScope too. I would be quite interested to know if the iPT-VCAM1+ population you have comprehensively described matches the PT Class A cells we saw.",2024-05-03T10:36:51,samvid_kurlekar,Samvid Kurlekar,10.1101/2022.10.24.513598,Spatially resolved human kidney multi-omics single cell atlas highlights the key role of the fibrotic microenvironment in kidney disease progression,"Amin Abedini, Jonathan Levinsohn, Konstantin A Klötzer, Bernhard Dumoulin, Ziyuan Ma, Julia Frederick, Poonam Dhillon, Michael S Balzer, Rojesh Shrestha, Hongbo Liu, Steven Vitale, Kishor Devalaraja-Narashimha, Paola Grandi, Tanmoy Bhattacharyya, Erding Hu, Steven S. Pullen, Carine M Boustany-Kari, Paolo Guarnieri, Anil Karihaloo, Daniel Traum, Hanying Yan, Kyle Coleman, Matthew Palmer, Lea Sarov-Blat, Lori Morton, Christopher A. Hunter, Klaus H Kaestner, Mingyao Li, Katalin Susztak",2024-02-11
https://www.biorxiv.org/content/10.1101/2022.12.02.518683v1#comment-6449991747,biorxivstage,0,This article is now published in Leukemia doi 10.1038/s41375-024-02250-6,2024-05-03T08:40:27,gregoryehx,Gregory Ehx,10.1101/2022.12.02.518683,Autophagy degrades immunogenic endogenous retroelements induced by 5-azacytidine in acute myeloid leukemia,"Nandita Noronha, Chantal Durette, Bianca E Silva, Justine Courtois, Juliette Humeau, Allan Sauvat, Marie-Pierre Hardy, Krystel Vincent, Jean-Philippe Laverdure, Joël Lanoix, Frédéric Baron, Pierre Thibault, Claude Perreault, Gregory Ehx",2022-12-03
https://www.biorxiv.org/content/10.1101/2024.04.29.591623v1#comment-6449728814,biorxivstage,0,"Nanomotif looks like a fine tool, especially for metagenomics, and I have no doubt it will push the prokaryotic methylation nanopore field further! I was curious if you would be able to benchmark it more, as the benchmark presented in Fig 1C is quite limited in scope, and could be expanded. We have shared R10.4.1 data for a variety of microbes that you might be interested in benchmarking on, include some with paired PacBio data in REBASE (which is not ground truth, but a good comparision): aws s3 cp --recursive s3://cultivarium-sequencing/MICROBEMOD-DATA-NOV2023/mapped_bams/ . aws s3 cp --recursive s3://cultivarium-sequencing/MICROBEMOD-DATA-NOV2023/reference_genomes/ . aws s3 cp --recursive s3://cultivarium-sequencing/MICROBEMOD-DATA-NOV2023/pod5/ . It is also worth noting that the comparison to MicrobeMod is a bit limited due to the reason that you note here: ""The low motif recall of MicrobeMod, at high coverage and high motif occurrence settings, primarily stems from identification of similar motifs that are not identical to the benchmarking motif, e.g. SNGAm6TC instead of GAm6T"". Despite this, overall my sense is very that nanomotif's motif calling will be likely superior in many circumstances to STREME in the context of prokaryotic methylation. Probably the best way to evaluate methylation motifs would be with some manual inspection after running multiple tools (and parameters).",2024-05-02T21:22:33,acc_account,Alex Crits-Christoph,10.1101/2024.04.29.591623,Nanomotif: Identification and Exploitation of DNA Methylation Motifs in Metagenomes using Oxford Nanopore Sequencing,"Søren Heidelbach, Sebastian Mølvang Dall, Jeppe Støtt Bøjer, Jacob Nissen, Lucas N.L. van der Maas, Mantas Sereika, Rasmus H. Kirkegaard, Sheila I. Jensen, Sabrina Just Kousgaard, Ole Thorlacius-Ussing, Katja Hose, Thomas Dyhre Nielsen, Mads Albertsen",2024-05-02
https://www.biorxiv.org/content/early/2018/01/05/243683#comment-6449042549,biorxivstage,0,"The article has published in Hum Gene Ther. Utility of Self-Destructing CRISPR/Cas Constructs for Targeted Gene Editing in the Retina. Li F, Hung SSC, Mohd Khalid MKN, Wang JH, Chrysostomou V, Wong VHY, Singh V, Wing K, Tu L, Bender JA, Pébay A, King AE, Cook AL, Wong RCB, Bui BV, Hewitt AW, Liu GS. Hum Gene Ther. 2019 Nov;30(11):1349-1360. doi: 10.1089/hum.2019.021. Epub 2019 Oct 25. PMID: 31373227",2024-05-01T23:26:21,gueisheungliu,Guei-Sheung Liu,10.1101/243683,Efficacy and dynamics of self-targeting CRISPR/Cas constructs for gene editing in the retina,"Fan Li, Sandy S.C. Hung, Jiang-Hui Wang, Vicki Chrysostomou, Vickie H.Y. Wong, James A. Bender, Leilei Tu, Alice Pébay, Anna E King, Anthony L. Cook, Raymond C.B. Wong, Bang V. Bui, Alex W. Hewitt, Guei-Sheung Liu",2018-01-05
https://www.biorxiv.org/content/10.1101/548297v1#comment-6449041321,biorxivstage,0,"The article has now publshed in Nucleic Acid Ther. An Integrative Multi-Omics Analysis Reveals MicroRNA-143 as a Potential Therapeutic to Attenuate Retinal Angiogenesis. Wang JH, Chuang YF, Chen J, Singh V, Lin FL, Wilson R, Tu L, Ma C, Wong RCB, Wang PY, Zhong J, Hewitt AW, van Wijngaarden P, Dusting GJ, Liu GS. Nucleic Acid Ther. 2022 Aug;32(4):251-266. doi: 10.1089/nat.2021.0111. Epub 2022 Mar 31. PMID: 35363088",2024-05-01T23:23:51,gueisheungliu,Guei-Sheung Liu,10.1101/548297,MicroRNA-143 plays a protective role in ischemia-induced retinal neovascularization,"Jiang-Hui Wang, Jinying Chen, Damien Ling, Leilei Tu, Vikrant Singh, Moeen Riaz, Fan Li, Selwyn M. Prea, Zheng He, Bang V. Bui, Alex W. Hewitt, Peter van Wijngaarden, Gregory J. Dusting, Guei-Sheung Liu",2019-02-13
https://www.biorxiv.org/content/10.1101/2021.01.29.428701v1#comment-6449040029,biorxivstage,0,The article has now published in Pharmacol Res. 2023 Jan:187:106617. doi: 10.1016/j.phrs.2022.106617. Epub 2022 Dec 16.,2024-05-01T23:21:11,gueisheungliu,Guei-Sheung Liu,10.1101/2021.01.29.428701,TAK1: a potential therapeutic target for retinal neovascularization,"Fan-Li Lin, Jiang-Hui Wang, Jinying Chen, Linxin Zhu, Yu-Fan Chuang, Leilei Tu, Chenkai Ma, Suraj Lama, Damien Ling, Raymond Ching-Bong Wong, Alex W. Hewitt, Ching-Li Tseng, Bang V. Bui, Peter van Wijngaarden, Gregory J. Dusting, Peng-Yuan Wang, Guei-Sheung Liu",2021-01-29
https://www.biorxiv.org/content/10.1101/2024.04.19.590252v1#comment-6448828234,biorxivstage,0,Fantastic study of the clamping effects of Rocaglamide analogs across the helicase family.  I particularly like the different effects of nucleotide and that ATP rather than AMP-PNP can stabilize different helicases as shown in Figure 5F.  I wonder if mixtures of ATP and smaller concentrations of AMP-PNP could let helicases work (ATP) and then trap (AMP-PNP).  Great study of so many dimensions of this assay! Congratulations!,2024-05-01T17:47:25,kevanshokat,Kevan Shokat,10.1101/2024.04.19.590252,Proteomic Discovery of RNA-Protein Molecular Clamps Using a Thermal Shift Assay with ATP and RNA (TSAR),"Stanley I. Goldstein, Alice C. Fan, Zihao Wang, Sai K. Naineni, Johan Lengqvist, Alexey Chernobrovkin, Steve B. Garcia-Gutierrez, Regina Cencic, Kesha Patel, Sidong Huang, Lauren E. Brown, Andrew Emili, John A. Porco",2024-04-19
https://www.biorxiv.org/content/10.1101/2024.03.22.586320v1#comment-6448789110,biorxivstage,0,"This manuscript explores the mechanisms involved with decreased immunity due to aging. It does this by looking at the microbiome found within mice at different ages, then looking at increased inflammation utilizing immunoassays. The results show increased innate immunity and inflammatory signals, showing that an older mice’s microbiome acts differently on the TLR signaling system. The manuscript excels on the immunological side; however, the microbiome side of the study lacks quality control and explanation. I would recommend contacting a microbiome expert to get more insight into the field, as there is much missing from this report. This review focuses on the microbiome side of the report, which has quite a few problems to work on. 1. Polymerase Chain Reaction (PCR) details are missing, such as the primers used, the polymerase used, and the procedure used, such as the temperature, timing, number of cycles. The PCR is not repeatable based on what is said in the methods. Refer to the paper ‘The Impact of DNA Polymerase and Number of Rounds of Amplification in PCR on 16S rRNA Gene Sequence Data’ at DIO: https:// doi.org/10.1128/mSphere.001.... 2. When sequencing the PCR data, the number of reads per sample is not stated. This is important to know if the coverage of the communities is measured. The authors also do not include the observed number of taxa to compare to the Chao1 numbers to determine coverage. This is shown in Figure 1B, where the chao1 number is very low. The taxa used for this graph is not stated, leaving the reader confused if it is the number of genera, or phyla. The lower number assumes phyla, while genera is the more commonly used in the field and should be in the hundreds.  Showing the number of ASVs/OTUs in each sample is a common measure of alpha diversity. 3. The method to which the sequenced data was sorted is not given. The authors do not state if ASVs or OTU’s were utilized which leads to confusion in the way the dominant taxa were determined. It is also impossible to know if the sequenced data was corrected for 16S copy number, or for variance in genome size. Refer to ‘The Variability of the 16S rRNA Gene in Bacterial Genomes and Its Consequences for Bacterial Community Analyses’ at DIO: https://doi.org/10.1371/jou... Next are some more minor issues that can be addressed. 1. At line 340, the instrument and settings for the zirconia beads are not explained. 2. No reference is given for the CLR method at line 385. 3. In the statistical analysis, it states that data was rarefied to the minimum library size, but that size is not mentioned. 4. Figure 1A states P=0.002, however no statistical test is given to get that P. 5. Figure 1C utilizes the words upregulated and downregulated which are used with expression data. I believe this is abundance of taxonomic groups, so different word choices would be more accurate, such as more or less represented.  Further, you don’t know that age caused that, as implied by the phrase “by age.” - Timothy Tomkins, SHSU biomedical student.",2024-05-01T16:53:49,timothytomkins,Timothy Tomkins,10.1101/2024.03.22.586320,Aging amplifies a gut microbiota immunogenic signature linked to heightened inflammation,"Maria Elisa Caetano-Silva, Akriti Shrestha, Audrey F. Duff, Danica Kontic, Patricia C. Brewster, Mikaela C. Kasperek, Chia-Hao Lin, Derek A. Wainwright, Diego Hernandez-Saavedra, Jeffrey A. Woods, Michael T. Bailey, Thomas W. Buford, Jacob M. Allen",2024-03-27
