comment url,comment forum,comment keywords,comment message,comment date,comment username,comment name,paper doi,paper title,paper authors,paper date
https://www.biorxiv.org/content/10.1101/2024.11.01.621620v1#comment-6594118038,biorxivstage,0,"This study, identifying orthologs of human sleep-related genes in the Lokiarchaeota will certainly help in understanding human sleep physiology. The study supports the concept that sleep is a conserved biological function and evolutionarily distinct new features have developed later. The findings that the genes associated with energy metabolism and cellular repair, which play a primordial role of sleep in cellular maintenance in the Lokiarchaeota, suggest the origin and evolutionary purpose of sleep. The results are in line with the previous assumptions regarding the restorative and protective functions of sleep, including cellular maintenance and gene protection. Moreover, such researches can provide valuable information for drug development as conservation and evolutionary background of genes linked to disease could lead to the discovery of novel therapeutic targets. This work has used both phylogenomics and bioinformatics to solve a biological problem. This research illustrates the scope of such studies in finding solutions to many biological problems. Why sleep is necessary and is maintained by evolution is not fully answered. From an evolutionary standpoint, phylogenetic approaches would help to unravel some of the unresolved mysteries of nature. The phylogenomics approach to sleep science is rather new, but combining phylogenomics and bioinformatics research on a range of species may help in understanding facts which are still unknown.",2024-11-17T07:22:07,velyudhanmohankumar,Velyudhan Mohan Kumar,10.1101/2024.11.01.621620,Unraveling the Mysteries of Sleep: Exploring Phylogenomic Sleep Signals in the Recently Characterized Archaeal Phylum Lokiarchaeota near Loki’s Castle,"Seithikurippu R Pandi-Perumal, Konda Mani Saravanan, Sayan Paul, David Warren Spence, Saravana Babu Chidambaram",2024-11-03
https://www.biorxiv.org/content/10.1101/2024.11.13.623507v1#comment-6594063311,biorxivstage,0,"Fantastic paper, breathtaking results. Just one minor suggestion—when I searched for RFam on GitHub, I found a repo with an almost identical name (Rfam) already exists, for an RNA bioinformatics tool. So to avoid confusion/difficulty locating the Rosetta Flow Atomic Matching codebase (and paper, whenever Ahern et al comes out), it might be a good idea to change the shorthand nickname for the model before publishing the repo (and the papers). RFlam, RoFAM and RoFlam all appear to have more unique namespace than RFam, while still being just two syllables to pronounce. Just a thought!",2024-11-17T04:42:42,,De Novo Enzyme Enjoyer,10.1101/2024.11.13.623507,Computational Design of Metallohydrolases,"Donghyo Kim, Seth M. Woodbury, Woody Ahern, Indrek Kalvet, Nikita Hanikel, Saman Salike, Samuel J. Pellock, Anna Lauko, Donald Hilvert, David Baker",2024-11-14
https://www.biorxiv.org/content/10.1101/2023.03.12.532284v1#comment-6594033835,biorxivstage,0,This article has been published in The ADVANCE Journal: https://www.advancejournal.org/article/122098-the-clash-of-academic-hierarchy-and-inclusive-leadership-evolution-of-leadership-in-a-nationwide-diversity-equity-and-inclusion-initiative,2024-11-17T03:09:55,dianecodding,Diane Codding,10.1101/2023.03.12.532284,"The Clash of Academic Hierarchy and Inclusive Leadership: Evolution of Leadership in a Nationwide Diversity, Equity, and Inclusion Initiative","Diane Codding, Bennett B. Goldberg",2023-03-13
https://www.biorxiv.org/content/10.1101/2023.01.08.523134v1#comment-6593797253,biorxivstage,1,"Hi Jang, Thanks for your comments. The 0.08W/cm2 is the intensity provided by the curing light source of the rheometer.  The fabricator of the light source is Lumen Dynamix LDGI, different from the printer fabricator LumenX. Here I also attached the UV intensity by the LumenX, which maximun is about 40 mW/cm2. LumenX: 20 mW/cm2 (47% of full intensity) 25 mW/cm2	(58% of full intensity) 30 mW/cm2 (69% of full intensity)",2024-11-16T18:27:04,jishizhanchen,Jishizhan Chen,10.1101/2023.01.08.523134,ColMA/PEGDA Bioink for Digital Light Processing 3D Printing in Biomedical Engineering,Jishizhan Chen,2023-01-08
https://www.biorxiv.org/content/10.1101/2023.01.08.523134v1#comment-6593757060,biorxivstage,2,"Dear all, please read and cite the formal publication of this preprint here: https://doi.org/10.1016/j.ijbiomac.2024.137253",2024-11-16T17:11:50,jishizhanchen,Jishizhan Chen,10.1101/2023.01.08.523134,ColMA/PEGDA Bioink for Digital Light Processing 3D Printing in Biomedical Engineering,Jishizhan Chen,2023-01-08
https://www.biorxiv.org/content/10.1101/2023.06.13.544727v1#comment-6593736490,biorxivstage,1,"This preprint has just been published in Science Advances as follows: Li-Qiang Wang#, Yeyang Ma#, Mu-Ya Zhang#, Han-Ye Yuan, Xiang-Ning Li, Wencheng Xia, Kun Zhao, Xi Huang, Jie Chen, Dan Li, Liangyu Zou, Zhengzhi Wang, Weidong Le, Cong Liu*, Yi Liang*. Amyloid fibril structures and ferroptosis activation induced by ALS-causing SOD1 mutations. Science Advances 2024 Nov 1, 10(44), eado8499.",2024-11-16T16:34:07,,Yi Liang,10.1101/2023.06.13.544727,ALS-causing SOD1 mutations H46R and G85R form similar novel amyloid fibril structures and promote ferroptosis in cells,"Li-Qiang Wang, Yeyang Ma, Mu-Ya Zhang, Han-Ye Yuan, Xiang-Ning Li, Wencheng Xia, Kun Zhao, Xi Huang, Jie Chen, Liangyu Zou, Dan Li, Zhengzhi Wang, Weidong Le, Cong Liu, Yi Liang",2023-06-13
https://www.biorxiv.org/content/10.1101/2024.06.11.598333v1#comment-6593322836,biorxivstage,0,this paper is now published in nature communications --> https://doi.org/10.1038/s41467-024-53642-2,2024-11-15T21:56:15,,Mikaela Follmer,10.1101/2024.06.11.598333,Depolarization induces calcium-dependent BMP4 release from mouse embryonic palate mesenchyme,"Mikaela L Follmer, Trevor Isner, Yunus H. Ozekin, Claire Levitt, Emily Anne Bates",2024-06-12
https://www.biorxiv.org/content/10.1101/2024.10.10.617580v1#comment-6592890523,biorxivstage,2,"Authors of the review Olivier Languin-Cattoën, Giovanni Bussi Summary The authors use Molecular Dynamics with enhanced sampling techniques to gain insight in the directional catch-bond mechanism of Vinculin tail (Vt) interaction with F-actin. They construct two models of the Vt-actin complex that are hypothesized to represent a weak state and a strong state in a force-activated allostery model of the catch bond. They use enhanced sampling techniques to estimate the free-energy landscape of the unbinding process in each state, as well as the unbinding kinetics, in absence and presence of pulling forces of variable intensities and directions along the actin filament axis. Their results demonstrate higher kinetic stability for the strong state with respect to the hypothesized weak one, with unbinding kinetics in range of experimental expectations, confirming the viability of a “3-state” (2 bound states, 4 unbinding pathways) kinetic model of the bidirectional catch bond observed in single-molecule experiments. They additionally observe an increase in bond lifetimes for moderate constant pulling force (10-20 pN) in both directions, indicating an intrinsic catch-bond behavior within each “allosteric” state that may superimpose to the overall allosteric one. They show how an external pulling force affects the positioning of the H1 α-helix believed to act as a regulatory motif of the weak-to-strong transition, providing a compelling structural hypothesis for a force-induced allosteric mechanism. Finally, they provide molecular insight on the difference in stability between both states, highlighting the role of a C-terminal extension (CTE) and the redistribution of Vt-actin contacts under force. Comments * We wonder if the nomenclature “Holo” can be confusing at first glance for the reader, given the historical usage of the holo- and apo- prefixes to designate protein constructs with and without their constitutive prosthetic groups (usually non-proteic cofactors) * We suggest that the authors make clearer the composition of the Holo and Aligned protein sequences given the different numbering in 6UPW and 1QKR (that we guess is due to the presence of Metavinculin instead of Vinculin), that in our understanding are identical except for the absence of the leading H1 helix. * In FES calculations, since the constant force (that is, a linear bias) is applied on the same coordinate Q_‖, we expect that the resulting FES could be entirely predicted from the FES at zero force by simple addition of the linear slope, given sufficient exploration of the Q_‖ direction during the OPES-MetaD sampling. This fact could be used by the authors to assess the consistency between the FES computed at different forces. Alternatively, one may want to first aggregate the OPES-MetaD simulations at all forces using appropriate reweighting, and then estimate minimum free-energy paths and free-energy barriers at arbitrary force using the aggregated FES. This approach might lead to a better statistical use of the vast amount of simulations and a smoother estimate of the FES at all forces within the studied range. Finally, the multiple trajectories (20 replicates x 9 force values) could be used in a single bootstrap to assess the statistical uncertainty of the results (see below). * Given the coarse nature of the set of chosen CVs (Q_‖ and Q_⊥) it is unclear whether the Vt is able to regain its canonical binding site during OPES-MetaD, notably because of free rotation with respect to the actin filament. - The authors acknowledge the difficulty in the methods (sec. 5.5) without explicitly stating whether such rebinding events happen at all in their simulations. We believe this is an important piece of information for proper understanding of the FES presented. We would suggest showing time series to clarify how many binding/unbinding events are observed. - One might expect that the absence of recrossing lead to a poor estimate of the free energy difference between the bound and unbound states as well as the height of the binding free energy barrier. On the bright side, the estimate of the unbinding barrier – which is the one they are the most interested in – can still be expected to be reliable. - The authors suggest to run multiple (20) separate OPES-MetaD simulations to compensate for this limitation. It should be acknowledged that independent runs starting from the bound state will not correct for the systematic bias caused by the absence of rebinding events. A bootstrap on these replicas would anyway estimate their statistical error. - We wonder if the use of the more specific CV Q_contact might allow for such recrossing to happen within OPES-MetaD, without the need of aggregating a high number of independent trajectories. In our understanding the authors only used Q_contact to assess the robustness of the free-energy barrier height to the precise choice of the projection space, but did not try to perform OPES-MetaD directly on this CV space, which could be instructive. * The authors analyze the FES by determining a minimum free-energy path using the “String method” as a post-processing method. - The Methods section might benefit from some information about the use of the method, in particular that it is directly applied on the 2D CV-space projected FES (as opposed to a search of a minimum energy path on the full potential energy surface as originally proposed in [50]), and provide details about initialization (choice of end points for the string, number of nodes, initial interpolation) and robustness to these parameters in the converged paths and corresponding barrier estimates. - Since the FES are aggregated from 20 independent OPES-MetaD runs, it might be relatively straightforward to estimate errors (for example using bootstrapping) and provide error bars on Fig 2c. We believe this would strengthen the significance of the observed barrier difference. * One may be concerned about the significance and reliability of the constructed “Aligned” state, since this state was constructed by aligning Vt to another conformation (in what we could refer to as “docking-by-homology”) with little experimental confirmation that such a state is stable in vitro. We understand that the model constitutes the core hypothesis of the whole computational approach, and that the consistency of the computational outcomes with single-molecule experiments themselves validates its plausibility. Nevertheless, it could be argued that lower binding affinity and lifetime are to be expected from a suboptimal binding partner in a suboptimal binding pose. This raises the question of whether the proposed model corresponds to a specific binding mode in reality, or if the results could be reproduced with a different alignment. Is this ruled out by the stability observed in the 500 ns simulations shown in Fig S1? * In Sec 3.2 §4, the authors say “these results [...] do not quantitatively explain the observed experimental results, since the experimental changes in lifetime shown in Fig. 1D reflect a net 1.4 kcal/mol change in barrier in the negative direction, and 0.6 kcal/mol in the positive direction (if one assumes a constant prefactor the kinetic rate constant)”. It was somewhat unclear to us where these values come from (Are they computed from the fitted 3-state model in SI S1? At a specific value of the pulling force?) and how exactly they are compared to the computed barriers for Holo and Aligned to conclude to a discrepancy (Overestimated?) * In Sec 3.4 §3, the authors convincingly remark that in two out of five simulations of Holo+H1 state pulled towards the barbed end, the conformation of H2–H5 becomes more similar to the Aligned (unbound Vt) structure, suggesting a first step in the strong → weak allosteric transition. We wonder if (i) the specific contacts made with actin and (ii) the specific intra-domain contacts of H1 with the H2–H5 bundle are also indicative of a displacement toward the Aligned state, since this would be an even stronger argument validating the proposed model. * Given the relative simplicity of the supposed allosteric motif and the suggestive results of the Holo+H1 simulations, we cannot help but wonder whether the authors also tried to ""unfold"" the H1 helix in the Aligned model with a N-terminal pulling force since this seems a very natural test to look for equally suggestive indications of a weak → strong allosteric transition under force. * Typos or writing remarks: - Fig 1B: The caption is inconsistent with the figure. In the caption, p₁ denotes the COM of Vt helices H2–H5, p₂ the COM of actin A1/A2 and p₃ the COM of actin A4/A5. On the figure instead (p₁, p₂, p₃) → (p₃, p₁, p₂). - Some repetitions that might be elegantly avoided x “capture the difficult-to-capture” (abstract) x “protein of interest [...] on our molecule of interest” (introduction  §1) x “takes into account a Boltzmann weighted average over all possible configurations [...] a Boltzmann weighted average over all possible configurations” (introduction §4) - Typos x “FimH-manose” → “FimH-mannose” (introduction §8) x “which is the the direction” (3.1 §1) x “These approximate one-dimensional free energy pathways also give us a way to define when the system has crossed into the unfolded state” → Maybe the authors meant “unbound state” (3.1 §1) x “not all of the catch bond need come from” → “need to come from” (3.2 §3) x “we note that these results are suggestive, they do not quantitatively” → We wonder if the authors intended a formulation along the lines of: “we note that despite being suggestive, these results do not quantitatively” (3.2 §4) x “a constant prefactor the kinetic rate constant” → “a constant prefactor for the kinetic rate constant” (3.2 §4) x “grafted to our Holo structure random orientation” → “grafted to our Holo structure with a random orientation” (3.4 §2) x “TIP3 water” → “TIP3P water” (5.1 §2) Acknowledgements This report was written after a journal club given by OLC in the bussilab group meeting. All the members of the group, including external guests, are acknowledged for participating in the discussion and providing feedback that was useful to prepare this report. The corresponding authors of the original manuscript were consulted before posting this report.",2024-11-15T07:55:21,giovannibussi,Giovanni Bussi,10.1101/2024.10.10.617580,A direct computational assessment of vinculin-actin unbinding kinetics reveals catch bonding behavior,"Willmor J. Peña Ccoa, Fatemah Mukadum, Aubin Ramon, Guillaume Stirnemann, Glen M. Hocky",2024-10-13
https://www.biorxiv.org/content/10.1101/2024.03.14.584550v1#comment-6592854074,biorxivstage,0,The final version of this article is published in https://doi.org/10.1083/jcb.202404085.,2024-11-15T05:26:52,shigeakisaitoh,Shigeaki Saitoh,10.1101/2024.03.14.584550,Arrayed CRISPRi library to suppress genes required for Schizosaccharomyces pombe viability,"Ken Ishikawa, Saeko Soejima, Takashi Nishimura, Shigeaki Saitoh",2024-03-15
https://www.biorxiv.org/content/10.1101/2024.06.03.597187v2#comment-6592606121,biorxivstage,0,"This prepint is now published, citation: PLoS ONE 19(10): e0305505. https://doi.org/10.1371/journal.pone.0305505",2024-11-14T20:30:07,,Patrick Neale,10.1101/2024.06.03.597187,Participatory science methods to monitor water quality and ground truth remote sensing of the Chesapeake Bay,"Patrick Neale, Shelby Brown, Tara Sill, Alison Cawood, Maria Tzortziou, Jieun Park, Min-Sun Lee, Beth Paquette",2024-06-05
https://www.biorxiv.org/content/10.1101/2024.11.02.621661v1#comment-6592479804,biorxivstage,1,We really appreciate your thoughtful comments. Thank you!,2024-11-14T17:23:54,seithikurippurpandiperumal,Seithikurippu R Pandi-Perumal,10.1101/2024.11.02.621661,Cross-Kingdom Genomic Conservation of Human Sleep-Related Gene Orthologs: Phylogenomic Evidence from Chlamydomonas reinhardtii,"Seithikurippu R Pandi-Perumal, Konda Mani Saravanan, Sayan Paul, George C. Abraham, David Warren Spence, Saravana Babu Chidambaram",2024-11-03
https://www.biorxiv.org/content/10.1101/2024.08.21.609006v1#comment-6592411583,biorxivstage,0,"Based on information brought up to the attention of the authors, the passage below will be modified in the final published version. More specifically, it has been clarified that the isoformof Rap1GAP used in the EMTA does not affect nucleotide exchange and that additional evidence supports that the this system detects active Galpha(i/o). These conclusions are partially supported by evidence presented in paper that has been published (doi: 10.1126/scisignal.adi4747). ""For example, EMTA biosensors for G proteins of the Gi/o family are based on using Rap1GAP as a detector module, for which it is unclear whether it affects nucleotide exchange on different Gα subunits of this family or its preference for binding to Gα-GTP or Gα-GDP dissociated from Gβγ (35, 36), thereby raising questions about what is exactly represented by the BRET changes detected by this sensor.""",2024-11-14T15:48:57,mikelgarciamarcos,Mikel Garcia-Marcos,10.1101/2024.08.21.609006,Direct detection of endogenous Gαi activity in cells with a sensitive conformational biosensor,"Alex Luebbers, Remi Janicot, Jingyi Zhao, Clementine E. Philibert, Mikel Garcia-Marcos",2024-08-22
https://www.biorxiv.org/content/10.1101/2023.12.12.562603v2#comment-6592269363,biorxivstage,0,Watch our PowerPoint presentation at the MMEE2024 conference: https://youtu.be/dwZRbpUDZq0,2024-11-14T11:34:17,disqus_xhE9SaekhL,John,10.1101/2023.12.12.562603,Computer Simulation and Mathematical Modeling of the Interactions Between Ecological and Sexual Selection to Reveal the Mechanism of Sympatric Speciation,"John Lin, James Lin, Natalie Wassall",2024-02-13
https://www.biorxiv.org/content/10.1101/2024.10.03.616309v1#comment-6592216174,biorxivstage,0,"Another paper had solved this problem and was published about two years ago: Najafi, A., Jolly, M. K., & George, J. T. (2023). Population dynamics of EMT elucidates the timing and distribution of phenotypic intra-tumoral heterogeneity. Iscience, 26(7).",2024-11-14T08:45:38,,BioPioneer,10.1101/2024.10.03.616309,Modeling the dynamics of EMT reveals genes associated with pan-cancer intermediate states and plasticity,"MeiLu McDermott, Riddhee Mehta, Evanthia T. Roussos Torres, Adam L. MacLean",2024-10-04
https://www.biorxiv.org/content/10.1101/2024.11.10.622831v1#comment-6591665497,biorxivstage,0,Very cool study Debbie and team. We recently did some work on the nblA protein as well that perhaps may be of interest: https://academic.oup.com/ve/article/10/1/veae082/7775594,2024-11-13T14:57:57,,Jozef Nissimov,10.1101/2024.11.10.622831,Oceanic photosynthesis is directly affected by cyanophage NblA proteins,"Omer Nadel, Rawad Hanna, Andrey Rozenberg, Dror Shitrit, Ran Tahan, Irena Pekarsky, Oded Béjà, Oded Kleifeld, Debbie Lindell",2024-11-10
https://www.biorxiv.org/content/10.1101/2024.10.31.621407v1#comment-6591553718,biorxivstage,1,"Hi, thank you for the positive feedback on the manuscript. Please contact the corresponding author for supplemental data! Thank you!",2024-11-13T11:23:49,sanja_zenker,Sanja Zenker,10.1101/2024.10.31.621407,Many transcription factor families have evolutionarily conserved binding motifs in plants,"Sanja Zenker, Donat Wulf, Anja Meierhenrich, Prisca Viehöver, Sarah Becker, Marion Eisenhut, Ralf Stracke, Bernd Weisshaar, Andrea Bräutigam",2024-11-03
https://www.biorxiv.org/content/10.1101/2024.10.31.621407v1#comment-6591553024,biorxivstage,0,"Hi, please contact the corresponding author for supplemental data! Thank you!",2024-11-13T11:22:00,sanja_zenker,Sanja Zenker,10.1101/2024.10.31.621407,Many transcription factor families have evolutionarily conserved binding motifs in plants,"Sanja Zenker, Donat Wulf, Anja Meierhenrich, Prisca Viehöver, Sarah Becker, Marion Eisenhut, Ralf Stracke, Bernd Weisshaar, Andrea Bräutigam",2024-11-03
https://www.biorxiv.org/content/10.1101/2024.10.15.618559v1#comment-6591364486,biorxivstage,0,"How can I get the data for the supplemental document, please?",2024-11-13T01:32:45,,mo,10.1101/2024.10.15.618559,Exploring voltage-gated sodium channel conformations and protein-protein interactions using AlphaFold2,"Diego Lopez-Mateos, Kush Narang, Vladimir Yarov-Yarovoy",2024-10-18
https://www.biorxiv.org/content/10.1101/2023.01.24.525314v1#comment-6591288419,biorxivstage,0,now published in Nature Communications https://www.nature.com/articles/s41467-024-53163-y,2024-11-12T22:52:53,disqus_sG4o2FXyvs,Francesco Iorio,10.1101/2023.01.24.525314,Integrative ensemble modelling of cetuximab sensitivity in colorectal cancer PDXs,"Umberto Perron, Elena Grassi, Aikaterini Chatzipli, Marco Viviani, Emre Karakoc, Lucia Trastulla, Claudio Isella, Eugenia R Zanella, Hagen Klett, Ivan Molineris, Julia Schueler, Manel Esteller, Enzo Medico, Nathalie Conte, Ultan McDermott, Livio Trusolino, Andrea Bertotti, Francesco Iorio",2023-01-24
https://www.biorxiv.org/content/10.1101/2024.11.02.621661v1#comment-6590956957,biorxivstage,0,"In this report, human sleep-related gene orthologs have been studied in the unicellular green alga Chlamydomonas reinhardtii, which had been earlier considered as a model organism for the study of photosynthesis and flagella/cilia. Comparative genomics, which is an essential tool in biological research, is a very potent method that yields biological insights that are not possible with any other approach. It could also help us understand the human genome study, which has the potential to help us comprehend human sleep and sleep disorders. Phylogenomics gives a more profound comprehension of the discoveries made possible by comparative genomics. The results of this study indicate that the calcium signaling and synaptic transmission involved in sleep regulation are conserved across phyla, and a simple model organisms like Chlamydomonas may be useful in elucidating higher-order, complex behaviors such as sleep. Chlamydomonas do not possess the complexity of the sleep seen in vertebrates. However, knowing their genetic makeup can help researchers to understand general molecular processes that may be used to understand sleep in more complex organisms. Comparative phylogenomic studies are also important in understanding human sleep disorders, and they may open new avenues for developing new therapeutic approaches.",2024-11-12T14:14:42,velyudhanmohankumar,Velyudhan Mohan Kumar,10.1101/2024.11.02.621661,Cross-Kingdom Genomic Conservation of Human Sleep-Related Gene Orthologs: Phylogenomic Evidence from Chlamydomonas reinhardtii,"Seithikurippu R Pandi-Perumal, Konda Mani Saravanan, Sayan Paul, George C. Abraham, David Warren Spence, Saravana Babu Chidambaram",2024-11-03
https://www.biorxiv.org/content/10.1101/2022.10.12.511921v1#comment-6590931913,biorxivstage,0,this paper has been published https://onlinelibrary.wiley.com/doi/10.1111/tra.12889,2024-11-12T13:29:21,,Claudia Almeida,10.1101/2022.10.12.511921,Deacidification of distal lysosomes by neuronal aging drives synapse loss,"Tatiana Burrinha, César Cunha, Cláudia Guimas Almeida",2022-10-17
