comment url,comment forum,comment keywords,comment message,comment date,comment username,comment name,paper doi,paper title,paper authors,paper date
https://www.biorxiv.org/content/10.1101/2022.08.20.504663v1#comment-5989055882,biorxivstage,3,"We reviewed this preprint as a part of Arcadia's preprint review initiative: https://twitter.com/Arcadia... Peidli et al. present a data resource (for single-cell perturbations) and apply energy distance (e-distance) to quantify differences in perturbations. For the data resource, the authors focus on curating single-cell RNAseq and ATACseq measurements perturbed with CRISPR, drug treatments, and a few other perturbation types. The authors curate a total of 44 datasets. Overall, the paper is very well written with a sound logical flow. However, many elements of the paper seem incomplete. We provide several specific comments regarding our views on how the paper could improve. We thank the authors for posting their preprint and code publicly. Our two primary comments are: 1. The data are not harmonized from reads. Instead, the authors process (in most cases) already processed read count by gene matrices. The authors also use different versions of scanpy to process different datasets. This is definitely still valuable, but the authors should state these facts earlier and probably decrease the use of “harmonization”. Additionally, there is no evaluation to determine the effect or benefit of this read count harmonization. Calculating e-distance before and after harmonization across datasets might be helpful. 2. E-distance is not sufficiently benchmarked. The math and intuition are described marvelously, but how does E-distance behave across datasets and common perturbations? How does subsampling read depth impact E-distance calculations? How does drug dose impact e-distance? How does sequencing technology impact e-distance? How does modifying the distance metric within the E-distance calculation impact calculations? We also have several general comments on different aspects of the paper and github repository. We hope that the authors can benefit from our deep dive on the paper. Thanks again! Introduction - Definition of single-cell perturbation data (SCPD) Overall, this subsection is more of a “methods/techniques overview” of how to collect SCPD rather than defining what SCPD actually is. What is output from these techniques? - The authors should define these data in more detail. - The authors should also further define the techniques as it is helpful to have a general idea of why the data collected from the techniques are “good” and not just “more data are better”. Motivation for distance measure of high-dimensional profiles: - The authors claim that E-distance can identify strong or weak perturbations. It’s unclear what a strong or weak perturbation is. I was unable to find this information from a quick google search so I think they should define that here (not found in methods either). Motivation for unifying datasets - Their motivation only seems to be “it doesn’t exist yet because it’s difficult to do” so therefore we should do it. What will/could come of the integrated and standardized datasets? What would we hope to find? Web Interface - The authors claim, “a web interface for data access, analysis and visualization is available at scperturb.org.” There is data access on that site, but analysis and visualization appear to be absent using Brave and Safari browsers. - It seems that one would require a computer with enough memory (500G) to run scPerturb to reproduce the analysis. The authors present solutions for how to overcome these requirements, but it did not seem that they attempted to solve them. - The authors state that there are Quality Control plots for each dataset on the website but we could not find. Results - The authors should briefly describe the methods underlying the statement “dense low-dimensional embeddings of the original data (see Methods for details)” in a bit more detail upon introduction. - It is surprising to me that there are so many cells with 2 perturbations (proportionally to a single perturbation) (sup fig 1). Is this because of an overweighting of a specific study? - It might be helpful to add targeted sequencing depth to table 1 per study, also helpful to add the sequencing platforms used. - Data source trust: Zenodo sources appear to be auxiliary data downloads as opposed to direct sources. How might other researchers assume trust in the sources? Are the included metadata implied or entrusted to the authors? - Are the UMAPs in Figure 3E the same UMAP space or are the spaces fit independently in both panels? - Need to provide a bit more rationale for why the authors chose E-distance over the other options. - Did they calculate E-distance for all perturbations? Sup Fig 3 shows this, so maybe? It was not obvious where to find the measurements. - There are only 11 drug perturbations in common. This is a very interesting observation! How many genes are perturbed in common datasets? Methods - For the scATAC-Seq data, it’s not clear to me if they perform LSI jointly across all samples or not. This would cause non-interoperability across datasets if not done jointly since each LSI dimension may mean something different in each dataset. In addition, they provide peaks x counts matrix -- which is dataset specific. I would suggest aligning jointly using a uniform set of peaks -- Running MACS2 on all datasets would be a huge benefit to the community. - How do the different versions of scanpy impact data processing? Typically, harmonized data are generated with a single pipeline. - When performing subsampling to fit PCA, did the authors transform the full data subsequently? In other words, does the PCA fitting step impact cell count for e-distance calculation? - What distance measure is used in the E-distance calculation for ||x_i - x_J||? L2? For perturbations, comparing L2 to other metrics would help benchmark the method. Code/Github - It seems to us a good idea to spend time improving the existing model / code at https://github.com/theislab.... The authors should justify why they are not contributing to existing open source code. - I can’t find the script “fragments2outputs.R” in their github. From their paper: “All features described in the overview above were computed with ArchR functions. For details inspect the “fragments2outputs.R” script in our code repository (see Data Availability).” Data Repo comments: - Manual data testing for reproducibility within https://github.com/sanderla... (one must perform the steps, the repo doesn’t provide or outline within the code itself) - Suggests using “mamba” but does not provide instructions on how to install mamba - Would suggest a small description for each folder in the directory (README) explaining its contents - There’s no usage example on how to download the data or use the program - Would  be best to have a notebook (or bash script) that describes the entire workflow. - The notebooks are not sequentially executed and there are no execution instructions - What environment (OS/hardware/configuration/etc) is required to run the code? - Is notebook (.ipynb) output expected within committed code? (should these have been scrubbed with nbconvert/jupytext?) Data Availability - Based on this section, their website only contains the first three bullet points (e.g scRNA-seq data, scATAC-seq data, and details about the datasets). We could not easily find the last three bullet points (Quality control plots for each dataset, Filtering, e.g., by readout or type of perturbation, Commands for direct file download using the Unix command curl) This review was produced jointly at The University of Colorado by: Gregory P. Way, PhD Natalie Davidson, PhD Erik Serrano Parker Hicks Jenna Tomkinson Dave Bunten",2022-09-19T14:09:03,gregory_way,Gregory Way,10.1101/2022.08.20.504663,scPerturb: Information Resource for Harmonized Single-Cell Perturbation Data,"Stefan Peidli, Tessa D. Green, Ciyue Shen, Torsten Gross, Joseph Min, Jake P. Taylor-King, Debora S. Marks, Augustin Luna, Nils Blüthgen, Chris Sander",2022-08-22
https://www.biorxiv.org/content/10.1101/2020.03.23.003897v1#comment-5988469185,biorxivstage,0,"I suppose, In fig.2 the result of SMEM should be ""ATCTCAGTC"" rather than ""ATATCAGTC""",2022-09-19T08:47:03,,ricky,10.1101/2020.03.23.003897,Accelerating Maximal-Exact-Match Seeding with Enumerated Radix Trees,"Arun Subramaniyan, Jack Wadden, Kush Goliya, Nathan Ozog, Xiao Wu, Satish Narayanasamy, David Blaauw, Reetuparna Das",2020-03-25
https://www.biorxiv.org/content/10.1101/2022.08.29.505664v1#comment-5988388787,biorxivstage,0,"Hi Thomas Burger: This article is a nice work. However, the low resolution of the Figures makes it confused to understand the content of the article. Could you provide clearer  Figures ? Best regards Jude",2022-09-19T07:58:28,zhljude,zhljude,10.1101/2022.08.29.505664,Applying FDR control subsequently to large scale one-way ANOVA testing in proteomics: practical considerations,Thomas Burger,2022-08-29
https://www.biorxiv.org/content/10.1101/2022.07.18.500549v2#comment-5987805562,biorxivstage,0,"Hi, cool paper! I had a bit of trouble understanding one thing though: how do you prevent or even correct for false positives in this procedure? Could you measure FPR? It seems to me that the narrow selection of literature (enriched in associations with Depression/AD), the relatively long reasoning chains, and the paths through hub nodes such as ""Nervous System Process"" can very easily result in hits that ""biologically make sense""; what prevents this process from just returning each and every entity that is connected to one of the parent nodes of Depression and AD? You even encourage hierarchical chains, so the chance for parent hub nodes is almost 1 I would assume. Generally, what is the reasoning for allowing these chains to cross through nodes with such low specificity?",2022-09-18T23:37:46,,Sebastian,10.1101/2022.07.18.500549,Causal feature selection using a knowledge graph combining structured knowledge from the biomedical literature and ontologies: a use case studying depression as a risk factor for Alzheimer’s disease,"Scott A. Malec, Sanya B. Taneja, Steven M. Albert, C. Elizabeth Shaaban, Helmet T. Karim, Arthur S. Levine, Paul Munro, Tiffany J. Callahan, Richard D. Boyce",2022-07-20
https://www.biorxiv.org/content/10.1101/2022.01.20.477098v1#comment-5985157267,biorxivstage,0,"A standard approach for protein structure compression is MMTF, which is a lossless compression format supported by RCSB PDB. After including metadata, does PIC outperforms MMTF in compression rate, with and without gzip compression?",2022-09-17T01:01:54,chengxinzhang,Chengxin Zhang,10.1101/2022.01.20.477098,Image-centric compression of protein structures improves space savings,"Luke Staniscia, Yun William Yu",2022-01-22
https://www.biorxiv.org/content/10.1101/2022.04.28.489957v1#comment-5985041098,biorxivstage,0,"Simon Zhongyuan Tian, Guoliang Li, Duo Ning, Kai Jing, Yewen Xu, Yang Yang, Melissa J Fullwood, Pengfei Yin, Guangyu Huang, Dariusz Plewczynski, Jixian Zhai, Ziwei Dai, Wei Chen, Meizhen Zheng, MCIBox: a toolkit for single-molecule multi-way chromatin interaction visualization and micro-domains identification, Briefings in Bioinformatics, 2022;, bbac380, https://doi.org/10.1093/bib...",2022-09-16T21:43:47,simonzhongyuantian,Simon Zhongyuan Tian,10.1101/2022.04.28.489957,MCIBox: A Toolkit for Single-molecule Multi-way Chromatin Interaction Visualization and Micro-Domains Identification,"Simon Zhongyuan Tian, Guoliang Li, Duo Ning, Kai Jing, Yewen Xu, Yang Yang, Melissa J. Fullwood, Pengfei Yin, Guangyu Huang, Dariusz Plewczynski, Wenxin Wang, Jixian Zhai, Ziying Wang, Ziwei Dai, Yuxin Lin, Wei Chen, Meizhen Zheng",2022-04-30
https://www.biorxiv.org/content/10.1101/2022.09.01.504601v1#comment-5984608029,biorxivstage,3,"Thank you very much for taking the time to read our preprint and for your comments. The purpose of the current release is merely to describe the deep learning approach and we feel that information provided is sufficient for qualified researchers to recapitulate the computational strategies. While reporting repellency in terms of protection, e.g. complete protection time, would indeed be appropriate in the context of acquiring data for registering and labeling of repellent products (per EPA & WHO guidelines), we recognise the added complexity of such studies. The complete protection time of a specific repellent can (partially) be tuned using traditional and more advanced formulations, e.g. by influencing speed of release and rate of absorption by the skin. We, therefore, think that the potency of the repellents (e.g. expressed as ED50) would be a more suitable metric at the stage of compound discovery, and complete protection time is a more suitable metric in a product development stage. We agree that a good repellent should provide approximately 100% protection from mosquito bites for several hours, in the context of topically applied repellents (typically 300-400 ug/cm2). Please note that we tested compounds at very low densities (25 ug/cm2 and 13 ug/cm2 in our membrane feeding assay and arm-by-cage assay, respectively) in order to be able to pick up responses that outperform current gold standard repellents (DEET and picaridin). As exemplified in Figure 2E the percentage protection goes up with increasing dose, and the exact nature of this dose-response relationship is the focus of our current studies. Indeed, IP considerations prevent us from releasing more data on the nature of the novel molecules that were discovered but we hope to do so with publication in a peer-reviewed journal in due time. Thanks for spotting the erroneous statements with respect to picaridin and ORs, we will correct them in a new version on BioRxiv. Koen Dechering",2022-09-16T14:15:25,koendechering,Koen Dechering,10.1101/2022.09.01.504601,A deep learning and digital archaeology approach for mosquito repellent discovery,"Jennifer N. Wei, Marnix Vlot, Benjamin Sanchez-Lengeling, Brian K. Lee, Luuk Berning, Martijn W. Vos, Rob W.M. Henderson, Wesley W. Qian, D. Michael Ando, Kurt M. Groetsch, Richard C. Gerkin, Alexander B. Wiltschko, Koen J. Dechering",2022-09-03
https://www.biorxiv.org/content/10.1101/2022.09.13.507775v1#comment-5984398773,biorxivstage,0,This is a very important paper. It indicates that classifying and understanding the crystal polymorphisms that occur during protein/enzyme reactions with its ligand in crystals can lead to a detailed understanding of protein reaction mechanisms. This paper will become increasingly important with the development of the 4th generation synchrotron radiation facilities.,2022-09-16T12:07:25,disqus_3INbmg0DGy,EM,10.1101/2022.09.13.507775,Elucidating polymorphs of crystal structures with intensity-based hierarchical clustering analysis on multiple diffraction datasets,"Hiroaki Matsuura, Naoki Sakai, Sachiko Toma-Fukai, Norifumi Muraki, Koki Hayama, Hironari Kamikubo, Shigetoshi Aono, Yoshiaki Kawano, Masaki Yamamoto, Kunio Hirata",2022-09-14
https://www.biorxiv.org/content/10.1101/2022.08.05.502972v2#comment-5983247154,biorxivstage,0,"The difference between Figures 4 and 5 is striking. In Figure 4, UniRep/BO is clearly superior to the other versions, whereas in Figure 5, even a random sequence performs well until higher iterations and there is never a clear difference between UniRep/BO and the other methods. You highlight that this task is very specific and is convex as explanations for why UniRep/BO is not clearly better, but I am still wondering why the performance for any method is not much better than random. Also, you also state that the sequence length is fixed at thirteen residues. In part A of the results, you mention that an advantage of BO is that the sequence length can change during optimization. Have you experimented with letting BO run with a variable length sequence on the unknown target matching problem? In addition, can you perform the AlphaFold task using the two ablated methods? I think including the ablation results for all three tasks would be helpful. I think Figure 1 could be made clearer if the sequences and labels proposed from the logits went directly to the train step, instead of being directed first to a separate shape. This would make Figure 1 have a more triangular structure, with the logits at the top, the UniRep vector in the bottom left, and the prediction plot in the bottom right. I think this could help make the flow of information clearer.",2022-09-15T15:36:04,fosterbirnbaum,Foster Birnbaum,10.1101/2022.08.05.502972,Now What Sequence? Pre-trained Ensembles for Bayesian Optimization of Protein Sequences,"Ziyue Yang, Katarina A. Milas, Andrew D. White",2022-09-02
https://www.biorxiv.org/content/10.1101/2022.08.15.504040v1#comment-5983147205,biorxivstage,1,"Hi Ludovic, thank you for your comment. We will make sure to include the references you provided. How are you thinking about the patchy GC-PC connectivity in terms of learning specific tasks? I read through your review article but I am not sure if I understand your claim. One point I understood was the idea that different learned behaviors strengthen different combinations of GC-PC synapses. But could you clarify what you mean when you say ""task-dependent optimal coding level should be somehow nested in a relatively invariant anatomical frame""?",2022-09-15T13:46:16,marjoriexie,Marjorie Xie,10.1101/2022.08.15.504040,Task-dependent optimal representations for cerebellar learning,"Marjorie Xie, Samuel Muscinelli, Kameron Decker Harris, Ashok Litwin-Kumar",2022-08-15
https://www.biorxiv.org/content/10.1101/2022.07.24.499430v1#comment-5982870330,biorxivstage,2,"Review coordinated via ASAPbio’s crowd preprint review This review reflects comments and contributions by Joe Biggane, Luciana Gallo, Rachel Lau, Sam Lord, Dipika Mishra, Claudia Molina. The comments were synthesized by Iratxe Puebla. The study reports two two Bcl-2 family proteins, BNIP5 and Bcl-G, which inhibit Bak-dependent apoptosis through engagement of MODE 2 inhibition. The BH3 domains of these proteins act as selective Bak activators, while not inhibiting anti-apoptotic proteins, leading to increased binding of activated Bak to Mcl-1, which prevents apoptosis. The reviewers raised a couple of questions about the methodology and several other suggestions for the paper, outlined below: Methodology Throughout the study various BH3 mimetics are used, but the combinations in which they are used and/or the doses employed could be more clearly reported. For example, in Figure 1E and 1F ABT-737 and S63845 are used at 1 μM.  Then, in Figure 1H, A-331852 is substituted for ABT-737 in combination with S63845 and the concentration is not reported. In Figure 1H, ABT-737 and S63845 are used again, but this time at a concentration of 2 μM each. Other concentrations are used  in Figures 2, 3, and 5.  There seems to be a dose-response assay in Figure 3B, but it is used for a specific use case. It would be beneficial to report all combinations and doses employed, and the rationale for them in the main text, to allow readers to fully interpret the data presented. In various figures, there is a concern about the statistical approach to calculate p-values based on multiple measurements or cells within each sample. The t-test and ANOVA assume that each measurement is independent, and multiple nuclei within the same sample are not independent. Recommend either not reporting p-values or averaging together the values from each biological replicate to calculate the p-value using those sample-level means. For more information, see https://doi.org/10.1371/jou... and https://doi.org/10.1083/jcb... Specific comments Introduction ‘ The two MOMP effectors Bcl-2 associated x (Bax) and Bcl-2 antagonist killer (Bak) are inactive in resting cells as these cells exhibit low levels of proapoptotic BH3-only proteins (e.g. BIM)....and some are additionally able to activate Bax and Bak (sensitizers and direct activators, e.g. BIM)’ - Recommend revising the fragment for clarity, adding references to support the statements and possibly an introductory figure to help visualize the proteins involved. Introduction, last paragraph ‘ We found that two Bcl-2 proteins, Bcl-2 interacting protein 5 (BNIP5) and Bcl-G, act as selective inhibitors of Bak-dependent but not Bax-dependent apoptosis…’ - The fragment is unclear, BNIP5 and Bcl-G are first reported as Bak-inhibitors, then activators and back to inhibitors. Does this mean to describe protein-protein interaction and changes in conformation? Figure 1 - Recommend using a different color scheme for Figure 1E to assist visual interpretation of the results, in particular consider using a color-blind friendly color palette. - ‘ colony formation (F)’ - The text later on refers to ‘clonogenic survival’, would it be possible to clarify in the legend or text what is being assessed, i.e. recovery assay, clonogenic survival or colony formation? - Figure 1G - Please clarify whether 2 uM of each are used in this experiment. - ‘ We transduced PC9 lung cancer or A375 melanoma cells…’ - It is nice to see that different cell lines were assessed to address any cell line-specific effects. Would be interesting to see if this effect occurs in normal cell lines and not just cancer cell lines. Figure 2 -  The inline color-coded legends are useful when bars are displayed but in the figure several bars are close to zero, consider an alternative method to label the bars. Results ‘...suggesting posttranscriptional regulation of Bak levels by BNIP5 ’ - Maybe large proteome databases of multiple cell lines (e.g CCLE) can be datamined to determine the correlation between BNIP and Bak expression? Figure 3B, 3D and 3E - Please clarify the concentrations used for each treatment in the figure legend. Methods, Cell viability and cell death measurements - The study assessed cell death or cell viability with either live cell imaging, or in fixed cells, can the methodology for this be elaborated upon? Also, propidium iodide staining is used in several sections of the results, recommend adding information about this under the Methods section. Methods - There are several missing references in the Methods section. Suggest adding Supplemental Figure 6 as a graphical abstract.",2022-09-15T07:03:40,iratxepuebla,Iratxe Puebla,10.1101/2022.07.24.499430,Anti-apoptotic BH3-only proteins inhibit Bak-dependent apoptosis,"Sebastian Ruehl, Clifford S. Guy, Zhenrui Li, Mao Yang, Tudor Moldoveanu, Douglas R. Green",2022-07-24
