comment url,comment forum,comment keywords,comment message,comment date,comment username,comment name,paper doi,paper title,paper authors,paper date
https://www.biorxiv.org/content/10.1101/2023.03.23.534018v1#comment-6182514793,biorxivstage,3,"Pre-publication review of ""Forecasting dynamics of a recolonizing wolf population under different management strategies"" by Petracca et al. https://doi.org/10.1101/202... Reviewed by Adrian Treves, PhD Professor of Environmental Studies, Founder and Director of the Carnivore Coexistence Lab, University of Wisconsin-Madison +1-608-890-1450 http://faculty.nelson.wisc.... (which includes full disclosures of potentially competing interests in the CCC.php page) Direct inquiries to atreves@wisc.edu 11 May 2023 I appreciate that Dr. Petracca and colleagues posted their manuscript to a preprint server to facilitate independent review and scientific debate. Such preprints are a healthy step in our field to improve the reliability of science. Also I acknowledge the risk posed by preprints, such as policy-makers or the public running with results or inferences before they have been approved by qualified peer scientists. I think two aspects of the preprint process guard against such undesirable outcomes: (a) peer reviews attached to the preprint as a comment should serve to caution against such precipitous use of preprints, and (b) the authors can reinforce the need for caution in subsequent revisions to the preprint, even citing their pre-reviewers. The science-policy interface in which this work lies is fraught with difficulties. Also I acknowledge these sorts of models are complex and difficult to parameterize realistically with confidence. None of my comments or criticisms below are meant to undermine the hard work put in, but rather they are meant to improve the final product, improve outcomes for wolves, and improve the policy that may result from applied research. Thanks in advance for reading my comments in that spirit. I have chosen not to cite much research below, instead calling the authors’ attentions to our website (above) where peer-reviewed substantiation of all my assertions can be found. I welcome peers’ emails to atreves@wisc.edu if anyone has trouble finding the evidence. Most of my comments relate to Tables 1 and 2 and the associated scenarios. A question about Table 1: the caption includes ""Lethal removal rate was calculated directly from state agency records."" Please provide those with annual numbers and locations (East or West) to help the reader understand the geographic and spatial context of that assertion. The annual lethal removal rate was a single point estimate of 0.04. I don’t understand why this was treated as a constant not bracketed by annual variability? Later, the authors wrote ""In scenario 1 (“Baseline”) we simulated all relevant factors, as described below, at levels observed in the data collection period (2009-2020)."" All factors include those affecting the human-caused mortality, right? There are numerous studies documenting a variable annual rate of lethal removal. There seem to me to be other issues with assuming a constant annual lethal removal rate in baseline and the scenario for increased removals below. The assumptions that seem to be made about constant annual lethal removal in the baseline or the increased removal scenarios might be summed up as ""livestock losses will never get better or worse so long as the current rate of removal is applied randomly to wolf packs and entire packs are removed."" I don’t mean to caricature the assumption, I mean to make it plainer so it can be scrutinized. 1. If lethal removal is assumed to be effective in preventing livestock loss as WDFW has implied in the past, then it seems surprising that the model would treat it as ineffective or needing constant renewal. Can this be justified scientifically and by reference to articles that have not themselves been undermined by subsequent work? I call your attention to recent reviews of the literature on lethal removal which indicates unpredictable effects of lethal removal of wolves, resulting in increases, decreases and no change in livestock losses depending on study and site and years (the latter of no effect in the majority of cases, see studies of wolf removal by Grente, Krofel, and Santiago-Ávila. 2. Is predation on livestock random? If not, how does the imposition of a random scheme affect the model (a sensitivity analysis would be useful); many studies reveal that predation on livestock is not spatially random or uniform. Rather livestock losses are sometimes highly predictable from spatial features and wolf pack demographics. Therefore, I also call your attention to risk models that are analogous to resource selection functions, which have been used to model livestock loss in our region among others (see my lab website and search for ""risk"" and ""forecast"" please). 3 . Has WDFW lethal removal eliminated entire packs and in what percentage of cases? This baseline information might be helpful in interpreting the scenarios. I discuss partial or entire pack removal further below. I was confused by the increased removals scenario and the harvest scenario. Given they are differentiated I have to assume increased removals is NOT public hunting, trapping, hounding, etc. It is unclear what conditions might lead to such an increase in lethal removals. The authors wrote ""In scenarios 4 and 5 (“Increased removals”), we simulated an increased number of lethal management removals such that 30% of the wolf population[*] would be removed every four years, corresponding to an annual removal rate of 8.5%."" Does this replace the baseline removal rate or supplement it? I didn’t see a scientific justification for the value of 30% and I don’t understand where 8.5% came from (30 /4 = 7.5%). Even if I add the baseline it does not reach 8.5%. I’m sure I’m missing something but the calculation could be clarified. Another concern about this scenario is that it uses a flat mortality rate (% of population) regardless of conditions. That seems to simulate population reduction (sometimes called culling) but applied randomly to entire packs. Given that is a highly unusual pattern of management, it would help to understand the rationale behind it. See below where other more common scenarios are NOT considered. Therefore, I do not understand the criteria applied when selecting scenarios that deserve modeling and scenarios that do not deserve modeling. ""Harvest"" See issues with terminology in the section on Minor comments below. Every 6 months: This is an unusual off-take pattern. Readers may be tempted to assume that the policy-makers among the authors or their superiors in state agencies are planning two seasons of wolf-killing per year. The authors might wish to address why such an unusual wolf-killing system was included in this paper. Also, the method that allows only adults or juveniles yet simulates twice-a-year 'harvest’ assumes the public can avoid killing pups. Is there evidence for that assumption? The assumption seems dubious on its face but regardless it requires some consideration of methods of 'harvest’ and accidental non-target killing. Additive: While this is more conservative than any compensatory scenarios, it still does not acknowledge the many sources of evidence for super-additive mortality when the public begins killing wolves: Creel, Vucetich, Chapron, or when wolf-killing is liberalized in general: Santiago-Avila, Louchouarn, Suutarinen, Liberg, Treves. There are now more than ten studies quantifying the super-additive effects on population dynamics or the undocumented losses of wolves when killing is liberalized (I.e., undocumented deaths that can be attributed to policies of liberalized killing). The OMISSION of any alternative scenario with super-additive mortality and the OMISSIOn of alternative scenarios with increases in illegal killing triggered by the harvest and increased removals scenarios are problematic. I capitalized the word OMISSION to emphasize that they are not scientific decisions but value-based decisions about which scenarios to publish and which not to publish. Value-based decisions are akin to unstated assumptions derived from personal or organizational preferences / beliefs / policies. Assumptions about parameter values or interactions between variables should be transparently stated and usually justified scientifically. Unstated assumptions in a modeling paper seem to me to be scientific missteps because the range of possible parameter values was circumscribed for reasons that are not transparent or justified by peer-reviewed research. Also, please note that an attempt to scientifically justify circumscribed parameter values might require an even-handed summary of evidence for and against the assumed constraints on parameter values. For example, the increased removal scenarios (currently unjustified) might be paired with a lowered removal scenario or a scenario that curbs ongoing mortality sources such as poaching or vehicle collisions, hypothetically. To me it seems easier to evaluate alternative scenarios even-handedly than to justify the current ones. Furthermore, my concern is that the decisions about which scenarios to publish in the current manuscript leave unanswered 'why these scenarios and not others?' And the authors do not touch upon alternative scenarios for how wolf-human coexistence might play out differently. Instead, the scenarios presented in this paper are a subset of wolf-human coexistence and that subset is slanted towards negative views of wolves (more killing). For example, there is nothing scientific telling us to simulate lethal removal at level x or y. We explored this problem in sustainable use models in Frontiers in Conservation Science in 2021. My criticism is meant to be constructive as it is not too late to adapt your models to positive wolf-human coexistence scenarios, such as those involving provisioning to improve wolf reproduction or survival, increasing wild prey bases in regions with low prey, better enforcement against unregulated, human-caused mortality, use of non-lethal methods to protect livestock etc. I understand WDFW might never undertake such actions but that does not constrain scientists seeking approximations of reality. Also, administrations change, private actors / organizations sometimes step in, and background conditions change especially for a simulation run for 50 years. I hope you see how a subset of scenarios was presented for non-scientific reasons. Please remind readers that the selection of scenarios is value-based not science-based. Moreover, the selection of parameters within scenarios may also be value-based. For example, partial pack removals — simulated in your methods when ""excess"" removals are randomly assigned to another pack short of full pack removal — is NOT suggested to be effective in any study, even Bradley et al. 2015. Moreover, can the latter study even be used to justify the effectiveness of removal of entire wolf packs? I don’t think so. Consider that Santiago-Ávila et al. 2018 showed Bradley et al. 2015 was not reproducible until and unless the methods are clarified. Also, the 2018 article identified a possible statistical bias favoring lethal removal. If the data were to be shared (another hallmark of reproducibility), the bias minimized, and the methods clarified, one might argue that full pack removal has a scientific basis. But we’re not there yet. Because I noticed omissions of scenarios and circumscribed parameter values without explicit statement of assumptions and missing literature, I offer a comment on potentially competing interests. T The scientific community has changed position on this in recent years and is increasingly recognizing the potentially distorting effects of values and ideology on scientific research. Nothing is necessarily disqualifying but all should be disclosed fully and transparently. Ideological commitments expressed through memberships in civil society and professional societies (e.g., TWS or AFWA), institutional policy positions (e.g., WDFW’s current policies), and personal affiliations or rivalries, might all place pressures on individuals that reflect competing interests. These can affect the unstated assumptions, literature reviews (what is cited and summarized versus omitted) and the methods chosen and analyses used, in addition to the traditional issues relating to financial interests. I am not referring to one or two articles being missed but a pattern of omitting peer-reviewed research in highly ranked international journals as I noted here. I emphasize the issue of potentially competing interests as a way to inspire greater public confidence in the scientific endeavor. Thanks for your kind attention. Again I admire your decision to publish preprints so that pre-publication review has an opportunity to influence the future manuscript and perhaps public policy. Minor concerns Terminology: The term ""recovery"" has a meaning in US federal and state endangered species law as you all no doubt are aware. Recovery in its legal sense may lead policy-makers to shift regulatory schemes to down- or delist wolves. Therefore it is not a value-neutral scientific term and could be viewed as prejudicial. I see passages in your text where recover(y) is appropriate but others where it was used to refer to recolonization or population growth. There I recommend instead using recolonizing or geographic spread or numerical rebound which do not imply a legal status. This seems especially relevant when scenario outcomes suggest a low likelihood of achieving legal recovery. Relatedly, I recommend careful consideration of certain jargon words that may be mainstream in wildlife management but are not commonplace in ecological sciences or policy among all publics –  and may have value-based or moral connotations, e.g., harvest and depredation. In place of harvest I suggest ""permitted, regulated wolf-killing by the public"", because harvest is a euphemism that holds implicit assumptions about the values of wolves and motivations of humans who participate. To see why not to use 'depredation’, look at the first definition in the Oxford English Dictionary. I used it for years but now see the error. Finally, the discussion of non-lethal methods might benefit from updating to include studies since 2010 on livestock-guarding dogs, and systematic reviews of effectiveness 2016-2021.",2023-05-11T13:43:40,adriantreves,ADRIAN TREVES,10.1101/2023.03.23.534018,Forecasting dynamics of a recolonizing wolf population under different management strategies,"Lisanne S. Petracca, Beth Gardner, Benjamin T. Maletzke, Sarah J. Converse",2023-03-25
https://www.biorxiv.org/content/10.1101/2022.02.04.479188v2#comment-6182420005,biorxivstage,0,This is beautiful work - I am really intrigued by the possibility of functional diversity of cholinergic projection neurons  that this may underscore--- your studies target anterior SI (DB?)  to BLA- whereas others targeted more caudal NBM/ posterior SI projections to BLA.  Could different states and valence cues engage different BFCNs?,2023-05-11T11:08:19,,Lorna Role,10.1101/2022.02.04.479188,Reward contingency gates selective cholinergic suppression of amygdala neurons,"Eyal Y. Kimchi, Anthony Burgos-Robles, Gillian A. Matthews, Tatenda Chakoma, Makenzie Patarino, Javier Weddington, Cody A. Siciliano, Wannan Yang, Shaun Foutch, Renee Simons, Ming-fai Fong, Miao Jing, Yulong Li, Daniel B. Polley, Kay M. Tye",2023-05-10
https://www.biorxiv.org/content/10.1101/2023.01.10.521980v1#comment-6181763670,biorxivstage,0,"Now published in Nature Communications. Purhonen, J., Banerjee, R., Wanne, V. Mitochondrial complex III deficiency drives c-MYC overexpression and illicit cell cycle entry leading to senescence and segmental progeria. , 2356 (2023). https://doi.org/10.1038/s41...",2023-05-10T16:34:31,jukkakallijrvi,Jukka Kallijarvi,10.1101/2023.01.10.521980,Mitochondrial complex III deficiency drives c-MYC overexpression and illicit cell cycle entry leading to senescence and segmental progeria,"Janne Purhonen, Rishi Banerjee, Vilma Wanne, Nina Sipari, Matthias Mörgelin, Vineta Fellman, Jukka Kallijärvi",2023-01-10
https://www.biorxiv.org/content/10.1101/2023.02.01.526705v1#comment-6181223401,biorxivstage,0,"Summary CryoET allows researchers to view biomolecular complexes in their native state via in situ imaging of cells, as opposed to purifying such complexes and viewing them in isolation via single particle cryoEM. However, traditional sample preparation of thin cell sections is laborious and can introduce artifacts. In this paper, the authors quantify the sample damage introduced by cryo-FIB milling, a newer technique proposed as an alternative to traditional sample preparation. Although much has been done to understand how radiation damage affects particles in single particle cryoEM, the same cannot be said for understanding how cryo-FIB milling damage affects samples in cryoET. As cryo-FIB milling becomes more widely used, downstream workflows and data interpretation will be helped greatly by understanding the mechanism and characteristics of damage caused by cryo-FIB milling itself. This paper aims to characterize the damage caused by cryo-FIB milling by using a model system, the ribosome. The authors utilize a previous template matching method they developed, 2DTM, as a broad metric for comparing and quantifying damage. The major success of this paper is highlighting practical considerations for sample preparation based on quantification of damage from cryo-FIB milling. The major confusion we have with this paper is in interpreting the data for the mechanism of cryo-FIB milling damage, and whether alternate explanations for the data have been explored. This paper provides helpful insight into what one can expect from cryo-FIB milling their samples, and lays the groundwork for optimizing sample preparation. Major points We are unsure what new information the plots in Figures 1G and 1H provide relative to Figures 1E and 1F. It makes sense that the 2DTM SNR values plateau in the thicker lamella, as there is a larger region of undisturbed particles. However, because the 2DTM SNR is also included in Figures 1E and 1F in an untransformed and more intuitive coordinate frame, we are unsure what new interpretations come out of Figures 1G and 1H, and why this coordinate frame is necessary. Although Figure 3 shows that damage from FIB milling is distinct from typical radiation damage in cryoEM, the statement “This is consistent with a model in which the FIB-damaged targets have effectively lost a fraction of their structure, compared to undamaged targets, possibly due to displacement of a subset of atoms by colliding ions” currently relies solely on the use of 2DTM SNR as a measure. This could be more strongly supported by solving structures or 2D classes of LSUs from varying depths in the lamella to observe the damage. Solving these structures from the datasets and low pass filtering them to different spatial frequencies (as done in Figure 3) would be helpful to see if there are consistent changes at the molecular level that could explain the propagation of radiation damage as a result of displacement of atoms due to colliding Ga+3 ions. Figure 2A illustrates how variable 2DTM SNR values can be. Outlining potential workflows for experimental validation of this ribosome dataset and other datasets would be helpful for those wishing to benchmark cryo-FIB milling damage on their own particular system of interest. In the discussion section, the practical recommendation that particles more than 30 nm deep can be used for subtomogram averaging seems at odds with the earlier observation that damage can be seen up to 60 nm deep from each lamella surface. The 2DTM approach and the estimation of radiation damage relies on the reduction in correlation between the ideal, undamaged template and SNR. Can there by any other reasons for a reduction in this correlation other than FIB milling and/or electron exposure? e.g. stacking of multiple particles in Z-direction in case of higher ice thicknesses leading to reduced detectability. The fact that the damage makes it impossible to pick entire particles suggests that the scale of radiation damage due to Gallium ions makes the entire particle explode. Are there any instances in which you see differential damage meaning that only a part of the particle is damaged and the rest is intact? I would expect this since different parts of particle are exposed at different points along Y axis. Otherwise, it can be concluded that the damage is always of “whole” particles but there is no conclusion clearly stating this. This could be worth exploring. Figure 3F: it is well established that at low scattering angles, the electron scattering factors of negatively charged atoms can be negative. Was this considered when calculating the SNR from phosphorous atoms in the phosphodiester bond? Minor points In Figures 1G and 1H, we suggest using nanometers instead of Angstroms as the x-axis label. This will make it easier to interpret the blue dotted lines as the edges of the lamella. In Figure 1, it is unclear if “relative 2DTM SNR” of Figures 1E and 1F are exactly the same as “2DTM SNR” of Figures 1G and 1H. How does the 2DTM method take into account the radiation damage in template structure? Would it be possible to recapitulate the template model based on the known mechanisms of radiation damage due to exposure to electron beam during imaging so as to use a close to ideal model for template matching? It would be helpful if the rationale for selection of undamaged, ideal templates in 2DTM is explained in more depth. For example, are these from single particle cryoEM data with the minimum possible radiation damage or are they from other experimental techniques? What does the dotted line in Fig 2D represent? Why are there more outliers (outside the lamella thickness) in 120 nm sample (fig 1G) than in the case of 200 nm lamella? What does the existence of these outliers indicate? Are particles averaged over Y-axis in fig 1G and H? What is the error in measurement of electron exposure and how is it propagated in measuring the radiation damage? -Tushar Raskar, Daphne Chen, and James Fraser",2023-05-09T22:54:47,,Daphne ,10.1101/2023.02.01.526705,Quantification of gallium cryo-FIB milling damage in biological lamella,"Bronwyn A. Lucas, Nikolaus Grigorieff",2023-02-03
https://www.biorxiv.org/content/10.1101/2023.01.09.523344v1#comment-6181055197,biorxivstage,0,"Thanks for posing this interesting question. We manipulated chromosome 1q in four different cell lines - A2780, AGS, A2058, and MCF10A. In A2780 and MCF10A, TP53 is wild-type and the cells have a functional p53 pathway. In AGS and A2058, p53 is either mutated or non-functional. (I know that AGS is reported to have wild-type TP53, but we pulsed these cells with a DNA damaging-drug and they didn't up-regulate p53 targets, so either this cell line has acquired a mutation in TP53 or there's some other alteration in the pathway). There's clearly a strong interaction between 1q copy number and TP53 mutation status, as 1q gains are much more common in TP53-wildtype tumors compared to TP53-mutant tumors. However, there is still a significant fraction of TP53-mutant tumors with 1q gains, so there's probably some benefit for this aneuploidy that's p53-independent. We don't yet know what it is. Regarding the role of p53 in the 1q-regain events that we observed, it's an interesting question and we haven't done the experiment. p53-mutant cells have a weaker G2 checkpoint, so they might enter mitosis with unrepaired DNA damage or replication fork problems that promote chromosome missegregation. But that's just a hypothesis, it would be interesting to test!",2023-05-09T19:25:42,jasonsheltzer,Jason Sheltzer,10.1101/2023.01.09.523344,Oncogene-like addiction to aneuploidy in human cancers,"Vishruth Girish, Asad A. Lakhani, Christine M. Scaduto, Sarah L. Thompson, Leanne M. Brown, Ryan A. Hagenson, Erin L. Sausville, Brianna E. Mendelson, Devon A. Lukow, Monet Lou Yuan, Pranav K. Kandikuppa, Eric C. Stevens, Sophia N. Lee, Barbora Salovska, Wenxue Li, Joan C. Smith, Alison M. Taylor, Robert A. Martienssen, Yansheng Liu, Ruping Sun, Jason M. Sheltzer",2023-01-10
https://www.biorxiv.org/content/10.1101/2023.04.06.535924v1#comment-6181035578,biorxivstage,1,Thanks a lot for your insightful comments Renzo. We will consider them all.,2023-05-09T19:03:10,atenaakbari,Atena Akbari,10.1101/2023.04.06.535924,Layer Dependence of Monocular and Binocular Responses in Human Ocular Dominance Columns at 7T using VASO and BOLD,"Atena Akbari, Joseph S Gati, Peter Zeman, Brett Liem, Ravi S Menon",2023-04-09
https://www.biorxiv.org/content/10.1101/2023.04.06.535924v1#comment-6181003156,biorxivstage,0,"Thanks a lot for your commnets Faruk, we used LN2_LAYERS, and LAYNII 2.2.0. I'll add that to the manuscript.",2023-05-09T18:21:14,atenaakbari,Atena Akbari,10.1101/2023.04.06.535924,Layer Dependence of Monocular and Binocular Responses in Human Ocular Dominance Columns at 7T using VASO and BOLD,"Atena Akbari, Joseph S Gati, Peter Zeman, Brett Liem, Ravi S Menon",2023-04-09
