comment url,comment forum,comment keywords,comment message,comment date,comment username,comment name,paper doi,paper title,paper authors,paper date
https://www.biorxiv.org/content/10.1101/2023.03.30.534874v1#comment-6183552789,biorxivstage,1,"The following is a review compiled by graduate students participating in the Infectious Disease Journal Club, Department of Biomedical Sciences, University at Albany, SUNY, USA: This paper uses computational analyses of bacterial genomes to determine the distribution of anti-phage defense systems in actinobacterial species. The authors look at the diversity of defense systems, their enrichment in actinobacteria relative to other bacterial clades, and their genomic location. The authors suggest that some defense systems are enriched in the genomes of actinobacteria relative to other bacterial clades, while other systems are de-enriched. The authors also show that different defense systems are encoded in different regions of Streptomyces chromosomes, suggesting differential importance in phage defense. The fact that many defense systems are found more or less frequently in actinobacteria versus other bacteria, including some defense systems being completely absent from actinobacteria, highlights the fact that previous searches for defense systems have likely been biased in terms of the species used. The paper is well written, and with a few exceptions, the data are clearly presented. The analyses seem appropriate for the questions being asked. However, there is a concern that the genomes used are in some cases heavily biased towards individual species, most notably Mycobacterium tuberculosis. This bias could lead to erroneous conclusions about the relative abundance of some classes of defense systems in actinobacteria. Major comment The species used for Actinobacteria and Proteobacteria are not representative of the phylum in each case. For Actinobacteria, ~9% of genomes are from Mycobacterium tuberculosis. For Proteobacteria, ~19% of genomes are from Escherichia coli and ~15% are from Klebsiella pneumoniae. This is especially problematic for M. tuberculosis, a species for which there is very little variation across strains. Some analyses may be influenced by these biases in the genomes used. For example, Figure 1B shows data for mycobacteria, but ~55% of the mycobacterial genomes analyzed are from M. tuberculosis. In Figure 1E, enrichment of gp29_gp30 is likely to be strongly influenced by M. tuberculosis genomes; this is a rare defense system that happens to be found in most M. tuberculosis genomes, so it likely appears a lot more enriched in actinobacteria than it really is. The same problem likely applies to other systems that appear enriched in actinobacteria. The analysis in Figure 1D will be heavily skewed by E. coli and K. pneumoniae. We recommend that the authors include only one genome per species. This will reduce potential biases. The authors should also include some text to highlight that biases in which genomes are sequenced may lead to biases in their data, since biases are inevitable based on the availability of genome sequences. Minor comments 1. In the Introduction, it would be helpful if the authors could include a few sentences to describe what is known about the defense systems that are discussed most frequently in the paper, i.e., RM, Wadjet, CRISPR-Cas and Lamassu. 2. In Figure 2, could the authors show the same species in panels A and B? This would be less confusing. 3. Can the author’s speculate a bit more on why some BGC’s cluster at the ends of chromosomes? 4. Figure 1 legends for 1C and 1E are flipped. 5. In the Conclusions section, the authors discuss the possibility of undiscovered defense systems in Actinobacteria, given that the DefenseFinder program can only detect systems that are already known. Can the authors describe how novel defense systems could be identified based on their data for actinobacteria? 6. Figure 1D is confusing and does not indicate which systems are more/less abundant. The data would be better represented in a form similar to Figure 1E. 7. Figure 2B shows some examples of defense islands. Can the authors comment on the frequency with which defense systems in actinobacteria cluster in defense islands, and how this compares with other bacterial clades? 8. In Figures 3A and 3B, it is difficult to tell which systems are being shown in each concentric ring. Perhaps the authors can point out the few defense systems that are widely conserved. 9. The colors of bars in Figure 1E should be described in the legend. 10. For Figure 3C, it would be informative to show data only for Streptomyces, and to indicate in that plot which defense systems were inferred using Pagel’s lambda to be horizontally acquired. 11. Figure 3C considers only plasmids and prophages as mobile genetic elements. Can the authors look for other types of element, e.g., transposons? 12. It would be helpful to include a list of gene families for each class of defense systems analyzed. If DarTG includes toxin-antitoxin systems that are abundant in M. tuberculosis, the authors should mention that. Suggestion for an additional analysis The authors have generated a rich dataset of defense systems in actinobacteria. They could use this dataset to look for candidates for novel defense systems using a “guilt by association” approach, i.e., look for gene families that are enriched in their proximity to known defense systems.",2023-05-12T19:14:21,disqus_y9FR6hyg5J,Joseph Wade,10.1101/2023.03.30.534874,Genomic characterization of the antiviral arsenal of Actinobacteria,"H. Georjon, F. Tesson, H. Shomar, A. Bernheim",2023-03-30
https://www.biorxiv.org/content/10.1101/2022.05.30.494059v1#comment-6183506842,biorxivstage,0,"Hi Ben, nice work. Not sure if this has been published yet but you may want to take a look at Faiman et al. 2022 on the use of hydrogen stable isotopes for marking a village population of Anopheles coluzzii. We showed 20% survive the 7 month long dry season https://www.nature.com/arti...",2023-05-12T18:22:48,royfaiman,Roy Faiman,10.1101/2022.05.30.494059,A Meta-analysis of Longevity Estimates of Mosquito Vectors of Disease,"Ben Lambert, Ace North, H. Charles J. Godfray",2022-05-31
https://www.biorxiv.org/content/10.1101/2023.04.11.536486v1#comment-6183474300,biorxivstage,1,"Fascinating research and results. One comment: the moth shown in Supplementary Figure 1i is not Noctua pronuba but its sister species Noctua fimbriata. I do not think that species will behave differently but the authors better show a specimen of N. pronuba. Maurice Franssen, amateur entomologist, Wageningen, the Netherlands",2023-05-12T17:40:58,,Maurice Franssen,10.1101/2023.04.11.536486,Why flying insects gather at artificial light,"Samuel T Fabian, Yash Sondhi, Pablo Allen, Jamie Theobald, Huai-Ti Lin",2023-04-12
https://www.biorxiv.org/content/10.1101/2022.11.20.517292v3#comment-6183441008,biorxivstage,0,"Link to article: https://www.nature.com/arti... (available May 18th, 2023)",2023-05-12T16:55:58,,Michael Jensen,10.1101/2022.11.20.517292,Homunculus Interruptus: A motor association area in the depth of the central sulcus,"Michael A. Jensen, Harvey Huang, Gabriela Ojeda Valencia, Bryan T. Klassen, Max A. van den Boom, Timothy J. Kaufmann, Gerwin Schalk, Peter Brunner, Dora Hermes, Gregory A. Worrell, Kai J. Miller",2022-12-30
https://www.biorxiv.org/content/10.1101/2022.11.23.517609v1#comment-6183419114,biorxivstage,0,"If you look at the supplementary material and find the ""lib_ID"" for the SARS-like BtSY2 and BtSY1, match it to the sample site initials and match those to the sampling locations provided in the map in Fig 1. (A), you'll see that the SARS-like BtSY2 samples were collected at Chuxiong, Yunnan Province, China and SARS-like BtSY1 samples were collected at Lushui, Yunnan province, China. The authors also state several times in the main text that all bat samples analyzed in this study were sampled in Yunnan, China, such as in lines 265-266 of the 'Sample collection' subsection, of the Methodology section.",2023-05-12T16:26:18,496e66696e6974650d0a,V.,10.1101/2022.11.23.517609,"Individual bat viromes reveal the co-infection, spillover and emergence risk of potential zoonotic viruses","Jing Wang, Yuan-fei Pan, Li-fen Yang, Wei-hong Yang, Chu-ming Luo, Juan Wang, Guo-peng Kuang, Wei-chen Wu, Qin-yu Gou, Gen-yang Xin, Bo Li, Huan-le Luo, Yao-qing Chen, Yue-long Shu, Deyin Guo, Zi-Hou Gao, Guodong Liang, Jun Li, Edward C. Holmes, Yun Feng, Mang Shi",2022-11-23
https://www.biorxiv.org/content/10.1101/2023.05.02.539054v1#comment-6183418351,biorxivstage,0,"Dear Joao Pedro Saraiva, I checked your paper and I suggest you to fix the citations of the different resources. The pipelines you mentioned in the analysis in my opinion are not properly cited: 1-The pipeline ""8k"" you mentioned is not a pipeline, but Donovan used Metabat with different settings. You should mention Kang for the metabat software. 2-The Multi-Metagenome pipeline (MM) you mentioned is again not a pipeline but a very old approach that (in my opinion) is outdated. 3-The third pipeline you mentioned ""Karst and colleagues (DT)"" is obviously the more accurate because he implemented many different binning tools and then he dereplicated the results. Here you should mention the binning software used. In my opinion you should report more precisely the binning software used in order for the readers to understand better the procedure used. I hope my suggestions will be useful to clarify these sections in the manuscript. Sincerely -- Stefano",2023-05-12T16:25:18,stefanocampanaro,Stefano Campanaro,10.1101/2023.05.02.539054,Simulation of 69 microbial communities indicates sequencing depth and false positives are major drivers of bias in Prokaryotic metagenome-assembled genome recovery,"Ulisses Nunes da Rocha, Jonas Coelho Kasmanas, Rodolfo Toscan, Danilo S. Sanches, Stefania Magnusdottir, Joao Pedro Saraiva",2023-05-02
https://www.biorxiv.org/content/10.1101/2022.11.23.517609v1#comment-6183301394,biorxivstage,0,"To be fair, they do give some information in lines 265-266 in the 'Sample collection' subsection of the Methods section: ""A total of 149 rectum samples from bats were collected from six counties/cities in Yunnan province, China between 2015 and 2019"" You can look at Fig. 1 (A) "" Locations in Yunnan province 567 China where bat samples were taken"" , where they show a map of the sampling locations within Yunnan province.",2023-05-12T13:44:39,496e66696e6974650d0a,V.,10.1101/2022.11.23.517609,"Individual bat viromes reveal the co-infection, spillover and emergence risk of potential zoonotic viruses","Jing Wang, Yuan-fei Pan, Li-fen Yang, Wei-hong Yang, Chu-ming Luo, Juan Wang, Guo-peng Kuang, Wei-chen Wu, Qin-yu Gou, Gen-yang Xin, Bo Li, Huan-le Luo, Yao-qing Chen, Yue-long Shu, Deyin Guo, Zi-Hou Gao, Guodong Liang, Jun Li, Edward C. Holmes, Yun Feng, Mang Shi",2022-11-23
https://www.biorxiv.org/content/10.1101/2022.01.11.475197v3#comment-6183187974,biorxivstage,0,Now published in Oncogene: https://doi.org/10.1038/s41...,2023-05-12T10:16:13,,Neyret-Kahn,10.1101/2022.01.11.475197,Epigenomic mapping identifies a super-enhancer repertoire that regulates cell identity in bladder cancers through distinct transcription factor networks,"Hélène Neyret-Kahn, Jacqueline Fontugne, Xiang Yu Meng, Clarice S. Groeneveld, Luc Cabel, Tao Ye, Elodie Guyon, Clémentine Krucker, Florent Dufour, Elodie Chapeaublanc, Audrey Rapinat, Daniel Jeffery, Yann Neuzillet, Thierry Lebret, David Gentien, Irwin Davidson, Yves Allory, Isabelle Bernard-Pierrot, François Radvanyi",2022-02-14
https://www.biorxiv.org/content/10.1101/2022.09.20.508796v3#comment-6182765926,biorxivstage,0,Here is the published version: https://www.nature.com/arti...,2023-05-11T19:02:58,jingyijessicali,Jingyi Jessica Li,10.1101/2022.09.20.508796,A unified framework of realistic in silico data generation and statistical model inference for single-cell and spatial omics,"Dongyuan Song, Qingyang Wang, Guanao Yan, Tianyang Liu, Jingyi Jessica Li",2023-03-03
https://www.biorxiv.org/content/10.1101/2023.02.23.529628v1#comment-6182759210,biorxivstage,2,"I admit I'm still a bit confused here. I am certainly no historian of science, so perhaps there have been prior claims that this data refutes that I am unaware of. However, to me, no matter which way you look at the data, your sample suggests that males are indeed larger than females in most mammals. Instead of the approach I previously described, one could alternatively drop the species in the ""same size"" category under the justification that they have high uncertainty as to whether mean male size is larger than mean female size. After parsing your sample down, you'd still have more than 2.5 times as many mammal species in which males are larger than females on average, in cases where uncertainty is low. Of course, measuring more individuals of these species and including more species could change these results. There might be interesting phylogenetic patterns too. However, I still don't know what numbers are being looked at to draw the central conclusion. The fact that the 44% ""larger males"" category is less than 50% does not seem relevant to me in light of the points I raised about what the ""same size"" category actually includes. Therefore, the title does not seem to fit the data. My intention here is not to be obtuse; I am considering future work on bird body mass dimorphism that would be interesting to compare with your dataset, hence my interest. You are of course free to take my comments into consideration during publication or to reject them.",2023-05-11T18:54:33,esaitta,Evan Saitta,10.1101/2023.02.23.529628,New estimates indicate that males are not larger than females in most mammals,"Kaia J. Tombak, Severine B. S. W. Hex, Daniel I. Rubenstein",2023-02-23
https://www.biorxiv.org/content/10.1101/2023.05.05.539533v1#comment-6182649887,biorxivstage,0,"This is an additional example of pathogen effectors hijacking host phosphatase. The similar model has been studied in bacterial, in which bacterial AvrE-family Type-III effector proteins (T3Es) hijacking host PP2A (Jin, 2016, Plos pathogen), and phytophthora infenstans effector Pi04314 hijacking host protein pp1c (Bovink Nat communication ,2016)",2023-05-11T16:36:06,disqus_YkkptvzOeC,sm,10.1101/2023.05.05.539533,Pathogen protein modularity enables elaborate mimicry of a host phosphatase,"Hui Li, Jinlong Wang, Tung Ariel Kuan, Bozeng Tang, Li Feng, Jiuyu Wang, Zhi Cheng, Jan Skłenar, Paul Derbyshire, Michelle Hulin, Yufei Li, Yi Zhai, Yingnan Hou, Frank L.H. Menke, Yanli Wang, Wenbo Ma",2023-05-05
https://www.biorxiv.org/content/10.1101/2022.12.01.518661v1#comment-6182648875,biorxivstage,0,"yes it was, please check again figures 3 and 4",2023-05-11T16:34:43,christoschinopoulos,Dr. Christos Chinopoulos,10.1101/2022.12.01.518661,Viability of HepG2 and MCF-7 Cells is not Correlated with Mitochondrial Bioenergetics,"Judit Doczi, Noemi Karnok, David Bui, Victoria Azarov, Gergely Pallag, Sara Nazarian, Bence Czumbel, Thomas N Seyfried, Christos Chinopoulos",2022-12-02
https://www.biorxiv.org/content/10.1101/2022.10.07.511353v2#comment-6182529233,biorxivstage,1,"PREreview of “Single-cell profiling of complex plant responses to Pseudomonas syringae infection.” Amelia H. Lovelace1, Sarah Pottinger1, George Seddon-Roberts2, Emma Turley2 1 The Sainsbury Laboratory, Norwich Research Park, Norwich, UK 2 The John Innes Centre, Norwich Research Park, Norwich, UK * All authors contributed equally to the review and are listed in alphabetically based on last name Overview At the time this paper was posted to Biorxiv, it was the first to report single-cell RNA sequencing (scRNA-seq) analysis of plants during infection and therefore is of great significance and interest to the microbe-plant interactions community. The authors use scRNA-seq to compare cell populations from Arabidopsis thaliana during mock or pathogen infection by the Pseusomonas syringae. Through this comparison, they identified a distinct subset of cells that are responsive to this bacterial pathogen. Through pseudotime trajectory analysis they demonstrate that cells transition from an immune state to a susceptible state. From this analysis they identified known and unknown marker genes for these two states and characterized them through promoter report lines. Using confocal imagery, they evaluated these reporter lines during infection over both time and space. Together the authors uncover the herterogenity during pathogen infection and this dataset is a great resource to the community. We all enjoyed reading and discussing the manuscript. Overall, the manuscript is well written, and the findings are novel and exciting. The bioinformatics analysis is robust and consistent with previous scRNA-seq methods. However, the methods used to obtain these cells for scRNA-seq provide limitations to their interpretations and should be addressed. Below, we include some general comments as well as some specific comments/questions for some figures that came up during our discussion. We hope the authors find these useful. General Comments The authors use the tape sandwich method to enrich mesophyll cells from mock and infected tissue; however, by removing the epidermal layers this overlooks the first line of defence in a natural P. syringae infection. This biases the scRNA-Seq results making it difficult to draw correlations with their seedling infection assays which aim to characterize immune and susceptible maker genes identified through these results. The authors misinterpret the trajectory analysis where they correlate time with pseudotime. They state that their susceptibility gene expression analysis at later infection is consistent with their pseudotime trajectory analysis; however, their scRNA-Seq analysis was only performed on one time point. As such pseudotime may be more analogous to spatial distance from the infection site. The authors performed limited spatial characterization experiments of their marker immune and susceptibility genes to support their pseudotime analysis. Lastly, a major concern of ours is the low number of cells and seemingly one biological replicate sample used to produce this data. Their data would be more robust if more biological replicate samples were used and more cells were sequenced. Specific Comments by Figure Overall maintaining consistent use of colors across figures will help especially when red is associated with immune and blue for susceptible in figure S3 but the opposite for Fig 2 Figure 2 •	Immune and susceptible labels could be added to panel A, so as to make the graphic easier to understand. •	Additionally, the clusters M1-M5 are difficult to distinguish from one another in panel A. It is not clear what the colored labels in panel B are for. •	The authors used an unsupervised trajectory analysis in which the starting point they used was other. Does the same trajectory play out if they changed the starting point to a different group of cells? Figure 3 •	The authors state “The expression of all immune markers was significantly reduced at 72 hpi when plants exhibited chlorosis and water-soaked symptoms (Figure 3C and 3D)” but there are no pictures of these symptoms in this figure. •	The authors state that LipoP1 is expressed in guard cells in the absence of infection yet no stomatal markers were used to demonstrate this in panel C. Figure 5 •	Focus on substomatal cavities, yet no use of stomatal marker genes, which might make localisation more convincing. Figure 6 •	While the top section of this figure is very helpful, we felt that the lower panel including the line graph might be confusing to a reader. Figure S1 •	Suggested that ΔhopQ was no different to the WT Pst DC3000 in terms of infectivity, but could infect both N. benthamiana and A. thaliana. Why was ΔhopQ used in downstream analysis if no N. benthamiana infection models were used? Figure S2 •	Scaling of panels A and B might be misleading, as the scale of panel A is ten-fold larger than that of panel B. •	Panel C doesn’t contain a statistic on the figure. There is a figure (without a p value) in the text, but this makes the figure harder to evaluate. •	Panels G-N contain a lot of darkness, making correlation difficult to discern. Perhaps removal of cells with a value of 0.00 would make the panels easier to read, as well as making patterns easier to identify. The authors state “that the vast majority of cells profiled in this study are similar in cell type as those profiled by others”. Based off the methods used by the authors, the majority of the cell types are mesophyll and in other methods used this would also be the same given that mesophyll cells have a larger representation in leaf tissue. However, many cell types are missing from the authors data which is difficult to see using the visualization methods provided. •	Panel D has no y-axis label. •	What function does panel E serve? With the amount going on in this figure, perhaps it could be excluded if it is unnecessary. Figure S3 •	Hard to see assigned clusters on panels A-C. Perhaps an overlay similar to Figure 2A would be advantageous. •	What does each cell in panel B represent? There seems to be too few to represent each individual cell from RNA-seq dataset. •	In panel D, perhaps GO terms should be clustered grouped based on expression in each cluster. A dot plot might also illustrate data better. Figure S4 •	This figure is quite difficult to decipher and might be more easily interpreted as a Venn diagram. Figure S5 •	Pseudotime trajectory should be labelled more clearly, with clear labelled transitions, so that cluster states can be more easily assigned. Figure S6 •	There is no second rep for FRK1. Why is this? •	The authors state that LipoP1 is expressed in guard cells in the absence of infection yet no stomatal markers were used to demonstrate this.",2023-05-11T14:02:47,disqus_EzIt2lfC5H,Amelia,10.1101/2022.10.07.511353,Single-cell profiling of complex plant responses to Pseudomonas syringae infection,"Jie Zhu, Signe Lolle, Andrea Tang, Bella Guel, Brian Kvikto, Benjamin Cole, Gitta Coaker",2023-03-06
