comment url,comment forum,comment keywords,comment message,comment date,comment username,comment name,paper doi,paper title,paper authors,paper date
https://www.biorxiv.org/content/10.1101/2022.09.26.509600v2#comment-6021486755,biorxivstage,0,"Hello! I just wanted to start off by saying that I really enjoyed reading your paper! I’ve often read about this topic before, but this was a really novel take on the topic of antimicrobial resistance. Beginning with the introduction and abstract I thought there was sufficient background information provided on why this topic is important,  and why it is relevant to study today. In addition, it was also clear to me what the goal of this paper was (studying the effects of ARM-1 on Mfd). However, I would have preferred to see a little more background information on the Mfd compound. I understood how it operates to produce mutations, but I wish this compound was expanded upon a little more. Perhaps including some information on whether this compound is only seen in bacteria, and if not, are there any analogs in other organisms? Moving on to the first experiment, this was the only part of the study I had a little trouble understanding. I understood the underlying mechanisms that displayed the relationship of Mfd to the RNAP molecule, and how the ARM-1 compound thwarts this relationship. I just wish a little more context was provided as to how you arrived from 43 hits to ARM-1. When focusing on the next three figures presented I think that these were all done very well. I will, however, suggest for figure 2 perhaps splitting up the figure into two separate figures/parts. The first part containing information for figures 2A and 2B, and the next part containing information for figures 2C and 2D. I suggest this because the two halves of figure 2 discuss information that deals with separate topics. I thought that figure 3 was very clear and displayed your findings quite well! The only suggestion I have here is to define what “CTL” is. I tried to find a specific definition for this term in the paper but was unable to do so. Figure 4 was quite clear, and I found everything quite easy to understand! Overall, I really enjoyed reading this paper. This was a very interesting look into something I think many people have heard of in at least some context. I am very interested to see where this research goes next, as I believe it has a lot of potential to create a very positive impact throughout the world.",2022-10-24T22:09:32,jorawarsandhu,Jorawar Sandhu,10.1101/2022.09.26.509600,A small molecule that inhibits the evolution of antibiotic resistance,"Anna E. Johnson, Harrison Bracey, Angel Joel Hernandez Viera, Juan Carvajal-Garcia, Esra N. Simsek, Kwangho Kim, Houra Merrikh",2022-10-03
https://www.biorxiv.org/content/10.1101/2022.10.16.512425v1#comment-6021387227,biorxivstage,0,Supplementary videos are available from https://www.youtube.com/pla...,2022-10-24T20:02:15,maiwennkersaudykerhoas,Maiwenn KERSAUDY-KERHOAS,10.1101/2022.10.16.512425,A microfluidic finger-actuated blood lysate preparation device enabled by rapid acoustofluidic mixing,"Md Ehtashamul Haque, Alvaro J. Conde, William N. MacPherson, Stephen R Knight, Richard M. Carter, Maïwenn Kersaudy-Kerhoas",2022-10-20
https://www.biorxiv.org/content/10.1101/2022.10.22.513359v1#comment-6021204419,biorxivstage,0,"Very interesting paper.  I note - in 2000 we published a paper that is somewhat related to what you report here.  See https://genomebiology.biome.... In this we reported on how comparisons of closely / moderately closely related bacterial genomes showed that the distance a gene was from the origin of replication was conserved but the side of the origin it was on was not.  In comparisons of very close relatives, one can see the inversions that led to this pattern. In comparisons of slightly more distant relatives, one could not really see the inversions but we saw an X-like pattens of conservation. This has been seen now in many many other comparisons of bacterial and archaeal genomes. We discuss in the paper possible explanations for why this pattern is seen including mutation bias (e.g., more symmetric inversions than others) or selection (e.g., distance a gene is from the origin).",2022-10-24T16:48:31,jonathan_eisen,Jonathan Eisen,10.1101/2022.10.22.513359,A quantitative model for the transcriptional landscape of the bacterial cell cycle,"Andrew Pountain, Peien Jiang, Magdalena Podkowik, Bo Shopsin, Victor J. Torres, Itai Yanai",2022-10-23
https://www.biorxiv.org/content/10.1101/2022.06.27.497797v1#comment-6021160170,biorxivstage,0,"Hi! I thought that this was a great paper. It was very informational and allowed for easy understandings of the goal of the research which i thought was pretty interesting. I did, however, have some questions about the main points. I think a point being proven was in regard to the  question about parasites expressing antigenic variation while in extracellular spaces. I was curious on when exactly the antigenic variation occurs. Is there a signal that notifies the parasite when to change the VSG coat also? I think ultimately these were questions the paper posed as well, however i think it could be beneficial to list some speculations on what you might think is occurring. It could help with providing some context in relation to this in the background. Also I was a bit unclear on the plan for future work. I didn't see it really discussed in detail, either that, or I wasn't sure if the questions you posed at the end of discussion was where the future work was headed. Overall, the paper was great i was able to fully emerge and and take interest in the topic despite this not being my primary discipline. Explanations were amazing, I would just narrow down on the points you weren't sure about because I also wasn't sure about it and others may not be as well.",2022-10-24T15:59:40,nyahjohnson,Nyah Johnson,10.1101/2022.06.27.497797,Extravascular spaces are reservoirs of antigenic diversity in Trypanosoma brucei infection,"Alexander Beaver, Nathan P. Crilly, Jill Hakim, Bailin Zhang, Bryce Bobb, Filipa Rijo-Ferreira, Luisa Figueiredo, Monica R. Mugnier",2022-06-27
https://www.biorxiv.org/content/10.1101/2022.10.15.512190v1#comment-6021137976,biorxivstage,0,"The maps in this paper have been flipped vertically rather than rotated 180°, so the directions are wrong",2022-10-24T15:34:28,disqus_gdOB3cpykC,James Saulsbury,10.1101/2022.10.15.512190,"Global disparities in plant science: a legacy of colonialism, patriarchy, and exclusion","Rose A. Marks, Erik J. Amézquita, Sarah Percival, Alejandra Rougon-Cardoso, Claudia Chibici-Revneanu, Shandry M. Tebele, Jill M. Farrant, Daniel H. Chitwood, Robert VanBuren",2022-10-18
https://www.biorxiv.org/content/10.1101/2022.10.18.512756v1#comment-6021119082,biorxivstage,0,"But the great advantage of Type IIS restriction enzymes is, that if I assemble fragments using these enzymes I don't need to leave the recognition site of these enzymes in. It let's me create scareless, seamless sequences. So when I use Type IIS RE why would I let them in? The only reason would be for further modifications. But then, why would I leave the same site several times and not use different sites, so I can direct my future modifications specifically? I can't imagine someone, would have designed this like that.",2022-10-24T15:12:40,marliseamstutz,Marlise Amstutz,10.1101/2022.10.18.512756,Endonuclease fingerprint indicates a synthetic origin of SARS-CoV-2,"Valentin Bruttel, Alex Washburne, Antonius VanDongen",2022-10-20
https://www.biorxiv.org/content/10.1101/2022.10.18.512767v1#comment-6021104481,biorxivstage,0,the paper has been accepted by Antiviral Research,2022-10-24T14:55:29,,Alexander,10.1101/2022.10.18.512767,The Prophylactic and Therapeutic Efficacy of the Broadly Active Antiviral Ribonucleoside N4-Hydroxycytidine (EIDD-1931) in a Mouse Model of Lethal Ebola Virus Infection,"Gregory R. Bluemling, Shuli Mao, Michael G. Natchus, Wendy Painter, Sabue Mulangu, Mark Lockwood, Abel De La Rosa, Trevor Brasel, Jason E. Comer, Alexander N. Freiberg, Alexander A. Kolykhalov, George R. Painter",2022-10-18
https://www.biorxiv.org/content/10.1101/2021.08.20.457079v3#comment-6020944090,biorxivstage,3,"In this paper, Weilnhammer et al. tackle an intruiging question at the heart of decision-making theory: do observers use stable strategies, or do their strategies ('modes') change within a session? This papers analyses the autocorrelation in perceptual decision-making, and finds that it fluctuates between externally- and internally-driven strategies in ways that are strikingly similar between humans and mice. I very much enjoyed reading this work. The topic is exciting, and together with the Ashwood paper (which I see as a companion) this work will undoubtedly spur many future developments across psychology and neuroscience. The author's commitment to open science is laudable, and I am glad to see them making such good use of open, large-scale, community-curated datasets. I do have a few questions that are important to fully understand and validate the author's conclusions, and several minor suggestions. My expertise lies in the analysis of behavioral data, so I will mostly comment on main figures 1-4 rather than the model in figure 5. I thank the authors for also sharing this work as a preprint. As a signatory of Publish Your Reviews, I have committed to publish my peer reviews alongside the preprint version of an article. Specfically, this review will also be posted on the bioRxiv comments section. For more information, see publishyourreviews.org. Major questions 1. Do mode fluctuations have a characteristic timescale? I find terminology like 'oscillated as 1/f noise' (l. 985) a bit confusing - there may be frequency-specific oscillations, *or* a 1/f spectrum, but these are not the same ( https://www.nature.com/arti.... While the 1/f characteristic is clearly shown in Figures 2D, 3D, 4D (and the authors discuss self-organized criticality), I could not reconcile this with some other aspects of the analyses and writing. First, are phase and coherence not usually computed as a function of frequency? If so, which frequency is used in Figure 2E,F? Methods section 7.3.4 and l. 148 could be elaborated for readers unfamiliar with spectral analyses of behavior (how should the units of coherence be intrepreted?). Second, how can the simulation with a phasic mode switch at a single frequency (Figure 5A) give rise to a 1/f spectrum (Figure 4D), rather than a spectrum with an oscillatory peak (l. 425)? Third, there is a long history of investigating oscillations in perception (work by Fries, VanRullen, Kastner and many others, as the authors cite) albeit at a much faster timescale than shown here. Since the unit in this manuscript is trials (not time), are these two lines of work inherently incomparable, or can something be said about the typical trial length and therefore the interpretation of the best-fitting f = 0.11 in their model fits (l. 890/891)? Throughout the manuscript, it would help to distinguish oscillatory vs. 1/f. Alternatively, I may fundamentally misunderstand the results, in which case further elaboration and clarification would be great. 4. It would be very helpful if the full set of figure panels (as in Figures 2, 3, 4) was reproduced for each of their control simulations (S4, S6, S7), to better compare these models' behavior against human and mouse data. This would increase confidence in the main findings, and further pinpoint what exact behavioral signatures are unique to bimodal inference (rather than arousal fluctuations or decision bouds). I would like to suggest further control analyses to strengthen the existing ones. First, to conclude that internal-external mode fluctuations do not reflect periods of 'limited capacity', 'energy budget' or 'unstructured neuro-cognitive noise' (section 5.3), can you simulate and fit data from a process that additionally (or only) has periods of low/high perceptual sensitivity or task engagement (for instance, simulating high lapses)? Especially in the mouse data (and shown by Ashwood, there are likely periods of disengagement from the task, e.g. when mice become satieted towards the end of the session. One prediction may be that this would lead to more errors in history-congruent modes (as in 3A), Second, recent work (reviewed in https://doi.org/10.51628/00... has shown that slow drifts in decision boundary, without any strategic history-dependent updating, may give rise to statistical confounds and apparent history-dependence. It is difficult to intuit how such a process may affect the analyses presented here: could the authors simulate a process with only a slowly drifting bound (beyond the static response bias in section 5.4)? Minor suggestions 1. I applaud the authors for sharing their full workflow on OSF. However, I did find the format (all files in a zip) a bit difficult to work with: for instance, it's not possible to view the code in-line without downloading. To further increase the usefulness of the codebase to others, consider exploring ways to present the code in a way that allows easy re-running, inspection and versioning (e.g. in a notebook form, or at least with the scripts on GitHub). Also, comments on how to use the files (where to start? how to install/run? what are the dependencies? what version of R?) would be of great help to others who want to implement the same method. 3. Could the authors show standard (and history-conditioned) psychometric curves in both modes? This would show if there are considerable lapses, which can bias the estimation of history-dependent logistic regression models (see http://www.journalofvision..... If lapses are considerable, this may need to be taken into account in the model (or at least simulated to check that it doesn't introduce confounds). Related to this, how many human studies did not have stimulus strength information (and thus presumably only one level of task difficulty), and do the results look the same without studies with these missing data? 17. The authors recognize that trial-to-trial variations in stimulus strength (i.e. task difficulty) are a major driver of choices, and account for this in their control analysis. However, when defining stimulus-congruence, this is (as far as I can tell) only done based on the sign (i.e. a binary indicator), thus removing the _degree_ of stimulus congruence. Would the results look the same is stimulus-congruence was instead coded as a continuous variable, i.e. being more congruent when stimulus strength is high? 18. Why not show the logistic regression results in Figure 2B, which takes into account several confounds that are now hidden in the supplement? 19. Why do the mixed effects models only have random intercepts, and not random slopes? It seems that sensory and history dependence vary substantially across observers, which random slopes could capture. 20. Consider visualizing the phase information (Figure 2E) on a circular plot. To better interpret the coherence and phase information (see my first main question), it would be very helpful to discuss whether the two modes are anti-correlated/alternate at a specific frequency. 21. Please define 'infra-slow' when first used (see first main question). Is this characterized by a specific frequency range? 22. I am unsure if the selection of IBL mouse sessions may affect these results. Specifically, the authors here use a simple performance criterion of 80% in easy trials. However, in this task contrasts were introduced gradually, meaning that 80% correct on easy trials may happen early on in training as well as very late (with very different contrast sets). In Figure S5, could it be indicated which sessions were incorporated into the main analysis? Would the results hold if using a more stringent criterion to consider animals 'trained', as proposed in the original IBL paper ( https://github.com/int-brai..., which also incorporates bias and lapses)? A related point is that TDs are a lot larger (Figure 3H) than in the original paper (IBL et al. 2021, Figure 3 - supplement 2A), which may be remarked upon. 23. Also Figure S5: it would be of great interest to also see the within-session changes in mode, for mice as well as humans (see also my main question above on satiety). 24. The green plots in Supplementary Figure 2 are interesting but also a bit worrying, showing all sorts of autocorrelation in the stimulus sequences that make the paper's conclusions trickier to assess. The authors already discuss some features of the IBL task design that introduce specific autocorrelation patterns (i.e. post-error bias correction). Is such information, describing the specific algorithms for sequence generation, available for the studies from the confidence database? And could the authors relate specific stimulus sequences to the behavioral modes they observe? 25. In section 5.7, it should be noted that mice did receive single-trial feedback. How about humans? Splitting the confidence database into those studies with and without single-trial feedback could be used to nicely test the predictions in line 549 / Figure 5. 26. RT distributions are characteristically long-tailed, which can strongly affect scaling them. I am a bit confused that all values in Figure 2H lie below zero, should this not be zero-meaned? Was a transform (e.g. log) used before zscore? If not, could the authors show the RT distributions per study before and after outlier removal and scaling, to give a better sense of the distributions that were used in the analyses (or replicate 2H without normalization so that the real RT units are visible, as in 3H)? It would also be nice to add the range of individual cutoff values used for exclusion criteria (l. 776). 27. To make the magnitude of weights in figure 2B, 3B and 4B easier to interpret, consider adding the weight for sensory stimuli (see Abrahamyan figure 3 - may need to be on a differen y-scale). 28. lines 436-445: are these correlations linear, or may there be quadratic relationships between posterior certainty and RT, confidence, TDs? A supplementary figure would be nice. 29. Very minor: I had some issues printing the figures, likely due to many transparent datapoints in the pdf. For the final version, consider exporting the figures to a high-resolution bitmap format to reduce the size. 30. The work contains a couple of remaining typos (e.g. ressource'), duplicate words, etc. 31. l. 148, S2F -> 2F. 32. l. 653, where in the Ashwood paper is this number of >100 trials mentioned? As far as I can tell, they only analyze the first 90 trials of each session (see their figure 3E). 33. Some references should be updated: for instance, 21 is now published in eLife, and 12 & 66 point to the same paper (published and preprint). Please check all the references to make sure that they point to the most recent versions. 34. Consider adding author contribution statement and/or displaying this visually (see e.g. https://twitter.com/Steinme..., https://elifesciences.org/a... figure 6). Also, is there a reason why one author is now omitted, compared to the first bioRxiv version? Further questions As with all fresh ideas, this work raises many more questions that it can answer: while beyond the scope of this manuscript, I list some here so that they may be of use to the community. - Especially together with the paper by Ashwood et al., the obvious next question is the structure of mode fluctuations: are there two modes (as suggested here) or more (as suggested by Ashwood)? Do these switch in a discrete vs. continuous way? - At what timescale do states/modes change? How does this relate to even slower timescales in biology, e.g. at the level of circadian rhythms? - It is fantastic to see that large-scale databases are increasingly being used for cross-species comparison. In a way, it's a shame that these exist only for humans and mice. Are there plans or efforts to collect and publish similar databases from non-human primates (where many, many trials of perceptual decision-making tasks have been collected over the years)?",2022-10-24T11:08:05,,Anne Urai,10.1101/2021.08.20.457079,Bimodal inference in humans and mice,"Veith Weilnhammer, Heiner Stuke, Kai Standvoss, Philipp Sterzer",2022-07-05
https://www.biorxiv.org/content/10.1101/2022.09.27.509833v1#comment-6020788144,biorxivstage,1,"Hello, my name is Sarah O’Malley, and I am a student of the Biomedical Research minor at UCLA. I recently read this paper with my program’s journal club, and I want to thank you for your work on mEVs and early biomarkers of tobacco smoking-induced disease. My class learned a great deal of information while reading and discussing this paper, and I would like to present some suggestions and comments: The variety of techniques utilized to isolate and characterize mEVs here were impressive. However, I suggest including percentage breakdowns of the different populations studied on the flow cytometry plots (Figure 2A, 2B, 2E). This data may have already been calculated through FlowJo or could easily be calculated with this software, and it would be valuable to display these percentages to provide more precise quantifications of EV populations. In addition, I believe that Figure 2D may have been incorrectly referred to as Figure 5D in the results section titled “Extracellular vesicle concentration increases in circulation 1 hour after smoking in never-smokers”. Also, in the results or discussion section, I would suggest including a description of why there are four post-smoking samples in Figure 2F compared to the 20 non-smoking participants or the nine pre-smoking samples shown in Figure 2F. Next, if possible, I would also suggest conducting the tests performed on nonsmokers in Figure 1 and 2 on smokers as well, which could provide additional data on the acute effects of smoking and if these effects change with the chronic smoking of tobacco. I understand that this data may be difficult to collect, but I believe that it could bolster the content of this paper. Lastly, I was wondering what specific statistical test you conducted for this figure. The figure legend states that a non-parametric unpaired t-test was performed. However, I wonder if a paired test should have been used, as this data consists of blood from the same individuals pre- and post-smoking. Thus, I do not know if the groups can be considered independent. Also, t-tests are parametric tests, so I am unsure of what a nonparametric t-test refers to. This pattern of referring to a nonparametric t-test was also maintained throughout the paper. Was a Wilcoxon signed-rank test performed? If not, then I would suggest implementing this statistical test here, as it serves a similar purpose to a t-test but is applicable to paired, nonparametric data. For the other instances of unpaired nonparametric t-tests, I would suggest using a Mann-Whitney U test, which also serves a similar purpose to a t-test but is applicable to unpaired, nonparametric data. In Figure 4B, I would suggest expanding the heatmap to display MFI levels for each sample analyzed instead of condensing the data as shown. In this condensed form, the data is a bit difficult to interpret. Alternatively, I would suggest displaying some of the quantifications of activation marker levels described in the results section, as these quantifications would convey the same message but through a more easily interpretable form. The discussion around Figure 5 depends on a trend shown in sTREM2 expression and a statistical decrease in BDNF expression. In the results and discussion sections, the following conclusions made about the smoking-linked mechanisms of neurodegeneration may be a bit strong based on this data. I would suggest performing follow-up experiments on other neurodegeneration markers to strengthen this evidence or perhaps test BBB functionality, as this was a concept linked to neurodegeneration throughout this paper. I have a quick general note on the references section. I had some trouble finding a few of the papers cited in-text in the references section (e.g. Zalba et al. 2007, Sophocles Chrissobolis et al. 2011). My class had similar difficulties navigating the references section, so I would suggest following up on the consistency of citations in-text and within this section. Overall, thank you for posting this paper! It was a highly educational read.",2022-10-24T04:59:52,disqus_aGqZeVkNZA,Sarah O'Malley,10.1101/2022.09.27.509833,Initial and ongoing tobacco smoking elicits vascular damage and distinct inflammatory response linked to neurodegeneration,"Alejandra P. Garza, Lorena Morton, Éva Pállinger, Edit I. Buzás, Stefanie Schreiber, Björn H. Schott, Ildiko Rita Dunay",2022-09-28
